published,search_term,category,title,summary,link,matched_words,activity_type,raw_text,entity_source_text,article_fetch_status,resolved_article_url,city_candidates,district_candidates,neighborhood_candidates,street_candidates,facility_candidates,company_candidates,company_candidate_scores,entity_quality_note,maps_queries,maps_candidates,maps_best_guess,maps_status,maps_match_scores,maps_rejected_candidates,record_quality_score,duplicate_group_id
2026-06-09 11:11:09,tesis yangını,Fiziksel Risk / Yangın,Gaziantep Tekstil Fabrikası Yangını,Gaziantep Tekstil Fabrikası Yangını | Son Dakika Gelişmeleri HaberGo,https://news.google.com/rss/articles/CBMipwFBVV95cUxQOWFycnJ5Z2Y4V25zS2xJMDhScktlMlBldTRqcVhwUXQ3MFYyWXp5dWx6cjBKbTI2OGVwVmNnLW02TDB0ajN6VTZzV3BfLXJ6dHh3QURDZlFJaVpnMWRreUR5SUZpcG1UazVnMWJyNUxxQ053THM4SVZXTnZ2MElZbC1fbkVvMnNTMHc4cXdmT1gtdVhzSmt4dUZmbnBJcFc0c0daLUg5Yw?oc=5,"fabrika, tekstil",fabrika,Gaziantep Tekstil Fabrikası Yangını | Son Dakika Gelişmeleri HaberGo,Gaziantep Tekstil Fabrikası Yangını Gaziantep Tekstil Fabrikası Yangını | Son Dakika Gelişmeleri HaberGo Gaziantep Tekstil Fabrikası Yangını | Son Dakika Gelişmeleri HaberGo,browser_failed,https://news.google.com/rss/articles/CBMipwFBVV95cUxQOWFycnJ5Z2Y4V25zS2xJMDhScktlMlBldTRqcVhwUXQ3MFYyWXp5dWx6cjBKbTI2OGVwVmNnLW02TDB0ajN6VTZzV3BfLXJ6dHh3QURDZlFJaVpnMWRreUR5SUZpcG1UazVnMWJyNUxxQ053THM4SVZXTnZ2MElZbC1fbkVvMnNTMHc4cXdmT1gtdVhzSmt4dUZmbnBJcFc0c0daLUg5Yw?oc=5&hl=tr&gl=TR&ceid=TR:tr,,,,,Gaziantep Tekstil Fabrikası | Yangını Gaziantep Tekstil Fabrikası,Gaziantep Tekstil,Gaziantep Tekstil:292:body+summary+title,il yok | ilçe yok,,,,maps araması yapılmadı,,,131.18,1
2026-06-09 19:40:34,para aklama,Diğer,"Europol: Kosova Merkezli Suç Ağı Çökertildi, 80 Milyon Euroluk Mal Varlığına El Konuldu","Europol: Kosova Merkezli Suç Ağı Çökertildi, 80 Milyon Euroluk Mal Varlığına El Konuldu Kosovahaber.com",https://news.google.com/rss/articles/CBMivwFBVV95cUxPSE5NVFpCVEphdEJhQUhremI3OUdralppWG1tb2t4eW9CcGlDMGdRT2syb1V1VzlqNE5Ddy10T25CTWY5OThZZkF2SUpuYTJjRld3d0hHcFlEeXhTektSV01nSVprOF94cV93SHVtQVZPTGc2bi1pMkNhZmdxb3RHTGVucXZSenpPb2YzZlBrM0d1V1NwOGk3OUpRNmVHbDJWZ2djNDMzcDE0TVo3cThZSmNFLVBhZDFMZ25RaDJRUQ?oc=5,"el konuldu, mal varlığı",,"Europol, şifreli iletişim platforması SKY ECC üzerinden elde edilen mesajların, Kosova merkezli uluslararası bir organize suç şebekesini ortaya çıkardığını açıkladı. Europol’e göre örgüt; büyük ölçekli uyuşturucu kaçakçılığı, sahte kimlik belgelerinin kullanımı, yasa dışı silah bulundurma ve kara para aklama faaliyetleri yürütüyordu. Yaklaşık üç yıl süren soruşturma, 9 Haziran’da Kosova’da düzenlenen eş zamanlı operasyonla sonuçlandı. Operasyonda suç örgütünün kilit konumdaki beş üyesi gözaltına alındı. Yaklaşık 150 güvenlik görevlisinin katıldığı operasyona Europol uzmanları da destek verdi. Soruşturmaya göre suç örgütü, Avrupa’nın çeşitli ülkelerindeki uyuşturucu sevkiyatlarını şifreli iletişim sistemleri üzerinden koordine ediyor, operasyonel merkezini ise Kosova’da bulunduruyordu. Örgütün üst düzey yöneticileri Kosova’dan, uluslararası uyuşturucu sevkiyatlarını yönetiyor, lojistik faaliyetleri koordine ediyor, suç gelirlerinin aklanmasını organize ediyordu. Europol tarafından","Europol: Kosova Merkezli Suç Ağı Çökertildi, 80 Milyon Euroluk Mal Varlığına El Konuldu Europol: Kosova Merkezli Suç Ağı Çökertildi, 80 Milyon Euroluk Mal Varlığına El Konuldu Kosovahaber.com Europol, şifreli iletişim platforması SKY ECC üzerinden elde edilen mesajların, Kosova merkezli uluslararası bir organize suç şebekesini ortaya çıkardığını açıkladı. Europol’e göre örgüt; büyük ölçekli uyuşturucu kaçakçılığı, sahte kimlik belgelerinin kullanımı, yasa dışı silah bulundurma ve kara para aklama faaliyetleri yürütüyordu. Yaklaşık üç yıl süren soruşturma, 9 Haziran’da Kosova’da düzenlenen eş zamanlı operasyonla sonuçlandı. Operasyonda suç örgütünün kilit konumdaki beş üyesi gözaltına alındı. Yaklaşık 150 güvenlik görevlisinin katıldığı operasyona Europol uzmanları da destek verdi. Soruşturmaya göre suç örgütü, Avrupa’nın çeşitli ülkelerindeki uyuşturucu sevkiyatlarını şifreli iletişim sistemleri üzerinden koordine ediyor, operasyonel merkezini ise Kosova’da bulunduruyordu. Örgütün üst düzey yöneticileri Kosova’dan, uluslararası uyuşturucu sevkiyatlarını yönetiyor, lojistik faaliyetleri koordine ediyor, suç gelirlerinin aklanmasını organize ediyordu.",browser_full_article,https://kosovahaber.com/haber/europol-kosova-merkezli-suc-agi-cokertildi-80-milyon-euroluk-mal-varligina-el-konuldu-102141,,,,,,,,il yok | ilçe yok | firma yok | faaliyet/tesis yok,,,,maps araması yapılmadı,,,95.19,2
2026-06-09 15:07:33,depo yangını,Fiziksel Risk / Yangın,Çorlu'da Market Deposunda Yangın,Çorlu'da Market Deposunda Yangın SonDakika,https://news.google.com/rss/articles/CBMihAFBVV95cUxOcnZJRTJkaTZmUElETmIzazZWRmxzUXZBSm44a19GV3RNb0V3R3ZKN0hodzRJbVJHZXloNHBjaGFzUENOVTZMSlQtOF9hRTBJMkt4Y3VmNFBRRHJEX013RTh1ZHFsYlpfNnZCRUVxamIzbEp1VHBQRFdIZFlYR1VNaU03cV_SAYQBQVVfeXFMTnJ2SUUyZGk2ZlBJRE5iM2s2VkZsc1F2QUpuOGtfRld0TW9Fd0d2SjdIaHc0SW1SR2V5aDRwY2hhc1BDTlU2TEpULThfYUUwSTJLeGN1ZjRQUURyRF9Nd0U4dWRxbGJaXzZ2QkVFcWpiM2xKdVRwUERXSGRZWEdVTWlNN3Ff?oc=5,depo,depo,"Tekirdağ'ın Çorlu ilçesinde bir marketin deposunda çıkan yangın, itfaiyenin müdahalesiyle söndürüldü. Tekirdağ'ın Çorlu ilçesinde bir marketin deposunda çıkan yangın, itfaiyenin müdahalesiyle söndürüldü. Tekirdağ'ın Çorlu ilçesinde bir marketin deposunda çıkan yangın, itfaiyenin müdahalesiyle söndürüldü. Çorlu'da Market Deposunda Yangın Son Güncelleme: 09.06.2026 18:07 Tekirdağ'ın Çorlu ilçesinde bir marketin deposunda çıkan yangın, itfaiyenin müdahalesiyle söndürüldü. Mehmetcan ARSLAN/ ÇORLU ( Tekirdağ ), TEKİRDAĞ'ın Çorlu ilçesinde bir marketin deposunda çıkan yangın, paniğe neden oldu. Yangın, itfaiyenin müdahalesiyle, büyümeden söndürüldü. Yangın Muhittin Mahallesi Serçe Sokak üzerinde 17.00 sularında meydana geldi. Sokak üzerindeki marketin depo kısmında, henüz bilinmeyen nedenle yangın çıktı. Alevler kısa sürede büyüyerek dumanların yükselmesine neden oldu. İhbarla bölgeye itfaiye, sağlık ve polis ekipleri sevk edildi. Market içerisinde bulunan müşteriler ve çalışanlar panikle dışarı çıktı. Polis çevrede güvenlik önlemleri alırken, itfaiye yangına müdahale etti. Ekiplerinin yaklaşık 1 saat süren çalışmasıyla yangın kontrol altına alınarak söndürüldü. Yangının çıkış nedenine ilişkin inceleme başlatıldı. Haber-Kamera: Mehmetcan ARSLAN - ÇORLU (Tekirdağ), Kaynak: DHA Mehmetcan ARSLAN/ ÇORLU ( Tekirdağ ), TEKİRDAĞ'ın Çorlu ilçesinde bir marketin deposunda çıkan yangın, paniğe neden oldu. Yangın, itfaiyenin müdahalesiyle, büyümeden söndürüldü. Yangın Muhittin Mahallesi Serçe Sokak üzerinde 17.00 sularında meydana geldi. Sokak üzerindeki marketin depo kısmında, henüz bilinmeyen nedenle yangın çıktı. Alevler kısa sürede büyüyerek dumanların yükselmesine neden oldu. İhbarla bölgeye itfaiye, sağlık ve polis ekipleri sevk edildi. Market içerisinde bulunan müşteriler ve çalışanlar panikle dışarı çıktı. Polis çevrede güvenlik önlemleri alırken, itfaiye yangına müdahale etti. Ekiplerinin yaklaşık 1 saat süren çalışmasıyla yangın kontrol altına alınarak söndürüldü. Yangının çıkış nedenine ilişkin inceleme başlatıldı. Haber-Kamera: Mehmetcan ARSLAN - ÇORLU (Tekirdağ), Çorlu'da Market Deposunda Yangın Tekirdağ'ın Çorlu ilçesinde bir marketin deposunda çıkan yangın, itfaiyenin müdahalesiyle söndürüldü. Mehmetcan ARSLAN/ ÇORLU ( Tekirdağ ), TEKİRDAĞ'ın Çorlu ilçesinde bir marketin deposunda çıkan yangın, paniğe neden oldu. Yangın, itfaiyenin müdahalesiyle, büyümeden söndürüldü. Yangın Muhittin Mahallesi Serçe Sokak üzerinde 17.00 sularında meydana geldi. Sokak üzerindeki marketin depo kısmında, henüz bilinmeyen nedenle yangın çıktı. Alevler kısa sürede büyüyerek dumanların yükselmesine neden oldu. İhbarla bölgeye itfaiye, sağlık ve polis ekipleri sevk edildi. Market içerisinde bulunan müşteriler ve çalışanlar panikle dışarı çıktı. Polis çevrede güvenlik önlemleri alırken, itfaiye yangına müdahale etti. Ekiplerinin yaklaşık 1 saat süren çalışmasıyla yangın kontrol altına alınarak söndürüldü. Yangının çıkış nedenine ilişkin inceleme başlatıldı. Haber-Kamera: Mehmetcan ARSLAN - ÇORLU (Tekirdağ),","Çorlu'da Market Deposunda Yangın Çorlu'da Market Deposunda Yangın SonDakika Tekirdağ'ın Çorlu ilçesinde bir marketin deposunda çıkan yangın, itfaiyenin müdahalesiyle söndürüldü. Çorlu'da Market Deposunda Yangın Son Güncelleme: 09.06.2026 18:07 Tekirdağ'ın Çorlu ilçesinde bir marketin deposunda çıkan yangın, itfaiyenin müdahalesiyle söndürüldü. Mehmetcan ARSLAN/ ÇORLU ( Tekirdağ ), TEKİRDAĞ'ın Çorlu ilçesinde bir marketin deposunda çıkan yangın, paniğe neden oldu. Yangın, itfaiyenin müdahalesiyle, büyümeden söndürüldü. Yangın Muhittin Mahallesi Serçe Sokak üzerinde 17.00 sularında meydana geldi. Sokak üzerindeki marketin depo kısmında, henüz bilinmeyen nedenle yangın çıktı. Alevler kısa sürede büyüyerek dumanların yükselmesine neden oldu. İhbarla bölgeye itfaiye, sağlık ve polis ekipleri sevk edildi. Market içerisinde bulunan müşteriler ve çalışanlar panikle dışarı çıktı. Polis çevrede güvenlik önlemleri alırken, itfaiye yangına müdahale etti. Ekiplerinin yaklaşık 1 saat süren çalışmasıyla yangın kontrol altına alınarak söndürüldü. Yangının çıkış nedenine ilişkin inceleme başlatıldı. Haber-Kamera: Mehmetcan ARSLAN - ÇORLU (Tekirdağ), Kaynak: DHA Mehmetcan ARSLAN/ ÇORLU ( Tekirdağ ), TEKİRDAĞ'ın Çorlu ilçesinde bir marketin deposunda çıkan yangın, paniğe neden oldu. Haber-Kamera: Mehmetcan ARSLAN - ÇORLU (Tekirdağ), Çorlu'da Market Deposunda Yangın Tekirdağ'ın Çorlu ilçesinde bir marketin deposunda çıkan yangın, itfaiyenin müdahalesiyle söndürüldü. Haber-Kamera: Mehmetcan ARSLAN - ÇORLU (Tekirdağ),",browser_full_article,https://www.sondakika.com/amp/haber-corlu-da-market-deposunda-yangin-19929943/,Tekirdağ,Çorlu,Yangın Muhittin Mahallesi,,,,,firma yok | faaliyet/tesis yok,,,,maps araması yapılmadı,,,99.5,3
2026-06-09 10:20:01,depo yangını,Fiziksel Risk / Yangın,Gaziantep'te Molhan Tekstil fabrikasında çıkan yangın kontrol altına alındı,Gaziantep'te Molhan Tekstil fabrikasında çıkan yangın kontrol altına alındı Aksiyon.com.TR,https://news.google.com/rss/articles/CBMirgFBVV95cUxNOXctMVZEUW8tYU9aeFZrSFRwS1hBZWVmRlQ4R0kwNTVjRnFYSzJfZThGWjBYZHJYTTgtaEI3ekYyODhDcnRjNTJfWnVjdTRBd003VU9nMklnYm92X2RqWG5FZ21LQmd3UkNTb3hvOTg0UHBoRXBndnh1N3RndkN0OEJlU3lPbzZOZ1JDMXNIcndCcGhRY0ZfOG9BZ2Fnd1AtSDl4QlB6UWhhUVV4UUHSAbMBQVVfeXFMUDV1RXBtb2pFdUhhRDY4X1BBWEVrVy10NG5Oa0lyazlNLWdFTjFoaXlMc1RfZlRRcWtSZnZld2F5VWZndDhLcjJBT3ZLMTlHbWVra1R4SUtwcW5hLTc0cTJQU2RkQlBxelhhcUxPeElPd05ucmo4X044ZEp0Q0tvbm13SFByWXNxMnJMMTdUdjNsTXFManVUTm5RVmV1MDhGLWotTHkxcVlEVXc2dmFSMWxTRUE?oc=5,"fabrika, tekstil",fabrika,"Gaziantep 5.Organize Sanayi Bölgesi'ndeki Molhan Tekstil fabrikasında sabah çıkan yangın, ekiplerin müdahalesiyle kontrol altına alındı; can kaybı yok, soğutma sürüyor. Gaziantep 5.Organize Sanayi Bölgesi'ndeki Molhan Tekstil fabrikasında sabah çıkan yangın, ekiplerin müdahalesiyle kontrol altına alındı; can kaybı yok, soğutma sürüyor. Gaziantep 5.Organize Sanayi Bölgesi'ndeki Molhan Tekstil fabrikasında sabah çıkan yangın, ekiplerin müdahalesiyle kontrol altına alındı; can kaybı yok, soğutma sürüyor. Gaziantep'te Molhan Tekstil fabrikasında çıkan yangın kontrol altına alındı Olay ve müdahale Gaziantep'in 5.Organize Sanayi Bölgesi nde bulunan Molhan Tekstil fabrikasında sabah saat 09.04 civarında bilinmeyen bir nedenle yangın çıktı. Kısa sürede büyüyen alevler için 112 acil çağrı merkezine ihbarda bulunuldu. İhbar üzerine bölgeye çok sayıda itfaiye, sağlık, polis ve AFAD ekibi sevk edildi. Olay yerine ulaşan itfaiye ekipleri, fabrikayı saran yangına müdahale etti; müdahale, 60 personel ve yaklaşık 50 araç ile yürütüldü. Ekiplerin yoğun çalışması sonucu yangın yaklaşık 5 saat süren müdahalenin ardından kontrol altına alındı. Yetkili açıklaması Gaziantep Büyükşehir Belediyesi Başkanvekili Halil Uğur , çalışmalarla ilgili olarak şu bilgileri verdi: ""Sabah 09.04’te itfaiye daire başkanlığımıza gelen ihbara istinaden ekiplerimiz harekete geçti. Bize gelen ihbardan 6 dakika sonra organize itfaiye ekiplerimizle birlikte yangına müdahalemiz başladı. Araştırmalarımıza göre yangın fabrikanın depo alanında çıkıyor. Teknik olarak detaylar araştırılıyor. Sevindirici olay da şu ana kadar can kaybının olmamış olmasıdır. İtfaiye daire başkanlığımızın kontrolünde 50’ye yakın itfaiye aracı ve destek araçla müdahale ediyoruz. Bunların yanında GASKİ, Kent estetiği, organize sanayinin tüm araçlarıyla birlikte yangına müdahale ediyoruz. Yangının etrafa sıçramasıyla ilgili durum kontrol altına alındı. Söndürme işlemi yapılıyor. Kısa süre içinde söndürme işlemi tamamlandıktan sonra soğutma çalışmalarına başlayacağız. Yangın kontrolümüz altında. Geçmiş olsun dileklerimi iletiyorum."" Güncel durum İtfaiye ekipleri fabrikada yer yer söndürme ve soğutma çalışmalarına devam ediyor. Yetkililer, yangının etrafı sarması riskinin kontrol altına alındığını ve teknik incelemelerle yangının çıkış nedeninin araştırıldığını belirtiyor. Şu ana kadar can kaybı bildirilmedi , soğutma çalışmaları tamamlanana kadar bölgedeki müdahale sürdürülüyor. GAZİANTEP'TE BİR TEKSTİL FABRİKASINDA ÇIKAN VE KISA SÜREDE BÜYÜYEN YANGIN KONTROL ALTINA ALINDI. 1 Karaman'da motosiklet kaldırıma çarpıp karşı şeride savruldu; sürücü yaralanmadı Karaman'da motosiklet kaldırıma çarpıp karşı şeride savruldu; sürücü yaralanmadı 2 Çan'da tamir için bırakılan araç Edremit'te bulundu: 2 şüpheli tutuklandı Çan'da tamir için bırakılan araç Edremit'te bulundu: 2 şüpheli tutuklandı 3 Gebze'de 3 katlı binanın en üst katında çıkan yangın söndürüldü Gebze'de 3 katlı binanın en üst katında çıkan yangın söndürüldü 4 Konya'da Mayıs ayında polis bölgesinde 1.556 trafik kazası: 3 ölü, 1.143 yaralı Konya'da Mayıs ayında polis bölgesinde 1.556 trafik kazası: 3 ölü, 1.143 yaralı 5 Gebze'de 3. kat yangını: Çamaşır makinesi kaynaklı olduğu iddia edildi, itfaiye söndürdü Gebze'de 3. kat yangını: Çamaşır makinesi kaynaklı olduğu iddia edildi, itfaiye söndürdü 6 Tarsus’ta Adana-Mersin Otoyolu Ziyaret Tepe mevkiinde otomobil tıra çarptı: 1 ölü, 4 yaralı Tarsus’ta Adana-Mersin Otoyolu Ziyaret Tepe mevkiinde otomobil tıra çarptı: 1 ölü, 4 yaralı 7 Bulgaristan sınır polisi filosunu güçlendirdi: 10 milyon 487 bin 747,64 avroluk yeni araç ve ekipman Bulgaristan sınır polisi filosunu güçlendirdi: 10 milyon 487 bin 747,64 avroluk yeni araç ve ekipman Gaziantep'te Molhan Tekstil fabrikasında çıkan yangın kontrol altına alındı Gaziantep 5.Organize Sanayi Bölgesi'ndeki Molhan Tekstil fabrikasında sabah çıkan yangın, ekiplerin müdahalesiyle kontrol altına alındı; can kaybı yok, soğutma sürüyor. Gaziantep'in 5.Organize Sanayi Bölgesi nde bulunan Molhan Tekstil fabrikasında sabah saat 09.04 civarında bilinmeyen bir nedenle yangın çıktı. Kısa sürede büyüyen alevler için 112 acil çağrı merkezine ihbarda bulunuldu. İhbar üzerine bölgeye çok sayıda itfaiye, sağlık, polis ve AFAD ekibi sevk edildi. Olay yerine ulaşan itfaiye ekipleri, fabrikayı saran yangına müdahale etti; müdahale, 60 personel ve yaklaşık 50 araç ile yürütüldü. Ekiplerin yoğun çalışması sonucu yangın yaklaşık 5 saat süren müdahalenin ardından kontrol altına alındı. Gaziantep Büyükşehir Belediyesi Başkanvekili Halil Uğur , çalışmalarla ilgili olarak şu bilgileri verdi: ""Sabah 09.04’te itfaiye daire başkanlığımıza gelen ihbara istinaden ekiplerimiz harekete geçti. Bize gelen ihbardan 6 dakika sonra organize itfaiye ekiplerimizle birlikte yangına müdahalemiz başladı. Araştırmalarımıza göre yangın fabrikanın depo alanında çıkıyor. Teknik olarak detaylar araştırılıyor. Sevindirici olay da şu ana kadar can kaybının olmamış olmasıdır. İtfaiye daire başkanlığımızın kontrolünde 50’ye yakın itfaiye aracı ve destek araçla müdahale ediyoruz. Bunların yanında GASKİ, Kent estetiği, organize sanayinin tüm araçlarıyla birlikte yangına müdahale ediyoruz. Yangının etrafa sıçramasıyla ilgili durum kontrol altına alındı. Söndürme işlemi yapılıyor. Kısa süre içinde söndürme işlemi tamamlandıktan sonra soğutma çalışmalarına başlayacağız. Yangın kontrolümüz altında. Geçmiş olsun dileklerimi iletiyorum."" İtfaiye ekipleri fabrikada yer yer söndürme ve soğutma çalışmalarına devam ediyor. Yetkililer, yangının etrafı sarması riskinin kontrol altına alındığını ve teknik incelemelerle yangının çıkış nedeninin araştırıldığını belirtiyor. Şu ana kadar can kaybı bildirilmedi , soğutma çalışmaları tamamlanana kadar bölgedeki müdahale sürdürülüyor. GAZİANTEP'TE BİR TEKSTİL FABRİKASINDA ÇIKAN VE KISA SÜREDE BÜYÜYEN YANGIN KONTROL ALTINA ALINDI. Ben Meryem Özdemir, 24 yaşındayım, Bursa'dan çalışıyorum. aksiyon.com.tr Gündem'deyim ama spesifik olarak eğitim ve sağlık politikalarındaki güncel gelişmelere odaklanıyorum. Öğrenmeye açık, meraklı ve enerjik bir yapım var. 29 Aralık: Van, Zonguldak, Karabük, Bolu ve Düzce'de okullar tatil — Üniversiteler ne durumda? Taşacak Bu Deniz 13. bölüm neden yok? TRT 1, 2 Ocak yayın planını değiştirdi 2026 Zorunlu Trafik Sigortası: SEDDK Teminat Limitlerini ve Çoklu Araç Tarifesini Yeniden Belirledi Resmi Gazete'de yayımlandı: 66 meslekte Mesleki Yeterlilik Belgesi zorunluluğu Market poşeti fiyatı 2026'da 1 TL oldu — 1 Ocak 2026'da yürürlüğe giren tarife 1 Ocak'ta İstanbul'da Toplu Taşıma Ücretsiz: İBB Metro, Metrobüs ve Otobüs Ek Seferlerini Açıkladı Emekliye 60.000 TL'ye Kadar Paketler: Bankaların Güncel Promosyon ve Ek Avantajları 29 Aralık İstanbul'da Okullar Tatil mi? Valilik ve Meteoroloji Açıklamaları 2026 Ehliyet, Pasaport ve Kimlik Kartı Harçları Resmileşti: Yeni Tarifeler ve Geçerlilik Tarihi İstanbul'da simit fiyatları fiilen yükseldi: Resmi tarife 15 TL, satışlar 20-25 TL'ye çıktı 26-27 Aralık Hava Durumu: İstanbul, Ankara ve Yalova için Kar Tahminleri 2026 Sosyal Destek Zamları: Evde Bakım, 65 Yaş ve Engelli Maaşlarında Yeni Tahminler","Gaziantep'te Molhan Tekstil fabrikasında çıkan yangın kontrol altına alındı Gaziantep'te Molhan Tekstil fabrikasında çıkan yangın kontrol altına alındı Aksiyon.com.TR Gaziantep 5.Organize Sanayi Bölgesi'ndeki Molhan Tekstil fabrikasında sabah çıkan yangın, ekiplerin müdahalesiyle kontrol altına alındı; can kaybı yok, soğutma sürüyor. Gaziantep'te Molhan Tekstil fabrikasında çıkan yangın kontrol altına alındı Olay ve müdahale Gaziantep'in 5.Organize Sanayi Bölgesi nde bulunan Molhan Tekstil fabrikasında sabah saat 09.04 civarında bilinmeyen bir nedenle yangın çıktı. Kısa sürede büyüyen alevler için 112 acil çağrı merkezine ihbarda bulunuldu. İhbar üzerine bölgeye çok sayıda itfaiye, sağlık, polis ve AFAD ekibi sevk edildi. Olay yerine ulaşan itfaiye ekipleri, fabrikayı saran yangına müdahale etti; müdahale, 60 personel ve yaklaşık 50 araç ile yürütüldü. Ekiplerin yoğun çalışması sonucu yangın yaklaşık 5 saat süren müdahalenin ardından kontrol altına alındı. Yetkili açıklaması Gaziantep Büyükşehir Belediyesi Başkanvekili Halil Uğur , çalışmalarla ilgili olarak şu bilgileri verdi: ""Sabah 09.04’te itfaiye daire başkanlığımıza gelen ihbara istinaden ekiplerimiz harekete geçti. Bize gelen ihbardan 6 dakika sonra organize itfaiye ekiplerimizle birlikte yangına müdahalemiz başladı. Araştırmalarımıza göre yangın fabrikanın depo alanında çıkıyor. Teknik olarak detaylar araştırılıyor. Sevindirici olay da şu ana kadar can kaybının olmamış olmasıdır. İtfaiye daire başkanlığımızın kontrolünde 50’ye yakın itfaiye aracı ve destek araçla müdahale ediyoruz. Bunların yanında GASKİ, Kent estetiği, organize sanayinin tüm araçlarıyla birlikte yangına müdahale ediyoruz. Yangının etrafa sıçramasıyla ilgili durum kontrol altına alındı. Kısa süre içinde söndürme işlemi tamamlandıktan sonra soğutma çalışmalarına başlayacağız. Yangın kontrolümüz altında. Geçmiş olsun dileklerimi iletiyorum."" Güncel durum İtfaiye ekipleri fabrikada yer yer söndürme ve soğutma çalışmalarına devam ediyor. Yetkililer, yangının etrafı sarması riskinin kontrol altına alındığını ve teknik incelemelerle yangının çıkış nedeninin araştırıldığını belirtiyor. GAZİANTEP'TE BİR TEKSTİL FABRİKASINDA ÇIKAN VE KISA SÜREDE BÜYÜYEN YANGIN KONTROL ALTINA ALINDI. 1 Karaman'da motosiklet kaldırıma çarpıp karşı şeride savruldu; sürücü yaralanmadı Karaman'da motosiklet kaldırıma çarpıp karşı şeride savruldu; sürücü yaralanmadı 2 Çan'da tamir için bırakılan araç Edremit'te bulundu: 2 şüpheli tutuklandı Çan'da tamir için bırakılan araç Edremit'te bulundu: 2 şüpheli tutuklandı 3 Gebze'de 3 katlı binanın en üst katında çıkan yangın söndürüldü Gebze'de 3 katlı binanın en üst katında çıkan yangın söndürüldü 4 Konya'da Mayıs ayında polis bölgesinde 1.556 trafik kazası: 3 ölü, 1.143 yaralı Konya'da Mayıs ayında polis bölgesinde 1.556 trafik kazası: 3 ölü, 1.143 yaralı 5 Gebze'de 3. kat yangını: Çamaşır makinesi kaynaklı olduğu iddia edildi, itfaiye söndürdü Gebze'de 3. kat yangını: Çamaşır makinesi kaynaklı olduğu iddia edildi, itfaiye söndürdü 6 Tarsus’ta Adana-Mersin Otoyolu Ziyaret Tepe mevkiinde otomobil tıra çarptı: 1 ölü, 4 yaralı Tarsus’ta Adana-Mersin Otoyolu Ziyaret Tepe mevkiinde otomobil tıra çarptı: 1 ölü, 4 yaralı 7 Bulgaristan sınır polisi filosunu güçlendirdi: 10 milyon 487 bin 747,64 avroluk yeni araç ve ekipman Bulgaristan sınır polisi filosunu güçlendirdi: 10 milyon 487 bin 747,64 avroluk yeni araç ve ekipman Gaziantep'te Molhan Tekstil fabrikasında çıkan yangın kontrol altına alındı Gaziantep 5.Organize Sanayi Bölgesi'ndeki Molhan Tekstil fabrikasında sabah çıkan yangın, ekiplerin müdahalesiyle kontrol altına alındı; can kaybı yok, soğutma sürüyor. Gaziantep'in 5.Organize Sanayi Bölgesi nde bulunan Molhan Tekstil fabrikasında sabah saat 09.04 civarında bilinmeyen bir nedenle yangın çıktı. Gaziantep Büyükşehir Belediyesi Başkanvekili Halil Uğur , çalışmalarla ilgili olarak şu bilgileri verdi: ""Sabah 09.04’te itfaiye daire başkanlığımıza gelen ihbara istinaden ekiplerimiz harekete geçti. Geçmiş olsun dileklerimi iletiyorum."" İtfaiye ekipleri fabrikada yer yer söndürme ve soğutma çalışmalarına devam ediyor. Ben Meryem Özdemir, 24 yaşındayım, Bursa'dan çalışıyorum. 29 Aralık: Van, Zonguldak, Karabük, Bolu ve Düzce'de okullar tatil — Üniversiteler ne durumda? TRT 1, 2 Ocak yayın planını değiştirdi 2026 Zorunlu Trafik Sigortası: SEDDK Teminat Limitlerini ve Çoklu Araç Tarifesini Yeniden Belirledi Resmi Gazete'de yayımlandı: 66 meslekte Mesleki Yeterlilik Belgesi zorunluluğu Market poşeti fiyatı 2026'da 1 TL oldu — 1 Ocak 2026'da yürürlüğe giren tarife 1 Ocak'ta İstanbul'da Toplu Taşıma Ücretsiz: İBB Metro, Metrobüs ve Otobüs Ek Seferlerini Açıkladı Emekliye 60.000 TL'ye Kadar Paketler: Bankaların Güncel Promosyon ve Ek Avantajları 29 Aralık İstanbul'da Okullar Tatil mi? Valilik ve Meteoroloji Açıklamaları 2026 Ehliyet, Pasaport ve Kimlik Kartı Harçları Resmileşti: Yeni Tarifeler ve Geçerlilik Tarihi İstanbul'da simit fiyatları fiilen yükseldi: Resmi tarife 15 TL, satışlar 20-25 TL'ye çıktı 26-27 Aralık Hava Durumu: İstanbul, Ankara ve Yalova için Kar Tahminleri 2026 Sosyal Destek Zamları: Evde Bakım, 65 Yaş ve Engelli Maaşlarında Yeni Tahminler",browser_full_article,https://www.aksiyon.com.tr/gaziantep-te-molhan-tekstil-fabrikasinda-cikan-yangin-kontrol-altina-alindi-290982,Bursa | Düzce | Gaziantep | İstanbul | Karaman,Edremit | Gebze | Tarsus,,,,Molhan Tekstil,Molhan Tekstil:292:body+summary+title,faaliyet/tesis yok,Molhan Tekstil Edremit Bursa Türkiye,,,maps sonucu düşük güven nedeniyle elendi,,Edremit | Bursa,183.0,4
