published,search_term,category,title,summary,link,matched_words,activity_type,raw_text,entity_source_text,article_fetch_status,resolved_article_url,city_candidates,district_candidates,neighborhood_candidates,street_candidates,facility_candidates,company_candidates,company_candidate_scores,entity_quality_note,maps_queries,maps_candidates,maps_best_guess,maps_status,maps_match_scores,maps_rejected_candidates,record_quality_score,duplicate_group_id
2026-06-01 05:36:00,iflas,İflas / Konkordato / Mali Sorun,Çuvalla para harcayarak büyük yatırım yapmışlardı! Dev gıda şirketi sessiz sedasız iflas etti,Çuvalla para harcayarak büyük yatırım yapmışlardı! Dev gıda şirketi sessiz sedasız iflas etti Yeni Akit Gazetesi,https://news.google.com/rss/articles/CBMi2AFBVV95cUxQT1h6am5yN0N0MXA0OHZocF9tUk80b2VmQWtEeUcyRHFKMHZxUGp0REczTnh0M0pwSHN6amdDUGJkdndwelJMaTlETEQzd2JKR3I1WlhTRFI3SHowTlVtcUcxODVncEE1eGNfODBtbkpseXRxdm54UWJPZVlrVGxycEVFeG1jaGwxZVJ1ZGxoN0Z3ems2Y28zX0NpNnRQY3EtY2hxdXdXTTVnZGdCRGNRa3V1REt6dkNDeTNSUzZWN0tlY3gtNjZoazIwLUNYZnZ1LTBQcmExS3LSAdgBQVVfeXFMUE9YempucjdDdDFwNDh2aHBfbVJPNG9lZkFrRHlHMkRxSjB2cVBqdERHM054dDNKcEhzempnQ1BiZHZ3cHpSTGk5RExEM3diSkdyNVpYU0RSN0h6ME5VbXFHMTg1Z3BBNXhjXzgwbW5KbHl0cXZueFFiT2VZa1RscnBFRXhtY2hsMWVSdWRsaDdGd3prNmNvM19DaTZ0UGNxLWNocXV3V001Z2RnQkRjUWt1dURLenZDQ3kzUlM2VjdLZWN4LTY2aGsyMC1DWGZ2dS0wUHJhMUty?oc=5,"gıda, şirket",şirket / firma,"Ekonomi Çuvalla para harcayarak büyük yatırım yapmışlardı! Dev gıda şirketi sessiz sedasız iflas etti 2026-06-01 08:36 Güncelleme Tarihi: 2026-06-01 11:52 5 milyon dolarlık yatırımla pizza üretim robotları icat eden şirket, 10. yılında iflas ettiğini duyurdu. 3 ABD'de Seattle merkezli robotik şirketi Picnic Works, faaliyetlerini sona erdirerek varlıklarının tasfiye sürecini başlattı. 4 Picnic Works, tek bir işçinin saatte 130 pizza yapmasına imkan tanıyan robotik pizza yapma makinesi geliştirmişti. Fakat geliştirilen makinelerin pizzaları pişirmediği ortaya çıktı. Pizza malzemelerinin boyutları ve miktarları da yine çalışanlar tarafından seçilmek zorundaydı, makine sadece peyniri, sosları ve diğer malzemeleri ekliyordu. 5 Picnic Works'ün ilk robot pizza makinesi olan Leonardo, yaklaşık 2,1 metre genişliğinde, 1,5 metre yüksekliğinde ve 0,9 metre derinliğindeydi. 6 Ardından şirket, 1,5 metreden daha az genişliğe sahip Michelangelo adlı daha küçük bir model icat etti. 2016 senesinde kurulan şirket, 2024 yılında yüksek hacimli müşteri segmentine yönelmek için 5 milyon dolarlık yatırım almıştı. Fakat bu strateji şirketi ayakta tutmaya yetmedi. 7 Son senelerde yönetim kademesinde de değişiklikler yaşayan şirket iflastan sonra tasfiye sürecine girerken, şirketin varlıklarının tek bir alıcıya satıldığı belirtildi. 8 Şirket robot pizza makinelerini kontrol eden 20 çalışanıyla faaliyet gösteriyordu. Ekonomi Çuvalla para harcayarak büyük yatırım yapmışlardı! Dev gıda şirketi sessiz sedasız iflas etti 2026-06-01 08:36 Güncelleme Tarihi: 2026-06-01 11:52 5 milyon dolarlık yatırımla pizza üretim robotları icat eden şirket, 10. yılında iflas ettiğini duyurdu. 3 ABD'de Seattle merkezli robotik şirketi Picnic Works, faaliyetlerini sona erdirerek varlıklarının tasfiye sürecini başlattı. 4 Picnic Works, tek bir işçinin saatte 130 pizza yapmasına imkan tanıyan robotik pizza yapma makinesi geliştirmişti. Fakat geliştirilen makinelerin pizzaları pişirmediği ortaya çıktı. Pizza malzemelerinin boyutları ve miktarları da yine çalışanlar tarafından seçilmek zorundaydı, makine sadece peyniri, sosları ve diğer malzemeleri ekliyordu. 5 Picnic Works'ün ilk robot pizza makinesi olan Leonardo, yaklaşık 2,1 metre genişliğinde, 1,5 metre yüksekliğinde ve 0,9 metre derinliğindeydi. 6 Ardından şirket, 1,5 metreden daha az genişliğe sahip Michelangelo adlı daha küçük bir model icat etti. 2016 senesinde kurulan şirket, 2024 yılında yüksek hacimli müşteri segmentine yönelmek için 5 milyon dolarlık yatırım almıştı. Fakat bu strateji şirketi ayakta tutmaya yetmedi. 7 Son senelerde yönetim kademesinde de değişiklikler yaşayan şirket iflastan sonra tasfiye sürecine girerken, şirketin varlıklarının tek bir alıcıya satıldığı belirtildi. 8 Şirket robot pizza makinelerini kontrol eden 20 çalışanıyla faaliyet gösteriyordu. Çuvalla para harcayarak büyük yatırım yapmışlardı! Dev gıda şirketi sessiz sedasız iflas etti 5 milyon dolarlık yatırımla pizza üretim robotları icat eden şirket, 10. yılında iflas ettiğini duyurdu. ABD'de Seattle merkezli robotik şirketi Picnic Works, faaliyetlerini sona erdirerek varlıklarının tasfiye sürecini başlattı. Picnic Works, tek bir işçinin saatte 130 pizza yapmasına imkan tanıyan robotik pizza yapma makinesi geliştirmişti. Fakat geliştirilen makinelerin pizzaları pişirmediği ortaya çıktı. Pizza malzemelerinin boyutları ve miktarları da yine çalışanlar tarafından seçilmek zorundaydı, makine sadece peyniri, sosları ve diğer malzemeleri ekliyordu. Picnic Works'ün ilk robot pizza makinesi olan Leonardo, yaklaşık 2,1 metre genişliğinde, 1,5 metre yüksekliğinde ve 0,9 metre derinliğindeydi. Ardından şirket, 1,5 metreden daha az genişliğe sahip Michelangelo adlı daha küçük bir model icat etti. 2016 senesinde kurulan şirket, 2024 yılında yüksek hacimli müşteri segmentine yönelmek için 5 milyon dolarlık yatırım almıştı. Fakat bu strateji şirketi ayakta tutmaya yetmedi. Son senelerde yönetim kademesinde de değişiklikler yaşayan şirket iflastan sonra tasfiye sürecine girerken, şirketin varlıklarının tek bir alıcıya satıldığı belirtildi. Şirket robot pizza makinelerini kontrol eden 20 çalışanıyla faaliyet gösteriyordu.","Çuvalla para harcayarak büyük yatırım yapmışlardı! Dev gıda şirketi sessiz sedasız iflas etti Çuvalla para harcayarak büyük yatırım yapmışlardı! Dev gıda şirketi sessiz sedasız iflas etti Yeni Akit Gazetesi Ekonomi Çuvalla para harcayarak büyük yatırım yapmışlardı! Dev gıda şirketi sessiz sedasız iflas etti 2026-06-01 08:36 Güncelleme Tarihi: 2026-06-01 11:52 5 milyon dolarlık yatırımla pizza üretim robotları icat eden şirket, 10. yılında iflas ettiğini duyurdu. 3 ABD'de Seattle merkezli robotik şirketi Picnic Works, faaliyetlerini sona erdirerek varlıklarının tasfiye sürecini başlattı. 4 Picnic Works, tek bir işçinin saatte 130 pizza yapmasına imkan tanıyan robotik pizza yapma makinesi geliştirmişti. Fakat geliştirilen makinelerin pizzaları pişirmediği ortaya çıktı. Pizza malzemelerinin boyutları ve miktarları da yine çalışanlar tarafından seçilmek zorundaydı, makine sadece peyniri, sosları ve diğer malzemeleri ekliyordu. 5 Picnic Works'ün ilk robot pizza makinesi olan Leonardo, yaklaşık 2,1 metre genişliğinde, 1,5 metre yüksekliğinde ve 0,9 metre derinliğindeydi. 6 Ardından şirket, 1,5 metreden daha az genişliğe sahip Michelangelo adlı daha küçük bir model icat etti. 2016 senesinde kurulan şirket, 2024 yılında yüksek hacimli müşteri segmentine yönelmek için 5 milyon dolarlık yatırım almıştı. Fakat bu strateji şirketi ayakta tutmaya yetmedi. 7 Son senelerde yönetim kademesinde de değişiklikler yaşayan şirket iflastan sonra tasfiye sürecine girerken, şirketin varlıklarının tek bir alıcıya satıldığı belirtildi. 8 Şirket robot pizza makinelerini kontrol eden 20 çalışanıyla faaliyet gösteriyordu. Çuvalla para harcayarak büyük yatırım yapmışlardı! Dev gıda şirketi sessiz sedasız iflas etti 5 milyon dolarlık yatırımla pizza üretim robotları icat eden şirket, 10. ABD'de Seattle merkezli robotik şirketi Picnic Works, faaliyetlerini sona erdirerek varlıklarının tasfiye sürecini başlattı. Picnic Works, tek bir işçinin saatte 130 pizza yapmasına imkan tanıyan robotik pizza yapma makinesi geliştirmişti. Picnic Works'ün ilk robot pizza makinesi olan Leonardo, yaklaşık 2,1 metre genişliğinde, 1,5 metre yüksekliğinde ve 0,9 metre derinliğindeydi. Ardından şirket, 1,5 metreden daha az genişliğe sahip Michelangelo adlı daha küçük bir model icat etti. Son senelerde yönetim kademesinde de değişiklikler yaşayan şirket iflastan sonra tasfiye sürecine girerken, şirketin varlıklarının tek bir alıcıya satıldığı belirtildi. Şirket robot pizza makinelerini kontrol eden 20 çalışanıyla faaliyet gösteriyordu.",browser_full_article,https://m.yeniakit.com.tr/amp/foto-galeri/158871/cuvalla-para-harcayarak-buyuk-yatirim-yapmislardi-dev-gida-sirketi-sessiz-sedasiz-iflas-etti,,,,,,,,il yok | ilçe yok | firma yok | faaliyet/tesis yok,,,,maps araması yapılmadı,,,105.5,14
2026-06-01 10:12:00,mali suç,Diğer,"Buca'daki yolsuzluğun detayları ortaya çıktı: Belediyede ""rüşvet fabrikası"" kurmuşlar","Buca'daki yolsuzluğun detayları ortaya çıktı: Belediyede ""rüşvet fabrikası"" kurmuşlar Yirmidört Tv",https://news.google.com/rss/articles/CBMivAFBVV95cUxPVndjdmxIaTc3cENuQ1lxeFlrbk5iVVF0d3dKYU9tQTdKTml2aEU4MnpEZFVaRVhnb3BHWFdEVnRfLUd4QnhRWXpJOF9KX1pSYzRnblpiaHR1WjZtT2VVWDhaaHQ1TVh3cDkyemcxZXJoV2hJZGsyR1BVQk1OdDN4MTR5b240UGQ3dXJUc2xLNzNaSDBYY3FIWWszSlFGRy1kWEtOT1NaS1RXVjFQb1RPbW1qc3JjU2pYcEJxdQ?oc=5,fabrika,fabrika,"Buca'daki yolsuzluğun detayları ortaya çıktı: Belediyede ""rüşvet fabrikası"" kurmuşlar Yirmidört Tv","Buca'daki yolsuzluğun detayları ortaya çıktı: Belediyede ""rüşvet fabrikası"" kurmuşlar Buca'daki yolsuzluğun detayları ortaya çıktı: Belediyede ""rüşvet fabrikası"" kurmuşlar Yirmidört Tv Buca'daki yolsuzluğun detayları ortaya çıktı: Belediyede ""rüşvet fabrikası"" kurmuşlar Yirmidört Tv",browser_failed,https://news.google.com/rss/articles/CBMivAFBVV95cUxPVndjdmxIaTc3cENuQ1lxeFlrbk5iVVF0d3dKYU9tQTdKTml2aEU4MnpEZFVaRVhnb3BHWFdEVnRfLUd4QnhRWXpJOF9KX1pSYzRnblpiaHR1WjZtT2VVWDhaaHQ1TVh3cDkyemcxZXJoV2hJZGsyR1BVQk1OdDN4MTR5b240UGQ3dXJUc2xLNzNaSDBYY3FIWWszSlFGRy1kWEtOT1NaS1RXVjFQb1RPbW1qc3JjU2pYcEJxdQ?oc=5&hl=tr&gl=TR&ceid=TR:tr,,,,,rüşvet fabrikası,,,il yok | ilçe yok | firma yok,,,,maps araması yapılmadı,,,107.98,15
2026-06-01 05:15:08,örgütlü suç,Operasyon / Soruşturma / Suç,"Buca’da vahim iddialar: Suç örgütü kurmak, rüşvet, imar ve ihalelerde usülsüzlük, bankamatik personel, darp…","Buca’da vahim iddialar: Suç örgütü kurmak, rüşvet, imar ve ihalelerde usülsüzlük, bankamatik personel, darp… Erhan Gülenç",https://news.google.com/rss/articles/CBMi0gFBVV95cUxPbXM5VzU2ZnFuUGhEcXdzemhyVUdVaFVNNXMzRkZicklFZjAtT0tCRkVBTlp6TmJyYmp4eEI2eS1PQU04NVNHVHpvazVXYWstdi1HTWVCV3hzbm5ONmZMZXZUanhwY2EtVGUxNkhOS3QzQmhkWS00cG9pU3RncUJMSC15LWVJTTVyTl9jQzluWnI2Y2RxSS1iNDdBbWFENkRlaGNmNGpxaFNCTTh6OUV1Tk9aRlgtdmtBb2l3WjREODkzbkt5akNpV01iRmktWEdNVXc?oc=5,banka,finansal kuruluş,"Buca’da vahim iddialar: Suç örgütü kurmak, rüşvet, imar ve ihalelerde usülsüzlük, bankamatik personel, darp… Erhan Gülenç","Buca’da vahim iddialar: Suç örgütü kurmak, rüşvet, imar ve ihalelerde usülsüzlük, bankamatik personel, darp… Buca’da vahim iddialar: Suç örgütü kurmak, rüşvet, imar ve ihalelerde usülsüzlük, bankamatik personel, darp… Erhan Gülenç Buca’da vahim iddialar: Suç örgütü kurmak, rüşvet, imar ve ihalelerde usülsüzlük, bankamatik personel, darp… Erhan Gülenç",browser_failed,https://news.google.com/rss/articles/CBMi0gFBVV95cUxPbXM5VzU2ZnFuUGhEcXdzemhyVUdVaFVNNXMzRkZicklFZjAtT0tCRkVBTlp6TmJyYmp4eEI2eS1PQU04NVNHVHpvazVXYWstdi1HTWVCV3hzbm5ONmZMZXZUanhwY2EtVGUxNkhOS3QzQmhkWS00cG9pU3RncUJMSC15LWVJTTVyTl9jQzluWnI2Y2RxSS1iNDdBbWFENkRlaGNmNGpxaFNCTTh6OUV1Tk9aRlgtdmtBb2l3WjREODkzbkt5akNpV01iRmktWEdNVXc?oc=5&hl=tr&gl=TR&ceid=TR:tr,İzmir,Buca,,,,,,firma yok | faaliyet/tesis yok,,,,maps araması yapılmadı,,,119.46,16
2026-05-31 17:11:07,usulsüzlük,Diğer,"Araştırmacı gazetecilik ağı, vize şirketi VFS Global'i mercek altına aldı: Rüşvet, bot yazılımlar, zorunlu ödemeler...","Araştırmacı gazetecilik ağı, vize şirketi VFS Global'i mercek altına aldı: Rüşvet, bot yazılımlar, zorunlu ödemeler... Gazete Oksijen",https://news.google.com/rss/articles/CBMi7AFBVV95cUxPUHBaRzdjWnNWSEdFMnJUekpnNU1pbTBXWjhMMlR1dWRFdGtKQThtc1QtNERCRGxBSk5CaVRwY1BndEw2bzlha0ZMYVdkM3NZT0RSaHJ0VGpnUlM0NU9IQWxVNkxOOFNOV25CSFZkQmJHMUhnT2lnUWZnRVhabUdnM280Y2FNaXlLejJQYzlCbVlNbEYwbjcySTJFakZTNzF2MVhLekNoZjJTXzBsaWVnNmZ5TGs1RUNkTlNJa1JNaEtTWDRNSXNTcUVJNXFWeExkRktENWx1eU1vWmlPcnhiX1Vya0Y4NWxMcU5KdA?oc=5,şirket,şirket / firma,"Araştırmacı gazetecilik ağı, vize şirketi VFS Global'i mercek altına aldı: Rüşvet, bot yazılımlar, zorunlu ödemeler... Gazete Oksijen","Araştırmacı gazetecilik ağı, vize şirketi VFS Global'i mercek altına aldı: Rüşvet, bot yazılımlar, zorunlu ödemeler... Araştırmacı gazetecilik ağı, vize şirketi VFS Global'i mercek altına aldı: Rüşvet, bot yazılımlar, zorunlu ödemeler... Gazete Oksijen Araştırmacı gazetecilik ağı, vize şirketi VFS Global'i mercek altına aldı: Rüşvet, bot yazılımlar, zorunlu ödemeler...",browser_failed,https://gazeteoksijen.com/dunya/uluslararasi-arastirmaci-gazetecilik-agindan-vfs-global-dosyasi-vize-almak-isteyenler-nasil-ek-ucret-odemeye-zorlandi-277221,,,,,,,,il yok | ilçe yok | firma yok | faaliyet/tesis yok,,,,maps araması yapılmadı,,,99.58,17
2026-06-01 08:18:59,ihale yolsuzluğu,Banka / Finansal Kuruluş,Buca Belediyesi’ne yolsuzluk operasyonu: Bankamatik memur sistemi ortaya çıktı,Buca Belediyesi’ne yolsuzluk operasyonu: Bankamatik memur sistemi ortaya çıktı TRHaber,https://news.google.com/rss/articles/CBMiwgFBVV95cUxNNWtsaTNFMlB6SzY4OHBtVDVWejhSOGkzZVRLLWVwUm5qWGc3SldLUXFleVowajZHakVXUzdnekhRTkJseWZqcXdOTk5sRUN0LW9XMVN6bXlzNHJLTmdCMVZGT1NNeUpGUlpsLUxmdklVcGkyNVI5ckNUT0llNVJpRGtBaVdyNE9laVN2eTVzN0VKNWdPd3FOeWpKc0Nla0Vjbi1PT0h3ZDNKM3A3dTd1TS1IUFgtdWxQVXJYRGhTeG9MZw?oc=5,banka,finansal kuruluş,Buca Belediyesi’ne yolsuzluk operasyonu: Bankamatik memur sistemi ortaya çıktı TRHaber,Buca Belediyesi’ne yolsuzluk operasyonu: Bankamatik memur sistemi ortaya çıktı Buca Belediyesi’ne yolsuzluk operasyonu: Bankamatik memur sistemi ortaya çıktı TRHaber Buca Belediyesi’ne yolsuzluk operasyonu: Bankamatik memur sistemi ortaya çıktı TRHaber,browser_failed,https://news.google.com/rss/articles/CBMiwgFBVV95cUxNNWtsaTNFMlB6SzY4OHBtVDVWejhSOGkzZVRLLWVwUm5qWGc3SldLUXFleVowajZHakVXUzdnekhRTkJseWZqcXdOTk5sRUN0LW9XMVN6bXlzNHJLTmdCMVZGT1NNeUpGUlpsLUxmdklVcGkyNVI5ckNUT0llNVJpRGtBaVdyNE9laVN2eTVzN0VKNWdPd3FOeWpKc0Nla0Vjbi1PT0h3ZDNKM3A3dTd1TS1IUFgtdWxQVXJYRGhTeG9MZw?oc=5&hl=tr&gl=TR&ceid=TR:tr,,,,,,,,il yok | ilçe yok | firma yok | faaliyet/tesis yok,,,,maps araması yapılmadı,,,67.36,18
2026-05-31 14:56:22,bankaya soruşturma,Banka / Finansal Kuruluş,Muğla Ortaca’da Korku Dolu Anlar: Savrulan Araç Bankaya Daldı,Muğla Ortaca’da Korku Dolu Anlar: Savrulan Araç Bankaya Daldı Muğla Gazetesi,https://news.google.com/rss/articles/CBMiuAFBVV95cUxPSWUzY0lyUHNOaWRUbDZ0NzlHVlF3VGt2N2w5MERBV3JBbUR1eWJTSmpBV2tNVE5wQ3FOLTBSeFF0b0Z3NHhnVVZqSnJvT042X1RKWWp4VE5Kc1FMVUpyY3FydGROa3lVT1lyZk91TTVUUkxRNlhFc1gwS3hhYWxZbERNZmoyRnVQLXozd3I5UjhZZi1lb2Z1R29FQWZmVVdWQVZQdDNhdGxlYW1hVUVjS1FqU041Q0cy?oc=5,banka,finansal kuruluş,Muğla Ortaca’da Korku Dolu Anlar: Savrulan Araç Bankaya Daldı Muğla Gazetesi,Muğla Ortaca’da Korku Dolu Anlar: Savrulan Araç Bankaya Daldı Muğla Ortaca’da Korku Dolu Anlar: Savrulan Araç Bankaya Daldı Muğla Gazetesi Muğla Ortaca’da Korku Dolu Anlar: Savrulan Araç Bankaya Daldı Muğla Gazetesi,browser_failed,https://news.google.com/rss/articles/CBMiuAFBVV95cUxPSWUzY0lyUHNOaWRUbDZ0NzlHVlF3VGt2N2w5MERBV3JBbUR1eWJTSmpBV2tNVE5wQ3FOLTBSeFF0b0Z3NHhnVVZqSnJvT042X1RKWWp4VE5Kc1FMVUpyY3FydGROa3lVT1lyZk91TTVUUkxRNlhFc1gwS3hhYWxZbERNZmoyRnVQLXozd3I5UjhZZi1lb2Z1R29FQWZmVVdWQVZQdDNhdGxlYW1hVUVjS1FqU041Q0cy?oc=5&hl=tr&gl=TR&ceid=TR:tr,Muğla,Ortaca,,,,,,firma yok | faaliyet/tesis yok,,,,maps araması yapılmadı,,,76.26,19
2026-06-01 07:41:24,yangın,Fiziksel Risk / Yangın,"Bursa'da Ermetal Fabrikası'nda Kaynak Kaynaklı Yangın Paniği: Maddi Hasar Var, Can Kaybı Yok","Bursa'da Ermetal Fabrikası'nda Kaynak Kaynaklı Yangın Paniği: Maddi Hasar Var, Can Kaybı Yok Ege Alternatif",https://news.google.com/rss/articles/CBMizgFBVV95cUxPdUJoeldKeldiSlR1YzI1YmpFRmFwbFY4OVNuS0hQdFI0c1BwS1hKcnUxLXdxaU9DT19aTUd5MjdpRVljTk9hMmpYS2ROMVF0UVVRWHFyTzh4YnVfXzZ0NGk5dTBCUUV4SE1ySjhwVlZVTDB2V01DM1EySkh0TVU1OHNMZXlSWlVCX0lUUFFneTdXMnIxQk9Jc2xuY2ZiTHNhZ1NaNEdLVlpRTzRfemdScWFWZW9meDM5alVjNm1TbjBYNjI3T2t6V2JLa1FaQQ?oc=5,fabrika,fabrika,"Bursa'da Ermetal Fabrikası'nda Kaynak Kaynaklı Yangın Paniği: Maddi Hasar Var, Can Kaybı Yok Ege Alternatif","Bursa'da Ermetal Fabrikası'nda Kaynak Kaynaklı Yangın Paniği: Maddi Hasar Var, Can Kaybı Yok Bursa'da Ermetal Fabrikası'nda Kaynak Kaynaklı Yangın Paniği: Maddi Hasar Var, Can Kaybı Yok Ege Alternatif Bursa'da Ermetal Fabrikası'nda Kaynak Kaynaklı Yangın Paniği: Maddi Hasar Var, Can Kaybı Yok Ege Alternatif",browser_failed,https://news.google.com/rss/articles/CBMizgFBVV95cUxPdUJoeldKeldiSlR1YzI1YmpFRmFwbFY4OVNuS0hQdFI0c1BwS1hKcnUxLXdxaU9DT19aTUd5MjdpRVljTk9hMmpYS2ROMVF0UVVRWHFyTzh4YnVfXzZ0NGk5dTBCUUV4SE1ySjhwVlZVTDB2V01DM1EySkh0TVU1OHNMZXlSWlVCX0lUUFFneTdXMnIxQk9Jc2xuY2ZiTHNhZ1NaNEdLVlpRTzRfemdScWFWZW9meDM5alVjNm1TbjBYNjI3T2t6V2JLa1FaQQ?oc=5&hl=tr&gl=TR&ceid=TR:tr,Bursa,,,,da Ermetal Fabrikası,,,ilçe yok | firma yok,,,,maps araması yapılmadı,,,123.82,20
2026-06-01 07:59:37,yangın,Fiziksel Risk / Yangın,Fabrikada korkutan yangın: Kaynak çalışması faciaya yol açıyordu,Fabrikada korkutan yangın: Kaynak çalışması faciaya yol açıyordu Yeni Şafak,https://news.google.com/rss/articles/CBMisgFBVV95cUxPcjBnMXdJWW9QVkRSTHdWd0FzSE1uSmw2M01FbEtxcTJXUWkxTDI2eDNqYjZ4STVJRktvSWVkeFB1SVhiT3ZlOXBscUhEenZmWUJuR1E2MFdxSTlEUjllUnlqRndtUXdyaDZOVmxmZEZ5X2g3U3Y4ZnlOQkJTV1RMRkx4WC1Bc2Q1XzUtMjVXTnNBRWhEWGN3REEtOGoyczg4RHpOaGgtQVkzYzBVWlBRZzBR0gGyAUFVX3lxTE9yMGcxd0lZb1BWRFJMd1Z3QXNITW5KbDYzTUVsS3FxMldRaTFMMjZ4M2piNnhJNUlGS29JZWR4UHVJWGJPdmU5cGxxSER6dmZZQm5HUTYwV3FJOURSOWVSeWpGd21Rd3JoNk5WbGZkRnlfaDdTdjhmeU5CQlNXVExGTHhYLUFzZDVfNS0yNVdOc0FFaERYY3dEQS04ajJzODhEek5oaC1BWTNjMFVaUFFnMFE?oc=5,fabrika,fabrika,"GÜNDEM Ömerli Barajı’nda doluluk oranı yüzde 96’ya ulaştı GÜNDEM TEM Otoyolu'nu kullanacaklar dikkat: İstanbul yönü trafiğe kapatılıyor GÜNDEM Bayramda acı bilanço: Bakan Çiftçi trafik kazalarında yaşanan can kaybını açıkladı GÜNDEM Şüpheli tırda 5,5 milyon adet bandrolsüz sigara ele geçirildi GÜNDEM 29 bin 353 personelin yeri değişti: Jandarma’da dev atama listesi açıklandı Fabrikada korkutan yangın: Kaynak çalışması faciaya yol açıyordu Bursa’da bir fabrikada çıkan yangın paniğe neden oldu. İtfaiye ekiplerinin hızlı müdahalesiyle kontrol altına alınan yangın, korku dolu anlar yaşattı. Yangın, saat 08.30 sıralarında Osmangazi ilçesi Demirtaş Organize Sanayi Bölgesi’nde faaliyet gösteren Ermetal fabrikasında meydana geldi. Edinilen bilgiye göre, fabrikada yapılan kaynak çalışması yangına neden oldu. Kısa sürede büyüyen alevleri fark eden çalışanlar durumu 112 Acil Çağrı Merkezi’ne bildirdi. İhbar üzerine olay yerine çok sayıda itfaiye ekibi sevk edildi. Ekiplerin hızlı müdahalesi sayesinde yangın kısa sürede kontrol altına alınırken, alevler çevredeki bölümlere sıçramadan söndürüldü. Yangında can kaybı ya da yaralanma yaşanmazken, fabrikada maddi hasar meydana geldi. Olayla ilgili inceleme başlatıldı.","Fabrikada korkutan yangın: Kaynak çalışması faciaya yol açıyordu Fabrikada korkutan yangın: Kaynak çalışması faciaya yol açıyordu Yeni Şafak GÜNDEM Ömerli Barajı’nda doluluk oranı yüzde 96’ya ulaştı GÜNDEM TEM Otoyolu'nu kullanacaklar dikkat: İstanbul yönü trafiğe kapatılıyor GÜNDEM Bayramda acı bilanço: Bakan Çiftçi trafik kazalarında yaşanan can kaybını açıkladı GÜNDEM Şüpheli tırda 5,5 milyon adet bandrolsüz sigara ele geçirildi GÜNDEM 29 bin 353 personelin yeri değişti: Jandarma’da dev atama listesi açıklandı Fabrikada korkutan yangın: Kaynak çalışması faciaya yol açıyordu Bursa’da bir fabrikada çıkan yangın paniğe neden oldu. İtfaiye ekiplerinin hızlı müdahalesiyle kontrol altına alınan yangın, korku dolu anlar yaşattı. Yangın, saat 08.30 sıralarında Osmangazi ilçesi Demirtaş Organize Sanayi Bölgesi’nde faaliyet gösteren Ermetal fabrikasında meydana geldi. Edinilen bilgiye göre, fabrikada yapılan kaynak çalışması yangına neden oldu. Kısa sürede büyüyen alevleri fark eden çalışanlar durumu 112 Acil Çağrı Merkezi’ne bildirdi. İhbar üzerine olay yerine çok sayıda itfaiye ekibi sevk edildi. Ekiplerin hızlı müdahalesi sayesinde yangın kısa sürede kontrol altına alınırken, alevler çevredeki bölümlere sıçramadan söndürüldü. Yangında can kaybı ya da yaralanma yaşanmazken, fabrikada maddi hasar meydana geldi. Olayla ilgili inceleme başlatıldı.",browser_full_article_dom,https://news.google.com/rss/articles/CBMisgFBVV95cUxPcjBnMXdJWW9QVkRSTHdWd0FzSE1uSmw2M01FbEtxcTJXUWkxTDI2eDNqYjZ4STVJRktvSWVkeFB1SVhiT3ZlOXBscUhEenZmWUJuR1E2MFdxSTlEUjllUnlqRndtUXdyaDZOVmxmZEZ5X2g3U3Y4ZnlOQkJTV1RMRkx4WC1Bc2Q1XzUtMjVXTnNBRWhEWGN3REEtOGoyczg4RHpOaGgtQVkzYzBVWlBRZzBR0gGyAUFVX3lxTE9yMGcxd0lZb1BWRFJMd1Z3QXNITW5KbDYzTUVsS3FxMldRaTFMMjZ4M2piNnhJNUlGS29JZWR4UHVJWGJPdmU5cGxxSER6dmZZQm5HUTYwV3FJOURSOWVSeWpGd21Rd3JoNk5WbGZkRnlfaDdTdjhmeU5CQlNXVExGTHhYLUFzZDVfNS0yNVdOc0FFaERYY3dEQS04ajJzODhEek5oaC1BWTNjMFVaUFFnMFE?oc=5&hl=tr&gl=TR&ceid=TR:tr,Bursa,Osmangazi,Demirtaş,,,,,firma yok | faaliyet/tesis yok,,,,maps araması yapılmadı,,,120.95,21
