published,search_term,category,title,summary,link,matched_words,activity_type,raw_text,entity_source_text,article_fetch_status,resolved_article_url,city_candidates,district_candidates,neighborhood_candidates,street_candidates,facility_candidates,company_candidates,company_candidate_scores,entity_quality_note,maps_queries,maps_candidates,maps_best_guess,maps_status,maps_match_scores,maps_rejected_candidates,record_quality_score,duplicate_group_id
2026-07-06 20:24:58,depo yangını,Fiziksel Risk / Yangın,Samsun'da korkutan depo yangını: Boya ve inşaat malzemeleri alev alev yandı,Samsun'da korkutan depo yangını: Boya ve inşaat malzemeleri alev alev yandı Bengü Türk,https://news.google.com/rss/articles/CBMiugFBVV95cUxNRTNIRHRELUxmMWJnVVpnWjVwSEZPY3FRZE5FUEludzBXNXhMZHRiR3ZNa1Z4U3RMSFJuaXVRU0lBQXFoX1FFQmt6Sks5ZjdrWnk0MjlwdElkRU90bWZab2l2eVZJcmdqU1NSTEIzSkxGanhIUkZoTUczRUM4Nk80aHVRMVJ5djViTGNPeUh0cjhENU5McVlIbkhDVGVWRlNQYlVHXzV5aElUdkpvTmJuam52WkZHSXJLbXfSAboBQVVfeXFMTUUzSER0RC1MZjFiZ1VaZ1o1cEhGT2NxUWRORVBJbncwVzV4TGR0Ykd2TWtWeFN0TEhSbml1UVNJQUFxaF9RRUJrekpLOWY3a1p5NDI5cHRJZEVPdG1mWm9pdnlWSXJnalNTUkxCM0pMRmp4SFJGaE1HM0VDODZPNGh1UTFSeXY1YkxjT3lIdHI4RDVOTHFZSG5IQ1RlVkZTUGJVR181eWhJVHZKb05ibmpudlpGR0lyS213?oc=5,"depo, inşaat",depo,"Samsun'un Tekkeköy ilçesinde boya ve inşaat malzemesi deposunda çıkan yangın söndürüldü. Samsun'un Tekkeköy ilçesinde boya ve inşaat malzemesi deposunda çıkan yangın söndürüldü. Samsun'da korkutan depo yangını: Boya ve inşaat malzemeleri alev alev yandı 06/07/2026 23:24 Kutay Durukan Samsun'un Tekkeköy ilçesinde boya ve inşaat malzemesi deposunda çıkan yangın söndürüldü. 23 Nisan Mahallesi Hürriyet Caddesi'nde bulunan inşaat malzemesi deposunda henüz belirlenemeyen nedenle yangın çıktı. Çevredekilerin haber vermesi üzerine olay yerine itfaiye, polis ve sağlık ekipleri sevk edildi. İtfaiye ekipleri yangını kısa sürede kontrol altına alarak söndürdü. Yangında depo kullanılamaz hale geldi. Ekiplerin soğutma çalışmaları devam ediyor. İlk yorum yazan siz olun Asayiş Haberleri 23 Nisan Mahallesi Hürriyet Caddesi'nde bulunan inşaat malzemesi deposunda henüz belirlenemeyen nedenle yangın çıktı. Çevredekilerin haber vermesi üzerine olay yerine itfaiye, polis ve sağlık ekipleri sevk edildi. İtfaiye ekipleri yangını kısa sürede kontrol altına alarak söndürdü. Yangında depo kullanılamaz hale geldi. Ekiplerin soğutma çalışmaları devam ediyor. Samsun'da korkutan depo yangını: Boya ve inşaat malzemeleri alev alev yandı 23 Nisan Mahallesi Hürriyet Caddesi'nde bulunan inşaat malzemesi deposunda henüz belirlenemeyen nedenle yangın çıktı. Çevredekilerin haber vermesi üzerine olay yerine itfaiye, polis ve sağlık ekipleri sevk edildi. İtfaiye ekipleri yangını kısa sürede kontrol altına alarak söndürdü. Yangında depo kullanılamaz hale geldi. Ekiplerin soğutma çalışmaları devam ediyor.",Samsun'da korkutan depo yangını: Boya ve inşaat malzemeleri alev alev yandı Samsun'da korkutan depo yangını: Boya ve inşaat malzemeleri alev alev yandı Bengü Türk Samsun'un Tekkeköy ilçesinde boya ve inşaat malzemesi deposunda çıkan yangın söndürüldü. Samsun'da korkutan depo yangını: Boya ve inşaat malzemeleri alev alev yandı 06/07/2026 23:24 Kutay Durukan Samsun'un Tekkeköy ilçesinde boya ve inşaat malzemesi deposunda çıkan yangın söndürüldü. 23 Nisan Mahallesi Hürriyet Caddesi'nde bulunan inşaat malzemesi deposunda henüz belirlenemeyen nedenle yangın çıktı. İtfaiye ekipleri yangını kısa sürede kontrol altına alarak söndürdü. Yangında depo kullanılamaz hale geldi. Ekiplerin soğutma çalışmaları devam ediyor. İlk yorum yazan siz olun Asayiş Haberleri 23 Nisan Mahallesi Hürriyet Caddesi'nde bulunan inşaat malzemesi deposunda henüz belirlenemeyen nedenle yangın çıktı. Samsun'da korkutan depo yangını: Boya ve inşaat malzemeleri alev alev yandı 23 Nisan Mahallesi Hürriyet Caddesi'nde bulunan inşaat malzemesi deposunda henüz belirlenemeyen nedenle yangın çıktı.,browser_full_article,https://www.benguturk.com/amp/asayis/samsunda-korkutan-depo-yangini-boya-ve-insaat-malzemeleri-alev-alev-yandi-273458h,Samsun,Tekkeköy,Tekkeköy | 23 Nisan Mahallesi | alev yandı 23 Nisan Mahallesi,,,,,firma yok | faaliyet/tesis yok,,,,maps araması yapılmadı,,,140.0,25
2026-07-06 18:34:53,depo yangını,Fiziksel Risk / Yangın,Bilecik’te ot yangını depo önünde söndürüldü,Bilecik’te ot yangını depo önünde söndürüldü Aksiyon.com.TR,https://news.google.com/rss/articles/CBMihAFBVV95cUxOTm5IemZmYkJIQTNIcTVuVTRSNy16Z2JsNE10QURJV2h4OGVRU3ZmSVZTZXdRRzRhUmVlVHJrUm9uRlpJZFNKLXpFaFpQWjRQNkVBR25DaUczUXgyRjA5VkpjSElrTDFMZnlzX2h0RHk0YjZndXRCUzd5UEdDMGNuN3ZkRDXSAYoBQVVfeXFMTkpUMnRzQWd3clREampmUkE0Ui1TUnRmWGlPbDlqb3J6dFNJVUp2d2FTRk54a0RLbU8zV3hIbi05ZV8tS3pJYUtPREpNXzlmak90OWdLLXE0bHoyeEFPM0ZvcXNSMkV2QlFvVjFiVlFuOHBDck5tcDZScHp1RE1vRWRZYW03SmhUQ3BR?oc=5,depo,depo,"Bilecik İstiklal Mahallesi'nde çıkan ot yangını, içinde onlarca dolu tüp bulunan deponun kullanılmayan kısmına sıçramadan itfaiye tarafından söndürüldü; yollar kapatıldı, soğutma yapıldı. Bilecik İstiklal Mahallesi'nde çıkan ot yangını, içinde onlarca dolu tüp bulunan deponun kullanılmayan kısmına sıçramadan itfaiye tarafından söndürüldü; yollar kapatıldı, soğutma yapıldı. Bilecik İstiklal Mahallesi'nde çıkan ot yangını, içinde onlarca dolu tüp bulunan deponun kullanılmayan kısmına sıçramadan itfaiye tarafından söndürüldü; yollar kapatıldı, soğutma yapıldı. Bilecik’te ot yangını depo önünde söndürüldü Bilecik merkez İstiklal Mahallesi Milli Egemenlik Caddesi üzerinde çıkan ot yangını, içinde onlarca dolu tüpün bulunduğu depo ya sıçramadan kontrol altına alınarak söndürüldü. Olayın, kimliği belirsiz şahısların çıkardığı iddia edilen ateş sonucu başladığı bildirildi. Müdahale ve güvenlik önlemleri Yangını gören vatandaşların ihbarı üzerine çok sayıda sağlık, itfaiye, polis ve zabıta ekipleri sevk edildi. Emniyet ve zabıta ekipleri, tüplerin patlama riski nedeniyle çevrede geniş çaplı güvenlik önlemi aldı. Olay yerine giden tüm yollar trafikte kapatıldı ve alana giriş-çıkışlar tamamen yasaklandı. Soğutma çalışması ve inceleme İtfaiye ekiplerinin hızlı müdahalesiyle alevler ana depoya sıçramadan söndürülürken, ekipler depo çevresinde uzun süreli soğutma çalışması gerçekleştirdi. Olay maddi hasarla sonuçlandı; yetkililer yangının çıkış nedeni ve olaya ilişkin sorumluların tespiti için inceleme başlattı. BİLECİK'TE KİMLİĞİ BELİRSİZ ŞAHISLARIN ÇIKARDIĞI İDDİA EDİLEN OT YANGINI, İÇİNDE ONLARCA DOLU TÜPÜN BULUNDUĞU DEPOYA SIÇRAMADAN SON ANDA SÖNDÜRÜLDÜ 1 Antalya Konyaaltı'nda inşaat iskelesinden düşen işçi ağır yaralandı Antalya Konyaaltı'nda inşaat iskelesinden düşen işçi ağır yaralandı 2 Bozdoğan'da ziraat ve otluk alanda yangın: müdahale havadan ve karadan sürüyor Bozdoğan'da ziraat ve otluk alanda yangın: müdahale havadan ve karadan sürüyor 3 Ayvacık’ta orman yangını 4 Kayseri'de apartman görevlisini öldüren zanlının yargılanmasına devam edildi Kayseri'de apartman görevlisini öldüren zanlının yargılanmasına devam edildi 5 Batman'da suda mahsur kalan 2 kişi dalgıç ekipleri tarafından kurtarıldı Batman'da suda mahsur kalan 2 kişi dalgıç ekipleri tarafından kurtarıldı 6 Kocaeli'de boya fabrikasında yangın kontrol altına alındı Kocaeli'de boya fabrikasında yangın kontrol altına alındı 7 Bilirkişi raporu: kamyonet sürücüsü Umut'un ölümünde asli ve tam kusurlu Bilirkişi raporu: kamyonet sürücüsü Umut'un ölümünde asli ve tam kusurlu Bilecik’te ot yangını depo önünde söndürüldü Bilecik İstiklal Mahallesi'nde çıkan ot yangını, içinde onlarca dolu tüp bulunan deponun kullanılmayan kısmına sıçramadan itfaiye tarafından söndürüldü; yollar kapatıldı, soğutma yapıldı. Bilecik merkez İstiklal Mahallesi Milli Egemenlik Caddesi üzerinde çıkan ot yangını, içinde onlarca dolu tüpün bulunduğu depo ya sıçramadan kontrol altına alınarak söndürüldü. Olayın, kimliği belirsiz şahısların çıkardığı iddia edilen ateş sonucu başladığı bildirildi. Yangını gören vatandaşların ihbarı üzerine çok sayıda sağlık, itfaiye, polis ve zabıta ekipleri sevk edildi. Emniyet ve zabıta ekipleri, tüplerin patlama riski nedeniyle çevrede geniş çaplı güvenlik önlemi aldı. Olay yerine giden tüm yollar trafikte kapatıldı ve alana giriş-çıkışlar tamamen yasaklandı. İtfaiye ekiplerinin hızlı müdahalesiyle alevler ana depoya sıçramadan söndürülürken, ekipler depo çevresinde uzun süreli soğutma çalışması gerçekleştirdi. Olay maddi hasarla sonuçlandı; yetkililer yangının çıkış nedeni ve olaya ilişkin sorumluların tespiti için inceleme başlattı. BİLECİK'TE KİMLİĞİ BELİRSİZ ŞAHISLARIN ÇIKARDIĞI İDDİA EDİLEN OT YANGINI, İÇİNDE ONLARCA DOLU TÜPÜN BULUNDUĞU DEPOYA SIÇRAMADAN SON ANDA SÖNDÜRÜLDÜ Merhaba, ben Zeynep Kaya. 25 yaşındayım, İzmir'den çalışıyorum. aksiyon.com.tr Gündem kategorisinde veri gazeteciliği yapıyorum. Rakamlar benim işim. Anketlerin, istatistiklerin dilini halkın anlayacağı şekilde haberleştiriyorum. Genelde sessiz ama çok dikkatli bir yapıya sahibim. İstanbul'da simit fiyatları fiilen yükseldi: Resmi tarife 15 TL, satışlar 20-25 TL'ye çıktı 29 Aralık İstanbul'da Okullar Tatil mi? Valilik ve Meteoroloji Açıklamaları 2026 Sosyal Destek Zamları: Evde Bakım, 65 Yaş ve Engelli Maaşlarında Yeni Tahminler Taşacak Bu Deniz 13. bölüm neden yok? TRT 1, 2 Ocak yayın planını değiştirdi Market poşeti fiyatı 2026'da 1 TL oldu — 1 Ocak 2026'da yürürlüğe giren tarife 2026 Zorunlu Trafik Sigortası: SEDDK Teminat Limitlerini ve Çoklu Araç Tarifesini Yeniden Belirledi 1 Ocak'ta İstanbul'da Toplu Taşıma Ücretsiz: İBB Metro, Metrobüs ve Otobüs Ek Seferlerini Açıkladı Emekliye 60.000 TL'ye Kadar Paketler: Bankaların Güncel Promosyon ve Ek Avantajları 29 Aralık: Van, Zonguldak, Karabük, Bolu ve Düzce'de okullar tatil — Üniversiteler ne durumda? 2026 Ehliyet, Pasaport ve Kimlik Kartı Harçları Resmileşti: Yeni Tarifeler ve Geçerlilik Tarihi Resmi Gazete'de yayımlandı: 66 meslekte Mesleki Yeterlilik Belgesi zorunluluğu 26-27 Aralık Hava Durumu: İstanbul, Ankara ve Yalova için Kar Tahminleri","Bilecik’te ot yangını depo önünde söndürüldü Bilecik’te ot yangını depo önünde söndürüldü Aksiyon.com.TR Bilecik İstiklal Mahallesi'nde çıkan ot yangını, içinde onlarca dolu tüp bulunan deponun kullanılmayan kısmına sıçramadan itfaiye tarafından söndürüldü; yollar kapatıldı, soğutma yapıldı. Bilecik’te ot yangını depo önünde söndürüldü Bilecik merkez İstiklal Mahallesi Milli Egemenlik Caddesi üzerinde çıkan ot yangını, içinde onlarca dolu tüpün bulunduğu depo ya sıçramadan kontrol altına alınarak söndürüldü. Olayın, kimliği belirsiz şahısların çıkardığı iddia edilen ateş sonucu başladığı bildirildi. Müdahale ve güvenlik önlemleri Yangını gören vatandaşların ihbarı üzerine çok sayıda sağlık, itfaiye, polis ve zabıta ekipleri sevk edildi. Emniyet ve zabıta ekipleri, tüplerin patlama riski nedeniyle çevrede geniş çaplı güvenlik önlemi aldı. Olay yerine giden tüm yollar trafikte kapatıldı ve alana giriş-çıkışlar tamamen yasaklandı. Soğutma çalışması ve inceleme İtfaiye ekiplerinin hızlı müdahalesiyle alevler ana depoya sıçramadan söndürülürken, ekipler depo çevresinde uzun süreli soğutma çalışması gerçekleştirdi. Olay maddi hasarla sonuçlandı; yetkililer yangının çıkış nedeni ve olaya ilişkin sorumluların tespiti için inceleme başlattı. BİLECİK'TE KİMLİĞİ BELİRSİZ ŞAHISLARIN ÇIKARDIĞI İDDİA EDİLEN OT YANGINI, İÇİNDE ONLARCA DOLU TÜPÜN BULUNDUĞU DEPOYA SIÇRAMADAN SON ANDA SÖNDÜRÜLDÜ 1 Antalya Konyaaltı'nda inşaat iskelesinden düşen işçi ağır yaralandı Antalya Konyaaltı'nda inşaat iskelesinden düşen işçi ağır yaralandı 2 Bozdoğan'da ziraat ve otluk alanda yangın: müdahale havadan ve karadan sürüyor Bozdoğan'da ziraat ve otluk alanda yangın: müdahale havadan ve karadan sürüyor 3 Ayvacık’ta orman yangını 4 Kayseri'de apartman görevlisini öldüren zanlının yargılanmasına devam edildi Kayseri'de apartman görevlisini öldüren zanlının yargılanmasına devam edildi 5 Batman'da suda mahsur kalan 2 kişi dalgıç ekipleri tarafından kurtarıldı Batman'da suda mahsur kalan 2 kişi dalgıç ekipleri tarafından kurtarıldı 6 Kocaeli'de boya fabrikasında yangın kontrol altına alındı Kocaeli'de boya fabrikasında yangın kontrol altına alındı 7 Bilirkişi raporu: kamyonet sürücüsü Umut'un ölümünde asli ve tam kusurlu Bilirkişi raporu: kamyonet sürücüsü Umut'un ölümünde asli ve tam kusurlu Bilecik’te ot yangını depo önünde söndürüldü Bilecik İstiklal Mahallesi'nde çıkan ot yangını, içinde onlarca dolu tüp bulunan deponun kullanılmayan kısmına sıçramadan itfaiye tarafından söndürüldü; yollar kapatıldı, soğutma yapıldı. Bilecik merkez İstiklal Mahallesi Milli Egemenlik Caddesi üzerinde çıkan ot yangını, içinde onlarca dolu tüpün bulunduğu depo ya sıçramadan kontrol altına alınarak söndürüldü. Yangını gören vatandaşların ihbarı üzerine çok sayıda sağlık, itfaiye, polis ve zabıta ekipleri sevk edildi. İtfaiye ekiplerinin hızlı müdahalesiyle alevler ana depoya sıçramadan söndürülürken, ekipler depo çevresinde uzun süreli soğutma çalışması gerçekleştirdi. BİLECİK'TE KİMLİĞİ BELİRSİZ ŞAHISLARIN ÇIKARDIĞI İDDİA EDİLEN OT YANGINI, İÇİNDE ONLARCA DOLU TÜPÜN BULUNDUĞU DEPOYA SIÇRAMADAN SON ANDA SÖNDÜRÜLDÜ Merhaba, ben Zeynep Kaya. 25 yaşındayım, İzmir'den çalışıyorum. Genelde sessiz ama çok dikkatli bir yapıya sahibim. İstanbul'da simit fiyatları fiilen yükseldi: Resmi tarife 15 TL, satışlar 20-25 TL'ye çıktı 29 Aralık İstanbul'da Okullar Tatil mi? Valilik ve Meteoroloji Açıklamaları 2026 Sosyal Destek Zamları: Evde Bakım, 65 Yaş ve Engelli Maaşlarında Yeni Tahminler Taşacak Bu Deniz 13. TRT 1, 2 Ocak yayın planını değiştirdi Market poşeti fiyatı 2026'da 1 TL oldu — 1 Ocak 2026'da yürürlüğe giren tarife 2026 Zorunlu Trafik Sigortası: SEDDK Teminat Limitlerini ve Çoklu Araç Tarifesini Yeniden Belirledi 1 Ocak'ta İstanbul'da Toplu Taşıma Ücretsiz: İBB Metro, Metrobüs ve Otobüs Ek Seferlerini Açıkladı Emekliye 60.000 TL'ye Kadar Paketler: Bankaların Güncel Promosyon ve Ek Avantajları 29 Aralık: Van, Zonguldak, Karabük, Bolu ve Düzce'de okullar tatil — Üniversiteler ne durumda? 2026 Ehliyet, Pasaport ve Kimlik Kartı Harçları Resmileşti: Yeni Tarifeler ve Geçerlilik Tarihi Resmi Gazete'de yayımlandı: 66 meslekte Mesleki Yeterlilik Belgesi zorunluluğu 26-27 Aralık Hava Durumu: İstanbul, Ankara ve Yalova için Kar Tahminleri",browser_full_article,https://www.aksiyon.com.tr/bilecik-te-ot-yangini-depo-onunde-sonduruldu-309389,Batman | Bilecik | Düzce | İstanbul | İzmir,Konyaaltı | Bozdoğan | Merkez | Ayvacık,TR Bilecik İstiklal Mahallesi | söndürüldü Bilecik merkez İstiklal Mahallesi | önünde söndürüldü Bilecik İstiklal Mahallesi | Bilecik merkez İstiklal Mahallesi,İstiklal Mahallesi Milli Egemenlik Caddesi,,,,firma yok | faaliyet/tesis yok,,,,maps araması yapılmadı,,,121.75,26
2026-07-07 01:32:51,fabrika yangını,Fiziksel Risk / Yangın,"Dong A Anonim Şirketi'nde çıkan yangın, fabrika binasının 100 metrekareden fazla alanına hasar verdi.","Dong A Anonim Şirketi'nde çıkan yangın, fabrika binasının 100 metrekareden fazla alanına hasar verdi. Vietnam.vn",https://news.google.com/rss/articles/CBMilwFBVV95cUxNS2xhN1FieFhzenc4R1NKeU5Cdm5uWDFWOUI2QmNQTHNaMDZIdEd4dnB4Qi1IMFpaVUJzbm1uNDdRS2d3MVhpaWlrZGd6eGRxclJjX1ZwMHkwYzEtWldBaEJzQ2Ztb3VtTXV2ZHh2dDctb1ZBdlN3MDJ4bm1HSVNMV0dVc0tXTHpWV3RxdGc0VmZCUU9GLWRJ?oc=5,"anonim şirket, fabrika, şirket",fabrika | şirket / firma,"Dong A Anonim Şirketi'nde çıkan yangın, fabrika binasının 100 metrekareden fazla alanına hasar verdi. Vietnam.vn","Dong A Anonim Şirketi'nde çıkan yangın, fabrika binasının 100 metrekareden fazla alanına hasar verdi. Dong A Anonim Şirketi'nde çıkan yangın, fabrika binasının 100 metrekareden fazla alanına hasar verdi. Vietnam.vn Dong A Anonim Şirketi'nde çıkan yangın, fabrika binasının 100 metrekareden fazla alanına hasar verdi.",browser_failed,https://news.google.com/rss/articles/CBMilwFBVV95cUxNS2xhN1FieFhzenc4R1NKeU5Cdm5uWDFWOUI2QmNQTHNaMDZIdEd4dnB4Qi1IMFpaVUJzbm1uNDdRS2d3MVhpaWlrZGd6eGRxclJjX1ZwMHkwYzEtWldBaEJzQ2Ztb3VtTXV2ZHh2dDctb1ZBdlN3MDJ4bm1HSVNMV0dVc0tXTHpWV3RxdGc0VmZCUU9GLWRJ?oc=5&hl=tr&gl=TR&ceid=TR:tr,,,,,,Dong A Anonim Şirketi'nde,Dong A Anonim Şirketi'nde:328:body+summary+title,il yok | ilçe yok | faaliyet/tesis yok,Dong A Anonim Şirketi'nde Türkiye,Dong A Anonim Şirketi'nde Türkiye,Dong A Anonim Şirketi'nde Türkiye,firma adı + güvenli maps adayı var,100.0,,201.62,27
2026-07-02 14:47:59,depo yangını,Fiziksel Risk / Yangın,Alanya'da 5 yıldızlı otelde yangın paniği: Depo alevlere teslim oldu,Alanya'da 5 yıldızlı otelde yangın paniği: Depo alevlere teslim oldu GZT,https://news.google.com/rss/articles/CBMiowFBVV95cUxPejZndGNvTGp1N0Jwa0xjSHJ0cHVScDJRRW1LaWRBaXVESzE5bWt1Z0JvcU1vUWx3VVhJX3ZMXzRhdXFUXzVFNzNrV2RqVi1OMHdyaWl5ZDlmdDRBV01KOEZVLU1ZWjN3RW8zSTV0THJxcmwybEVwTDhMT1pjQmwteFAxSHVaNHcwRElEbWxicmxGckNvNjZ5QVJXbDlTNjRoei13?oc=5,depo,depo,"Antalya’nın Alanya ilçesindeki 5 yıldızlı bir otelin geri dönüşüm deposunda çıkan yangın, bölgede kısa süreli paniğe neden oldu. Ekiplerin hızlı müdahalesi sayesinde alevler, tesisin diğer bölümlerine sıçramadan kontrol altına alındı. Antalya’nın Alanya ilçesindeki 5 yıldızlı bir otelin geri dönüşüm deposunda çıkan yangın, bölgede kısa süreli paniğe neden oldu. Ekiplerin hızlı müdahalesi sayesinde alevler, tesisin diğer bölümlerine sıçramadan kontrol altına alındı.","Alanya'da 5 yıldızlı otelde yangın paniği: Depo alevlere teslim oldu Alanya'da 5 yıldızlı otelde yangın paniği: Depo alevlere teslim oldu GZT Antalya’nın Alanya ilçesindeki 5 yıldızlı bir otelin geri dönüşüm deposunda çıkan yangın, bölgede kısa süreli paniğe neden oldu. Ekiplerin hızlı müdahalesi sayesinde alevler, tesisin diğer bölümlerine sıçramadan kontrol altına alındı.",browser_full_article,https://www.gzt.com/gundem/alanyada-5-yildizli-otelde-yangin-panigi-depo-alevlere-teslim-oldu-4237808,Antalya,Alanya,,,,,,firma yok | faaliyet/tesis yok,,,,maps araması yapılmadı,,,92.69,28
2026-07-06 21:19:00,depo yangını,Fiziksel Risk / Yangın,Samsun Tekkeköy'de Boya Deposunda Çıkan Yangın İtfaiye Ekipleri Tarafından Söndürüldü,Samsun Tekkeköy'de Boya Deposunda Çıkan Yangın İtfaiye Ekipleri Tarafından Söndürüldü Mersin Haber,https://news.google.com/rss/articles/CBMiwwFBVV95cUxNWkVLYVdHQloxdTFQYnpnX0Rlb0dVd3pITFZlVmMtNF94MTB0WjdDZ2FEaGpmTURwY19saEpXeEtCTE1BMkw2eUFuXzZHNmtObXJOd2RacGhsTEZPWUQwSGR3MzZ3N0RaczlsbnhCU0MtWUtSZ1k5U1dlT0JabGFTNU0yZnhTNzVYVTlIenFpM0pFY2ZOeVZPdkVtajA5dk1TTTRORzB0bUZKbTYxb1FCUFdwaXZjeUJNQ0phT0FOSDYta2vSAVdBVV95cUxQZ0NQMzZ2WXA3d2JQYVhpeHpFRTM3VnVEQ3EycEthOFNtZG94aG5LUjBRamZ3bDdQY180YlpXZWNFNlFwRllnWWlYMHdhZ2tQOVItWjJwb2c?oc=5,depo,depo,"Mersin'den haberiniz olsun! Mersin ve ilçelerinden son dakika ve önemli haberler, gelişmeler olayları sunar. Samsun Tekkeköy'de bulunan bir boya deposunda çıkan yangın, itfaiye ekiplerinin hızlı müdahalesiyle kontrol altına alındı. Olayda depo hasar gördü. Mersin'den haberiniz olsun! Mersin ve ilçelerinden son dakika ve önemli haberler, gelişmeler olayları sunar.","Samsun Tekkeköy'de Boya Deposunda Çıkan Yangın İtfaiye Ekipleri Tarafından Söndürüldü Samsun Tekkeköy'de Boya Deposunda Çıkan Yangın İtfaiye Ekipleri Tarafından Söndürüldü Mersin Haber Mersin'den haberiniz olsun! Samsun Tekkeköy'de bulunan bir boya deposunda çıkan yangın, itfaiye ekiplerinin hızlı müdahalesiyle kontrol altına alındı.",browser_full_article,https://www.mersinhaber.com/haber-samsun-tekkekoyde-boya-deposunda-cikan-yangin-itfaiye-ekipleri-tarafindan-sonduruldu/696542,Mersin | Samsun,Tekkeköy,Tekkeköy,,,,,firma yok | faaliyet/tesis yok,,,,maps araması yapılmadı,,,136.65,29
