published,search_term,category,title,summary,link,matched_words,activity_type,raw_text,entity_source_text,article_fetch_status,resolved_article_url,city_candidates,district_candidates,neighborhood_candidates,street_candidates,facility_candidates,company_candidates,company_candidate_scores,entity_quality_note,maps_queries,maps_candidates,maps_best_guess,maps_status,maps_match_scores,maps_rejected_candidates,record_quality_score,duplicate_group_id
2026-07-06 04:14:30,iflas,İflas / Konkordato / Mali Sorun,"Havayolu şirketi iflas etti: 17 bin kişi işsiz kaldı, uçaklar çöle çekiliyor","Havayolu şirketi iflas etti: 17 bin kişi işsiz kaldı, uçaklar çöle çekiliyor Sözcü Gazetesi",https://news.google.com/rss/articles/CBMiqwFBVV95cUxOcFk5M3ZPWlE0OGlFeUEzejN6UG5NcVNHLWRMZzJPMVlVZ1M3RnQ2QThOdnV4WUdsVEZMTmsxZ0hqeGVqZERsZ0xmZ3pEUGNOVU05WFVidTF1V2Y4Zl9keU81QmFQcE5scVBNcHJnSDZnXzd0MUpfVHRIT1Nqb2JMRkplMS1pUGlnYVBHTlVyVWwzU1JmaFVmc3l3QS0xUE43TFZ1bElTaUF5czg?oc=5,şirket,şirket / firma,"ABD merkezli bütçe havayolu Spirit Airlines'ın tamamen kapanmasıyla 17 bin personel işsiz kalırken, şirkete ait 630 milyon dolarlık dev filo Arizona çölünde korumaya alınıyor. ABD merkezli bütçe havayolu Spirit Airlines'ın tamamen kapanmasıyla 17 bin personel işsiz kalırken, şirkete ait 630 milyon dolarlık dev filo Arizona çölünde korumaya alınıyor. ABD merkezli bütçe havayolu Spirit Airlines'ın tamamen kapanmasıyla 17 bin personel işsiz kalırken, şirkete ait 630 milyon dolarlık dev filo Arizona çölünde korumaya alınıyor. Google algoritmasına bırakmayın, okuyacağınız haberi siz seçin! Tıkla ve ekle ABD merkezli bütçe havayolu Spirit Airlines'ın tamamen kapanmasıyla 17 bin personel işsiz kalırken, şirkete ait 630 milyon dolarlık dev filo Arizona çölünde korumaya alınıyor. Spirit Airlines, federal hükümetin kurtarma paketini reddetmesinin ardından 34 yıllık faaliyetlerine son vererek resmen iflas etti. Bu ani kapanış kararı, havayolunda görev yapan tüm personelin iş akdinin feshedilmesine ve iç hat uçuşlarında büyük bir bütçeli koltuk krizine yol açtı. ARİZONA ÇÖLÜNDEKİ FİLO OPERASYONU NASIL YÜRÜTÜLÜYOR? Şirketin tasfiye sürecine girmesiyle birlikte, her birinin motor değeri 15 ila 20 milyon dolar arasında değişen parlak sarı renkli Airbus uçakları Arizona çölündeki havalimanlarına taşınmaya başladı. Eyaletteki Goodyear ve Marana havalimanlarının kuru iklim şartları, uçak gövdelerinin ve yüksek maliyetli motor parçalarının nemden paslanmasını kesin olarak engelliyor. Uçakların tahliye işlemlerini üstlenen Nomadic Aviation Group, operasyonlarda işsiz kalan eski Spirit Airlines pilotlarına öncelik tanıyarak Atlantic City, Miami ve Fort Lauderdale şehirlerinden çöle 25 uçuş gerçekleştirdi. Arizona'da koruma altına alınan uçakların ilerleyen süreçte yeniden boyanarak farklı havayolu şirketlerine kiralanması veya satılması planlanıyor. İFLAS MAHKEMESİNE SUNULAN SATIŞ TALEBİ NELERİ KAPSIYOR? Mayıs 2026'da gerçekleşen çöküşün ardından New York Güney Bölgesi İflas Mahkemesine başvuran şirket yönetimi, 27 adet Airbus A320 ve A321 model uçağın satışı için acil onay talep etti. Toplam piyasa değeri yaklaşık 630 milyon dolar olan bu uçak filosunun satışından elde edilecek nakit kaynak, biriken borçların ödenmesinde ve tasfiye operasyonlarının tamamlanmasında kullanılacak. Alıcı konumunda bulunan Save 2026-B LLC şirketi, ihale sürecinde başlangıç taban teklifini vermeyi resmi olarak kabul etti. Mahkemenin onay vermesi durumunda açık artırmaya açılacak olan filo için uluslararası pazardan daha yüksek tekliflerin toplanmasının önü açılacak. HAVAYOLU ŞİRKETİNİN İFLAS SÜRECİNİ HANGİ FAKTÖRLER HIZLANDIRDI? Kovid-19 pandemisinden bu yana yüksek işletme giderleri ve 8,1 milyar dolarlık borç yüküyle mücadele eden şirketin JetBlue ile birleşme planı, rekabet yasaları gerekçesiyle daha önce engellenmişti. Son dönemde patlak veren İran savaşı sebebiyle küresel jet yakıtı fiyatlarının fırlaması, havayolunun alacaklılarıyla yürüttüğü yapılandırma görüşmelerini tamamen çıkmaza soktu. Federal hükümetin vergi mükelleflerince finanse edilecek son kurtarma paketini reddetmesi üzerine cuma günü durdurulan faaliyetler, cumartesi günü tamamen sonlandırıldı. Aylık 1,7 milyon iç hat yolcusuna hizmet veren şirketin pazardan çekilmesiyle boşalan havalimanı kapı hakları, Delta Airlines gibi diğer büyük havayolu şirketlerine devredilmeye başlandı. www.sozcu.com.tr internet sitesinde yayınlanan yazı, haber ve fotoğrafların her türlü telif hakkı Mega Ajans ve Rek. Tic. A.Ş'ye aittir. İzin alınmadan, kaynak gösterilerek dahi iktibas edilemez. Bu habere emoji ile tepki ver Spirit Airlines, federal hükümetin kurtarma paketini reddetmesinin ardından 34 yıllık faaliyetlerine son vererek resmen iflas etti. Bu ani kapanış kararı, havayolunda görev yapan tüm personelin iş akdinin feshedilmesine ve iç hat uçuşlarında büyük bir bütçeli koltuk krizine yol açtı. ARİZONA ÇÖLÜNDEKİ FİLO OPERASYONU NASIL YÜRÜTÜLÜYOR? Şirketin tasfiye sürecine girmesiyle birlikte, her birinin motor değeri 15 ila 20 milyon dolar arasında değişen parlak sarı renkli Airbus uçakları Arizona çölündeki havalimanlarına taşınmaya başladı. Eyaletteki Goodyear ve Marana havalimanlarının kuru iklim şartları, uçak gövdelerinin ve yüksek maliyetli motor parçalarının nemden paslanmasını kesin olarak engelliyor. Uçakların tahliye işlemlerini üstlenen Nomadic Aviation Group, operasyonlarda işsiz kalan eski Spirit Airlines pilotlarına öncelik tanıyarak Atlantic City, Miami ve Fort Lauderdale şehirlerinden çöle 25 uçuş gerçekleştirdi. Arizona'da koruma altına alınan uçakların ilerleyen süreçte yeniden boyanarak farklı havayolu şirketlerine kiralanması veya satılması planlanıyor. İFLAS MAHKEMESİNE SUNULAN SATIŞ TALEBİ NELERİ KAPSIYOR? Mayıs 2026'da gerçekleşen çöküşün ardından New York Güney Bölgesi İflas Mahkemesine başvuran şirket yönetimi, 27 adet Airbus A320 ve A321 model uçağın satışı için acil onay talep etti. Toplam piyasa değeri yaklaşık 630 milyon dolar olan bu uçak filosunun satışından elde edilecek nakit kaynak, biriken borçların ödenmesinde ve tasfiye operasyonlarının tamamlanmasında kullanılacak. Alıcı konumunda bulunan Save 2026-B LLC şirketi, ihale sürecinde başlangıç taban teklifini vermeyi resmi olarak kabul etti. Mahkemenin onay vermesi durumunda açık artırmaya açılacak olan filo için uluslararası pazardan daha yüksek tekliflerin toplanmasının önü açılacak. HAVAYOLU ŞİRKETİNİN İFLAS SÜRECİNİ HANGİ FAKTÖRLER HIZLANDIRDI? Kovid-19 pandemisinden bu yana yüksek işletme giderleri ve 8,1 milyar dolarlık borç yüküyle mücadele eden şirketin JetBlue ile birleşme planı, rekabet yasaları gerekçesiyle daha önce engellenmişti. Son dönemde patlak veren İran savaşı sebebiyle küresel jet yakıtı fiyatlarının fırlaması, havayolunun alacaklılarıyla yürüttüğü yapılandırma görüşmelerini tamamen çıkmaza soktu. Federal hükümetin vergi mükelleflerince finanse edilecek son kurtarma paketini reddetmesi üzerine cuma günü durdurulan faaliyetler, cumartesi günü tamamen sonlandırıldı. Aylık 1,7 milyon iç hat yolcusuna hizmet veren şirketin pazardan çekilmesiyle boşalan havalimanı kapı hakları, Delta Airlines gibi diğer büyük havayolu şirketlerine devredilmeye başlandı. DOLAR 46,84 0,02 (%0,05) EURO 53,55 -0,04 (%-0,08) Haber Merkezi Facebook ile paylaş Messenger ile gönder E-pos","Havayolu şirketi iflas etti: 17 bin kişi işsiz kaldı, uçaklar çöle çekiliyor Havayolu şirketi iflas etti: 17 bin kişi işsiz kaldı, uçaklar çöle çekiliyor Sözcü Gazetesi ABD merkezli bütçe havayolu Spirit Airlines'ın tamamen kapanmasıyla 17 bin personel işsiz kalırken, şirkete ait 630 milyon dolarlık dev filo Arizona çölünde korumaya alınıyor. Google algoritmasına bırakmayın, okuyacağınız haberi siz seçin! Tıkla ve ekle ABD merkezli bütçe havayolu Spirit Airlines'ın tamamen kapanmasıyla 17 bin personel işsiz kalırken, şirkete ait 630 milyon dolarlık dev filo Arizona çölünde korumaya alınıyor. Spirit Airlines, federal hükümetin kurtarma paketini reddetmesinin ardından 34 yıllık faaliyetlerine son vererek resmen iflas etti. ARİZONA ÇÖLÜNDEKİ FİLO OPERASYONU NASIL YÜRÜTÜLÜYOR? Şirketin tasfiye sürecine girmesiyle birlikte, her birinin motor değeri 15 ila 20 milyon dolar arasında değişen parlak sarı renkli Airbus uçakları Arizona çölündeki havalimanlarına taşınmaya başladı. Eyaletteki Goodyear ve Marana havalimanlarının kuru iklim şartları, uçak gövdelerinin ve yüksek maliyetli motor parçalarının nemden paslanmasını kesin olarak engelliyor. Uçakların tahliye işlemlerini üstlenen Nomadic Aviation Group, operasyonlarda işsiz kalan eski Spirit Airlines pilotlarına öncelik tanıyarak Atlantic City, Miami ve Fort Lauderdale şehirlerinden çöle 25 uçuş gerçekleştirdi. Arizona'da koruma altına alınan uçakların ilerleyen süreçte yeniden boyanarak farklı havayolu şirketlerine kiralanması veya satılması planlanıyor. İFLAS MAHKEMESİNE SUNULAN SATIŞ TALEBİ NELERİ KAPSIYOR? Mayıs 2026'da gerçekleşen çöküşün ardından New York Güney Bölgesi İflas Mahkemesine başvuran şirket yönetimi, 27 adet Airbus A320 ve A321 model uçağın satışı için acil onay talep etti. Toplam piyasa değeri yaklaşık 630 milyon dolar olan bu uçak filosunun satışından elde edilecek nakit kaynak, biriken borçların ödenmesinde ve tasfiye operasyonlarının tamamlanmasında kullanılacak. Alıcı konumunda bulunan Save 2026-B LLC şirketi, ihale sürecinde başlangıç taban teklifini vermeyi resmi olarak kabul etti. Mahkemenin onay vermesi durumunda açık artırmaya açılacak olan filo için uluslararası pazardan daha yüksek tekliflerin toplanmasının önü açılacak. HAVAYOLU ŞİRKETİNİN İFLAS SÜRECİNİ HANGİ FAKTÖRLER HIZLANDIRDI? Kovid-19 pandemisinden bu yana yüksek işletme giderleri ve 8,1 milyar dolarlık borç yüküyle mücadele eden şirketin JetBlue ile birleşme planı, rekabet yasaları gerekçesiyle daha önce engellenmişti. Son dönemde patlak veren İran savaşı sebebiyle küresel jet yakıtı fiyatlarının fırlaması, havayolunun alacaklılarıyla yürüttüğü yapılandırma görüşmelerini tamamen çıkmaza soktu. Aylık 1,7 milyon iç hat yolcusuna hizmet veren şirketin pazardan çekilmesiyle boşalan havalimanı kapı hakları, Delta Airlines gibi diğer büyük havayolu şirketlerine devredilmeye başlandı. İzin alınmadan, kaynak gösterilerek dahi iktibas edilemez. Bu habere emoji ile tepki ver Spirit Airlines, federal hükümetin kurtarma paketini reddetmesinin ardından 34 yıllık faaliyetlerine son vererek resmen iflas etti.",browser_full_article,https://www.sozcu.com.tr/havayolu-sirketi-iflas-etti-17-bin-kisi-issiz-kaldi-ucaklar-cole-cekiliyor-p334025,,,,,,,,il yok | ilçe yok | firma yok | faaliyet/tesis yok,,,,maps araması yapılmadı,,,91.75,74
2026-07-07 08:31:41,mali kriz,İflas / Konkordato / Mali Sorun,Türk tekstilinde dev kriz! 60 yıllık şirket ikinci kez konkordato istedi,Türk tekstilinde dev kriz! 60 yıllık şirket ikinci kez konkordato istedi MYGAZETE,https://news.google.com/rss/articles/CBMipwFBVV95cUxPa3cyUUhOQ19lTWdkczI0bkRyX2NHT0RxQVlFMWQyUU9YYTdldVZPR1FibXh5WGlTc011WnlrdjlDallYbFk2UnFoLS0wY1RxdEt5c1lHSW5DWllyY1lVcDBJeEQ4YXB5ZzRCOERINXJZdXN0cTl6WkE5OGZSTVhPWG42LV8zSlVBRDgtdS1uMGVteGhYc3VudE1ZRS1lSWRtZkRWNHdvTQ?oc=5,"tekstil, şirket",şirket / firma,Türk tekstilinde dev kriz! 60 yıllık şirket ikinci kez konkordato istedi MYGAZETE,Türk tekstilinde dev kriz! 60 yıllık şirket ikinci kez konkordato istedi Türk tekstilinde dev kriz! 60 yıllık şirket ikinci kez konkordato istedi MYGAZETE Türk tekstilinde dev kriz! 60 yıllık şirket ikinci kez konkordato istedi MYGAZETE,browser_failed,https://news.google.com/rss/articles/CBMipwFBVV95cUxPa3cyUUhOQ19lTWdkczI0bkRyX2NHT0RxQVlFMWQyUU9YYTdldVZPR1FibXh5WGlTc011WnlrdjlDallYbFk2UnFoLS0wY1RxdEt5c1lHSW5DWllyY1lVcDBJeEQ4YXB5ZzRCOERINXJZdXN0cTl6WkE5OGZSTVhPWG42LV8zSlVBRDgtdS1uMGVteGhYc3VudE1ZRS1lSWRtZkRWNHdvTQ?oc=5&hl=tr&gl=TR&ceid=TR:tr,,,,,,,,il yok | ilçe yok | firma yok | faaliyet/tesis yok,,,,maps araması yapılmadı,,,73.06,75
2026-07-01 12:06:17,mali kriz,Banka / Finansal Kuruluş,İngiliz Bankacılık Sektöründe Tarihi Dönüşüm: Halifax Markası Tarihe Karışıyor,İngiliz Bankacılık Sektöründe Tarihi Dönüşüm: Halifax Markası Tarihe Karışıyor HaberGo,https://news.google.com/rss/articles/CBMirwFBVV95cUxPR0lZaFF1X3RuTmVSLTF5R1ZDanFTVFJTeVlaazJjWW8tZGxycHBEZ2trQ1lDZ0hKV3B2V3V3S2hZend5Q2s0M1JxUHNDeGEzMEk5YlFrU3daRnNnT0hNdndWX0xaeVd1c2JlVWREcWVHX3pBLWdDZVA0VDhQMUhnMU50LXROYV9WelA0WURFMVlOUGRtVWt1azdsZ0F1TlZUVVE3Z3kySkpPWm1oNU5R0gG0AUFVX3lxTE5XUXBiMk9tdmkyWEVjd2FOcjJULTNLTHFqSEF3UW9ROG4xMkozczF5R0ZhTDRBeWJmS2FUdGJ1dVFUZGcwc2lKc2pDN2FJNVQzX00xNzY3dTBwX3ZtWll0VmpNZjh6dld2ZWt5VU1remJkUFZuaFVzMGNYRE1UdFZ5dGt4NEIwUHQxODlQNWZsLUJnYVBDLTJncnVCa2w3cUVKWVdQR3FBejFLeXdmYmJsNTZFRA?oc=5,"banka, bankacılık",finansal kuruluş,"173 yıllık Halifax markası Lloyds çatısı altında birleşiyor. Şubeler, hesap numaraları ve geçiş süreciyle ilgili tüm detaylar haberimizde. 173 yıllık Halifax markası Lloyds çatısı altında birleşiyor. Şubeler, hesap numaraları ve geçiş süreciyle ilgili tüm detaylar haberimizde. 173 yıllık Halifax markası Lloyds çatısı altında birleşiyor. Şubeler, hesap numaraları ve geçiş süreciyle ilgili tüm detaylar haberimizde. Dünya İngiliz Bankacılık Sektöründe Tarihi Dönüşüm: Halifax Markası Tarihe Karışıyor Lloyds Banking Group, 173 yıllık köklü Halifax markasını kaldırarak tüm hesapları Lloyds çatısı altında toplama kararını resmen açıkladı. HM Haber Merkezi Paylaş: Linki kopyala · 1 dk 67 okunma Google News'te Takip Et İngiliz Bankacılık Sektöründe Tarihi Dönüşüm: Halifax Markası Tarihe Karışıyor Birleşik Krallık'ın finansal tarihindeki en köklü kurumlardan biri olan Halifax , bağlı olduğu Lloyds Banking Group tarafından alınan stratejik karar doğrultusunda faaliyetlerine tek başına devam etmeyecek. Grup, Halifax markası altında yeni hesap açılışlarını durdururken, mevcut hesapların kademeli olarak Lloyds markasına taşınması sürecini başlattı. Şube ve Operasyonel Süreç Nasıl İşleyecek? Grup bünyesinde toplam 531 şube bulunurken, Halifax markasını taşıyan 190 şubenin tabelaları 2027 yılı başından itibaren kaldırılacak. Yapılan resmi açıklamada, marka değişikliği nedeniyle herhangi bir şube kapatılmasının söz konusu olmadığı vurgulandı. Müşterilerin en çok merak ettiği teknik detaylar konusunda ise banka, hesap numaraları ve sort kodlarının (banka şube kodları) bu geçişten etkilenmeyeceğini ve aynı kalacağını garanti etti. Bir Devrin Sonu: Halifax'ın Tarihsel Yolculuğu 1800'lerin ortasında, konut sıkıntısını çözmek ve insanların kendi evlerini inşa edebilmeleri için bir yapı topluluğu olarak kurulan Halifax, 1928 yılında dünyanın kendi türündeki en büyük yapı topluluğu konumuna yükselmişti. Ancak 1990'ların ortasında halka açık bir bankaya dönüşen kurum, 2001'de Bank of Scotland ile birleşerek HBOS'u oluşturdu. 2008 küresel finansal krizi sırasında hatalı yönetim kararlarıyla çöküşün eşiğine gelen grup, 20 milyar sterlinlik kamu desteğiyle Lloyds tarafından kurtarılmıştı. Bu süreçten sonra İngiltere, Galler ve Kuzey İrlanda'da tek marka stratejisine geçilmesine karar veren grup, sadece İskoçya'daki müşterileri için Bank of Scotland markasını korumaya devam edecek. Dijital Dönüşüm ve Stratejik Hamle Lloyds CEO'su Charlie Nunn'ın dijital ve mobil bankacılığa öncelik veren beş yıllık planının sonuna gelinirken, bu hamle operasyonel maliyetleri düşürmeyi ve marka gücünü tek merkezde toplamayı hedefliyor. Müşteri İlişkileri Yöneticisi Jas Singh, geçiş sürecinde uygulama tasarımının ve şube personelinin aynı kalacağını, ancak müşterilerin Lloyds'un sunduğu daha geniş ödül ve hizmet paketlerinden yararlanabileceğini belirtti. # finansal kriz # Halifax # Lloyds Banking Group # İngiltere bankacılık # marka birleşmesi # İngiliz bankaları HM Haber Merkezi HaberGo Editor ve Muhabır ekibi 💬 Yorumlar","İngiliz Bankacılık Sektöründe Tarihi Dönüşüm: Halifax Markası Tarihe Karışıyor İngiliz Bankacılık Sektöründe Tarihi Dönüşüm: Halifax Markası Tarihe Karışıyor HaberGo 173 yıllık Halifax markası Lloyds çatısı altında birleşiyor. Dünya İngiliz Bankacılık Sektöründe Tarihi Dönüşüm: Halifax Markası Tarihe Karışıyor Lloyds Banking Group, 173 yıllık köklü Halifax markasını kaldırarak tüm hesapları Lloyds çatısı altında toplama kararını resmen açıkladı.",browser_full_article,https://www.habergo.com.tr/haber/ingiliz-bankacilik-sektorunde-tarihi-donusum-halifax-markasi-tarihe-karisiyor,,,,,,,,il yok | ilçe yok | firma yok | faaliyet/tesis yok,,,,maps araması yapılmadı,,,81.5,76
2026-07-06 16:37:37,borç krizi,İflas / Konkordato / Mali Sorun,Viyana merkezli Risk Experts mühendislik firması iflas başvurusunda bulundu,Viyana merkezli Risk Experts mühendislik firması iflas başvurusunda bulundu HaberGo,https://news.google.com/rss/articles/CBMisgFBVV95cUxPUWlQUE5XbHVvNk1xeVhPQlVZVXV3X2IxTHZqT19iTDh3am1kTmlWWmwySDU4WVFETDZ0aDd1UUk5dkdRU2dtb0t2al9kd0JJaHcwelBablAzSE5XMEFBbHV3MURxcW1aY2ZBZWx0S0pLb1paV1lFek4tTGQ4dFpxaHRZSHNkT01oR1lNeDNxaGtIRXVtX01YS1lEdEJUUVk0NDhSQi00TTJMYlZ5aE1XeWR30gGyAUFVX3lxTE9RaVBQTldsdW82TXF5WE9CVVlVdXdfYjFMdmpPX2JMOHdqbWROaVZabDJINThZUURMNnRoN3VRSTl2R1FTZ21vS3ZqX2R3QklodzB6UFpuUDNITlcwQUFsdXcxRHFxbVpjZkFlbHRLSktvWlpXWUV6Ti1MZDh0WnFodFlIc2RPTWhHWU14M3Foa0hFdW1fTVhLWUR0QlRRWTQ0OFJCLTRNMkxiVnloTVd5ZHc?oc=5,firma,şirket / firma,Dünya Viyana merkezli Risk Experts mühendislik firması iflas başvurusunda bulundu Haber Merkezi · 6 Temmuz 2026 Viyana merkezli mühendislik ve danışmanlık firması Risk Experts Ri Viyana merkezli Risk Experts mühendislik firması iflas başvurusunda bulundu Viyana merkezli mühendislik ve danışmanlık firması Risk Experts Ri,Viyana merkezli Risk Experts mühendislik firması iflas başvurusunda bulundu Viyana merkezli Risk Experts mühendislik firması iflas başvurusunda bulundu HaberGo Dünya Viyana merkezli Risk Experts mühendislik firması iflas başvurusunda bulundu Haber Merkezi · 6 Temmuz 2026 Viyana merkezli mühendislik ve danışmanlık firması Risk Experts Ri Viyana merkezli Risk Experts mühendislik firması iflas başvurusunda bulundu Viyana merkezli mühendislik ve danışmanlık firması Risk Experts Ri,browser_full_article_dom,https://news.google.com/rss/articles/CBMisgFBVV95cUxPUWlQUE5XbHVvNk1xeVhPQlVZVXV3X2IxTHZqT19iTDh3am1kTmlWWmwySDU4WVFETDZ0aDd1UUk5dkdRU2dtb0t2al9kd0JJaHcwelBablAzSE5XMEFBbHV3MURxcW1aY2ZBZWx0S0pLb1paV1lFek4tTGQ4dFpxaHRZSHNkT01oR1lNeDNxaGtIRXVtX01YS1lEdEJUUVk0NDhSQi00TTJMYlZ5aE1XeWR30gGyAUFVX3lxTE9RaVBQTldsdW82TXF5WE9CVVlVdXdfYjFMdmpPX2JMOHdqbWROaVZabDJINThZUURMNnRoN3VRSTl2R1FTZ21vS3ZqX2R3QklodzB6UFpuUDNITlcwQUFsdXcxRHFxbVpjZkFlbHRLSktvWlpXWUV6Ti1MZDh0WnFodFlIc2RPTWhHWU14M3Foa0hFdW1fTVhLWUR0QlRRWTQ0OFJCLTRNMkxiVnloTVd5ZHc?oc=5&hl=tr&gl=TR&ceid=TR:tr,,,,,,,,il yok | ilçe yok | firma yok | faaliyet/tesis yok,,,,maps araması yapılmadı,,,77.46,77
2026-07-03 08:53:55,ödeme güçlüğü,Banka / Finansal Kuruluş,BDDK’nın tasarruf finansmanı sektörüne getirdiği yenilikler ne anlama geliyor?,BDDK’nın tasarruf finansmanı sektörüne getirdiği yenilikler ne anlama geliyor? Banka Dünyası,https://news.google.com/rss/articles/CBMipAFBVV95cUxPVWlEVDZOX3dGSDdIOGZ0UXk2MnBXVVViSWtUMGpKZ2dvc200clFoalFaSlZhWWpyY01rdGJtM2syb3RVUFE1NTlfbUZGbklUNi0zVlBlaEswQU9UX0hkVlh2VlFjNjdWeGFLZjh3M2UxQV9mNEVkb2NuaFV0N09LZXlYNVg5Z1ZqVWpjMEpvdnluRkVRSEJEMG1qQm9QVHBCX2l3cw?oc=5,banka,finansal kuruluş,BDDK’nın tasarruf finansmanı sektörüne getirdiği yenilikler ne anlama geliyor? Banka Dünyası,BDDK’nın tasarruf finansmanı sektörüne getirdiği yenilikler ne anlama geliyor? BDDK’nın tasarruf finansmanı sektörüne getirdiği yenilikler ne anlama geliyor? Banka Dünyası BDDK’nın tasarruf finansmanı sektörüne getirdiği yenilikler ne anlama geliyor?,browser_failed,https://news.google.com/rss/articles/CBMipAFBVV95cUxPVWlEVDZOX3dGSDdIOGZ0UXk2MnBXVVViSWtUMGpKZ2dvc200clFoalFaSlZhWWpyY01rdGJtM2syb3RVUFE1NTlfbUZGbklUNi0zVlBlaEswQU9UX0hkVlh2VlFjNjdWeGFLZjh3M2UxQV9mNEVkb2NuaFV0N09LZXlYNVg5Z1ZqVWpjMEpvdnluRkVRSEJEMG1qQm9QVHBCX2l3cw?oc=5&hl=tr&gl=TR&ceid=TR:tr,,,,,,,,il yok | ilçe yok | firma yok | faaliyet/tesis yok,,,,maps araması yapılmadı,,,78.92,78
2026-07-03 06:03:00,ödeme güçlüğü,Banka / Finansal Kuruluş,Borçları nedeniyle sürekli aranan vatandaştan bankalara sitem: “O kadar krediyi vermeden düşünseydiniz”,Borçları nedeniyle sürekli aranan vatandaştan bankalara sitem: “O kadar krediyi vermeden düşünseydiniz” Türkinform,https://news.google.com/rss/articles/CBMixAFBVV95cUxQaExGb3BUT0FiTTJvbDRscTMtYlRUYmpBdXNpemwyQldsTko5bjlrMXR2d0ZaSXRtZGJlWmtBRTY4dVR3N0NkNmRiZWZRSWU0S1QwRHZuR0ZMWlBMS2ZQNC1rRU9RMTVVRG50OUdkMzZSWGZLRlJ6d2x4S1ZWaE9FZDJ1VFowVGJhbkh5ZEkxYkZVOHRhSjZOcUVIQWhEMGZZbVhLNW8tQlBMMHRaTUhOeHJXU2JGdW5LM0t1NENIZ1Z4ckd3?oc=5,banka,finansal kuruluş,Borçları nedeniyle sürekli aranan vatandaştan bankalara sitem: “O kadar krediyi vermeden düşünseydiniz” Türkinform,Borçları nedeniyle sürekli aranan vatandaştan bankalara sitem: “O kadar krediyi vermeden düşünseydiniz” Borçları nedeniyle sürekli aranan vatandaştan bankalara sitem: “O kadar krediyi vermeden düşünseydiniz” Türkinform Borçları nedeniyle sürekli aranan vatandaştan bankalara sitem: “O kadar krediyi vermeden düşünseydiniz” Türkinform,browser_failed,https://news.google.com/rss/articles/CBMixAFBVV95cUxQaExGb3BUT0FiTTJvbDRscTMtYlRUYmpBdXNpemwyQldsTko5bjlrMXR2d0ZaSXRtZGJlWmtBRTY4dVR3N0NkNmRiZWZRSWU0S1QwRHZuR0ZMWlBMS2ZQNC1rRU9RMTVVRG50OUdkMzZSWGZLRlJ6d2x4S1ZWaE9FZDJ1VFowVGJhbkh5ZEkxYkZVOHRhSjZOcUVIQWhEMGZZbVhLNW8tQlBMMHRaTUhOeHJXU2JGdW5LM0t1NENIZ1Z4ckd3?oc=5&hl=tr&gl=TR&ceid=TR:tr,,,,,,,,il yok | ilçe yok | firma yok | faaliyet/tesis yok,,,,maps araması yapılmadı,,,87.14,79
