published,search_term,category,title,summary,link,matched_words,activity_type,raw_text,entity_source_text,article_fetch_status,resolved_article_url,city_candidates,district_candidates,neighborhood_candidates,street_candidates,facility_candidates,company_candidates,company_candidate_scores,entity_quality_note,maps_queries,maps_candidates,maps_best_guess,maps_status,maps_match_scores,maps_rejected_candidates,record_quality_score,duplicate_group_id
2026-07-06 13:37:00,fabrika yangını,Fiziksel Risk / Yangın,İzmir Menemen'deki Geri Dönüşüm Fabrikasında Çıkan Yangın Kontrol Altına Alındı,İzmir Menemen'deki Geri Dönüşüm Fabrikasında Çıkan Yangın Kontrol Altına Alındı Mersin Haber,https://news.google.com/rss/articles/CBMiuwFBVV95cUxPQTNIRnNITUlINThBRHFVa3RoTEdINUtIcngzTXF1bWRZN0Vzc2tQbnIyS0hfRHFGc2FmM2dFaVBpcVVyUkdfdXN4ZFBEMFdMX1BBWXpxS2hhZlJHZkdpWTJSLXdlaGlVNXRSeHE0Q3dFVFRKaWVyWmpOY0ZoeVlXNjFhWV85TlJZaEtBcERfTUlKMEFjdFVkdHBzWXlPM2otbmNKTEdwVEZtUjBTT3lodXpKX2kwZXBBd3pJ0gFXQVVfeXFMT1U0Z3J0RzR0V2JjSHc5U2VJaURtYVRBdmVnMjVfSTlCcktmZmw0N3VScXY5Ny0xRnJJSC1oZW91S281NDRsMlNadEQ5dktUdlVzZmgtdmpF?oc=5,fabrika,fabrika,"Mersin'den haberiniz olsun! Mersin ve ilçelerinden son dakika ve önemli haberler, gelişmeler olayları sunar. İzmir Menemen ilçesinde bir geri dönüşüm fabrikasında çıkan yangın, itfaiye ekiplerinin hızlı müdahalesiyle kontrol altına alındı. Olayda can kaybı ya da Mersin'den haberiniz olsun! Mersin ve ilçelerinden son dakika ve önemli haberler, gelişmeler olayları sunar. İzmir Menemen ilçesinde bir geri dönüşüm fabrikasında çıkan yangın, itfaiye ekiplerinin hızlı müdahalesiyle kontrol altına alındı. Olayda can kaybı ya da yaralanma yaşanmadı. Facebook X WhatsApp 2gün 18sa önce Edinilen bilgilere göre, yangın, saat 13.00 civarında Maltepe yolu üzerindeki Camikebir Mahallesi’ndeki geri dönüşüm fabrikasında henüz belirlenemeyen bir sebeple başladı. Kısa sürede büyüyen alevler, gökyüzünü kaplayan siyah dumanlar oluşturdu ve çevredeki birçok yerden görüldü. Olayı fark eden çevre sakinleri, durumu hemen yetkililere bildirdi. Bu ihbar üzerine olay yerine çok sayıda itfaiye ekibi yönlendirildi. Büyükşehir Belediyesi İtfaiye Daire Başkanlığı’na bağlı ekipler, 5 arazöz, 1 merdivenli araç, 2 tonaj aracı, 1 endüstriyel araç ve 1 köpük kulesi aracıyla yangına müdahale etmek üzere yoğun bir çaba sarf etti. İlçe belediyeleri de su tankerleri ve iş makineleriyle destek sağladı. Ekipler, alevlerin geri dönüşüm tesisinin etrafındaki evlere ve diğer yapılara sıçrama riskine karşı geniş güvenlik önlemleri aldı. Geri dönüşüm materyallerinin yüksek yanıcılığı nedeniyle yangın hızla yayıldı. Bu nedenle itfaiye ekipleri, yangına dört koldan müdahale ederek çevredeki yapılara ulaşmasını engellemeye çalıştı. Yangın otluk alana da sıçramıştı, fakat ekiplerin yoğun çalışmaları sonucunda yangın kontrol altına alındı. İş yerinin çevresinde soğutma çalışmalarının sürdüğü öğrenildi. Yangında can kaybı ya da yaralanma olmadığı belirtilirken, iş yerinde maddi hasar meydana geldiği ifade edildi. Gaziantep'te Gastronomi Eğitimleriyle Mutfak Kültürü Geleceğe Taşınıyor. Ankara'da Ulaştırma Bakanı Uraloğlu, Türkiye limanlarındaki yük elleçlemenin arttığını duyurdu. İzmir Kaynak: Mersin Haber + IHA İlgili Haberler İzmir Menemen'deki Geri Dönüşüm Fabrikasında Çıkan Yangın Kontrol Altına Alındı Haber Merkezi • 06 Temmuz 2026 16:37 • Güncellendi: 06 Temmuz 2026 16:39 İzmir Menemen ilçesinde bir geri dönüşüm fabrikasında çıkan yangın, itfaiye ekiplerinin hızlı müdahalesiyle kontrol altına alındı. Olayda can kaybı ya da yaralanma yaşanmadı. İzmir Menemen ilçesinde bir geri dönüşüm fabrikasında çıkan yangın, itfaiye ekiplerinin hızlı müdahalesiyle kontrol altına alındı. Olayda can kaybı ya da yaralanma yaşanmadı. Facebook X WhatsApp 2gün 18sa önce Edinilen bilgilere göre, yangın, saat 13.00 civarında Maltepe yolu üzerindeki Camikebir Mahallesi’ndeki geri dönüşüm fabrikasında henüz belirlenemeyen bir sebeple başladı. Kısa sürede büyüyen alevler, gökyüzünü kaplayan siyah dumanlar oluşturdu ve çevredeki birçok yerden görüldü. Olayı fark eden çevre sakinleri, durumu hemen yetkililere bildirdi. Bu ihbar üzerine olay yerine çok sayıda itfaiye ekibi yönlendirildi. Büyükşehir Belediyesi İtfaiye Daire Başkanlığı’na bağlı ekipler, 5 arazöz, 1 merdivenli araç, 2 tonaj aracı, 1 endüstriyel araç ve 1 köpük kulesi aracıyla yangına müdahale etmek üzere yoğun bir çaba sarf etti. İlçe belediyeleri de su tankerleri ve iş makineleriyle destek sağladı. Ekipler, alevlerin geri dönüşüm tesisinin etrafındaki evlere ve diğer yapılara sıçrama riskine karşı geniş güvenlik önlemleri aldı. Geri dönüşüm materyallerinin yüksek yanıcılığı nedeniyle yangın hızla yayıldı. Bu nedenle itfaiye ekipleri, yangına dört koldan müdahale ederek çevredeki yapılara ulaşmasını engellemeye çalıştı. Yangın otluk alana da sıçramıştı, fakat ekiplerin yoğun çalışmaları sonucunda yangın kontrol altına alındı. İş yerinin çevresinde soğutma çalışmalarının sürdüğü öğrenildi. Yangında can kaybı ya da yaralanma olmadığı belirtilirken, iş yerinde maddi hasar meydana geldiği ifade edildi. Gaziantep'te Gastronomi Eğitimleriyle Mutfak Kültürü Geleceğe Taşınıyor. Ankara'da Ulaştırma Bakanı Uraloğlu, Türkiye limanlarındaki yük elleçlemenin arttığını duyurdu. İzmir Kaynak: Mersin Haber + IHA İlgili Haberler Edinilen bilgilere göre, yangın, saat 13.00 civarında Maltepe yolu üzerindeki Camikebir Mahallesi’ndeki geri dönüşüm fabrikasında henüz belirlenemeyen bir sebeple başladı. Kısa sürede büyüyen alevler, gökyüzünü kaplayan siyah dumanlar oluşturdu ve çevredeki birçok yerden görüldü. Olayı fark eden çevre sakinleri, durumu hemen yetkililere bildirdi. Bu ihbar üzerine olay yerine çok sayıda itfaiye ekibi yönlendirildi. Büyükşehir Belediyesi İtfaiye Daire Başkanlığı’na bağlı ekipler, 5 arazöz, 1 merdivenli araç, 2 tonaj aracı, 1 endüstriyel araç ve 1 köpük kulesi aracıyla yangına müdahale etmek üzere yoğun bir çaba sarf etti. İlçe belediyeleri de su tankerleri ve iş makineleriyle destek sağladı. Ekipler, alevlerin geri dönüşüm tesisinin etrafındaki evlere ve diğer yapılara sıçrama riskine karşı geniş güvenlik önlemleri aldı. Geri dönüşüm materyallerinin yüksek yanıcılığı nedeniyle yangın hızla yayıldı. Bu nedenle itfaiye ekipleri, yangına dört koldan müdahale ederek çevredeki yapılara ulaşmasını engellemeye çalıştı. Yangın otluk alana da sıçramıştı, fakat ekiplerin yoğun çalışmaları sonucunda yangın kontrol altına alındı. İş yerinin çevresinde soğutma çalışmalarının sürdüğü öğrenildi. Yangında can kaybı ya da yaralanma olmadığı belirtilirken, iş yerinde maddi hasar meydana geldiği ifade edildi. İzmir Menemen'deki Geri Dönüşüm Fabrikasında Çıkan Yangın Kontrol Altına Alındı Haber Merkezi • 06 Temmuz 2026 16:37 • Güncellendi: 06 Temmuz 2026 16:39 İzmir Menemen ilçesinde bir geri dönüşüm fabrikasında çıkan yangın, itfaiye ekiplerinin hızlı müdahalesiyle kontrol altına alındı. Olayda can kaybı ya da yaralanma yaşanmadı. Haber Merkezi • 06 Temmuz 2026 16:37 • Güncellendi: 06 Temmuz 2026 16:39 İzmir Menemen ilçesinde bir geri dönüşüm fabrikasında çıkan yangın, itfaiye ekiplerinin hızlı müdahalesiyle kontrol altına alındı. Olayda can kaybı ya da yaralanma yaşanmadı. İzmir Menemen'deki Geri Dönüşüm Fabrikasında Çıkan Yangın Kontrol Altına Alındı Edinilen bilgilere göre, yangın, saat 13.00 civarında Maltepe yolu üzerindeki Camikebir Mahallesi’ndeki geri dönüşüm fabrikasında henüz belirlenemeyen bir sebeple başladı. Kısa sürede büyüyen alevler, gökyüzünü kaplayan siyah dumanlar oluşturdu ve çevredeki birçok yerden görüldü. Olayı fark eden çevre sakinleri, durumu hemen yetkililere bildirdi. Bu ihbar üzerine olay yerine çok sayıda itfaiye ekibi yönlendirildi. Büyükşehir Belediyesi İtfaiye Daire Başkanlığı’na bağlı ekipler, 5 arazöz, 1 merdivenli araç, 2 tonaj aracı, 1 endüstriyel araç ve 1 köpük kulesi aracıyla yangına müdahale etmek üzere yoğun bir çaba sarf etti. İlçe belediyeleri de su tankerleri ve iş makineleriyle destek sağladı. Ekipler, alevlerin geri dönüşüm tesisinin etrafındaki evlere ve diğer yapılara sıçrama riskine karşı geniş güvenlik önlemleri aldı. Geri dönüşüm materyallerinin yüksek yanıcılığı nedeniyle yangın hızla yayıldı. Bu nedenle itfaiye ekipleri, yangına dört koldan müdahale ederek çevredeki yapılara ulaşmasını engellemeye çalıştı. Yangın otluk alana da sıçramıştı, fakat ekiplerin yoğun çalışmaları sonucunda yangın kontrol altına alındı. İş yerinin çevresinde soğutma çalışmalarının sürdüğü öğrenildi. Yangında can kaybı ya da yaralanma olmadığı belirtilirken, iş yerinde maddi hasar meydana geldiği ifade edildi.","İzmir Menemen'deki Geri Dönüşüm Fabrikasında Çıkan Yangın Kontrol Altına Alındı İzmir Menemen'deki Geri Dönüşüm Fabrikasında Çıkan Yangın Kontrol Altına Alındı Mersin Haber Mersin'den haberiniz olsun! İzmir Menemen ilçesinde bir geri dönüşüm fabrikasında çıkan yangın, itfaiye ekiplerinin hızlı müdahalesiyle kontrol altına alındı. Olayda can kaybı ya da Mersin'den haberiniz olsun! Olayda can kaybı ya da yaralanma yaşanmadı. Facebook X WhatsApp 2gün 18sa önce Edinilen bilgilere göre, yangın, saat 13.00 civarında Maltepe yolu üzerindeki Camikebir Mahallesi’ndeki geri dönüşüm fabrikasında henüz belirlenemeyen bir sebeple başladı. Kısa sürede büyüyen alevler, gökyüzünü kaplayan siyah dumanlar oluşturdu ve çevredeki birçok yerden görüldü. Olayı fark eden çevre sakinleri, durumu hemen yetkililere bildirdi. Bu ihbar üzerine olay yerine çok sayıda itfaiye ekibi yönlendirildi. Büyükşehir Belediyesi İtfaiye Daire Başkanlığı’na bağlı ekipler, 5 arazöz, 1 merdivenli araç, 2 tonaj aracı, 1 endüstriyel araç ve 1 köpük kulesi aracıyla yangına müdahale etmek üzere yoğun bir çaba sarf etti. Ekipler, alevlerin geri dönüşüm tesisinin etrafındaki evlere ve diğer yapılara sıçrama riskine karşı geniş güvenlik önlemleri aldı. Geri dönüşüm materyallerinin yüksek yanıcılığı nedeniyle yangın hızla yayıldı. Bu nedenle itfaiye ekipleri, yangına dört koldan müdahale ederek çevredeki yapılara ulaşmasını engellemeye çalıştı. Yangın otluk alana da sıçramıştı, fakat ekiplerin yoğun çalışmaları sonucunda yangın kontrol altına alındı. Yangında can kaybı ya da yaralanma olmadığı belirtilirken, iş yerinde maddi hasar meydana geldiği ifade edildi. Gaziantep'te Gastronomi Eğitimleriyle Mutfak Kültürü Geleceğe Taşınıyor. Ankara'da Ulaştırma Bakanı Uraloğlu, Türkiye limanlarındaki yük elleçlemenin arttığını duyurdu. İzmir Kaynak: Mersin Haber + IHA İlgili Haberler İzmir Menemen'deki Geri Dönüşüm Fabrikasında Çıkan Yangın Kontrol Altına Alındı Haber Merkezi • 06 Temmuz 2026 16:37 • Güncellendi: 06 Temmuz 2026 16:39 İzmir Menemen ilçesinde bir geri dönüşüm fabrikasında çıkan yangın, itfaiye ekiplerinin hızlı müdahalesiyle kontrol altına alındı. İzmir Kaynak: Mersin Haber + IHA İlgili Haberler Edinilen bilgilere göre, yangın, saat 13.00 civarında Maltepe yolu üzerindeki Camikebir Mahallesi’ndeki geri dönüşüm fabrikasında henüz belirlenemeyen bir sebeple başladı. İzmir Menemen'deki Geri Dönüşüm Fabrikasında Çıkan Yangın Kontrol Altına Alındı Haber Merkezi • 06 Temmuz 2026 16:37 • Güncellendi: 06 Temmuz 2026 16:39 İzmir Menemen ilçesinde bir geri dönüşüm fabrikasında çıkan yangın, itfaiye ekiplerinin hızlı müdahalesiyle kontrol altına alındı. Haber Merkezi • 06 Temmuz 2026 16:37 • Güncellendi: 06 Temmuz 2026 16:39 İzmir Menemen ilçesinde bir geri dönüşüm fabrikasında çıkan yangın, itfaiye ekiplerinin hızlı müdahalesiyle kontrol altına alındı. İzmir Menemen'deki Geri Dönüşüm Fabrikasında Çıkan Yangın Kontrol Altına Alındı Edinilen bilgilere göre, yangın, saat 13.00 civarında Maltepe yolu üzerindeki Camikebir Mahallesi’ndeki geri dönüşüm fabrikasında henüz belirlenemeyen bir sebeple başladı.",browser_full_article,https://www.mersinhaber.com/haber-izmir-menemendeki-geri-donusum-fabrikasinda-cikan-yangin-kontrol-altina-alindi/696353,Ankara | Gaziantep | Mersin | İzmir,Menemen,Maltepe yolu üzerindeki Camikebir Mahallesi,,,,,firma yok | faaliyet/tesis yok,,,,maps araması yapılmadı,,,143.5,67
2026-07-06 11:07:00,fabrika yangını,Fiziksel Risk / Yangın,Afyon OSB'de Fabrika Yangını! Ekipler Seferber Oldu,Afyon OSB'de Fabrika Yangını! Ekipler Seferber Oldu afyonyerelhaber.com,https://news.google.com/rss/articles/CBMioAFBVV95cUxQM2IySzRaLUlmWlVpQVN4QlVyM21xY0RMbHZxQmUxX0ctN25ydV82RWZyU1d0a2tGd2xhRHRKSmNZR0xvb1pSV1hjREFVdDc0eTJhaHJGd2pHc0IxLS1LWk9OcFAtaV9BczBFVHBsM0VPVWNQRXViMGhlYmxqY1MxU1dVUXR2Wl9VamYzZzF3dW11WnFuYTE0dXVKWGd4X0Fz?oc=5,"fabrika, osb",fabrika,Afyon OSB'de Fabrika Yangını! Ekipler Seferber Oldu afyonyerelhaber.com,Afyon OSB'de Fabrika Yangını! Ekipler Seferber Oldu Afyon OSB'de Fabrika Yangını! Ekipler Seferber Oldu afyonyerelhaber.com Afyon OSB'de Fabrika Yangını! Ekipler Seferber Oldu afyonyerelhaber.com,browser_failed,https://news.google.com/rss/articles/CBMioAFBVV95cUxQM2IySzRaLUlmWlVpQVN4QlVyM21xY0RMbHZxQmUxX0ctN25ydV82RWZyU1d0a2tGd2xhRHRKSmNZR0xvb1pSV1hjREFVdDc0eTJhaHJGd2pHc0IxLS1LWk9OcFAtaV9BczBFVHBsM0VPVWNQRXViMGhlYmxqY1MxU1dVUXR2Wl9VamYzZzF3dW11WnFuYTE0dXVKWGd4X0Fz?oc=5&hl=tr&gl=TR&ceid=TR:tr,,,Afyon OSB | Ekipler Seferber Oldu Afyon OSB,,,,,il yok | ilçe yok | firma yok | faaliyet/tesis yok,,,,maps araması yapılmadı,,,73.96,68
2026-07-06 11:07:00,iflas,İflas / Konkordato / Mali Sorun,Ünlü okul kıyafeti firması iflas etti: Konkordato süreci kurtarmaya yetmedi,Ünlü okul kıyafeti firması iflas etti: Konkordato süreci kurtarmaya yetmedi Cumhuriyet,https://news.google.com/rss/articles/CBMivAFBVV95cUxQd3YzN1JlOTZRUlJQa3d6ZE5SX09leXkzVzVTRl9FT1E2bWlBeWFxWkcyQk9CSFIwUXk2U1pJOTg3T3NFOC1VaGhtbHp6ZTlKSXB5RDJxcUZEeUdJTjNRVFY0aTllSlB2c1c5SEJKWGVxcXZWZF9GY3BKWjBLMk5pYlJ5VWM5LVo0WlNESExpcVJreXJ4SUpySXE2VFd5Mllpa3BYa2pZMHdlWXRFYXFTcG5UaEZGUXZ3ZHUtWA?oc=5,firma,şirket / firma,"İzmir merkezli Cece Tekstil, mali krizi aşamayarak başvurduğu konkordato sürecinin başarısızlıkla sonuçlanmasının ardından mahkeme kararıyla resmen iflas etti. Okul ve iş kıyafetleri üretimi yapan firmanın 1 yıllık kesin mühlet süresini tamamlamasıyla toplanan İzmir 3. Asliye Ticaret Mahkemesi, şirketin iflasının açılmasına hükmederek tasfiye sürecini başlattı. İzmir merkezli Cece Tekstil, mali krizi aşamayarak başvurduğu konkordato sürecinin başarısızlıkla sonuçlanmasının ardından mahkeme kararıyla resmen iflas etti. Okul ve iş kıyafetleri üretimi yapan firmanın 1 yıllık kesin mühlet süresini tamamlamasıyla toplanan İzmir 3. Asliye Ticaret Mahkemesi, şirketin iflasının açılmasına hükmederek tasfiye sürecini başlattı. İzmir merkezli Cece Tekstil, mali krizi aşamayarak başvurduğu konkordato sürecinin başarısızlıkla sonuçlanmasının ardından mahkeme kararıyla resmen iflas etti. Okul ve iş kıyafetleri üretimi yapan firmanın 1 yıllık kesin mühlet süresini tamamlamasıyla toplanan İzmir 3. Asliye Ticaret Mahkemesi, şirketin iflasının açılmasına hükmederek tasfiye sürecini başlattı. Ekonomik sıkıntılar nedeniyle konkordato başvurusunda bulunan İzmir merkezli Cece Tekstil Medikal Sanayi ve Ticaret Limited Şirketi'nin hukuki süreci iflas kararıyla tamamlandı. Mahkeme, konkordato sürecinin başarıyla sonuçlanmaması nedeniyle şirket hakkında iflas kararı verdi. Okul kıyafetleri ve iş kıyafetleri üretimi alanında faaliyet gösteren Cece Tekstil için daha önce mahkeme tarafından 1 yıllık kesin mühlet kararı verilmişti. Bu süreçte Bağımsız Denetçi Mali Müşavir Vahap Yıldırım geçici konkordato komiseri olarak görev yaparken, hukukçu Sevgi Kanyılmaz ile tekstil mühendisi Atilla Yıldırım da konkordato komiseri olarak atanmıştı. MAHKEMEDEN İFLAS KARARI ÇIKTI Konkordato sürecinin olumlu sonuç vermemesi üzerine İzmir 3. Asliye Ticaret Mahkemesi, 2025/952 esas sayılı dosya kapsamında kararını açıkladı. Mahkeme, 3 Temmuz 2026 tarihinde saat 15.07 itibarıyla Cece Tekstil Medikal Sanayi ve Ticaret Ltd. Şti. hakkında iflasın açılmasına hükmetti. İFLAS SÜRECİ RESMEN BAŞLATILDI Mahkeme kararının ardından İzmir İflas Müdürlüğü tarafından iflas ilanı yayımlandı. Yayımlanan ilanda, iflas işlemlerinin resmen başlatıldığı belirtilirken, söz konusu ilanın 2004 sayılı İcra ve İflas Kanunu'nun 166'ncı maddesi kapsamında yayımlandığı ifade edildi. Hava Durumu Namaz Vakitleri Ünlü okul kıyafeti firması iflas etti: Konkordato süreci kurtarmaya yetmedi Takip Et: Paylaş: Ünlü ok","Ünlü okul kıyafeti firması iflas etti: Konkordato süreci kurtarmaya yetmedi Ünlü okul kıyafeti firması iflas etti: Konkordato süreci kurtarmaya yetmedi Cumhuriyet İzmir merkezli Cece Tekstil, mali krizi aşamayarak başvurduğu konkordato sürecinin başarısızlıkla sonuçlanmasının ardından mahkeme kararıyla resmen iflas etti. Okul ve iş kıyafetleri üretimi yapan firmanın 1 yıllık kesin mühlet süresini tamamlamasıyla toplanan İzmir 3. Asliye Ticaret Mahkemesi, şirketin iflasının açılmasına hükmederek tasfiye sürecini başlattı. Ekonomik sıkıntılar nedeniyle konkordato başvurusunda bulunan İzmir merkezli Cece Tekstil Medikal Sanayi ve Ticaret Limited Şirketi'nin hukuki süreci iflas kararıyla tamamlandı. Mahkeme, konkordato sürecinin başarıyla sonuçlanmaması nedeniyle şirket hakkında iflas kararı verdi. Okul kıyafetleri ve iş kıyafetleri üretimi alanında faaliyet gösteren Cece Tekstil için daha önce mahkeme tarafından 1 yıllık kesin mühlet kararı verilmişti. Bu süreçte Bağımsız Denetçi Mali Müşavir Vahap Yıldırım geçici konkordato komiseri olarak görev yaparken, hukukçu Sevgi Kanyılmaz ile tekstil mühendisi Atilla Yıldırım da konkordato komiseri olarak atanmıştı. MAHKEMEDEN İFLAS KARARI ÇIKTI Konkordato sürecinin olumlu sonuç vermemesi üzerine İzmir 3. Asliye Ticaret Mahkemesi, 2025/952 esas sayılı dosya kapsamında kararını açıkladı. Mahkeme, 3 Temmuz 2026 tarihinde saat 15.07 itibarıyla Cece Tekstil Medikal Sanayi ve Ticaret Ltd. Şti. hakkında iflasın açılmasına hükmetti. İFLAS SÜRECİ RESMEN BAŞLATILDI Mahkeme kararının ardından İzmir İflas Müdürlüğü tarafından iflas ilanı yayımlandı. Yayımlanan ilanda, iflas işlemlerinin resmen başlatıldığı belirtilirken, söz konusu ilanın 2004 sayılı İcra ve İflas Kanunu'nun 166'ncı maddesi kapsamında yayımlandığı ifade edildi. Hava Durumu Namaz Vakitleri Ünlü okul kıyafeti firması iflas etti: Konkordato süreci kurtarmaya yetmedi Takip Et: Paylaş: Ünlü ok",browser_full_article,https://www.cumhuriyet.com.tr/ekonomi/unlu-okul-kiyafeti-firmasi-iflas-etti-konkordato-sureci-kurtarmaya-yetmedi-2518459,İzmir | Bursa,Yıldırım,,,,Cece Tekstil Medikal Sanayi ve Ticaret Limited Şirketi'nin,Cece Tekstil Medikal Sanayi ve Ticaret Limited Şirketi'nin:57:body,faaliyet/tesis yok,Cece Tekstil Medikal Sanayi ve Ticaret Limited Şirketi'nin Yıldırım İzmir Türkiye,Cece Tekstil,Cece Tekstil,firma adı + güvenli maps adayı var,100.0,,205.4,69
2026-07-07 08:31:41,mali kriz,İflas / Konkordato / Mali Sorun,Türk tekstilinde dev kriz! 60 yıllık şirket ikinci kez konkordato istedi,Türk tekstilinde dev kriz! 60 yıllık şirket ikinci kez konkordato istedi MYGAZETE,https://news.google.com/rss/articles/CBMipwFBVV95cUxPa3cyUUhOQ19lTWdkczI0bkRyX2NHT0RxQVlFMWQyUU9YYTdldVZPR1FibXh5WGlTc011WnlrdjlDallYbFk2UnFoLS0wY1RxdEt5c1lHSW5DWllyY1lVcDBJeEQ4YXB5ZzRCOERINXJZdXN0cTl6WkE5OGZSTVhPWG42LV8zSlVBRDgtdS1uMGVteGhYc3VudE1ZRS1lSWRtZkRWNHdvTQ?oc=5,"tekstil, şirket",şirket / firma,Türk tekstilinde dev kriz! 60 yıllık şirket ikinci kez konkordato istedi MYGAZETE,Türk tekstilinde dev kriz! 60 yıllık şirket ikinci kez konkordato istedi Türk tekstilinde dev kriz! 60 yıllık şirket ikinci kez konkordato istedi MYGAZETE Türk tekstilinde dev kriz! 60 yıllık şirket ikinci kez konkordato istedi MYGAZETE,browser_failed,https://news.google.com/rss/articles/CBMipwFBVV95cUxPa3cyUUhOQ19lTWdkczI0bkRyX2NHT0RxQVlFMWQyUU9YYTdldVZPR1FibXh5WGlTc011WnlrdjlDallYbFk2UnFoLS0wY1RxdEt5c1lHSW5DWllyY1lVcDBJeEQ4YXB5ZzRCOERINXJZdXN0cTl6WkE5OGZSTVhPWG42LV8zSlVBRDgtdS1uMGVteGhYc3VudE1ZRS1lSWRtZkRWNHdvTQ?oc=5&hl=tr&gl=TR&ceid=TR:tr,,,,,,,,il yok | ilçe yok | firma yok | faaliyet/tesis yok,,,,maps araması yapılmadı,,,73.06,70
2026-07-03 06:03:00,ödeme güçlüğü,Banka / Finansal Kuruluş,Borçları nedeniyle sürekli aranan vatandaştan bankalara sitem: “O kadar krediyi vermeden düşünseydiniz”,Borçları nedeniyle sürekli aranan vatandaştan bankalara sitem: “O kadar krediyi vermeden düşünseydiniz” Türkinform,https://news.google.com/rss/articles/CBMixAFBVV95cUxQaExGb3BUT0FiTTJvbDRscTMtYlRUYmpBdXNpemwyQldsTko5bjlrMXR2d0ZaSXRtZGJlWmtBRTY4dVR3N0NkNmRiZWZRSWU0S1QwRHZuR0ZMWlBMS2ZQNC1rRU9RMTVVRG50OUdkMzZSWGZLRlJ6d2x4S1ZWaE9FZDJ1VFowVGJhbkh5ZEkxYkZVOHRhSjZOcUVIQWhEMGZZbVhLNW8tQlBMMHRaTUhOeHJXU2JGdW5LM0t1NENIZ1Z4ckd3?oc=5,banka,finansal kuruluş,Borçları nedeniyle sürekli aranan vatandaştan bankalara sitem: “O kadar krediyi vermeden düşünseydiniz” Türkinform,Borçları nedeniyle sürekli aranan vatandaştan bankalara sitem: “O kadar krediyi vermeden düşünseydiniz” Borçları nedeniyle sürekli aranan vatandaştan bankalara sitem: “O kadar krediyi vermeden düşünseydiniz” Türkinform Borçları nedeniyle sürekli aranan vatandaştan bankalara sitem: “O kadar krediyi vermeden düşünseydiniz” Türkinform,browser_failed,https://news.google.com/rss/articles/CBMixAFBVV95cUxQaExGb3BUT0FiTTJvbDRscTMtYlRUYmpBdXNpemwyQldsTko5bjlrMXR2d0ZaSXRtZGJlWmtBRTY4dVR3N0NkNmRiZWZRSWU0S1QwRHZuR0ZMWlBMS2ZQNC1rRU9RMTVVRG50OUdkMzZSWGZLRlJ6d2x4S1ZWaE9FZDJ1VFowVGJhbkh5ZEkxYkZVOHRhSjZOcUVIQWhEMGZZbVhLNW8tQlBMMHRaTUhOeHJXU2JGdW5LM0t1NENIZ1Z4ckd3?oc=5&hl=tr&gl=TR&ceid=TR:tr,,,,,,,,il yok | ilçe yok | firma yok | faaliyet/tesis yok,,,,maps araması yapılmadı,,,87.14,71
2026-07-08 03:25:00,borç krizi,Banka / Finansal Kuruluş,ZAFER ÖZCİVAN: MERKEZ BANKALARININ “İLERİ YÖNLENDİRME” POLİTİKALARI,ZAFER ÖZCİVAN: MERKEZ BANKALARININ “İLERİ YÖNLENDİRME” POLİTİKALARI Haber Ekspres,https://news.google.com/rss/articles/CBMiigFBVV95cUxONmpoaDN2b3p5V1pZWHMyR2x0T0RDM0g0bXhhR0JlYVNRZUNpNGRydkwtalgtcklnS01sSkhuOWdnQUM0TEFabTBDUGNjc2wxaUlNSjVURWpVQkE2dF9PRWh0UVJ0R2pVM2d0SEtjYkF1RVYzcjZjWVJpa3RqZW83QjBXMHlCaWdITkE?oc=5,banka,finansal kuruluş,ZAFER ÖZCİVAN: MERKEZ BANKALARININ “İLERİ YÖNLENDİRME” POLİTİKALARI Haber Ekspres,ZAFER ÖZCİVAN: MERKEZ BANKALARININ “İLERİ YÖNLENDİRME” POLİTİKALARI ZAFER ÖZCİVAN: MERKEZ BANKALARININ “İLERİ YÖNLENDİRME” POLİTİKALARI Haber Ekspres ZAFER ÖZCİVAN: MERKEZ BANKALARININ “İLERİ YÖNLENDİRME” POLİTİKALARI Haber Ekspres,browser_failed,https://www.haberekspres.com.tr/merkez-bankalarinin-ileri-yonlendirme-politikalari,,,,,,,,il yok | ilçe yok | firma yok | faaliyet/tesis yok,,,,maps araması yapılmadı,,,60.56,72
2026-07-06 11:05:22,tasfiye,İflas / Konkordato / Mali Sorun,CEPS’in yan kuruluşu Milano International tasfiye sürecine giriyor Yazar Investing.com,CEPS’in yan kuruluşu Milano International tasfiye sürecine giriyor Yazar Investing.com Investing.com Türkiye,https://news.google.com/rss/articles/CBMivgFBVV95cUxNNVRMcS1sRGpFeHhxLTVsb2kxT0JSR29kSDRPWUo3MV9oQXdUNHluVWJJcnM3TlMyRnJRODVxRS1IN2JoV2hwUlRST1hYcVZyNXMtOWRLZWRZNmVkemVFRnB0VWJyMkFsdHZsX1F2Y0llMndnckc0RDVqOW9oYW5DaDI2UGNIbXc0QmJwQVgxQlMxYTBOaElLSEZ6cXlmeUlaMjh4cG9JLUhDYmRHN3VETzlSbUNxYkxjSVpkcUxn?oc=5,kuruluş,,CEPS’in yan kuruluşu Milano International tasfiye sürecine giriyor Yazar Investing.com Investing.com Türkiye,CEPS’in yan kuruluşu Milano International tasfiye sürecine giriyor Yazar Investing.com CEPS’in yan kuruluşu Milano International tasfiye sürecine giriyor Yazar Investing.com Investing.com Türkiye CEPS’in yan kuruluşu Milano International tasfiye sürecine giriyor Yazar Investing.com Investing.com Türkiye,browser_failed,https://news.google.com/rss/articles/CBMivgFBVV95cUxNNVRMcS1sRGpFeHhxLTVsb2kxT0JSR29kSDRPWUo3MV9oQXdUNHluVWJJcnM3TlMyRnJRODVxRS1IN2JoV2hwUlRST1hYcVZyNXMtOWRLZWRZNmVkemVFRnB0VWJyMkFsdHZsX1F2Y0llMndnckc0RDVqOW9oYW5DaDI2UGNIbXc0QmJwQVgxQlMxYTBOaElLSEZ6cXlmeUlaMjh4cG9JLUhDYmRHN3VETzlSbUNxYkxjSVpkcUxn?oc=5&hl=tr&gl=TR&ceid=TR:tr,,,,,,,,il yok | ilçe yok | firma yok | faaliyet/tesis yok,,,,maps araması yapılmadı,,,87.08,73
