published,search_term,category,title,summary,link,matched_words,activity_type,raw_text,entity_source_text,article_fetch_status,resolved_article_url,city_candidates,district_candidates,neighborhood_candidates,street_candidates,facility_candidates,company_candidates,company_candidate_scores,entity_quality_note,maps_queries,maps_candidates,maps_best_guess,maps_status,maps_match_scores,maps_rejected_candidates,record_quality_score,duplicate_group_id
2026-06-09 09:31:00,iflas,İflas / Konkordato / Mali Sorun,100 ülkeye ihracat yapan alüminyum devi şirket iflas etti,100 ülkeye ihracat yapan alüminyum devi şirket iflas etti emlak 365,https://news.google.com/rss/articles/CBMirAFBVV95cUxNYThwSlVzaUpUT2xnMUJBWTl6aEQyNzBMcHZwWWM5OTZIQkctMUxGYS01SEhVWndjWTk0NXJIN1pJdHk4RXNvVm9CZy1WZ2dERnBZc2JIbWRpYmUtTkNVVmRxVFh5cVNrb1BLYTQtS2d5R2xPM3pMZktSQ0xrWW5yTW9TTDQzV3hGU205UlFSdkRzMGQ5QjhLQ0Y4X2lNLTdPWHVYbUdYMm5aYWdT?oc=5,şirket,şirket / firma,"Yıllarca yurt içi ve yurt dışında faaliyet gösteren, altı kıtada 100 ülkeye ihracat gerçekleştiren Patrop Group’un konkordato süreci iflasla sonuçlandı. Mahkeme, şirket hakkında iflas kararı verdi. Yıllarca yurt içi ve yurt dışında faaliyet gösteren, altı kıtada 100 ülkeye ihracat gerçekleştiren Patrop Group’un konkordato süreci iflasla sonuçlandı. Mahkeme, şirket hakkında iflas kararı verdi. Yıllarca yurt içi ve yurt dışında faaliyet gösteren, altı kıtada 100 ülkeye ihracat gerçekleştiren Patrop Group’un konkordato süreci iflasla sonuçlandı. Mahkeme, şirket hakkında iflas kararı verdi. Anasayfa Emlak Haberleri 100 ülkeye ihracat yapan alüminyum devi şirket iflas etti 100 ülkeye ihracat yapan alüminyum devi şirket iflas etti Yıllarca yurt içi ve yurt dışında faaliyet gösteren, altı kıtada 100 ülkeye ihracat gerçekleştiren Patrop Group’un konkordato süreci iflasla sonuçlandı. Mahkeme, şirket hakkında iflas kararı verdi. Yayınlanma: 09 Haziran 2026 Salı 12:31 Alüminyum üretiminde faaliyet gösteren Patrop Group İnşaat Sanayi ve Ticaret A.Ş. ile şirket ortağı Ziya Güngör tarafından başlatılan konkordato başvurusu kapsamında yürütülen yargı süreci tamamlandı. İstanbul 2. Asliye Ticaret Mahkemesi, yaklaşık üç ay süren değerlendirmenin ardından şirketin iflasına hükmetti. Yaklaşık 15 yıl önce alüminyum üretimi amacıyla iki büyük fabrika kuran şirket, zaman içerisinde ihracat ağını genişleterek altı kıtada 100 ülkeye ürün gönderen bir yapıya ulaştı. Ancak son dönemde yaşanan ekonomik zorluklar, artan maliyetler, kur baskısı ve nakit akışındaki sıkıntılar şirketin faaliyetlerini sürdürebilmesini zorlaştırdı. Mahkeme kararı resmileşti Mahkeme tarafından yayımlanan ilan metnine göre, İstanbul Ticaret Sicil Müdürlüğü'ne kayıtlı Patrop Group İnşaat Sanayi ve Ticaret A.Ş. hakkında 21 Mayıs 2026 tarihinde saat 17.15 itibarıyla iflasın açılmasına karar verildi. Tasfiye süreci başlıyor Karar doğrultusunda şirketin iflas tasfiyesi, İstanbul İflas Müdürlüğü tarafından adi tasfiye usulü çerçevesinde yürütülecek. Ayrıca İcra ve İflas Kanunu'nun ilgili hükümleri kapsamında iflas kararının ilan edileceği, dava sürecinde yatırılan iflas avanslarının da İstanbul İflas Müdürlüğü'ne aktarılacağı belirtildi. Böylece uzun yıllardır üretim ve ihracat faaliyetleriyle öne çıkan şirket için hukuki süreç yeni bir aşamaya geçmiş oldu. Emlak Haberleri Ankara’da artan arz konut üretimini hızlandırdı Alt kirada yazılı izin şartı: Kiracıyı tahliye ve tazminat riski bekliyor Boğaz’daki tarihi İstapan Yalısı’nda 5 milyon dolarlık indirim Deprem sonrası yavaşlayan gayrimenkul piyasası yeniden hareketlendi 100 ülkeye ihracat yapan alüminyum devi şirket iflas etti Yıllarca yurt içi ve yurt dışında faaliyet gösteren, altı kıtada 100 ülkeye ihracat gerçekleştiren Patrop Group’un konkordato süreci iflasla sonuçlandı. Mahkeme, şirket hakkında iflas kararı verdi. Yayınlanma: 09 Haziran 2026 Salı 12:31 Alüminyum üretiminde faaliyet gösteren Patrop Group İnşaat Sanayi ve Ticaret A.Ş. ile şirket ortağı Ziya Güngör tarafından başlatılan konkordato başvurusu kapsamında yürütülen yargı süreci tamamlandı. İstanbul 2. Asliye Ticaret Mahkemesi, yaklaşık üç ay süren değerlendirmenin ardından şirketin iflasına hükmetti. Yaklaşık 15 yıl önce alüminyum üretimi amacıyla iki büyük fabrika kuran şirket, zaman içerisinde ihracat ağını genişleterek altı kıtada 100 ülkeye ürün gönderen bir yapıya ulaştı. Ancak son dönemde yaşanan ekonomik zorluklar, artan maliyetler, kur baskısı ve nakit akışındaki sıkıntılar şirketin faaliyetlerini sürdürebilmesini zorlaştırdı. Mahkeme kararı resmileşti Mahkeme tarafından yayımlanan ilan metnine göre, İstanbul Ticaret Sicil Müdürlüğü'ne kayıtlı Patrop Group İnşaat Sanayi ve Ticaret A.Ş. hakkında 21 Mayıs 2026 tarihinde saat 17.15 itibarıyla iflasın açılmasına karar verildi. Tasfiye süreci başlıyor Karar doğrultusunda şirketin iflas tasfiyesi, İstanbul İflas Müdürlüğü tarafından adi tasfiye usulü çerçevesinde yürütülecek. Ayrıca İcra ve İflas Kanunu'nun ilgili hükümleri kapsamında iflas kararının ilan edileceği, dava sürecinde yatırılan iflas avanslarının da İstanbul İflas Müdürlüğü'ne aktarılacağı belirtildi. Böylece uzun yıllardır üretim ve ihracat faaliyetleriyle öne çıkan şirket için hukuki süreç yeni bir aşamaya geçmiş oldu. Emlak Haberleri Ankara’da artan arz konut üretimini hızlandırdı Alt kirada yazılı izin şartı: Kiracıyı tahliye ve tazminat riski bekliyor Boğaz’daki tarihi İstapan Yalısı’nda 5 milyon dolarlık indirim Deprem sonrası yavaşlayan gayrimenkul piyasası yeniden hareketlendi 100 ülkeye ihracat yapan alüminyum devi şirket iflas etti Yıllarca yurt içi ve yurt dışında faaliyet gösteren, altı kıtada 100 ülkeye ihracat gerçekleştiren Patrop Group’un konkordato süreci iflasla sonuçlandı. Mahkeme, şirket hakkında iflas kararı verdi. Yayınlanma: 09 Haziran 2026 Salı 12:31 Alüminyum üretiminde faaliyet gösteren Patrop Group İnşaat Sanayi ve Ticaret A.Ş. ile şirket ortağı Ziya Güngör tarafından başlatılan konkordato başvurusu kapsamında yürütülen yargı süreci tamamlandı. İstanbul 2. Asliye Ticaret Mahkemesi, yaklaşık üç ay süren değerlendirmenin ardından şirketin iflasına hükmetti. Yaklaşık 15 yıl önce alüminyum üretimi amacıyla iki büyük fabrika kuran şirket, zaman içerisinde ihracat ağını genişleterek altı kıtada 100 ülkeye ürün gönderen bir yapıya ulaştı. Ancak son dönemde yaşanan ekonomik zorluklar, artan maliyetler, kur baskısı ve nakit akışındaki sıkıntılar şirketin faaliyetlerini sürdürebilmesini zorlaştırdı. Mahkeme kararı resmileşti Mahkeme tarafından yayımlanan ilan metnine göre, İstanbul Ticaret Sicil Müdürlüğü'ne kayıtlı Patrop Group İnşaat Sanayi ve Ticaret A.Ş. hakkında 21 Mayıs 2026 tarihinde saat 17.15 itibarıyla iflasın açılmasına karar verildi. Tasfiye süreci başlıyor Karar doğrultusunda şirketin iflas tasfiyesi, İstanbul İflas Müdürlüğü tarafından adi tasfiye usulü çerçevesinde yürütülecek. Ayrıca İcra ve İflas Kanunu'nun ilgili hükümleri kapsamında iflas kararının ilan edileceği, dava sürecinde yatırılan iflas avanslarının da İstanbul İflas Müdürlüğü'ne aktarılacağı belirtildi. Böylece uzun yıllardır üretim ve ihracat faaliyetleriyle öne çıkan şirket için hukuki süreç yeni bir aşamaya geçmiş oldu. Alüminyum üretiminde faaliyet gösteren Patrop Group İnşaat Sanayi ve Ticaret A.Ş. ile şirket ortağı Ziya Güngör tarafından başlatılan konkordato başvurusu kapsamında yürütülen yargı süreci tamamlandı. İstanbul 2. Asliye Ticaret Mahkemesi, yaklaşık üç ay süren değerlendirmenin ardından şirketin iflasına hükmetti. Yaklaşık 15 yıl önce alüminyum üretimi amacıyla iki büyük fabrika kuran şirket, zaman içerisinde ihracat ağını genişleterek altı kıtada 100 ülkeye ürün gönderen bir yapıya ulaştı. Ancak son dönemde yaşanan ekonomik zorluklar, artan maliyetler, kur baskısı ve nakit akışındaki sıkıntılar şirketin faaliyetlerini sürdürebilmesini zorlaştırdı. Mahkeme kararı resmileşti Mahkeme tarafından yayımlanan ilan metnine göre, İstanbul Ticaret Sicil Müdürlüğü'ne kayıtlı Patrop Group İnşaat Sanayi ve Ticaret A.Ş. hakkında 21 Mayıs 2026 tarihinde saat 17.15 itibarıyla iflasın açılmasına karar verildi. Tasfiye süreci başlıyor Karar doğrultusunda şirketin iflas tasfiyesi, İstanbul İflas Müdürlüğü tarafından adi tasfiye usulü çerçevesinde yürütülecek. Ayrıca İcra ve İflas Kanunu'nun ilgili hükümleri kapsamında iflas kararının ilan edileceği, dava sürecinde yatırılan iflas avanslarının da İstanbul İflas Müdürlüğü'ne aktarılacağı belirtildi. Böylece uzun yıllardır üretim ve ihracat faaliyetleriyle öne çıkan şirket için hukuki süreç yeni bir aşamaya geçmiş oldu. 100 ülkeye ihracat yapan alüminyum devi şirket iflas etti Yıllarca yurt içi ve yurt dışında faaliyet gösteren, altı kıtada 100 ülkeye ihracat gerçekleştiren Patrop Group’un konkordato süreci iflasla sonuçlandı. Mahkeme, şirket hakkında iflas kararı verdi. Yayınlanma: 09 Haziran 2026 Salı 12:31 Alüminyum üretiminde faaliyet gösteren Patrop Group İnşaat Sanayi ve Ticaret A.Ş. ile şirket ortağı Ziya Güngör tarafından başlatılan konkordato başvurusu kapsamında yürütülen yargı süreci tamamlandı. İstanbul 2. Asliye Ticaret Mahkemesi, yaklaşık üç ay süren değerlendirmenin ardından şirketin iflasına hükmetti. Yaklaşık 15 yıl önce alüminyum üretimi amacıyla iki büyük fabrika kuran şirket, zaman içerisinde ihracat ağını genişleterek altı kıtada 100 ülkeye ürün gönderen bir yapıya ulaştı. Ancak son dönemde yaşanan ekonomik zorluklar, artan maliyetler, kur baskısı ve nakit akışındaki sıkıntılar şirketin faaliyetlerini sürdürebilmesini zorlaştırdı. Mahkeme kararı resmileşti Mahkeme tarafından yayımlanan ilan metnine göre, İstanbul Ticaret Sicil Müdürlüğü'ne kayıtlı Patrop Group İnşaat Sanayi ve Ticaret A.Ş. hakkında 21 Mayıs 2026 tarihinde saat 17.15 itibarıyla iflasın açılmasına karar verildi. Karar doğrultusunda şirketin iflas tasfiyesi, İstanbul İflas Müdürlüğü tarafından adi tasfiye usulü çerçevesinde yürütülecek. Ayrıca İcra ve İflas Kanunu'nun ilgili hükümleri kapsamında iflas kararının ilan edileceği, dava sürecinde yatırılan iflas avanslarının da İstanbul İflas Müdürlüğü'ne aktarılacağı belirtildi. Böylece uzun yıllardır üretim ve ihracat faaliyetleriyle öne çıkan şirket için hukuki süreç yeni bir aşamaya geçmiş oldu.","100 ülkeye ihracat yapan alüminyum devi şirket iflas etti 100 ülkeye ihracat yapan alüminyum devi şirket iflas etti emlak 365 Yıllarca yurt içi ve yurt dışında faaliyet gösteren, altı kıtada 100 ülkeye ihracat gerçekleştiren Patrop Group’un konkordato süreci iflasla sonuçlandı. Mahkeme, şirket hakkında iflas kararı verdi. Anasayfa Emlak Haberleri 100 ülkeye ihracat yapan alüminyum devi şirket iflas etti 100 ülkeye ihracat yapan alüminyum devi şirket iflas etti Yıllarca yurt içi ve yurt dışında faaliyet gösteren, altı kıtada 100 ülkeye ihracat gerçekleştiren Patrop Group’un konkordato süreci iflasla sonuçlandı. Yayınlanma: 09 Haziran 2026 Salı 12:31 Alüminyum üretiminde faaliyet gösteren Patrop Group İnşaat Sanayi ve Ticaret A.Ş. ile şirket ortağı Ziya Güngör tarafından başlatılan konkordato başvurusu kapsamında yürütülen yargı süreci tamamlandı. Asliye Ticaret Mahkemesi, yaklaşık üç ay süren değerlendirmenin ardından şirketin iflasına hükmetti. Yaklaşık 15 yıl önce alüminyum üretimi amacıyla iki büyük fabrika kuran şirket, zaman içerisinde ihracat ağını genişleterek altı kıtada 100 ülkeye ürün gönderen bir yapıya ulaştı. Ancak son dönemde yaşanan ekonomik zorluklar, artan maliyetler, kur baskısı ve nakit akışındaki sıkıntılar şirketin faaliyetlerini sürdürebilmesini zorlaştırdı. Mahkeme kararı resmileşti Mahkeme tarafından yayımlanan ilan metnine göre, İstanbul Ticaret Sicil Müdürlüğü'ne kayıtlı Patrop Group İnşaat Sanayi ve Ticaret A.Ş. hakkında 21 Mayıs 2026 tarihinde saat 17.15 itibarıyla iflasın açılmasına karar verildi. Tasfiye süreci başlıyor Karar doğrultusunda şirketin iflas tasfiyesi, İstanbul İflas Müdürlüğü tarafından adi tasfiye usulü çerçevesinde yürütülecek. Ayrıca İcra ve İflas Kanunu'nun ilgili hükümleri kapsamında iflas kararının ilan edileceği, dava sürecinde yatırılan iflas avanslarının da İstanbul İflas Müdürlüğü'ne aktarılacağı belirtildi. Böylece uzun yıllardır üretim ve ihracat faaliyetleriyle öne çıkan şirket için hukuki süreç yeni bir aşamaya geçmiş oldu. Emlak Haberleri Ankara’da artan arz konut üretimini hızlandırdı Alt kirada yazılı izin şartı: Kiracıyı tahliye ve tazminat riski bekliyor Boğaz’daki tarihi İstapan Yalısı’nda 5 milyon dolarlık indirim Deprem sonrası yavaşlayan gayrimenkul piyasası yeniden hareketlendi 100 ülkeye ihracat yapan alüminyum devi şirket iflas etti Yıllarca yurt içi ve yurt dışında faaliyet gösteren, altı kıtada 100 ülkeye ihracat gerçekleştiren Patrop Group’un konkordato süreci iflasla sonuçlandı. Alüminyum üretiminde faaliyet gösteren Patrop Group İnşaat Sanayi ve Ticaret A.Ş. ile şirket ortağı Ziya Güngör tarafından başlatılan konkordato başvurusu kapsamında yürütülen yargı süreci tamamlandı. 100 ülkeye ihracat yapan alüminyum devi şirket iflas etti Yıllarca yurt içi ve yurt dışında faaliyet gösteren, altı kıtada 100 ülkeye ihracat gerçekleştiren Patrop Group’un konkordato süreci iflasla sonuçlandı. Karar doğrultusunda şirketin iflas tasfiyesi, İstanbul İflas Müdürlüğü tarafından adi tasfiye usulü çerçevesinde yürütülecek.",browser_full_article,https://www.emlak365.com.tr/emlak-haberleri/100-ulkeye-ihracat-yapan-aluminyum-devi-sirket-iflas-etti-203631,Ankara,,,,,Patrop Group İnşaat Sanayi ve Ticaret A.Ş,Patrop Group İnşaat Sanayi ve Ticaret A.Ş:57:body | Patrop Group İnşaat Sanayi ve Ticaret A.Ş:raw_legal,ilçe yok | faaliyet/tesis yok,Patrop Group İnşaat Sanayi ve Ticaret A.Ş Ankara Türkiye,Patrop Group,Patrop Group,firma adı + güvenli maps adayı var,100.0,,165.65,21
2026-06-09 20:04:02,iflas,İflas / Konkordato / Mali Sorun,"Shtip'te tekstil işçileri, iflas eden Alman-Bulgar şirketlerinden kendilerine ödenmesi gereken maaşları talep ederek protesto gösterisi düzenledi.","Shtip'te tekstil işçileri, iflas eden Alman-Bulgar şirketlerinden kendilerine ödenmesi gereken maaşları talep ederek protesto gösterisi düzenledi. Слободен печат",https://news.google.com/rss/articles/CBMi1gFBVV95cUxOdkdBUEVUWTB4X3lvVVBRMlF0akVFYm9ISWk5OFNKdmtFS3dWeGpQX3YxV2ZTcG5vSVJmdUk1dERiX1pybVVZV3RZN21TcHpfcm9fQ05KX1FhbWZTaWFEV0RaMVkzMjR4bjBwTkxqOFVkSkR5TjUtVm1yR3RWZDlMWkR3bkEwbjRySEl3b2FkRUFvUUxycExGa1h3TlRqc0pzUHVMRHBrU2VidTFub0NEaVFzcndhRVBvakotcVVaSU1RcW0tMllPcTJMeVVvVGw3X2QxaG9R?oc=5,"tekstil, şirket",şirket / firma,"Shtip'te tekstil işçileri, iflas eden Alman-Bulgar şirketlerinden kendilerine ödenmesi gereken maaşları talep ederek protesto gösterisi düzenledi. Слободен печат","Shtip'te tekstil işçileri, iflas eden Alman-Bulgar şirketlerinden kendilerine ödenmesi gereken maaşları talep ederek protesto gösterisi düzenledi. Shtip'te tekstil işçileri, iflas eden Alman-Bulgar şirketlerinden kendilerine ödenmesi gereken maaşları talep ederek protesto gösterisi düzenledi. Слободен печат Shtip'te tekstil işçileri, iflas eden Alman-Bulgar şirketlerinden kendilerine ödenmesi gereken maaşları talep ederek protesto gösterisi düzenledi.",browser_failed,https://news.google.com/rss/articles/CBMi1gFBVV95cUxOdkdBUEVUWTB4X3lvVVBRMlF0akVFYm9ISWk5OFNKdmtFS3dWeGpQX3YxV2ZTcG5vSVJmdUk1dERiX1pybVVZV3RZN21TcHpfcm9fQ05KX1FhbWZTaWFEV0RaMVkzMjR4bjBwTkxqOFVkSkR5TjUtVm1yR3RWZDlMWkR3bkEwbjRySEl3b2FkRUFvUUxycExGa1h3TlRqc0pzUHVMRHBrU2VidTFub0NEaVFzcndhRVBvakotcVVaSU1RcW0tMllPcTJMeVVvVGw3X2QxaG9R?oc=5&hl=tr&gl=TR&ceid=TR:tr,,,,,,,,il yok | ilçe yok | firma yok | faaliyet/tesis yok,,,,maps araması yapılmadı,,,130.86,22
2026-06-10 06:33:00,iflas,İflas / Konkordato / Mali Sorun,İzmir'de dev tarım firmasına kötü haber! Mahkeme konkordato talebini reddetti!,İzmir'de dev tarım firmasına kötü haber! Mahkeme konkordato talebini reddetti! Son Mühür,https://news.google.com/rss/articles/CBMipwFBVV95cUxQQTZiWU1rVGZySlJ2VzhZQzdNM19BRGNYcDg5WURmRm5RUnRRMEZoN1EtbmVTZnRaeEkzUF8wWmdGR01rRndkRmtZc2NPZ0YwSU1jQ2pELUVPTjJuRGctcnU0QmYxajM1aWg1YWJvbWlHZ2hoRlJxc2cxOHpJRVBzcnVweFE4Q3I3bXBRSFc5c29KWUZDZVFrbDJRX29vT0pGanpHNkpNUdIBpwFBVV95cUxQQTZiWU1rVGZySlJ2VzhZQzdNM19BRGNYcDg5WURmRm5RUnRRMEZoN1EtbmVTZnRaeEkzUF8wWmdGR01rRndkRmtZc2NPZ0YwSU1jQ2pELUVPTjJuRGctcnU0QmYxajM1aWg1YWJvbWlHZ2hoRlJxc2cxOHpJRVBzcnVweFE4Q3I3bXBRSFc5c29KWUZDZVFrbDJRX29vT0pGanpHNkpNUQ?oc=5,firma,şirket / firma,"İzmir Asliye Ticaret Mahkemesi, Tusem Tarım Gıda Sanayi ve Ticaret Limited Şirketi ile ortağı S. K.’ nin mali darboğazdan kurtulmak için başvurduğu konkordato talebini reddetti. İzmir Asliye Ticaret Mahkemesi, Tusem Tarım Gıda Sanayi ve Ticaret Limited Şirketi ile ortağı S. K.’ nin mali darboğazdan kurtulmak için başvurduğu konkordato talebini reddetti. İzmir Asliye Ticaret Mahkemesi, Tusem Tarım Gıda Sanayi ve Ticaret Limited Şirketi ile ortağı S. K.’ nin mali darboğazdan kurtulmak için başvurduğu konkordato talebini reddetti. Son Mühür- Zeytin ve zeytinyağı sektöründe faaliyet gösteren Tusem Tarım, özellikle Hünkar markasıyla biliniyordu. Şirket, zeytini doğrudan üreticiden temin ederek kendi tesislerinde depolayıp işleyip, ardından paketleyerek piyasaya sunuyordu. Tusen Tarım yaşadığı ekonomik sıkıntılar nedeniyle geçtiğimiz aylarda konkordato talebinde bulunmuştu. İzmir'de faaliyet gösteren Tusem Tarım Gıda Ltd. Şti. ve şirket ortağı S. K.’nin mahkemeye yaptığı konkordato talebi reddedildi. Mahkeme, şirket üzerindeki tüm ihtiyati tedbir kararlarını kaldırırken konkordato komiserinin görevine de son verdi. İzmir iş dünyasında tarım ve gıda sektörünü yakından ilgilendiren önemli bir iflas erteleme (konkordato) davasında nihai karar çıktı. İzmir Ticaret Sicil Müdürlüğü’nün 270574 sicil numarasında kayıtlı Tusem Tarım Gıda Sanayi ve Ticaret Limited Şirketi ile şirketin gerçek kişi ortağı S. K. tarafından açılan konkordato davası olumsuz sonuçlandı. Mahkeme talebi reddetti, tedbirleri kaldırdı İzmir Asliye Ticaret Mahkemesi’nde görülen davanın 04/06/2026 tarihli duruşmasında, borçlu tarafların mali durumlarını düzelterek alacaklılarıyla anlaşma zeminini içeren konkordato talepleri mahkeme heyeti tarafından reddedildi. Mahkeme, ret kararıyla birlikte şu kritik adımları attı: Davacı şirket Tusem Tarım Gıda ve gerçek kişi S. K. yönünden mahkemece daha önce konulmuş olan tüm ihtiyati tedbir kararları tamamen kaldırıldı. Süreci yönetmesi için atanan konkordato komiserinin görevine son verildi. İstinaf yolu açık İcra İflas Kanunu’nun (İİK) 308/a maddesi uyarınca oy birliğiyle alınan bu karara karşı yargı yolu ise açık tutuldu. Borçlu davacılar yönünden kararın tebliğ edilmesinden, itiraz eden alacaklılar yönünden ise kararın ilan edilmesinden itibaren 2 hafta içinde İstinaf (Bölge Adliye Mahkemesi) yoluna başvuru yapılabilecek. Karar, İİK hükümleri gereğince tüm ilgililere resmen ilan edildi. İzmir'de dev tarım firmasına kötü haber! Mahkeme konkordato talebini reddetti! İzmir Asliye Ticaret Mahkemesi, Tusem Tarım Gıda Sanayi ve Ticaret Limited Şirketi ile ortağı S. K.’ nin mali darboğazdan kurtulmak için başvurduğu konkordato talebini reddetti. Mahkeme talebi reddetti, tedbirleri kaldırdı Son Mühür- Zeytin ve zeytinyağı sektöründe faaliyet gösteren Tusem Tarım, özellikle Hünkar markasıyla biliniyordu. Şirket, zeytini doğrudan üreticiden temin ederek kendi tesislerinde depolayıp işleyip, ardından paketleyerek piyasaya sunuyordu. Tusen Tarım yaşadığı ekonomik sıkıntılar nedeniyle geçtiğimiz aylarda konkordato talebinde bulunmuştu. İzmir'de faaliyet gösteren Tusem Tarım Gıda Ltd. Şti. ve şirket ortağı S. K.’nin mahkemeye yaptığı konkordato talebi reddedildi. Mahkeme, şirket üzerindeki tüm ihtiyati tedbir kararlarını kaldırırken konkordato komiserinin görevine de son verdi. İzmir iş dünyasında tarım ve gıda sektörünü yakından ilgilendiren önemli bir iflas erteleme (konkordato) davasında nihai karar çıktı. İzmir Ticaret Sicil Müdürlüğü’nün 270574 sicil numarasında kayıtlı Tusem Tarım Gıda Sanayi ve Ticaret Limited Şirketi ile şirketin gerçek kişi ortağı S. K. tarafından açılan konkordato davası olumsuz sonuçlandı. İzmir Asliye Ticaret Mahkemesi’nde görülen davanın 04/06/2026 tarihli duruşmasında, borçlu tarafların mali durumlarını düzelterek alacaklılarıyla anlaşma zeminini içeren konkordato talepleri mahkeme heyeti tarafından reddedildi. Mahkeme, ret kararıyla birlikte şu kritik adımları attı: Davacı şirket Tusem Tarım Gıda ve gerçek kişi S. K. yönünden mahkemece daha önce konulmuş olan tüm ihtiyati tedbir kararları tamamen kaldırıldı. Süreci yönetmesi için atanan konkordato komiserinin görevine son verildi. İcra İflas Kanunu’nun (İİK) 308/a maddesi uyarınca oy birliğiyle alınan bu karara karşı yargı yolu ise açık tutuldu. Borçlu davacılar yönünden kararın tebliğ edilmesinden, itiraz eden alacaklılar yönünden ise kararın ilan edilmesinden itibaren 2 hafta içinde İstinaf (Bölge Adliye Mahkemesi) yoluna başvuru yapılabilecek. Karar, İİK hükümleri gereğince tüm ilgililere resmen ilan edildi.","İzmir'de dev tarım firmasına kötü haber! Mahkeme konkordato talebini reddetti! İzmir'de dev tarım firmasına kötü haber! Mahkeme konkordato talebini reddetti! Son Mühür İzmir Asliye Ticaret Mahkemesi, Tusem Tarım Gıda Sanayi ve Ticaret Limited Şirketi ile ortağı S. K.’ nin mali darboğazdan kurtulmak için başvurduğu konkordato talebini reddetti. Son Mühür- Zeytin ve zeytinyağı sektöründe faaliyet gösteren Tusem Tarım, özellikle Hünkar markasıyla biliniyordu. Şirket, zeytini doğrudan üreticiden temin ederek kendi tesislerinde depolayıp işleyip, ardından paketleyerek piyasaya sunuyordu. Tusen Tarım yaşadığı ekonomik sıkıntılar nedeniyle geçtiğimiz aylarda konkordato talebinde bulunmuştu. İzmir'de faaliyet gösteren Tusem Tarım Gıda Ltd. Şti. ve şirket ortağı S. K.’nin mahkemeye yaptığı konkordato talebi reddedildi. Mahkeme, şirket üzerindeki tüm ihtiyati tedbir kararlarını kaldırırken konkordato komiserinin görevine de son verdi. İzmir iş dünyasında tarım ve gıda sektörünü yakından ilgilendiren önemli bir iflas erteleme (konkordato) davasında nihai karar çıktı. İzmir Ticaret Sicil Müdürlüğü’nün 270574 sicil numarasında kayıtlı Tusem Tarım Gıda Sanayi ve Ticaret Limited Şirketi ile şirketin gerçek kişi ortağı S. tarafından açılan konkordato davası olumsuz sonuçlandı. Mahkeme talebi reddetti, tedbirleri kaldırdı İzmir Asliye Ticaret Mahkemesi’nde görülen davanın 04/06/2026 tarihli duruşmasında, borçlu tarafların mali durumlarını düzelterek alacaklılarıyla anlaşma zeminini içeren konkordato talepleri mahkeme heyeti tarafından reddedildi. Mahkeme, ret kararıyla birlikte şu kritik adımları attı: Davacı şirket Tusem Tarım Gıda ve gerçek kişi S. Süreci yönetmesi için atanan konkordato komiserinin görevine son verildi. İzmir'de dev tarım firmasına kötü haber! Mahkeme konkordato talebini reddetti! Mahkeme talebi reddetti, tedbirleri kaldırdı Son Mühür- Zeytin ve zeytinyağı sektöründe faaliyet gösteren Tusem Tarım, özellikle Hünkar markasıyla biliniyordu. İzmir Asliye Ticaret Mahkemesi’nde görülen davanın 04/06/2026 tarihli duruşmasında, borçlu tarafların mali durumlarını düzelterek alacaklılarıyla anlaşma zeminini içeren konkordato talepleri mahkeme heyeti tarafından reddedildi.",browser_full_article,https://www.sonmuhur.com/izmirde-dev-tarim-firmasina-kotu-haber-mahkeme-konkordato-talebini-reddetti/amp,İzmir,,,,,Tusem Tarım Gıda Sanayi ve Ticaret Limited Şirketi,Tusem Tarım Gıda Ltd. Şti:130:body | Tusem Tarım Gıda Sanayi ve Ticaret Limited Şirketi:raw_legal,ilçe yok | faaliyet/tesis yok,Tusem Tarım Gıda Sanayi ve Ticaret Limited Şirketi İzmir Türkiye,Tusem Tarım,Tusem Tarım,firma adı + güvenli maps adayı var,100.0,,194.0,23
