published,search_term,category,title,summary,link,matched_words,activity_type,raw_text,entity_source_text,article_fetch_status,resolved_article_url,city_candidates,district_candidates,neighborhood_candidates,street_candidates,facility_candidates,company_candidates,company_candidate_scores,entity_quality_note,maps_queries,maps_candidates,maps_best_guess,maps_status,maps_match_scores,maps_rejected_candidates,record_quality_score,duplicate_group_id
2026-07-06 12:46:26,üretim tesisi yangını,Fiziksel Risk / Yangın,Menemen’deki geri dönüşüm tesisi yangınına yoğun müdahale,Menemen’deki geri dönüşüm tesisi yangınına yoğun müdahale Anka Haber,https://news.google.com/rss/articles/CBMimgFBVV95cUxOdnN3ZGFUWmhZR0JRS2pwU1kwaHREYUJ5WHBvZEVuZzROZDZqVHA3Y2xnQ3J5RVpsTUNuSWJ1cUZmUjVpdS1QdzhvZzlJcl9MZXV4elVsNF8zc2JEdXB6YUlYOWhoVDFqZVl2enAwc3hXQmJsT1l3MVNPUG9kZEhPMHJ6RElwRzFEN1o5eWFCdkhPQVdlSXo2TXVn?oc=5,tesis,,"İzmir Büyükşehir Belediyesi İtfaiye Daire Başkanlığı, Menemen'de bir geri dönüşüm tesisinde çıkan yangını kontrol altına almak için çok sayıda araç ve personelle çalışma yürütüyor. Yangının çevredeki ev ve yapılara sıçrama riskine karşı ekipler müdahalesini sürdürüyor. İzmir Büyükşehir Belediyesi İtfaiye Daire Başkanlığı, Menemen'de bir geri dönüşüm tesisinde çıkan yangını kontrol altına almak için çok sayıda araç ve personelle çalışma yürütüyor. Yangının çevredeki ev ve yapılara sıçrama riskine karşı ekipler müdahalesini sürdürüyor. İzmir Büyükşehir Belediyesi İtfaiye Daire Başkanlığı, Menemen'de bir geri dönüşüm tesisinde çıkan yangını kontrol altına almak için çok sayıda araç ve personelle çalışma yürütüyor. Yangının çevredeki ev ve yapılara sıçrama riskine karşı ekipler müdahalesini sürdürüyor. (İZMİR) - İzmir Büyükşehir Belediyesi İtfaiye Daire Başkanlığı, Menemen'de bir geri dönüşüm tesisinde çıkan yangını kontrol altına almak için çok sayıda araç ve personelle çalışma yürütüyor. Yangının çevredeki ev ve yapılara sıçrama riskine karşı ekipler müdahalesini sürdürüyor. İzmir'in Menemen ilçesi Camiikebir Mahallesi'nde bulunan bir geri dönüşüm tesisinde saat 13.00 sıralarında yangın çıktı. Tesisten yükselen yoğun dumanı fark eden çevre sakinlerinin ihbarı üzerine İzmir Büyükşehir Belediyesi İtfaiye Dairesi Başkanlığı ekipleri olay yerine sevk edildi. Yangına 5 arazöz, 1 merdivenli araç, 2 tonaj aracı, 1 endüstriyel araç ve 1 köpük kulesi aracıyla müdahale edilirken, söndürme çalışmalarına ilçe belediyeleri de su tankerleri ve iş makineleriyle destek verdi. ALEVLERLE DÖRT KOLDAN MÜCADELE Yangının çıktığı geri dönüşüm tesisinin çevresinde evler ve çeşitli yapılar bulunması nedeniyle ekipler, alevlerin sıçrama riskine karşı geniş güvenlik önlemleri aldı. Geri dönüşüm malzemelerinin yüksek yanıcılığı nedeniyle kısa sürede büyüyen yangına, çevredeki yapılara ulaşmasını önlemek amacıyla dört koldan müdahale edildi. Tesisin farklı noktalarında eş zamanlı çalışma yürüten ekipler, söndürme çalışmalarını aralıksız sürdürüyor. Menemen’deki geri dönüşüm tesisi yangınına yoğun müdahale (İZMİR) - İzmir Büyükşehir Belediyesi İtfaiye Daire Başkanlığı, Menemen'de bir geri dönüşüm tesisinde çıkan yangını kontrol altına almak için çok sayıda araç ve personelle çalışma yürütüyor. Yangının çevredeki ev ve yapılara sıçrama riskine karşı ekipler müdahalesini sürdürüyor. İzmir'in Menemen ilçesi Camiikebir Mahallesi'nde bulunan bir geri dönüşüm tesisinde saat 13.00 sıralarında yangın çıktı. Tesisten yükselen yoğun dumanı fark eden çevre sakinlerinin ihbarı üzerine İzmir Büyükşehir Belediyesi İtfaiye Dairesi Başkanlığı ekipleri olay yerine sevk edildi. Yangına 5 arazöz, 1 merdivenli araç, 2 tonaj aracı, 1 endüstriyel araç ve 1 köpük kulesi aracıyla müdahale edilirken, söndürme çalışmalarına ilçe belediyeleri de su tankerleri ve iş makineleriyle destek verdi. ALEVLERLE DÖRT KOLDAN MÜCADELE Yangının çıktığı geri dönüşüm tesisinin çevresinde evler ve çeşitli yapılar bulunması nedeniyle ekipler, alevlerin sıçrama riskine karşı geniş güvenlik önlemleri aldı. Geri dönüşüm malzemelerinin yüksek yanıcılığı nedeniyle kısa sürede büyüyen yangına, çevredeki yapılara ulaşmasını önlemek amacıyla dört koldan müdahale edildi. Tesisin farklı noktalarında eş zamanlı çalışma yürüten ekipler, söndürme çalışmalarını aralıksız sürdürüyor.","Menemen’deki geri dönüşüm tesisi yangınına yoğun müdahale Menemen’deki geri dönüşüm tesisi yangınına yoğun müdahale Anka Haber İzmir Büyükşehir Belediyesi İtfaiye Daire Başkanlığı, Menemen'de bir geri dönüşüm tesisinde çıkan yangını kontrol altına almak için çok sayıda araç ve personelle çalışma yürütüyor. Yangının çevredeki ev ve yapılara sıçrama riskine karşı ekipler müdahalesini sürdürüyor. (İZMİR) - İzmir Büyükşehir Belediyesi İtfaiye Daire Başkanlığı, Menemen'de bir geri dönüşüm tesisinde çıkan yangını kontrol altına almak için çok sayıda araç ve personelle çalışma yürütüyor. İzmir'in Menemen ilçesi Camiikebir Mahallesi'nde bulunan bir geri dönüşüm tesisinde saat 13.00 sıralarında yangın çıktı. Tesisten yükselen yoğun dumanı fark eden çevre sakinlerinin ihbarı üzerine İzmir Büyükşehir Belediyesi İtfaiye Dairesi Başkanlığı ekipleri olay yerine sevk edildi. Yangına 5 arazöz, 1 merdivenli araç, 2 tonaj aracı, 1 endüstriyel araç ve 1 köpük kulesi aracıyla müdahale edilirken, söndürme çalışmalarına ilçe belediyeleri de su tankerleri ve iş makineleriyle destek verdi. ALEVLERLE DÖRT KOLDAN MÜCADELE Yangının çıktığı geri dönüşüm tesisinin çevresinde evler ve çeşitli yapılar bulunması nedeniyle ekipler, alevlerin sıçrama riskine karşı geniş güvenlik önlemleri aldı. Geri dönüşüm malzemelerinin yüksek yanıcılığı nedeniyle kısa sürede büyüyen yangına, çevredeki yapılara ulaşmasını önlemek amacıyla dört koldan müdahale edildi. Tesisin farklı noktalarında eş zamanlı çalışma yürüten ekipler, söndürme çalışmalarını aralıksız sürdürüyor. Menemen’deki geri dönüşüm tesisi yangınına yoğun müdahale (İZMİR) - İzmir Büyükşehir Belediyesi İtfaiye Daire Başkanlığı, Menemen'de bir geri dönüşüm tesisinde çıkan yangını kontrol altına almak için çok sayıda araç ve personelle çalışma yürütüyor.",browser_full_article,https://ankahaber.net/haber/menemen-deki-geri-donusum-tesisi-yanginina-yogun-mudahale-d2f49de1,İzmir,Menemen,in Menemen ilçesi Camiikebir Mahallesi,,deki geri dönüşüm tesisi,,,firma yok,deki geri dönüşüm tesisi in Menemen ilçesi Camiikebir Mahallesi Menemen İzmir Türkiye,İzmir Geri Kazanım - İGK | Yalınsu Geri Kazanım | Yiğit Geri Dönüşüm | Kılıçoğulları Geri Dönüşüm | Aktaşlar geri dönüşüm,İzmir Geri Kazanım - İGK,"firma adı yok, tesis/lokasyon ile maps tahmini var",52.17391304347826 | 50.0 | 80.0 | 68.0 | 72.72727272727272,,184.5,1
2026-07-01 13:33:42,üretim tesisi yangını,Fiziksel Risk / Yangın,Dikkat! Kavurucu Sıcaklar Geldi: Sanayi Tesislerinde Yangın Riski Tırmanıyor,Dikkat! Kavurucu Sıcaklar Geldi: Sanayi Tesislerinde Yangın Riski Tırmanıyor Akdeniz Gerçek,https://news.google.com/rss/articles/CBMivgFBVV95cUxORnBvS194ZmgxTWZJck1oek5NNzFfZG9Sc1lUTjd6Q1VyRU85akpFa3NJZXNBQ2EwSlBlNE5wOUptZy1TWl9IX2NnTnRySTdSUTlRb2lFQ2ZpYk1ZQmxYZmtiZmhUcWx3NkJ2NnhmNGVzZDFmd1FDdy1xM3hTN3hmRVFIZDU4cnNodzF6Um03TFJqTlNFZDhaOGMydnVQMFNDRExGMjRRUlYwUFJkNmNiWS1OZDY1bVBuTkZZWEpn?oc=5,"sanayi, tesis",,Dikkat! Kavurucu Sıcaklar Geldi: Sanayi Tesislerinde Yangın Riski Tırmanıyor Akdeniz Gerçek,Dikkat! Kavurucu Sıcaklar Geldi: Sanayi Tesislerinde Yangın Riski Tırmanıyor Dikkat! Kavurucu Sıcaklar Geldi: Sanayi Tesislerinde Yangın Riski Tırmanıyor Akdeniz Gerçek Kavurucu Sıcaklar Geldi: Sanayi Tesislerinde Yangın Riski Tırmanıyor Akdeniz Gerçek,browser_failed,https://www.akdenizgercek.com.tr/gundem/dikkat-kavurucu-sicaklar-geldi-sanayi-tesislerinde-yangin-riski-tirmaniyor/380067,,,,,,,,il yok | ilçe yok | firma yok | faaliyet/tesis yok,,,,maps araması yapılmadı,,,77.66,2
2026-07-06 21:17:00,fabrika yangını,Fiziksel Risk / Yangın,Bursa İnegöl'de Orman Ürünleri Fabrikasında Çıkan Yangın İtfaiye Ekipleri Tarafından Hızla Kontrol Altına Alındı,Bursa İnegöl'de Orman Ürünleri Fabrikasında Çıkan Yangın İtfaiye Ekipleri Tarafından Hızla Kontrol Altına Alındı Mersin Haber,https://news.google.com/rss/articles/CBMi5wFBVV95cUxQM1RDaGlmVWZfS3ZGaVdYeGdpVkx2OEdQam5PNl8yVUVwMS0wbm1JWHY3bTNoeTZNMmgwYkJuZ1hEOWZESXRMVHJ0S0tXNGY2ZHZUR3FQMmtXU3N5dkUwdXZ1TWRmVEtKbENoZGkwcnBGQUJfSDdLdjVpbE81Y21QRHlTR1RHSW5xanBiREVRcjNRWkVENlVxamlZckpaUVZuNjJCSEo4OVU3aWRFNWFkVXVoUGo4VzRhaW5Kd0JkU1pOLUUycS10ckR3blFrdTdjaWNBcnpkNW5SOW1aSWp1cXdTSE1TbmPSAVdBVV95cUxNS0JRTkJNUGZhTi1TbnJ2SGd3VGlocEtIMWFEOVZhdWtjeU1BRGFYQ1lQVkFUZWg0UE9YQVdqdFJvR2xmeTI1UDZHdU5FOGJHd0lLZ1drekk?oc=5,fabrika,fabrika,"Mersin'den haberiniz olsun! Mersin ve ilçelerinden son dakika ve önemli haberler, gelişmeler olayları sunar. Bursa'nın İnegöl ilçesindeki bir orman ürünleri fabrikasının bahçesinde çıkan yangın, itfaiye ekiplerinin zamanında müdahalesiyle büyümeden söndürüldü. Mersin'den haberiniz olsun! Mersin ve ilçelerinden son dakika ve önemli haberler, gelişmeler olayları sunar. Bursa İnegöl'de Orman Ürünleri Fabrikasında Çıkan Yangın İtfaiye Ekipleri Tarafından Hızla Kontrol Altına Alındı Haber Merkezi • 07 Temmuz 2026 00:17 • Güncellendi: 07 Temmuz 2026 00:19 Bursa'nın İnegöl ilçesindeki bir orman ürünleri fabrikasının bahçesinde çıkan yangın, itfaiye ekiplerinin zamanında müdahalesiyle büyümeden söndürüldü. Yangın, saat 22.30 sularında meydana geldi. Bursa'nın İnegöl ilçesindeki bir orman ürünleri fabrikasının bahçesinde çıkan yangın, itfaiye ekiplerinin zamanında müdahalesiyle büyümeden söndürüldü. Yangın, saat 22.30 sularında meydana geldi. Facebook X WhatsApp 07 Temmuz 2026 00:17 Yangın, İnegöl Organize Sanayi Bölgesi 4. Cadde üzerinde bulunan orman ürünleri fabrikasının bahçesinde çıktı. Edinilen bilgilere göre, bahçede biriken ahşap atıkların henüz belirlenemeyen bir nedenden dolayı alev alması sonucu yangın başladı. Kısa sürede yükselen dumanlar, çevredeki vatandaşların dikkatini çekti ve hemen 112 Acil Çağrı Merkezi’ne ihbarda bulundular. İhbar üzerine, olay yerine çok sayıda İnegöl İtfaiyesi ekibi sevk edildi. Ekipler, yangına hızlı bir şekilde müdahale ederek alevlerin yayılmasını engelledi. Yangın, fabrikanın üretim alanına ve diğer bölümlerine ulaşmadan kontrol altına alındı. Yapılan yoğun çalışmalar sonucunda, bahçedeki ahşap atıklar zarar gördü ancak yangının daha büyük bir felakete yol açmasının önüne geçildi. Yangının çıkış sebebiyle ilgili detaylı bir inceleme başlatıldığı öğrenildi. Edirne'de 24 Düzensiz Göçmen ve Şüpheli Gözaltına Alındı Kocaeli Gölcük'te Direksiyon Hakimiyetini Kaybeden Otomobil Apartman Boşluğuna Düştü. Bursa Kaynak: Mersin Haber + IHA İlgili Haberler Yangın, İnegöl Organize Sanayi Bölgesi 4. Cadde üzerinde bulunan orman ürünleri fabrikasının bahçesinde çıktı. Edinilen bilgilere göre, bahçede biriken ahşap atıkların henüz belirlenemeyen bir nedenden dolayı alev alması sonucu yangın başladı. Kısa sürede yükselen dumanlar, çevredeki vatandaşların dikkatini çekti ve hemen 112 Acil Çağrı Merkezi’ne ihbarda bulundular. İhbar üzerine, olay yerine çok sayıda İnegöl İtfaiyesi ekibi sevk edildi. Ekipler, yangına hızlı bir şekilde müdahale ederek alevlerin yayılmasını engelledi. Yangın, fabrikanın üretim alanına ve diğer bölümlerine ulaşmadan kontrol altına alındı. Yapılan yoğun çalışmalar sonucunda, bahçedeki ahşap atıklar zarar gördü ancak yangının daha büyük bir felakete yol açmasının önüne geçildi. Yangının çıkış sebebiyle ilgili detaylı bir inceleme başlatıldığı öğrenildi. Bursa İnegöl'de Orman Ürünleri Fabrikasında Çıkan Yangın İtfaiye Ekipleri Tarafından Hızla Kontrol Altına Alındı Haber Merkezi • 07 Temmuz 2026 00:17 • Güncellendi: 07 Temmuz 2026 00:19 Bursa'nın İnegöl ilçesindeki bir orman ürünleri fabrikasının bahçesinde çıkan yangın, itfaiye ekiplerinin zamanında müdahalesiyle büyümeden söndürüldü. Yangın, saat 22.30 sularında meydana geldi. Haber Merkezi • 07 Temmuz 2026 00:17 • Güncellendi: 07 Temmuz 2026 00:19 Bursa'nın İnegöl ilçesindeki bir orman ürünleri fabrikasının bahçesinde çıkan yangın, itfaiye ekiplerinin zamanında müdahalesiyle büyümeden söndürüldü. Yangın, saat 22.30 sularında meydana geldi. Bursa İnegöl'de Orman Ürünleri Fabrikasında Çıkan Yangın İtfaiye Ekipleri Tarafından Hızla Kontrol Altına Alındı Yangın, İnegöl Organize Sanayi Bölgesi 4. Cadde üzerinde bulunan orman ürünleri fabrikasının bahçesinde çıktı. Edinilen bilgilere göre, bahçede biriken ahşap atıkların henüz belirlenemeyen bir nedenden dolayı alev alması sonucu yangın başladı. Kısa sürede yükselen dumanlar, çevredeki vatandaşların dikkatini çekti ve hemen 112 Acil Çağrı Merkezi’ne ihbarda bulundular. İhbar üzerine, olay yerine çok sayıda İnegöl İtfaiyesi ekibi sevk edildi. Ekipler, yangına hızlı bir şekilde müdahale ederek alevlerin yayılmasını engelledi. Yangın, fabrikanın üretim alanına ve diğer bölümlerine ulaşmadan kontrol altına alındı. Yapılan yoğun çalışmalar sonucunda, bahçedeki ahşap atıklar zarar gördü ancak yangının daha büyük bir felakete yol açmasının önüne geçildi. Yangının çıkış sebebiyle ilgili detaylı bir inceleme başlatıldığı öğrenildi.","Bursa İnegöl'de Orman Ürünleri Fabrikasında Çıkan Yangın İtfaiye Ekipleri Tarafından Hızla Kontrol Altına Alındı Bursa İnegöl'de Orman Ürünleri Fabrikasında Çıkan Yangın İtfaiye Ekipleri Tarafından Hızla Kontrol Altına Alındı Mersin Haber Mersin'den haberiniz olsun! Bursa'nın İnegöl ilçesindeki bir orman ürünleri fabrikasının bahçesinde çıkan yangın, itfaiye ekiplerinin zamanında müdahalesiyle büyümeden söndürüldü. Bursa İnegöl'de Orman Ürünleri Fabrikasında Çıkan Yangın İtfaiye Ekipleri Tarafından Hızla Kontrol Altına Alındı Haber Merkezi • 07 Temmuz 2026 00:17 • Güncellendi: 07 Temmuz 2026 00:19 Bursa'nın İnegöl ilçesindeki bir orman ürünleri fabrikasının bahçesinde çıkan yangın, itfaiye ekiplerinin zamanında müdahalesiyle büyümeden söndürüldü. Yangın, saat 22.30 sularında meydana geldi. Facebook X WhatsApp 07 Temmuz 2026 00:17 Yangın, İnegöl Organize Sanayi Bölgesi 4. Cadde üzerinde bulunan orman ürünleri fabrikasının bahçesinde çıktı. Edinilen bilgilere göre, bahçede biriken ahşap atıkların henüz belirlenemeyen bir nedenden dolayı alev alması sonucu yangın başladı. Kısa sürede yükselen dumanlar, çevredeki vatandaşların dikkatini çekti ve hemen 112 Acil Çağrı Merkezi’ne ihbarda bulundular. İhbar üzerine, olay yerine çok sayıda İnegöl İtfaiyesi ekibi sevk edildi. Ekipler, yangına hızlı bir şekilde müdahale ederek alevlerin yayılmasını engelledi. Yangın, fabrikanın üretim alanına ve diğer bölümlerine ulaşmadan kontrol altına alındı. Yapılan yoğun çalışmalar sonucunda, bahçedeki ahşap atıklar zarar gördü ancak yangının daha büyük bir felakete yol açmasının önüne geçildi. Yangının çıkış sebebiyle ilgili detaylı bir inceleme başlatıldığı öğrenildi. Edirne'de 24 Düzensiz Göçmen ve Şüpheli Gözaltına Alındı Kocaeli Gölcük'te Direksiyon Hakimiyetini Kaybeden Otomobil Apartman Boşluğuna Düştü. Bursa Kaynak: Mersin Haber + IHA İlgili Haberler Yangın, İnegöl Organize Sanayi Bölgesi 4. Haber Merkezi • 07 Temmuz 2026 00:17 • Güncellendi: 07 Temmuz 2026 00:19 Bursa'nın İnegöl ilçesindeki bir orman ürünleri fabrikasının bahçesinde çıkan yangın, itfaiye ekiplerinin zamanında müdahalesiyle büyümeden söndürüldü. Bursa İnegöl'de Orman Ürünleri Fabrikasında Çıkan Yangın İtfaiye Ekipleri Tarafından Hızla Kontrol Altına Alındı Yangın, İnegöl Organize Sanayi Bölgesi 4.",browser_full_article,https://www.mersinhaber.com/haber-bursa-inegolde-orman-urunleri-fabrikasinda-cikan-yangin-itfaiye-ekipleri-tarafindan-hizla-kontrol-altina-alindi/696539,Bursa | Edirne | Mersin | Kocaeli,İnegöl | Gölcük,İnegöl Organize Sanayi,,,,,firma yok | faaliyet/tesis yok,,,,maps araması yapılmadı,,,168.25,3
