published,search_term,category,title,summary,link,matched_words,activity_type,raw_text,entity_source_text,article_fetch_status,resolved_article_url,city_candidates,district_candidates,neighborhood_candidates,street_candidates,facility_candidates,company_candidates,company_candidate_scores,entity_quality_note,maps_queries,maps_candidates,maps_best_guess,maps_status,maps_match_scores,maps_rejected_candidates,record_quality_score,duplicate_group_id
2026-07-06 06:58:00,konkordato,İflas / Konkordato / Mali Sorun,Dünyaca ünlü markalara üretim yapan İzmirli tekstil devi konkordato istedi,Dünyaca ünlü markalara üretim yapan İzmirli tekstil devi konkordato istedi Yenigün Gazetesi,https://news.google.com/rss/articles/CBMivwFBVV95cUxPcFBCWHB0MzlaeDJRNXhSSU40ZHB6dUY2ZXJnenBqeEh0N2JqVU9QNXJ1RVJFYTRFTFR0b2R2aEtHQkwtQkU3eWRKcnJOcExWVl8yaDlzZjRUdS1rVGo3U1dDR2M1S01vSDhqTTlZak9qcEZtSE5TOXdHX3Axbnp1YkNlU19pLWQ2Z1hpMFdXOTVlaEMyLTNsbFhFTm9yZF92RGMzWnVHcnk3YTJRVG9MVGNBY1NrTkpFTE45eEJmUdIBxAFBVV95cUxPTWs4SkRob1dnNlFIeElSaE4xdVJEVHE0TU4wMWgySGNrdUhNM0FFTXlEYU9DYzliTTFEaTI0RDlFNkJSX0NMQmVnS2dtdEFrUHZPMUxaOGhIbEN3VW5oQU16WEtLSmdsNkE1QkFad21jMl9IM0E5dkpQMzIxVVpGSHlMS2w1dmtsbEt5RW1ZRVV3ZVdmU25teVRqTHpGMC1kc05oamRvU2JIMVR3VHMyeDdpazI4M0hpRnZQdlBGZk9NYm9x?oc=5,"tekstil, üretim",üretim tesisi,"Ekonomik krizin etkileri tekstil sektöründe de etkisini gösteriyor. İzmir'de faaliyet gösteren ve Armani, Versace, Kiğılı ile Paulmark gibi markalara fason üretim yapan Sir Hazır Giyim Tekstil, konkordato başvurusunda bulundu. Mahkeme şirkete 3 aylık geçici mühlet verdi. Ekonomik krizin etkileri tekstil sektöründe de etkisini gösteriyor. İzmir'de faaliyet gösteren ve Armani, Versace, Kiğılı ile Paulmark gibi markalara fason üret... Ekonomik krizin etkileri tekstil sektöründe de etkisini gösteriyor. İzmir'de faaliyet gösteren ve Armani, Versace, Kiğılı ile Paulmark gibi markalara fason üretim yapan Sir Hazır Giyim Tekstil, konkordato başvurusunda bulundu. Mahkeme şirkete 3 aylık geçici mühlet verdi. Türkiye'de son dönemde artan maliyetler, kurdaki dalgalanmalar ve ekonomik belirsizlikler birçok firmayı finansal açıdan zorlarken, konkordato başvurularına bir yenisi daha eklendi. İzmir'in köklü tekstil firmalarından Sir Hazır Giyim Tekstil Sanayi ve Ticaret Limited Şirketi, mali sıkıntılar nedeniyle konkordato talebinde bulundu. Mahkemeden 3 aylık geçici mühlet kararı İzmir 2. Asliye Ticaret Mahkemesi, şirketin başvurusunu değerlendirerek 3 ay süreyle geçici mühlet kararı verdi. Mahkeme ayrıca konkordato sürecini yürütmek üzere serbest muhasebeci mali müşavir Dilek Turan Ertaşkın ile hukukçu Yaşar Can Göksoy'u konkordato komiseri olarak görevlendirdi. Dünyaca ünlü markalara fason üretim yapıyor 1967 yılında kurulan Sir Hazır Giyim, İzmir'in Gaziemir ilçesine bağlı Sarnıç'taki üretim tesisiinde faaliyet gösteriyor. Firma; Kiğılı, Armani, Versace ve Paulmark başta olmak üzere çok sayıda yerli ve yabancı markaya fason üretim gerçekleştiriyor. Şirket, ceket, takım elbise, trençkot, mont ve kaban üretiminin yanı sıra sezon trendlerine yönelik özel koleksiyonlar da hazırlıyor. 530 çalışanı bulunuyor 2013 yılında Gaziemir'de 9 bin metrekarelik üretim tesisini hizmete açan Sir Hazır Giyim'in yaklaşık 530 çalışanı bulunuyor. Yıllık 390 bin adet üretim kapasitesine sahip olan şirket, uzun yıllardır hazır giyim ve tekstil sektöründe faaliyet gösteriyor. Konkordato sürecinin nasıl ilerleyeceği ve şirketin faaliyetlerini nasıl etkileyeceği ise mahkeme tarafından yürütülecek yargılama sürecinde netleşecek Kaynak: Haber Merkezi Dünyaca ünlü markalara üretim yapan İzmirli tekstil devi konkordato istedi Mahkemeden 3 aylık geçici mühlet kararı Dünyaca ünlü markalara fason üretim yapıyor Ekonomik krizin etkileri tekstil sektöründe de etkisini gösteriyor. İzmir'de faaliyet gösteren ve Armani, Versace, Kiğılı ile Paulmark gibi markalara fason üretim yapan Sir Hazır Giyim Tekstil, konkordato başvurusunda bulundu. Mahkeme şirkete 3 aylık geçici mühlet verdi. Türkiye'de son dönemde artan maliyetler, kurdaki dalgalanmalar ve ekonomik belirsizlikler birçok firmayı finansal açıdan zorlarken, konkordato başvurularına bir yenisi daha eklendi. İzmir'in köklü tekstil firmalarından Sir Hazır Giyim Tekstil Sanayi ve Ticaret Limited Şirketi, mali sıkıntılar nedeniyle konkordato talebinde bulundu. İzmir 2. Asliye Ticaret Mahkemesi, şirketin başvurusunu değerlendirerek 3 ay süreyle geçici mühlet kararı verdi. Mahkeme ayrıca konkordato sürecini yürütmek üzere serbest muhasebeci mali müşavir Dilek Turan Ertaşkın ile hukukçu Yaşar Can Göksoy'u konkordato komiseri olarak görevlendirdi. 1967 yılında kurulan Sir Hazır Giyim, İzmir'in Gaziemir ilçesine bağlı Sarnıç'taki üretim tesisiinde faaliyet gösteriyor. Firma; Kiğılı, Armani, Versace ve Paulmark başta olmak üzere çok sayıda yerli ve yabancı markaya fason üretim gerçekleştiriyor. Şirket, ceket, takım elbise, trençkot, mont ve kaban üretiminin yanı sıra sezon trendlerine yönelik özel koleksiyonlar da hazırlıyor. 2013 yılında Gaziemir'de 9 bin metrekarelik üretim tesisini hizmete açan Sir Hazır Giyim'in yaklaşık 530 çalışanı bulunuyor. Yıllık 390 bin adet üretim kapasitesine sahip olan şirket, uzun yıllardır hazır giyim ve tekstil sektöründe faaliyet gösteriyor. Konkordato sürecinin nasıl ilerleyeceği ve şirketin faaliyetlerini nasıl etkileyeceği ise mahkeme tarafından yürütülecek yargılama sürecinde netleşecek 06 Tem 2026 - 09:58 İzmir - İzmir Güncel Haberler Yazdır Yorum yazarak Gazete Yenigün Topluluk Kuralları’nı kabul etmiş bulunuyor ve yorumunuzla ilgili doğrudan veya dolaylı tüm sorumluluğu tek başınıza üstleniyorsunuz. Yazılan yorumlardan G","Dünyaca ünlü markalara üretim yapan İzmirli tekstil devi konkordato istedi Dünyaca ünlü markalara üretim yapan İzmirli tekstil devi konkordato istedi Yenigün Gazetesi Ekonomik krizin etkileri tekstil sektöründe de etkisini gösteriyor. İzmir'de faaliyet gösteren ve Armani, Versace, Kiğılı ile Paulmark gibi markalara fason üretim yapan Sir Hazır Giyim Tekstil, konkordato başvurusunda bulundu. Mahkeme şirkete 3 aylık geçici mühlet verdi. İzmir'de faaliyet gösteren ve Armani, Versace, Kiğılı ile Paulmark gibi markalara fason üret... Türkiye'de son dönemde artan maliyetler, kurdaki dalgalanmalar ve ekonomik belirsizlikler birçok firmayı finansal açıdan zorlarken, konkordato başvurularına bir yenisi daha eklendi. İzmir'in köklü tekstil firmalarından Sir Hazır Giyim Tekstil Sanayi ve Ticaret Limited Şirketi, mali sıkıntılar nedeniyle konkordato talebinde bulundu. Mahkemeden 3 aylık geçici mühlet kararı İzmir 2. Asliye Ticaret Mahkemesi, şirketin başvurusunu değerlendirerek 3 ay süreyle geçici mühlet kararı verdi. Mahkeme ayrıca konkordato sürecini yürütmek üzere serbest muhasebeci mali müşavir Dilek Turan Ertaşkın ile hukukçu Yaşar Can Göksoy'u konkordato komiseri olarak görevlendirdi. Dünyaca ünlü markalara fason üretim yapıyor 1967 yılında kurulan Sir Hazır Giyim, İzmir'in Gaziemir ilçesine bağlı Sarnıç'taki üretim tesisiinde faaliyet gösteriyor. Firma; Kiğılı, Armani, Versace ve Paulmark başta olmak üzere çok sayıda yerli ve yabancı markaya fason üretim gerçekleştiriyor. Şirket, ceket, takım elbise, trençkot, mont ve kaban üretiminin yanı sıra sezon trendlerine yönelik özel koleksiyonlar da hazırlıyor. 530 çalışanı bulunuyor 2013 yılında Gaziemir'de 9 bin metrekarelik üretim tesisini hizmete açan Sir Hazır Giyim'in yaklaşık 530 çalışanı bulunuyor. Yıllık 390 bin adet üretim kapasitesine sahip olan şirket, uzun yıllardır hazır giyim ve tekstil sektöründe faaliyet gösteriyor. Konkordato sürecinin nasıl ilerleyeceği ve şirketin faaliyetlerini nasıl etkileyeceği ise mahkeme tarafından yürütülecek yargılama sürecinde netleşecek Kaynak: Haber Merkezi Dünyaca ünlü markalara üretim yapan İzmirli tekstil devi konkordato istedi Mahkemeden 3 aylık geçici mühlet kararı Dünyaca ünlü markalara fason üretim yapıyor Ekonomik krizin etkileri tekstil sektöründe de etkisini gösteriyor. 1967 yılında kurulan Sir Hazır Giyim, İzmir'in Gaziemir ilçesine bağlı Sarnıç'taki üretim tesisiinde faaliyet gösteriyor. 2013 yılında Gaziemir'de 9 bin metrekarelik üretim tesisini hizmete açan Sir Hazır Giyim'in yaklaşık 530 çalışanı bulunuyor. Konkordato sürecinin nasıl ilerleyeceği ve şirketin faaliyetlerini nasıl etkileyeceği ise mahkeme tarafından yürütülecek yargılama sürecinde netleşecek 06 Tem 2026 - 09:58 İzmir - İzmir Güncel Haberler Yazdır Yorum yazarak Gazete Yenigün Topluluk Kuralları’nı kabul etmiş bulunuyor ve yorumunuzla ilgili doğrudan veya dolaylı tüm sorumluluğu tek başınıza üstleniyorsunuz.",browser_full_article,https://www.gazeteyenigun.com.tr/haber/28291381/dunyaca-unlu-markalara-uretim-yapan-izmirli-tekstil-devi-konkordato-istedi,İzmir,Gaziemir,,,,,,firma yok | faaliyet/tesis yok,,,,maps araması yapılmadı,,,118.75,25
2026-07-06 06:07:00,konkordato,İflas / Konkordato / Mali Sorun,Bursa'da 3 şirket ve bir kişi için konkordato süresi uzatıldı! Mahkemeden yeni karar,Bursa'da 3 şirket ve bir kişi için konkordato süresi uzatıldı! Mahkemeden yeni karar Bursada Bugün,https://news.google.com/rss/articles/CBMiywFBVV95cUxOTklvTGdZWkgxMjFzZE1NSEhsMk9pTUV3T2QzTE5QNmp4endIS1pGMDVxb1pza0tPLXo5TXlMYXJmc0g4S0FSNjBBa3NPX2ltdTlQWGhFQk5IZUt2ZFJCNzh0SEIwRmRZb0lEc05kVllON0dTMnhRWVBYWURCQ0Q2cnV6TVdYM21DT3NYUTBnNVE0dkNUb1B1TC15X3NDaExhcVBZV1h2bkpheDdOVUN0QTFYN0k2eXJiUUhWdFJIaWJwajMta3J3ZzhWUdIBzgFBVV95cUxNblVzRnFqY1ZQaUh4Szg0d0ltUXVrajZxLUVZOTRMNTZ1Q2lnWExJNm1yNE0wR3R0MVJ0a3JIalRBQzFsaDRDeWJ2UjY1N1BLMFh5UW93Q2tGV2ViVmcyVVJWWF9udkxWek9NLTMzQ3BCRndnOUxscU1obmlmS19hOU45OEhWMDRkN1JzQnl6a0tjMC1QRGlOZVdBMjFiMHRhTUZ0Q2pQM3BWLVg1aFhfRzFsM2hFTWo4ZWVtd1kyM2pFWVhWLXV0a1FjNDZrQQ?oc=5,şirket,şirket / firma,"Konkordato dosyasında mahkeme, inşaat, yapı malzemeleri ve kimya şirketlerine geçici mühlet uzattı. Şirketler yasal koruma altında faaliyetini sürdürürken, sonuç ağustostaki duruşmada belli olacak. Konkordato dosyasında mahkeme, inşaat, yapı malzemeleri ve kimya şirketlerine geçici mühlet uzattı. Şirketler yasal koruma altında faaliyetini sürdürürken, sonuç ağustostaki duruşmada belli olacak. Konkordato dosyasında mahkeme, inşaat, yapı malzemeleri ve kimya şirketlerine geçici mühlet uzattı. Şirketler yasal koruma altında faaliyetini sürdürürken, sonuç ağustostaki duruşmada belli olacak. Bursa'da 3 şirket ve bir kişi için konkordato süresi uzatıldı! Mahkemeden yeni karar Geçici Konkordato Mühleti İki Ay Daha Uzatıldı Koruma Tedbirleri Geçerliliğini Sürdürüyor Komiser Heyeti Görevine Devam Edecek Yeni Duruşma Tarihi Belli Oldu Konkordato Süreci Yakından Takip Ediliyor Konkordato dosyasında mahkeme, inşaat, yapı malzemeleri ve kimya şirketlerine geçici mühlet uzattı. Şirketler yasal koruma altında faaliyetini sürdürürken, sonuç ağustostaki duruşmada belli olacak. Bursa'da konkordato süreci devam eden üç şirket ve bir gerçek kişi hakkında önemli bir yargı kararı alındı. Bursa 3. Asliye Ticaret Mahkemesi, daha önce verilen geçici konkordato mühletinin uzatılmasına hükmederken, mevcut koruma tedbirlerinin de aynı şekilde uygulanmaya devam edeceğini açıkladı. Kararla birlikte dosyada görev yapan konkordato komiser heyetinin çalışmaları sürerken, sürecin geleceğini belirleyecek yeni duruşma tarihi de netleşti. Mahkemenin 2026/57 esas sayılı dosyasında görülen konkordato davasında, Dekopol Kimya İnşaat İnşaat Malzemeleri Mimarlık Mühendislik Nakliye Emlak Turizm Sanayi ve Ticaret Ltd. Şti., Poldek İnşaat Dekorasyon Kimya Nakliye Mobilya Tekstil Turizm Gıda Sanayi ve Ticaret Ltd. Şti., Stroform Yapı Malzemeleri Sanayi Ticaret Ltd. Şti. ile K. B. hakkında daha önce verilen üç aylık geçici mühlet yeniden değerlendirildi. Mahkeme, 2 Nisan 2026 tarihli ara kararla başlatılan geçici konkordato süresinin 1 Temmuz 2026 tarihinden itibaren iki ay daha uzatılmasına karar verdi. Böylece borçlular hakkındaki konkordato koruması belirlenen yeni süre boyunca devam edecek. Mahkeme kararına göre, geçici mühlet kapsamında uygulanan tüm hukuki koruma tedbirleri de yürürlükte kalacak. Bu kapsamda borçlular hakkında kamu alacakları dahil olmak üzere yeni icra takibi başlatılamayacak, devam eden takip işlemleri ilerletilemeyecek ve ihtiyati haciz ile ihtiyati tedbir kararları uygulanamayacak. Ayrıca konkordato süreci boyunca borçluların mal varlığını korumaya yönelik tedbirler de devam edecek. Mahkeme, bu uygulamaların ilgili mevzuat hükümleri doğrultusunda kesin mühletin sonuçlarını doğuracak şekilde sürdürüleceğini belirtti. Geçici mühlet süresinin uzatılmasıyla birlikte dosyada daha önce görevlendirilen konkordato komiser heyetinin görevinde herhangi bir değişiklik yapılmadı. Komiserler, şirketlerin mali durumunu izlemeye ve konkordato sürecini denetlemeye devam edecek. Hazırlanacak raporlar ve yapılacak incelemeler doğrultusunda mahkeme, ilerleyen süreçte konkordato talebine ilişkin nihai değerlendirmesini gerçekleştirecek. Geçici mühlet süresinin uzatılması kararının ardından davanın bir sonraki duruşmasının 21 Ağustos 2026 Cuma günü saat 13.40'ta yapılmasına hükmedildi. Duruşma, Bursa 3. Asliye Ticaret Mahkemesi'nin B Blok ikinci kattaki duruşma salonunda görülecek. Bu duruşmada konkordato sürecinin geldiği aşama, komiser heyetinin raporları ve tarafların talepleri değerlendirilerek dosyanın geleceğine ilişkin yeni kararların alınması bekleniyor. İnşaat, yapı malzemeleri ve kimya sektörlerinde faaliyet gösteren şirketleri kapsayan dosyada alınan süre uzatma kararı, hem alacaklılar hem de ticari faaliyetlerini sürdüren işletmeler açısından önem taşıyor. Mahkemenin verdiği geçici mühlet uzatma kararıyla birlikte şirketler faaliyetlerini yasal koruma altında sürdürmeye devam ederken, konkordato sürecinin nasıl sonuçlanacağı ise ağustos ayında yapılacak duruşmanın ardından daha netlik kazanacak. Diğer Bursa Haberleri - Bölge Haberleri için tıklayın Rekor trafik cezası yediği gün canına kıydı! Trump'ın Ankara'da kalacağı otelin karşısına bakın ne astılar! Bursa'da sahil trafiğine büyük düzenleme! O güzergah araçlara kapanıyor Bursa'da binlerce çalışanı olan tekstil devinde işçiler grev başlattı! Bursalılar dikkat! Otobüs güzergahlarına revizyon... Kredi kartı kullananlar aman dikkat! Bu adımı atlayanlar yandı","Bursa'da 3 şirket ve bir kişi için konkordato süresi uzatıldı! Mahkemeden yeni karar Bursa'da 3 şirket ve bir kişi için konkordato süresi uzatıldı! Mahkemeden yeni karar Bursada Bugün Konkordato dosyasında mahkeme, inşaat, yapı malzemeleri ve kimya şirketlerine geçici mühlet uzattı. Şirketler yasal koruma altında faaliyetini sürdürürken, sonuç ağustostaki duruşmada belli olacak. Bursa'da 3 şirket ve bir kişi için konkordato süresi uzatıldı! Mahkemeden yeni karar Geçici Konkordato Mühleti İki Ay Daha Uzatıldı Koruma Tedbirleri Geçerliliğini Sürdürüyor Komiser Heyeti Görevine Devam Edecek Yeni Duruşma Tarihi Belli Oldu Konkordato Süreci Yakından Takip Ediliyor Konkordato dosyasında mahkeme, inşaat, yapı malzemeleri ve kimya şirketlerine geçici mühlet uzattı. Bursa'da konkordato süreci devam eden üç şirket ve bir gerçek kişi hakkında önemli bir yargı kararı alındı. Asliye Ticaret Mahkemesi, daha önce verilen geçici konkordato mühletinin uzatılmasına hükmederken, mevcut koruma tedbirlerinin de aynı şekilde uygulanmaya devam edeceğini açıkladı. Kararla birlikte dosyada görev yapan konkordato komiser heyetinin çalışmaları sürerken, sürecin geleceğini belirleyecek yeni duruşma tarihi de netleşti. Mahkemenin 2026/57 esas sayılı dosyasında görülen konkordato davasında, Dekopol Kimya İnşaat İnşaat Malzemeleri Mimarlık Mühendislik Nakliye Emlak Turizm Sanayi ve Ticaret Ltd. Şti., Poldek İnşaat Dekorasyon Kimya Nakliye Mobilya Tekstil Turizm Gıda Sanayi ve Ticaret Ltd. Şti., Stroform Yapı Malzemeleri Sanayi Ticaret Ltd. Şti. ile K. Mahkeme, 2 Nisan 2026 tarihli ara kararla başlatılan geçici konkordato süresinin 1 Temmuz 2026 tarihinden itibaren iki ay daha uzatılmasına karar verdi. Böylece borçlular hakkındaki konkordato koruması belirlenen yeni süre boyunca devam edecek. Ayrıca konkordato süreci boyunca borçluların mal varlığını korumaya yönelik tedbirler de devam edecek. Geçici mühlet süresinin uzatılmasıyla birlikte dosyada daha önce görevlendirilen konkordato komiser heyetinin görevinde herhangi bir değişiklik yapılmadı. Komiserler, şirketlerin mali durumunu izlemeye ve konkordato sürecini denetlemeye devam edecek. Hazırlanacak raporlar ve yapılacak incelemeler doğrultusunda mahkeme, ilerleyen süreçte konkordato talebine ilişkin nihai değerlendirmesini gerçekleştirecek. Asliye Ticaret Mahkemesi'nin B Blok ikinci kattaki duruşma salonunda görülecek. Bu duruşmada konkordato sürecinin geldiği aşama, komiser heyetinin raporları ve tarafların talepleri değerlendirilerek dosyanın geleceğine ilişkin yeni kararların alınması bekleniyor. İnşaat, yapı malzemeleri ve kimya sektörlerinde faaliyet gösteren şirketleri kapsayan dosyada alınan süre uzatma kararı, hem alacaklılar hem de ticari faaliyetlerini sürdüren işletmeler açısından önem taşıyor. Mahkemenin verdiği geçici mühlet uzatma kararıyla birlikte şirketler faaliyetlerini yasal koruma altında sürdürmeye devam ederken, konkordato sürecinin nasıl sonuçlanacağı ise ağustos ayında yapılacak duruşmanın ardından daha netlik kazanacak. Diğer Bursa Haberleri - Bölge Haberleri için tıklayın Rekor trafik cezası yediği gün canına kıydı! Trump'ın Ankara'da kalacağı otelin karşısına bakın ne astılar! Bursa'da sahil trafiğine büyük düzenleme! O güzergah araçlara kapanıyor Bursa'da binlerce çalışanı olan tekstil devinde işçiler grev başlattı!",browser_full_article,https://www.bursadabugun.com/haber/bursa-da-3-sirket-ve-bir-kisi-icin-konkordato-suresi-uzatildi-mahkemeden-yeni-karar-1933440.html,Ankara | Bursa,,,,,Stroform Yapı Malzemeleri Sanayi Ticaret Ltd. Şti,Stroform Yapı Malzemeleri Sanayi Ticaret Ltd. Şti:104:body | Stroform Yapı Malzemeleri Sanayi Ticaret Ltd. Şti:raw_legal,ilçe yok | faaliyet/tesis yok,Stroform Yapı Malzemeleri Sanayi Ticaret Ltd. Şti Ankara Türkiye,FP İnşaat Malzemeleri Petrol Ürn. San. Tic. Ltd. Şti | Stropol Yapı Mal.Dek.San ve Tic.Ltd.Şti | Nil Tiritoğlu İnşaat ve Malzemeleri,FP İnşaat Malzemeleri Petrol Ürn. San. Tic. Ltd. Şti,firma adı + güvenli maps adayı var,65.97938144329896 | 71.26436781609195 | 57.142857142857146,Europiyer | Strofox Cnc Strafor Kesim,194.3,26
2026-07-06 05:46:20,konkordato,İflas / Konkordato / Mali Sorun,Dünya devlerine üretim yapan İzmirli erkek giyim markası konkordato ilan etti,Dünya devlerine üretim yapan İzmirli erkek giyim markası konkordato ilan etti Tek Referans,https://news.google.com/rss/articles/CBMinAFBVV95cUxNUjZveXM0YU54YUdydlBqcFlYS0p4M3d3T2doem1SOUlIVW9hTks3VDdpV1RRdlJiYUdrODBmNmQ0aUxXMERlbGFhUVlwb2VTajVRX2VDalNGT19BdFNma3VxN3FldUt5RHYweEZoSlpTWXNneGl1RFpnLV9fU0tVZkt1VjRqems2alh2RnNONGlvdi1tNVVmTHhtSms?oc=5,üretim,üretim tesisi,Dünya devlerine üretim yapan İzmirli erkek giyim markası konkordato ilan etti Tek Referans,Dünya devlerine üretim yapan İzmirli erkek giyim markası konkordato ilan etti Dünya devlerine üretim yapan İzmirli erkek giyim markası konkordato ilan etti Tek Referans Dünya devlerine üretim yapan İzmirli erkek giyim markası konkordato ilan etti Tek Referans,browser_failed,https://news.google.com/rss/articles/CBMinAFBVV95cUxNUjZveXM0YU54YUdydlBqcFlYS0p4M3d3T2doem1SOUlIVW9hTks3VDdpV1RRdlJiYUdrODBmNmQ0aUxXMERlbGFhUVlwb2VTajVRX2VDalNGT19BdFNma3VxN3FldUt5RHYweEZoSlpTWXNneGl1RFpnLV9fU0tVZkt1VjRqems2alh2RnNONGlvdi1tNVVmTHhtSms?oc=5&hl=tr&gl=TR&ceid=TR:tr,,,,,,,,il yok | ilçe yok | firma yok | faaliyet/tesis yok,,,,maps araması yapılmadı,,,77.9,27
2026-07-06 07:23:23,konkordato,İflas / Konkordato / Mali Sorun,İzmirli tekstil firması için konkordato kararı,İzmirli tekstil firması için konkordato kararı İlkses Gazetesi,https://news.google.com/rss/articles/CBMiiwFBVV95cUxQZ243N2ItdldEYjBzSHpEeWtwQl9fRUFXbllXZ3NuSEI4OFFyWGVSTHN0ZFNwdXc3MU83ZFl5U2pGSzJXZXNqZ1FPNms5dzRpQzZRMjRkWDR6akxRenZRX1FaQWViQzVEbFNqOWlaVXFWaHdIVU9GTVZkdVk1bGxhOHludlBWckdRQjhR0gGQAUFVX3lxTE9jX3R6a0xVcEtHY3JNWGNhcXRDcUE4Mld3b0xaOW1uSi1raGRMTndaN0wwdkpvR2otbENEZTFiSDMtRUp3cVFXa05weG4ycl9Ha0wzQl9RNndpNHNOcnpGbllZaDBFZjNtWnFid1lWaHRNblFUazRZc3p4REl3a0pMS3F3ZGxoSjhmalRiUVhMUg?oc=5,"firma, tekstil",şirket / firma,İzmirli tekstil firması için konkordato kararı İlkses Gazetesi,İzmirli tekstil firması için konkordato kararı İzmirli tekstil firması için konkordato kararı İlkses Gazetesi İzmirli tekstil firması için konkordato kararı İlkses Gazetesi,browser_failed,https://news.google.com/rss/articles/CBMiiwFBVV95cUxQZ243N2ItdldEYjBzSHpEeWtwQl9fRUFXbllXZ3NuSEI4OFFyWGVSTHN0ZFNwdXc3MU83ZFl5U2pGSzJXZXNqZ1FPNms5dzRpQzZRMjRkWDR6akxRenZRX1FaQWViQzVEbFNqOWlaVXFWaHdIVU9GTVZkdVk1bGxhOHludlBWckdRQjhR0gGQAUFVX3lxTE9jX3R6a0xVcEtHY3JNWGNhcXRDcUE4Mld3b0xaOW1uSi1raGRMTndaN0wwdkpvR2otbENEZTFiSDMtRUp3cVFXa05weG4ycl9Ha0wzQl9RNndpNHNOcnpGbllZaDBFZjNtWnFid1lWaHRNblFUazRZc3p4REl3a0pMS3F3ZGxoSjhmalRiUVhMUg?oc=5&hl=tr&gl=TR&ceid=TR:tr,,,,,,,,il yok | ilçe yok | firma yok | faaliyet/tesis yok,,,,maps araması yapılmadı,,,37.12,28
2026-07-05 19:15:47,konkordato,İflas / Konkordato / Mali Sorun,Borsa şirketiyle başlayan konkordato dalgası holdinge yayıldı,Borsa şirketiyle başlayan konkordato dalgası holdinge yayıldı ParaMedya,https://news.google.com/rss/articles/CBMipAFBVV95cUxQbmRGcC05eXVsOXFQV01mT3BvZU9CLWJZVF9YUjBpejEzNWRHeTZzaXN4UlFPSU0zNzVLQUVOLWpsMXJOU1lhWGhleGs3WUNCQmZkRUh6bFBDd0ZnSi1OaTJRM2N2TVFmVnkxOFZtbUo2cVF6Um9pMVBGN01Hd2FKODV6ZFhHZ0x1QjdFbkRUamtrUFk4S19YcG1EMnhzZm1FZkI0Q9IBqgFBVV95cUxQeU9HYTlfYXJmSlZ4dlpTNWhtcGg2dG03VFE1SGN3NHBoc1ZpWDdmZ2I2MG9jZ2ZDYWR4WWNZbS1EVTJlWVB1TDFMNzRmNE5nRV9jSk5oNEQxbFV1WV9NUmtzSDY5T0NMWDlPaVNJeldrOGJ5dmg3bWxJOElpTHc1QTJNVmIxcXNvdUsxRjlXSF9MZG9jVXhXQURuV1NsUjZUZ0tWc0g4MWk4Zw?oc=5,"holding, şirket",şirket / firma,"www.paramedya.com Güvenlik doğrulaması yapılıyor Bu web sitesi, kötü niyetli botlara karşı korunmak için bir güvenlik hizmeti kullanıyor. Web sitesi bir bot olmadığınızı doğrularken bu sayfa görüntülenir. Doğrulama başarılı. www.paramedya.com adresinin yanıt vermesi bekleniyor Güvenlik doğrulaması yapılıyor Doğrulama başarılı. www.paramedya.com adresinin yanıt vermesi bekleniyor Bu web sitesi, kötü niyetli botlara karşı korunmak için bir güvenlik hizmeti kullanıyor. Web sitesi bir bot olmadığınızı doğrularken bu sayfa görüntülenir.","Borsa şirketiyle başlayan konkordato dalgası holdinge yayıldı Borsa şirketiyle başlayan konkordato dalgası holdinge yayıldı ParaMedya www.paramedya.com Güvenlik doğrulaması yapılıyor Bu web sitesi, kötü niyetli botlara karşı korunmak için bir güvenlik hizmeti kullanıyor. Web sitesi bir bot olmadığınızı doğrularken bu sayfa görüntülenir. www.paramedya.com adresinin yanıt vermesi bekleniyor Güvenlik doğrulaması yapılıyor Doğrulama başarılı. www.paramedya.com adresinin yanıt vermesi bekleniyor Bu web sitesi, kötü niyetli botlara karşı korunmak için bir güvenlik hizmeti kullanıyor.",browser_full_article,https://www.paramedya.com/devami/142762/borsa-sirketiyle-baslayan-konkordato-dalgasi-holdinge-yayildi/,,,,,,,,il yok | ilçe yok | firma yok | faaliyet/tesis yok,,,,maps araması yapılmadı,,,61.62,29
