published,search_term,category,title,summary,link,matched_words,activity_type,raw_text,entity_source_text,article_fetch_status,resolved_article_url,city_candidates,district_candidates,neighborhood_candidates,street_candidates,facility_candidates,company_candidates,company_candidate_scores,entity_quality_note,maps_queries,maps_candidates,maps_best_guess,maps_status,maps_match_scores,maps_rejected_candidates,record_quality_score,duplicate_group_id
2026-07-07 10:31:00,üretim tesisi yangını,Fiziksel Risk / Yangın,Kocaeli'de Fabrika Yangını: Çok Sayıda Ekip Bölgeye Sevk Edildi,Kocaeli'de Fabrika Yangını: Çok Sayıda Ekip Bölgeye Sevk Edildi HABER 24,https://news.google.com/rss/articles/CBMilwFBVV95cUxPeUVHYXkwVzlSVHN1dlM4TC1SajQ5TXdqeXJIcHpadERzU2VNYVl6bzBiMktKNEdKZ2JPRGsyUGZ5cEJnSVVHVXpBTzhaVlNMMUd1bVJUSm1LN1E3LTJqYnY5SWJOVGtxdzJKeHN4d254bmF3a2k0dzJMYWlZcmUyU1lCNkh5S3RRYTZGNU5DXzZWY0doLWVJ0gGXAUFVX3lxTE95RUdheTBXOVJUc3V2UzhMLVJqNDlNd2p5ckhwelp0RHNTZU1hWXpvMGIyS0o0R0pnYk9EazJQZnlwQmdJVUdVekFPOFpWU0wxR3VtUlRKbUs3UTctMmpidjlJYk5Ua3F3Mkp4c3h3bnhuYXdraTR3MkxhaVlyZTJTWUI2SHlLdFFhNkY1TkNfNlZjR2gtZUk?oc=5,fabrika,fabrika,"Kocaeli'nin Körfez ilçesinde bulunan bir fabrikada çıkan yangına çok sayıda itfaiye ekibi müdahale ediyor. Kocaeli'nin Körfez ilçesinde bulunan bir fabrikada çıkan yangına çok sayıda itfaiye ekibi müdahale ediyor. Kocaeli'nin Körfez ilçesinde bulunan bir fabrikada çıkan yangına çok sayıda itfaiye ekibi müdahale ediyor. KOCAELİ Kocaeli'de Fabrika Yangını: Çok Sayıda Ekip Bölgeye Sevk Edildi Kocaeli'nin Körfez ilçesinde bulunan bir fabrikada çıkan yangına çok sayıda itfaiye ekibi müdahale ediyor. 07.07.2026 - 13:31 07.07.2026 - 13:31 Kocaeli'nin Körfez ilçesinde bulunan bir fabrikada çıkan yangın, bölgede paniğe neden oldu. Henüz belirlenemeyen bir nedenle başlayan yangının ardından yükselen yoğun duman, ilçenin birçok noktasından görüldü. İhbar üzerine olay yerine Kocaeli Büyükşehir Belediyesi İtfaiye Daire Başkanlığı ekipleri başta olmak üzere çok sayıda itfaiye, sağlık ve polis ekibi sevk edildi. Ekipler, alevlerin fabrikanın diğer bölümlerine ve çevredeki iş yerlerine sıçramaması için yoğun çalışma yürüttü. İlk belirlemelere göre yangının çıktığı fabrikanın kimyasal maddelerin bulunduğu bir üretim tesisi olduğu öğrenilirken, güvenlik önlemleri en üst seviyeye çıkarıldı. Olası patlama riskine karşı fabrikanın çevresi emniyet şeridiyle kapatıldı ve bölgedeki vatandaşların yangın alanına yaklaşmasına izin verilmedi. Yangının çıkış nedeni henüz netlik kazanmazken, ekiplerin söndürme ve soğutma çalışmaları aralıksız devam ediyor. Olayda can kaybı veya yaralanma olup olmadığına ilişkin resmi makamlardan henüz kesin bir açıklama yapılmadı. Yangının kontrol altına alınmasının ardından çıkış nedenine ilişkin detaylı inceleme başlatılacağı bildirildi. Bunl","Kocaeli'de Fabrika Yangını: Çok Sayıda Ekip Bölgeye Sevk Edildi Kocaeli'de Fabrika Yangını: Çok Sayıda Ekip Bölgeye Sevk Edildi HABER 24 Kocaeli'nin Körfez ilçesinde bulunan bir fabrikada çıkan yangına çok sayıda itfaiye ekibi müdahale ediyor. KOCAELİ Kocaeli'de Fabrika Yangını: Çok Sayıda Ekip Bölgeye Sevk Edildi Kocaeli'nin Körfez ilçesinde bulunan bir fabrikada çıkan yangına çok sayıda itfaiye ekibi müdahale ediyor. 07.07.2026 - 13:31 07.07.2026 - 13:31 Kocaeli'nin Körfez ilçesinde bulunan bir fabrikada çıkan yangın, bölgede paniğe neden oldu. Henüz belirlenemeyen bir nedenle başlayan yangının ardından yükselen yoğun duman, ilçenin birçok noktasından görüldü. İhbar üzerine olay yerine Kocaeli Büyükşehir Belediyesi İtfaiye Daire Başkanlığı ekipleri başta olmak üzere çok sayıda itfaiye, sağlık ve polis ekibi sevk edildi. Ekipler, alevlerin fabrikanın diğer bölümlerine ve çevredeki iş yerlerine sıçramaması için yoğun çalışma yürüttü. İlk belirlemelere göre yangının çıktığı fabrikanın kimyasal maddelerin bulunduğu bir üretim tesisi olduğu öğrenilirken, güvenlik önlemleri en üst seviyeye çıkarıldı. Olası patlama riskine karşı fabrikanın çevresi emniyet şeridiyle kapatıldı ve bölgedeki vatandaşların yangın alanına yaklaşmasına izin verilmedi. Yangının çıkış nedeni henüz netlik kazanmazken, ekiplerin söndürme ve soğutma çalışmaları aralıksız devam ediyor. Olayda can kaybı veya yaralanma olup olmadığına ilişkin resmi makamlardan henüz kesin bir açıklama yapılmadı. Yangının kontrol altına alınmasının ardından çıkış nedenine ilişkin detaylı inceleme başlatılacağı bildirildi.",browser_full_article,https://www.haber24.com.tr/kocaelide-fabrika-yangini-cok-sayida-ekip-bolgeye-sevk-edildi/amp,Kocaeli,Körfez,,,bir üretim tesisi,,,firma yok,bir üretim tesisi Körfez Kocaeli Türkiye,Gübretaş Yarımca Fabrikası | MCB Sanayi Ürünleri A.Ş | Tüpraş İzmit Rafinerisi | Tatparem Üretim Tesisi,Gübretaş Yarımca Fabrikası,"firma adı yok, tesis/lokasyon ile maps tahmini var",55.81395348837209 | 50.0 | 48.78048780487805 | 86.66666666666667,İGSAŞ - İstanbul Gübre Sanayii A.Ş,166.5,1
2026-07-06 12:46:26,üretim tesisi yangını,Fiziksel Risk / Yangın,Menemen’deki geri dönüşüm tesisi yangınına yoğun müdahale,Menemen’deki geri dönüşüm tesisi yangınına yoğun müdahale Anka Haber,https://news.google.com/rss/articles/CBMimgFBVV95cUxOdnN3ZGFUWmhZR0JRS2pwU1kwaHREYUJ5WHBvZEVuZzROZDZqVHA3Y2xnQ3J5RVpsTUNuSWJ1cUZmUjVpdS1QdzhvZzlJcl9MZXV4elVsNF8zc2JEdXB6YUlYOWhoVDFqZVl2enAwc3hXQmJsT1l3MVNPUG9kZEhPMHJ6RElwRzFEN1o5eWFCdkhPQVdlSXo2TXVn?oc=5,tesis,,"İzmir Büyükşehir Belediyesi İtfaiye Daire Başkanlığı, Menemen'de bir geri dönüşüm tesisinde çıkan yangını kontrol altına almak için çok sayıda araç ve personelle çalışma yürütüyor. Yangının çevredeki ev ve yapılara sıçrama riskine karşı ekipler müdahalesini sürdürüyor. İzmir Büyükşehir Belediyesi İtfaiye Daire Başkanlığı, Menemen'de bir geri dönüşüm tesisinde çıkan yangını kontrol altına almak için çok sayıda araç ve personelle çalışma yürütüyor. Yangının çevredeki ev ve yapılara sıçrama riskine karşı ekipler müdahalesini sürdürüyor. İzmir Büyükşehir Belediyesi İtfaiye Daire Başkanlığı, Menemen'de bir geri dönüşüm tesisinde çıkan yangını kontrol altına almak için çok sayıda araç ve personelle çalışma yürütüyor. Yangının çevredeki ev ve yapılara sıçrama riskine karşı ekipler müdahalesini sürdürüyor. (İZMİR) - İzmir Büyükşehir Belediyesi İtfaiye Daire Başkanlığı, Menemen'de bir geri dönüşüm tesisinde çıkan yangını kontrol altına almak için çok sayıda araç ve personelle çalışma yürütüyor. Yangının çevredeki ev ve yapılara sıçrama riskine karşı ekipler müdahalesini sürdürüyor. İzmir'in Menemen ilçesi Camiikebir Mahallesi'nde bulunan bir geri dönüşüm tesisinde saat 13.00 sıralarında yangın çıktı. Tesisten yükselen yoğun dumanı fark eden çevre sakinlerinin ihbarı üzerine İzmir Büyükşehir Belediyesi İtfaiye Dairesi Başkanlığı ekipleri olay yerine sevk edildi. Yangına 5 arazöz, 1 merdivenli araç, 2 tonaj aracı, 1 endüstriyel araç ve 1 köpük kulesi aracıyla müdahale edilirken, söndürme çalışmalarına ilçe belediyeleri de su tankerleri ve iş makineleriyle destek verdi. ALEVLERLE DÖRT KOLDAN MÜCADELE Yangının çıktığı geri dönüşüm tesisinin çevresinde evler ve çeşitli yapılar bulunması nedeniyle ekipler, alevlerin sıçrama riskine karşı geniş güvenlik önlemleri aldı. Geri dönüşüm malzemelerinin yüksek yanıcılığı nedeniyle kısa sürede büyüyen yangına, çevredeki yapılara ulaşmasını önlemek amacıyla dört koldan müdahale edildi. Tesisin farklı noktalarında eş zamanlı çalışma yürüten ekipler, söndürme çalışmalarını aralıksız sürdürüyor. Menemen’deki geri dönüşüm tesisi yangınına yoğun müdahale (İZMİR) - İzmir Büyükşehir Belediyesi İtfaiye Daire Başkanlığı, Menemen'de bir geri dönüşüm tesisinde çıkan yangını kontrol altına almak için çok sayıda araç ve personelle çalışma yürütüyor. Yangının çevredeki ev ve yapılara sıçrama riskine karşı ekipler müdahalesini sürdürüyor. İzmir'in Menemen ilçesi Camiikebir Mahallesi'nde bulunan bir geri dönüşüm tesisinde saat 13.00 sıralarında yangın çıktı. Tesisten yükselen yoğun dumanı fark eden çevre sakinlerinin ihbarı üzerine İzmir Büyükşehir Belediyesi İtfaiye Dairesi Başkanlığı ekipleri olay yerine sevk edildi. Yangına 5 arazöz, 1 merdivenli araç, 2 tonaj aracı, 1 endüstriyel araç ve 1 köpük kulesi aracıyla müdahale edilirken, söndürme çalışmalarına ilçe belediyeleri de su tankerleri ve iş makineleriyle destek verdi. ALEVLERLE DÖRT KOLDAN MÜCADELE Yangının çıktığı geri dönüşüm tesisinin çevresinde evler ve çeşitli yapılar bulunması nedeniyle ekipler, alevlerin sıçrama riskine karşı geniş güvenlik önlemleri aldı. Geri dönüşüm malzemelerinin yüksek yanıcılığı nedeniyle kısa sürede büyüyen yangına, çevredeki yapılara ulaşmasını önlemek amacıyla dört koldan müdahale edildi. Tesisin farklı noktalarında eş zamanlı çalışma yürüten ekipler, söndürme çalışmalarını aralıksız sürdürüyor.","Menemen’deki geri dönüşüm tesisi yangınına yoğun müdahale Menemen’deki geri dönüşüm tesisi yangınına yoğun müdahale Anka Haber İzmir Büyükşehir Belediyesi İtfaiye Daire Başkanlığı, Menemen'de bir geri dönüşüm tesisinde çıkan yangını kontrol altına almak için çok sayıda araç ve personelle çalışma yürütüyor. Yangının çevredeki ev ve yapılara sıçrama riskine karşı ekipler müdahalesini sürdürüyor. (İZMİR) - İzmir Büyükşehir Belediyesi İtfaiye Daire Başkanlığı, Menemen'de bir geri dönüşüm tesisinde çıkan yangını kontrol altına almak için çok sayıda araç ve personelle çalışma yürütüyor. İzmir'in Menemen ilçesi Camiikebir Mahallesi'nde bulunan bir geri dönüşüm tesisinde saat 13.00 sıralarında yangın çıktı. Tesisten yükselen yoğun dumanı fark eden çevre sakinlerinin ihbarı üzerine İzmir Büyükşehir Belediyesi İtfaiye Dairesi Başkanlığı ekipleri olay yerine sevk edildi. Yangına 5 arazöz, 1 merdivenli araç, 2 tonaj aracı, 1 endüstriyel araç ve 1 köpük kulesi aracıyla müdahale edilirken, söndürme çalışmalarına ilçe belediyeleri de su tankerleri ve iş makineleriyle destek verdi. ALEVLERLE DÖRT KOLDAN MÜCADELE Yangının çıktığı geri dönüşüm tesisinin çevresinde evler ve çeşitli yapılar bulunması nedeniyle ekipler, alevlerin sıçrama riskine karşı geniş güvenlik önlemleri aldı. Geri dönüşüm malzemelerinin yüksek yanıcılığı nedeniyle kısa sürede büyüyen yangına, çevredeki yapılara ulaşmasını önlemek amacıyla dört koldan müdahale edildi. Tesisin farklı noktalarında eş zamanlı çalışma yürüten ekipler, söndürme çalışmalarını aralıksız sürdürüyor. Menemen’deki geri dönüşüm tesisi yangınına yoğun müdahale (İZMİR) - İzmir Büyükşehir Belediyesi İtfaiye Daire Başkanlığı, Menemen'de bir geri dönüşüm tesisinde çıkan yangını kontrol altına almak için çok sayıda araç ve personelle çalışma yürütüyor.",browser_full_article,https://ankahaber.net/haber/menemen-deki-geri-donusum-tesisi-yanginina-yogun-mudahale-d2f49de1,İzmir,Menemen,in Menemen ilçesi Camiikebir Mahallesi,,deki geri dönüşüm tesisi,,,firma yok,deki geri dönüşüm tesisi in Menemen ilçesi Camiikebir Mahallesi Menemen İzmir Türkiye,"Ünsan Geri Dönüşüm Hurdacılık ve Hafriyat, Fabrika Sökümü | Sezer Geri Dönüşüm | KILIÇOĞULLARI GERİ DÖNÜŞÜM NAK.MET.İNŞ.TAAH.SAN. VE TİC. LTD. ŞT | Yiğit Geri Dönüşüm | Kılıçoğulları Geri Dönüşüm","Ünsan Geri Dönüşüm Hurdacılık ve Hafriyat, Fabrika Sökümü","firma adı yok, tesis/lokasyon ile maps tahmini var",66.66666666666666 | 80.0 | 66.66666666666666 | 80.0 | 68.0,,184.5,2
