published,search_term,category,title,summary,link,matched_words,activity_type,raw_text,entity_source_text,article_fetch_status,resolved_article_url,city_candidates,district_candidates,neighborhood_candidates,street_candidates,facility_candidates,company_candidates,company_candidate_scores,entity_quality_note,maps_queries,maps_candidates,maps_best_guess,maps_status,maps_match_scores,maps_rejected_candidates,record_quality_score,duplicate_group_id
2026-07-07 09:59:00,para aklama,Kara Para / MASAK / Bahis,Fedlan Kılıçaslan’ın Avrupa’daki bahis ağı: Polonya’daki şirketine kara para soruşturması,Fedlan Kılıçaslan’ın Avrupa’daki bahis ağı: Polonya’daki şirketine kara para soruşturması Kısa Dalga,https://news.google.com/rss/articles/CBMixgFBVV95cUxQaVF5LWFlbDdhTl9xVDJIeTJ6YTNmVVE4djRIQ20wNTBMZ0MwNG0zVjRmWXNvSm9nSUZZN2MzSEhhYmItSENRYkpBUDZJY2tuakUxUHd1Y2taaFdqejNzb3JvTnJhVWlMMDJiWnRDa2R5cGpWX1IwRWdMcDZfVVgzaFhDbGZCdW8xUFFlNURHbUxOZkQxaE9nWW1PX2d6ZHpTekFUb1RHY08wOUExd09mRnowTmdHSVFYNVFSX0tTZ3NkbUFfc3fSAcsBQVVfeXFMTWF0N0dOMklUbVNTWDJuUm93VHJFNXlWeTBmLUVtaGo0cVQ2Smp1ZnF6UU4zUlVsWnJjdk13c2dwaEs1M2NMd19sVmlXdWlTOFF4eWktSjhVZ3pqd1VxTDNuOUpacHoxTVNTdjRJQ3RtMHBiUi1LdzA2ZTVIaTJCY2VhdG5FbHRGcDRERkxDZDFISjljUE1XaGVBZ3hfVHNaNHRhQUQ5eWhRNzBxYlkwYmRDZk5OVWVpOF9XLS1aYUVlTmlIWm5CRDBSZ00?oc=5,şirket,şirket / firma,Fedlan Kılıçaslan’ın Avrupa’daki bahis ağı: Polonya’daki şirketine kara para soruşturması Kısa Dalga,Fedlan Kılıçaslan’ın Avrupa’daki bahis ağı: Polonya’daki şirketine kara para soruşturması Fedlan Kılıçaslan’ın Avrupa’daki bahis ağı: Polonya’daki şirketine kara para soruşturması Kısa Dalga Fedlan Kılıçaslan’ın Avrupa’daki bahis ağı: Polonya’daki şirketine kara para soruşturması Kısa Dalga,browser_failed,https://news.google.com/rss/articles/CBMixgFBVV95cUxQaVF5LWFlbDdhTl9xVDJIeTJ6YTNmVVE4djRIQ20wNTBMZ0MwNG0zVjRmWXNvSm9nSUZZN2MzSEhhYmItSENRYkpBUDZJY2tuakUxUHd1Y2taaFdqejNzb3JvTnJhVWlMMDJiWnRDa2R5cGpWX1IwRWdMcDZfVVgzaFhDbGZCdW8xUFFlNURHbUxOZkQxaE9nWW1PX2d6ZHpTekFUb1RHY08wOUExd09mRnowTmdHSVFYNVFSX0tTZ3NkbUFfc3fSAcsBQVVfeXFMTWF0N0dOMklUbVNTWDJuUm93VHJFNXlWeTBmLUVtaGo0cVQ2Smp1ZnF6UU4zUlVsWnJjdk13c2dwaEs1M2NMd19sVmlXdWlTOFF4eWktSjhVZ3pqd1VxTDNuOUpacHoxTVNTdjRJQ3RtMHBiUi1LdzA2ZTVIaTJCY2VhdG5FbHRGcDRERkxDZDFISjljUE1XaGVBZ3hfVHNaNHRhQUQ5eWhRNzBxYlkwYmRDZk5OVWVpOF9XLS1aYUVlTmlIWm5CRDBSZ00?oc=5&hl=tr&gl=TR&ceid=TR:tr,,,,,,,,il yok | ilçe yok | firma yok | faaliyet/tesis yok,,,,maps araması yapılmadı,,,86.5,35
2026-07-09 04:30:16,depo yangını,Fiziksel Risk / Yangın,Batman'da marketlere ait depolarda çıkan yangına müdahale ediliyor,Batman'da marketlere ait depolarda çıkan yangına müdahale ediliyor Anadolu Ajansı,https://news.google.com/rss/articles/CBMiqAFBVV95cUxNQkIwZ0dIX1hHY2FrVXhDMF9zVFU0M3dSZTlKcURxcFFrVGcwTkRSdU1yYkxoVG9kYmhNU3VaMjR2NzRzT2pyc2JhSmt0YllXb0diMjhJOHBXMy1SUnRvSDlHM3FiTnFlSm1VTllvRmlXaE50dUZjZTduSy10eTRHb3NOQk1BTkJEazZkQlpPemtyUVdBQlFKdm95TEVSRC1Na2swRW5XdXU?oc=5,depo,depo,Batman'da marketlere ait depolarda çıkan yangına müdahale ediliyor Anadolu Ajansı,Batman'da marketlere ait depolarda çıkan yangına müdahale ediliyor Batman'da marketlere ait depolarda çıkan yangına müdahale ediliyor Anadolu Ajansı Batman'da marketlere ait depolarda çıkan yangına müdahale ediliyor Anadolu Ajansı,browser_failed,https://news.google.com/rss/articles/CBMiqAFBVV95cUxNQkIwZ0dIX1hHY2FrVXhDMF9zVFU0M3dSZTlKcURxcFFrVGcwTkRSdU1yYkxoVG9kYmhNU3VaMjR2NzRzT2pyc2JhSmt0YllXb0diMjhJOHBXMy1SUnRvSDlHM3FiTnFlSm1VTllvRmlXaE50dUZjZTduSy10eTRHb3NOQk1BTkJEazZkQlpPemtyUVdBQlFKdm95TEVSRC1Na2swRW5XdXU?oc=5&hl=tr&gl=TR&ceid=TR:tr,Batman,,,,,,,ilçe yok | firma yok | faaliyet/tesis yok,,,,maps araması yapılmadı,,,80.06,36
2026-07-07 12:28:41,depo yangını,Fiziksel Risk / Yangın,Kepez’de Korkutan Yangın: İnşaat Deposu Kül Oldu,Kepez’de Korkutan Yangın: İnşaat Deposu Kül Oldu Akdeniz Gerçek,https://news.google.com/rss/articles/CBMilwFBVV95cUxQdVVCYS1uVWZHYlJVX0xrX21XNjN1OHZSbzBjWHZ3SXFuNWJSc0NKRVc3SGExN2hFVE9jTThKYVBBLW9RYkhLaVBvUGhYcnAwZjJHYnRBNWRpWm43QzZNLXF0dmhfT0ZmNVVWVHlIRmVteXh4TnVkTmk0R0N3dVpORU9oSmlLTldzV0hmVWZYZFdONUlnbmdN?oc=5,depo,depo,Kepez’de Korkutan Yangın: İnşaat Deposu Kül Oldu Akdeniz Gerçek,Kepez’de Korkutan Yangın: İnşaat Deposu Kül Oldu Kepez’de Korkutan Yangın: İnşaat Deposu Kül Oldu Akdeniz Gerçek Kepez’de Korkutan Yangın: İnşaat Deposu Kül Oldu Akdeniz Gerçek,browser_failed,https://news.google.com/rss/articles/CBMilwFBVV95cUxQdVVCYS1uVWZHYlJVX0xrX21XNjN1OHZSbzBjWHZ3SXFuNWJSc0NKRVc3SGExN2hFVE9jTThKYVBBLW9RYkhLaVBvUGhYcnAwZjJHYnRBNWRpWm43QzZNLXF0dmhfT0ZmNVVWVHlIRmVteXh4TnVkTmk0R0N3dVpORU9oSmlLTldzV0hmVWZYZFdONUlnbmdN?oc=5&hl=tr&gl=TR&ceid=TR:tr,Antalya,Kepez,,,İnşaat Deposu,,,firma yok,İnşaat Deposu Kepez Antalya Türkiye,Tile&Stone Depo | Sinerji Soğuk Hava Deposu | Özdemir iskele depo | Antalya Depo Yapı | Saraç inşaat depo,Tile&Stone Depo,"firma adı yok, tesis/lokasyon ile maps tahmini var",48.275862068965516 | 60.0 | 42.42424242424242 | 38.70967741935484 | 70.96774193548387,,142.38,37
2026-07-06 20:24:58,depo yangını,Fiziksel Risk / Yangın,Samsun'da korkutan depo yangını: Boya ve inşaat malzemeleri alev alev yandı,Samsun'da korkutan depo yangını: Boya ve inşaat malzemeleri alev alev yandı Bengü Türk,https://news.google.com/rss/articles/CBMiugFBVV95cUxNRTNIRHRELUxmMWJnVVpnWjVwSEZPY3FRZE5FUEludzBXNXhMZHRiR3ZNa1Z4U3RMSFJuaXVRU0lBQXFoX1FFQmt6Sks5ZjdrWnk0MjlwdElkRU90bWZab2l2eVZJcmdqU1NSTEIzSkxGanhIUkZoTUczRUM4Nk80aHVRMVJ5djViTGNPeUh0cjhENU5McVlIbkhDVGVWRlNQYlVHXzV5aElUdkpvTmJuam52WkZHSXJLbXfSAboBQVVfeXFMTUUzSER0RC1MZjFiZ1VaZ1o1cEhGT2NxUWRORVBJbncwVzV4TGR0Ykd2TWtWeFN0TEhSbml1UVNJQUFxaF9RRUJrekpLOWY3a1p5NDI5cHRJZEVPdG1mWm9pdnlWSXJnalNTUkxCM0pMRmp4SFJGaE1HM0VDODZPNGh1UTFSeXY1YkxjT3lIdHI4RDVOTHFZSG5IQ1RlVkZTUGJVR181eWhJVHZKb05ibmpudlpGR0lyS213?oc=5,"depo, inşaat",depo,"Samsun'un Tekkeköy ilçesinde boya ve inşaat malzemesi deposunda çıkan yangın söndürüldü. Samsun'un Tekkeköy ilçesinde boya ve inşaat malzemesi deposunda çıkan yangın söndürüldü. Samsun'da korkutan depo yangını: Boya ve inşaat malzemeleri alev alev yandı 06/07/2026 23:24 Kutay Durukan Samsun'un Tekkeköy ilçesinde boya ve inşaat malzemesi deposunda çıkan yangın söndürüldü. 23 Nisan Mahallesi Hürriyet Caddesi'nde bulunan inşaat malzemesi deposunda henüz belirlenemeyen nedenle yangın çıktı. Çevredekilerin haber vermesi üzerine olay yerine itfaiye, polis ve sağlık ekipleri sevk edildi. İtfaiye ekipleri yangını kısa sürede kontrol altına alarak söndürdü. Yangında depo kullanılamaz hale geldi. Ekiplerin soğutma çalışmaları devam ediyor. İlk yorum yazan siz olun Asayiş Haberleri 23 Nisan Mahallesi Hürriyet Caddesi'nde bulunan inşaat malzemesi deposunda henüz belirlenemeyen nedenle yangın çıktı. Çevredekilerin haber vermesi üzerine olay yerine itfaiye, polis ve sağlık ekipleri sevk edildi. İtfaiye ekipleri yangını kısa sürede kontrol altına alarak söndürdü. Yangında depo kullanılamaz hale geldi. Ekiplerin soğutma çalışmaları devam ediyor. Samsun'da korkutan depo yangını: Boya ve inşaat malzemeleri alev alev yandı 23 Nisan Mahallesi Hürriyet Caddesi'nde bulunan inşaat malzemesi deposunda henüz belirlenemeyen nedenle yangın çıktı. Çevredekilerin haber vermesi üzerine olay yerine itfaiye, polis ve sağlık ekipleri sevk edildi. İtfaiye ekipleri yangını kısa sürede kontrol altına alarak söndürdü. Yangında depo kullanılamaz hale geldi. Ekiplerin soğutma çalışmaları devam ediyor.",Samsun'da korkutan depo yangını: Boya ve inşaat malzemeleri alev alev yandı Samsun'da korkutan depo yangını: Boya ve inşaat malzemeleri alev alev yandı Bengü Türk Samsun'un Tekkeköy ilçesinde boya ve inşaat malzemesi deposunda çıkan yangın söndürüldü. Samsun'da korkutan depo yangını: Boya ve inşaat malzemeleri alev alev yandı 06/07/2026 23:24 Kutay Durukan Samsun'un Tekkeköy ilçesinde boya ve inşaat malzemesi deposunda çıkan yangın söndürüldü. 23 Nisan Mahallesi Hürriyet Caddesi'nde bulunan inşaat malzemesi deposunda henüz belirlenemeyen nedenle yangın çıktı. İtfaiye ekipleri yangını kısa sürede kontrol altına alarak söndürdü. Yangında depo kullanılamaz hale geldi. Ekiplerin soğutma çalışmaları devam ediyor. İlk yorum yazan siz olun Asayiş Haberleri 23 Nisan Mahallesi Hürriyet Caddesi'nde bulunan inşaat malzemesi deposunda henüz belirlenemeyen nedenle yangın çıktı. Samsun'da korkutan depo yangını: Boya ve inşaat malzemeleri alev alev yandı 23 Nisan Mahallesi Hürriyet Caddesi'nde bulunan inşaat malzemesi deposunda henüz belirlenemeyen nedenle yangın çıktı.,browser_full_article,https://www.benguturk.com/amp/asayis/samsunda-korkutan-depo-yangini-boya-ve-insaat-malzemeleri-alev-alev-yandi-273458h,Samsun,Tekkeköy,Tekkeköy | 23 Nisan Mahallesi | alev yandı 23 Nisan Mahallesi,,,,,firma yok | faaliyet/tesis yok,,,,maps araması yapılmadı,,,140.0,38
2026-07-06 14:40:00,yangın,Fiziksel Risk / Yangın,İstanbul Beşiktaş'ta korkutan yangın: İş yerinin deposu alev alev yandı!,İstanbul Beşiktaş'ta korkutan yangın: İş yerinin deposu alev alev yandı! Cumhuriyet,https://news.google.com/rss/articles/CBMitwFBVV95cUxNTUxDSE9YczVKbkhybWtKcXhZRVhueUVDTkxNRlBPd3hYTjMxMnlTQm1lTU1hNEg4cG9KNjN2QW84Q2ZLZEpnX0s4M2ZUd1pfUmt4ZDFOaFY3bC1SV29kZ05jWkF5ekJjYzFicENQa3hCR2oyMFdKellPRTNhaDBURlNQWUQ5OHprZDJHRUhNUmg0bm8xcHlNcV9EQmtXZ1U0RzRNWWNvRXByXzFxQ195TkdSb0JjeVk?oc=5,depo,depo,"Beşiktaş'ta tek katlı bir iş yerinin deposundan yükselen alevler kısa sürede büyüdü. Yangın itfaiye ekipleri tarafından söndürülürken, bitişikteki binada yaşayanlar yoğun duman nedeniyle kendi imkanlarıyla dışarı çıktı. Beşiktaş'ta tek katlı bir iş yerinin deposundan yükselen alevler kısa sürede büyüdü. Yangın itfaiye ekipleri tarafından söndürülürken, bitişikteki binada yaşayanlar yoğun duman nedeniyle kendi imkanlarıyla dışarı çıktı. Beşiktaş'ta tek katlı bir iş yerinin deposundan yükselen alevler kısa sürede büyüdü. Yangın itfaiye ekipleri tarafından söndürülürken, bitişikteki binada yaşayanlar yoğun duman nedeniyle kendi imkanlarıyla dışarı çıktı.","İstanbul Beşiktaş'ta korkutan yangın: İş yerinin deposu alev alev yandı! İstanbul Beşiktaş'ta korkutan yangın: İş yerinin deposu alev alev yandı! Cumhuriyet Beşiktaş'ta tek katlı bir iş yerinin deposundan yükselen alevler kısa sürede büyüdü. Yangın itfaiye ekipleri tarafından söndürülürken, bitişikteki binada yaşayanlar yoğun duman nedeniyle kendi imkanlarıyla dışarı çıktı.",browser_full_article,https://www.cumhuriyet.com.tr/turkiye/istanbul-besiktas-ta-korkutan-yangin-is-yerinin-deposu-alev-alev-yandi-2518534,İstanbul,Beşiktaş,,,İş yerinin deposu,,,firma yok,İş yerinin deposu Beşiktaş İstanbul Türkiye,Beşiktaş depo | Mane Tıbbi Ürünleri,Beşiktaş depo,"firma adı yok, tesis/lokasyon ile maps tahmini var",38.70967741935484 | 37.83783783783784,İdealDepo - Kiralık Depo - Eşya Depolama - Self Storage,173.34,39
2026-07-09 06:46:03,depo yangını,Fiziksel Risk / Yangın,Batman'da BİM Deposu'nda Yangın,Batman'da BİM Deposu'nda Yangın Son Dakika,https://news.google.com/rss/articles/CBMigwFBVV95cUxPSk9KMHZLSnpYVTI4dFBmRTJEbW1uV1FOVkFfakJjRWRjZnlYYnA4NllmY21odXZFOE9OajFMNDUtekdRdS1yNjVidmNIZnJiNUpwdWRqTk5UNWl3UjIxYVlLU2xzVTB0eG9ya2pCNUVveVNBWUtDb202b0VBTEREYm9QTdIBgwFBVV95cUxPSk9KMHZLSnpYVTI4dFBmRTJEbW1uV1FOVkFfakJjRWRjZnlYYnA4NllmY21odXZFOE9OajFMNDUtekdRdS1yNjVidmNIZnJiNUpwdWRqTk5UNWl3UjIxYVlLU2xzVTB0eG9ya2pCNUVveVNBWUtDb202b0VBTEREYm9QTQ?oc=5,depo,depo,"Batman OSB'deki BİM ana deposunda yangın çıktı, depo kullanılamaz hale geldi. İnceleme başlatıldı. Batman OSB'deki BİM ana deposunda yangın çıktı, depo kullanılamaz hale geldi. İnceleme başlatıldı. Batman OSB'deki BİM ana deposunda yangın çıktı, depo kullanılamaz hale geldi. İnceleme başlatıldı. Batman'da BİM Deposu'nda Yangın Son Güncelleme: 09.07.2026 09:46 Batman OSB'deki BİM ana deposunda yangın çıktı, depo kullanılamaz hale geldi. İnceleme başlatıldı. Batman Organize Sanayi Bölgesi'nde BİM marketin ana dağıtım deposunda çıkan yangında alevler geceyi aydınlatırken, geriye demir yığınları kaldı. Edinilen bilgilere göre, dün gece 02.45 sıralarında OSB 'de bulunan Birleşik Mağazalar AŞ'nin (BİM) ana deposunda henüz belirlenemeyen nedenle yangın çıktı. Yükselen alevler geceyi aydınlattı. 112 Acil Çağrı Merkezine yapılan ihbar üzerine bölgeye itfaiye, sağlık, emniyet ve jandarma TOMA'ları sevk edildi. Ekiplerin uzun uğraşları sonucu yangın kontrol altına alınarak söndürüldü. Yangının boyutu, depodan geriye demir yığınlarının kalmasıyla ortaya çıktı. Yangında ölen ya da yaralanan olmazken depo kullanılamaz hale geldi. Yangının çıkış nedeni belirlenmesi için inceleme başlatıldı. - BATMAN Kaynak: İHA Batman Organize Sanayi Bölgesi'nde BİM marketin ana dağıtım deposunda çıkan yangında alevler geceyi aydınlatırken, geriye demir yığınları kaldı. Edinilen bilgilere göre, dün gece 02.45 sıralarında OSB 'de bulunan Birleşik Mağazalar AŞ'nin (BİM) ana deposunda henüz belirlenemeyen nedenle yangın çıktı. Yükselen alevler geceyi aydınlattı. 112 Acil Çağrı Merkezine yapılan ihbar üzerine bölgeye itfaiye, sağlık, emniyet ve jandarma TOMA'ları sevk edildi. Ekiplerin uzun uğraşları sonucu yangın kontrol altına alınarak söndürüldü. Yangının boyutu, depodan geriye demir yığınlarının kalmasıyla ortaya çıktı. Yangında ölen ya da yaralanan olmazken depo kullanılamaz hale geldi. Yangının çıkış nedeni belirlenmesi için inceleme başlatıldı. - BATMAN Batman'da BİM Deposu'nda Yangın Batman OSB'deki BİM ana deposunda yangın çıktı, depo kullanılamaz hale geldi. İnceleme başlatıldı. Batman Organize Sanayi Bölgesi'nde BİM marketin ana dağıtım deposunda çıkan yangında alevler geceyi aydınlatırken, geriye demir yığınları kaldı. Edinilen bilgilere göre, dün gece 02.45 sıralarında OSB 'de bulunan Birleşik Mağazalar AŞ'nin (BİM) ana deposunda henüz belirlenemeyen nedenle yangın çıktı. Yükselen alevler geceyi aydınlattı. 112 Acil Çağrı Merkezine yapılan ihbar üzerine bölgeye itfaiye, sağlık, emniyet ve jandarma TOMA'ları sevk edildi. Ekiplerin uzun uğraşları sonucu yangın kontrol altına alınarak söndürüldü. Yangının boyutu, depodan geriye demir yığınlarının kalmasıyla ortaya çıktı. Yangında ölen ya da yaralanan olmazken depo kullanılamaz hale geldi. Yangının çıkış nedeni belirlenmesi için inceleme başlatıldı. - BATMAN","Batman'da BİM Deposu'nda Yangın Batman'da BİM Deposu'nda Yangın Son Dakika Batman OSB'deki BİM ana deposunda yangın çıktı, depo kullanılamaz hale geldi. Batman'da BİM Deposu'nda Yangın Son Güncelleme: 09.07.2026 09:46 Batman OSB'deki BİM ana deposunda yangın çıktı, depo kullanılamaz hale geldi. Batman Organize Sanayi Bölgesi'nde BİM marketin ana dağıtım deposunda çıkan yangında alevler geceyi aydınlatırken, geriye demir yığınları kaldı. Edinilen bilgilere göre, dün gece 02.45 sıralarında OSB 'de bulunan Birleşik Mağazalar AŞ'nin (BİM) ana deposunda henüz belirlenemeyen nedenle yangın çıktı. Yükselen alevler geceyi aydınlattı. 112 Acil Çağrı Merkezine yapılan ihbar üzerine bölgeye itfaiye, sağlık, emniyet ve jandarma TOMA'ları sevk edildi. Ekiplerin uzun uğraşları sonucu yangın kontrol altına alınarak söndürüldü. Yangının boyutu, depodan geriye demir yığınlarının kalmasıyla ortaya çıktı. Yangında ölen ya da yaralanan olmazken depo kullanılamaz hale geldi. Yangının çıkış nedeni belirlenmesi için inceleme başlatıldı. - BATMAN Kaynak: İHA Batman Organize Sanayi Bölgesi'nde BİM marketin ana dağıtım deposunda çıkan yangında alevler geceyi aydınlatırken, geriye demir yığınları kaldı. - BATMAN Batman'da BİM Deposu'nda Yangın Batman OSB'deki BİM ana deposunda yangın çıktı, depo kullanılamaz hale geldi.",browser_full_article,https://www.sondakika.com/amp/haber-batman-da-bim-deposu-nda-yangin-20033413/,Batman,,Batman OSB | 46 Batman OSB | 45 sıralarında OSB | nda Yangın Batman OSB | Batman Organize Sanayi,,da BİM Deposu,Birleşik Mağazalar AŞ,Birleşik Mağazalar AŞ:68:body | Birleşik Mağazalar AŞ:raw_legal,ilçe yok,Birleşik Mağazalar AŞ Batman OSB Batman Türkiye,,,maps sonucu düşük güven nedeniyle elendi,,Batman Bims Fabrikası | BİM market | Bim,152.6,40
2026-07-06 21:19:00,depo yangını,Fiziksel Risk / Yangın,Samsun Tekkeköy'de Boya Deposunda Çıkan Yangın İtfaiye Ekipleri Tarafından Söndürüldü,Samsun Tekkeköy'de Boya Deposunda Çıkan Yangın İtfaiye Ekipleri Tarafından Söndürüldü Mersin Haber,https://news.google.com/rss/articles/CBMiwwFBVV95cUxNWkVLYVdHQloxdTFQYnpnX0Rlb0dVd3pITFZlVmMtNF94MTB0WjdDZ2FEaGpmTURwY19saEpXeEtCTE1BMkw2eUFuXzZHNmtObXJOd2RacGhsTEZPWUQwSGR3MzZ3N0RaczlsbnhCU0MtWUtSZ1k5U1dlT0JabGFTNU0yZnhTNzVYVTlIenFpM0pFY2ZOeVZPdkVtajA5dk1TTTRORzB0bUZKbTYxb1FCUFdwaXZjeUJNQ0phT0FOSDYta2vSAVdBVV95cUxQZ0NQMzZ2WXA3d2JQYVhpeHpFRTM3VnVEQ3EycEthOFNtZG94aG5LUjBRamZ3bDdQY180YlpXZWNFNlFwRllnWWlYMHdhZ2tQOVItWjJwb2c?oc=5,depo,depo,"Samsun Tekkeköy'de Boya Deposunda Çıkan Yangın İtfaiye Ekipleri Tarafından Söndürüldü Haber Merkezi • 07 Temmuz 2026 00:19 • Güncellendi: 07 Temmuz 2026 00:22 Samsun Tekkeköy'de bulunan bir boya deposunda çıkan yangın, itfaiye ekiplerinin hızlı müdahalesiyle kontrol altına alındı. Olayda depo hasar gördü. Anasayfa Haberler Kategoriler Asayiş Samsun'da Boya Deposu Yangını Samsun Tekkeköy'de bulunan bir boya deposunda çıkan yangın, itfaiye ekiplerinin hızlı müdahalesiyle kontrol altına alındı. Olayda depo hasar gördü. Facebook X WhatsApp 07 Temmuz 2026 00:19 Edinilen bilgilere göre, Tekkeköy ilçesi Yıldıray Sokak üzerinde yer alan boya deposunda, henüz belirlenemeyen bir nedenle yangın meydana geldi. Yangın anında yükselen yoğun dumanları gören çevredekiler, durumu hemen yetkililere bildirdi. Olay yerine hızla intikal eden sağlık, polis ve itfaiye ekipleri, yangına müdahale etmek üzere hazırlıklarını yaptı. Alevler kısa sürede yayıldı ve büyüdü. İtfaiye ekipleri, olay yerine ulaşarak yangına müdahale etti ve alevleri kontrol altına almayı başardı. Yangın sonucunda boya deposunda maddi hasar oluştu. Olay sonrası, polis ekipleri çevrede güvenlik önlemleri alarak, olası bir tehlikeyi önlemek için gerekli tedbirleri aldı. Yangının çıkış sebebinin belirlenmesi için detaylı bir inceleme başlatıldığı bildirildi. Yangınla ilgili gelişmelerin takip edileceği ifade edildi. Ankara'da Savunma Sanayii Çalışma Yemeği'nde Bakan Güler, Türkiye'nin 2025 yılında 10 milyar 54 milyon dolarlık ihracat hacmine ulaşacağını belirtti. Kırıkkale'de NATO Liderler Zirvesi Kapsamında Güvenlik Önlemleri Alındı Samsun Kaynak: Mersin Haber + IHA İlgili Haberler Facebook X WhatsApp Son Eklenen Haberler 11:29 Kayıp 6 milyonluk ziynet eşyasını polis 200 saatlik kamera kayıtlarını inceleyip buldu: 1 gözaltı 11:29 Başkan Yaymanoğlu; ""Denizli sanayisinin güçlendirilmesi için iş birliğine önem veriyoruz"" 11:29 Kuşadası’nda yeşil alanlarda kapsamlı bakım ve düzenleme çalışması 11:29 Yunanistan’da yedek parça tesisinde yangın: 4 yaralı 11:25 Erkan Kork Hakkında Tahliye Kararı Verildi 11:26 Beylikdüzü'nde Silahlı Saldırı Sonucu Kaza 11:26 Antalya'da Yabancı Uyruklu Şahıs Gözaltına Alındı 11:27 Kırklareli'nde Çocuk Parkında Silahlı Saldırı 11:23 Tomarza'da Yaz Spor Okulları Heyecanı 11:24 Adana'da Kayıp Ticaretçi 11:25 Kalın Bağırsak Kanseri Önlenebilir: Konya'da Bilgilendirme 11:25 Kayseri'de Güreş Şampiyonu Salih Yazıcı 11:21 Dünyada Beş Yetişkinden Biri Tütün Kullanıyor 11:21 Ankara'da NATO Zirvesi'nin Renkli Anları 11:21 Kütahya'da Evin Dış Cephesi Çiniyle Süsleniyor 11:21 Vodafone Türkiye'den Yapay Zeka Atılımı 11:19 TÜVTÜRK'ten Muayene Hatırlatması İstanbul'da 11:19 Konya'da Savunma Sanayi Büyümeye Devam Ediyor 11:17 Konya Karapınar'da İki Kamyonet Çarpıştı 11:13 Manisa'da Sultaniye Üzümüne Koruma Önlemi Çok O","Samsun Tekkeköy'de Boya Deposunda Çıkan Yangın İtfaiye Ekipleri Tarafından Söndürüldü Samsun Tekkeköy'de Boya Deposunda Çıkan Yangın İtfaiye Ekipleri Tarafından Söndürüldü Mersin Haber Samsun Tekkeköy'de Boya Deposunda Çıkan Yangın İtfaiye Ekipleri Tarafından Söndürüldü Haber Merkezi • 07 Temmuz 2026 00:19 • Güncellendi: 07 Temmuz 2026 00:22 Samsun Tekkeköy'de bulunan bir boya deposunda çıkan yangın, itfaiye ekiplerinin hızlı müdahalesiyle kontrol altına alındı. Anasayfa Haberler Kategoriler Asayiş Samsun'da Boya Deposu Yangını Samsun Tekkeköy'de bulunan bir boya deposunda çıkan yangın, itfaiye ekiplerinin hızlı müdahalesiyle kontrol altına alındı. Facebook X WhatsApp 07 Temmuz 2026 00:19 Edinilen bilgilere göre, Tekkeköy ilçesi Yıldıray Sokak üzerinde yer alan boya deposunda, henüz belirlenemeyen bir nedenle yangın meydana geldi. Yangın anında yükselen yoğun dumanları gören çevredekiler, durumu hemen yetkililere bildirdi. Olay yerine hızla intikal eden sağlık, polis ve itfaiye ekipleri, yangına müdahale etmek üzere hazırlıklarını yaptı. Alevler kısa sürede yayıldı ve büyüdü. İtfaiye ekipleri, olay yerine ulaşarak yangına müdahale etti ve alevleri kontrol altına almayı başardı. Yangın sonucunda boya deposunda maddi hasar oluştu. Olay sonrası, polis ekipleri çevrede güvenlik önlemleri alarak, olası bir tehlikeyi önlemek için gerekli tedbirleri aldı. Yangının çıkış sebebinin belirlenmesi için detaylı bir inceleme başlatıldığı bildirildi. Yangınla ilgili gelişmelerin takip edileceği ifade edildi. Ankara'da Savunma Sanayii Çalışma Yemeği'nde Bakan Güler, Türkiye'nin 2025 yılında 10 milyar 54 milyon dolarlık ihracat hacmine ulaşacağını belirtti. Kırıkkale'de NATO Liderler Zirvesi Kapsamında Güvenlik Önlemleri Alındı Samsun Kaynak: Mersin Haber + IHA İlgili Haberler Facebook X WhatsApp Son Eklenen Haberler 11:29 Kayıp 6 milyonluk ziynet eşyasını polis 200 saatlik kamera kayıtlarını inceleyip buldu: 1 gözaltı 11:29 Başkan Yaymanoğlu; ""Denizli sanayisinin güçlendirilmesi için iş birliğine önem veriyoruz"" 11:29 Kuşadası’nda yeşil alanlarda kapsamlı bakım ve düzenleme çalışması 11:29 Yunanistan’da yedek parça tesisinde yangın: 4 yaralı 11:25 Erkan Kork Hakkında Tahliye Kararı Verildi 11:26 Beylikdüzü'nde Silahlı Saldırı Sonucu Kaza 11:26 Antalya'da Yabancı Uyruklu Şahıs Gözaltına Alındı 11:27 Kırklareli'nde Çocuk Parkında Silahlı Saldırı 11:23 Tomarza'da Yaz Spor Okulları Heyecanı 11:24 Adana'da Kayıp Ticaretçi 11:25 Kalın Bağırsak Kanseri Önlenebilir: Konya'da Bilgilendirme 11:25 Kayseri'de Güreş Şampiyonu Salih Yazıcı 11:21 Dünyada Beş Yetişkinden Biri Tütün Kullanıyor 11:21 Ankara'da NATO Zirvesi'nin Renkli Anları 11:21 Kütahya'da Evin Dış Cephesi Çiniyle Süsleniyor 11:21 Vodafone Türkiye'den Yapay Zeka Atılımı 11:19 TÜVTÜRK'ten Muayene Hatırlatması İstanbul'da 11:19 Konya'da Savunma Sanayi Büyümeye Devam Ediyor 11:17 Konya Karapınar'da İki Kamyonet Çarpıştı 11:13 Manisa'da Sultaniye Üzümüne Koruma Önlemi Çok O",browser_full_article_dom,https://news.google.com/rss/articles/CBMiwwFBVV95cUxNWkVLYVdHQloxdTFQYnpnX0Rlb0dVd3pITFZlVmMtNF94MTB0WjdDZ2FEaGpmTURwY19saEpXeEtCTE1BMkw2eUFuXzZHNmtObXJOd2RacGhsTEZPWUQwSGR3MzZ3N0RaczlsbnhCU0MtWUtSZ1k5U1dlT0JabGFTNU0yZnhTNzVYVTlIenFpM0pFY2ZOeVZPdkVtajA5dk1TTTRORzB0bUZKbTYxb1FCUFdwaXZjeUJNQ0phT0FOSDYta2vSAVdBVV95cUxQZ0NQMzZ2WXA3d2JQYVhpeHpFRTM3VnVEQ3EycEthOFNtZG94aG5LUjBRamZ3bDdQY180YlpXZWNFNlFwRllnWWlYMHdhZ2tQOVItWjJwb2c?oc=5&hl=tr&gl=TR&ceid=TR:tr,Adana | Ankara | Antalya | İstanbul | Kayseri,Tomarza | Karapınar | Tekkeköy,Tekkeköy,,da Boya Deposu,,,firma yok,da Boya Deposu Tekkeköy Tomarza Adana Türkiye,Edesa Boya | Yılmaz Küçükgöde Boya,Edesa Boya,"firma adı yok, tesis/lokasyon ile maps tahmini var",66.66666666666666 | 50,,214.0,41
