published,search_term,category,title,summary,link,matched_words,activity_type,raw_text,entity_source_text,article_fetch_status,resolved_article_url,city_candidates,district_candidates,neighborhood_candidates,street_candidates,facility_candidates,company_candidates,company_candidate_scores,entity_quality_note,maps_queries,maps_candidates,maps_best_guess,maps_status,maps_match_scores,maps_rejected_candidates,record_quality_score,duplicate_group_id
2026-06-23 14:28:00,fabrika yangını,Fiziksel Risk / Yangın,Fabrikada korkutan yangın!,Fabrikada korkutan yangın! Gazete Vatan,https://news.google.com/rss/articles/CBMid0FVX3lxTE9PWlhBejVjLU1RUUtWYjhpc0pmeXZSUDJURzFNUEhKNDA5MWhXU2F3b3dGTmJpSm1KRG52bnJXWEViRnF3VUlLQncxZ0RPcmJRd3VpeDdYZWlqRGlxbENUb196X1o0a2lzTDQ2eUFiUkN5NW00SVRF?oc=5,fabrika,fabrika,Fabrikada korkutan yangın! Gazete Vatan,Fabrikada korkutan yangın! Fabrikada korkutan yangın! Gazete Vatan Fabrikada korkutan yangın!,browser_failed,https://news.google.com/rss/articles/CBMid0FVX3lxTE9PWlhBejVjLU1RUUtWYjhpc0pmeXZSUDJURzFNUEhKNDA5MWhXU2F3b3dGTmJpSm1KRG52bnJXWEViRnF3VUlLQncxZ0RPcmJRd3VpeDdYZWlqRGlxbENUb196X1o0a2lzTDQ2eUFiUkN5NW00SVRF?oc=5&hl=tr&gl=TR&ceid=TR:tr,,,,,,,,il yok | ilçe yok | firma yok | faaliyet/tesis yok,,,,maps araması yapılmadı,,,31.14,1
2026-06-23 13:25:00,üretim tesisi yangını,Fiziksel Risk / Yangın,Mardin'de Örtü Yangını: Alevler Doğalgaz Üretim Tesisi ve Yerleşim Yerlerine Yaklaşıyor,Mardin'de Örtü Yangını: Alevler Doğalgaz Üretim Tesisi ve Yerleşim Yerlerine Yaklaşıyor Mardin Haber Gazetesi,https://news.google.com/rss/articles/CBMixgFBVV95cUxNV0ZCbFRfMG5vZ3FHZDNTYzVlNDNFVWVLRHJIZjV2blc2dmdKaFhaWXhyWVBDaVpQdlNpczEzTUlEZDFwazFwOHdCck54c2NMVVVoc3pPOFA5V1U4SFlLalNnYnh3Q243YmNITnN0OUg5bHQ5VGN0bTJvQ3E3T2VlZGIwV2sxZmI0c1gzNUZhY2k2ME1ScVRLX3NSbXNhX1Vyd3NaNGFGYWZ0a0J0N2k3ZlRFVktORXdOSmI1RXVWUWhmN292YVHSAcsBQVVfeXFMTmlNWkY2LXNWOThsZEk4b25WMExuSlZxMnlJQ1o3d1BPSDNmM3d2N1pnYjJCeVpCaUVnVTJRdlE0QzBOSFVuaTRhRVp6WGZpODllZG1BTnoxZkhLLXQ2NkdFRGRGcjVvckswMUEydktsbEVqSUp2QWRncnRMSUN2Nm1Ea0xsaHB2RmwtREVZTVV5dU5QTkEzbVVkbG9VbE44dFV3Vkt0YkFrc1F1TnJfcmFlZWg5ME03b2RWLVRtLWdyTWNwdjZfU24yUzg?oc=5,"tesis, üretim, üretim tesisi",üretim tesisi,"Mardin’in Yeşilli ilçesine bağlı kırsal Zeytinli Mahallesi’nde çıkan örtü yangını, rüzgarın da etkisiyle kısa sürede geniş bir alana yayıldı. Mardin’in Yeşilli ilçesine bağlı kırsal Zeytinli Mahallesi’nde çıkan örtü yangını, rüzgarın da etkisiyle kısa sürede geniş bir alana yayıldı. Mardin’in Yeşilli ilçesine bağlı kırsal Zeytinli Mahallesi’nde çıkan örtü yangını, rüzgarın da etkisiyle kısa sürede geniş bir alana yayıldı.","Mardin'de Örtü Yangını: Alevler Doğalgaz Üretim Tesisi ve Yerleşim Yerlerine Yaklaşıyor Mardin'de Örtü Yangını: Alevler Doğalgaz Üretim Tesisi ve Yerleşim Yerlerine Yaklaşıyor Mardin Haber Gazetesi Mardin’in Yeşilli ilçesine bağlı kırsal Zeytinli Mahallesi’nde çıkan örtü yangını, rüzgarın da etkisiyle kısa sürede geniş bir alana yayıldı.",browser_full_article,https://mardinhaber.com.tr/haber/28221254/mardinde-ortu-yangini-alevler-dogalgaz-uretim-tesisi-ve-yerlesim-yerlerine-yaklasiyor,Mardin,Yeşilli,ilçesine bağlı kırsal Zeytinli Mahallesi,,Alevler Doğalgaz Üretim Tesisi,Alevler Doğalgaz,Alevler Doğalgaz:292:body+summary+title,iyi,Alevler Doğalgaz ilçesine bağlı kırsal Zeytinli Mahallesi Yeşilli Mardin Türkiye,Alevler Doğalgaz ilçesine bağlı kırsal Zeytinli Mahallesi Yeşilli Mardin Türkiye,Alevler Doğalgaz ilçesine bağlı kırsal Zeytinli Mahallesi Yeşilli Mardin Türkiye,firma adı + güvenli maps adayı var,100.0,,281.0,2
2026-06-24 06:30:00,para aklama,Operasyon / Soruşturma / Suç,HSBC'ye büyük şok: Merkez Bankası fonları için soruşturma başlatıldı,HSBC'ye büyük şok: Merkez Bankası fonları için soruşturma başlatıldı Sözcü Gazetesi,https://news.google.com/rss/articles/CBMipwFBVV95cUxOUXc2azBJemFOcHppcUZLTVA3RDd0eEU1SzlhTVRUaUp4ODlzejlRcTJ1SXdXSjk5WTJCUVB3Z003cGkxMDVVTHVTd04xcHpSQjhYaGZlRDJjMTRUTE44VnBZQXdscDh0TTlUVHVOZ2V3T2VzYjllcmg4Y2RaLVEtZkNHdUNrY2VIRmFoaFRfMU1pdGs0U29DbGNQRmVlNzV4c3UwU3pYVQ?oc=5,banka,finansal kuruluş,"Ad Haberler - Ekonomi HSBC'ye büyük şok: Merkez Bankası fonları için soruşturma başlatıldı HSBC’nin İsviçre birimi, Lübnan Merkez Bankası’nın eski başkanı Riad Salameh ve yakınlarının yüz milyonlarca dolarlık kara para aklama faaliyetlerine göz yummakla suçlanıyor. Yayınlanma: 24 Haziran 2026 - 09:30 Güncellenme: Avrupa'nın en büyük bankacılık gruplarından HSBC, İsviçre'deki özel bankacılık birimi üzerinden yürütülen devasa bir yolsuzluk ve kara para aklama skandalının merkezinde yer alıyor. Fransız ve İsviçreli yargı makamları, bankanın Lübnan Merkez Bankası eski Başkanı Riad Salameh ve ortaklarının kamu fonlarını hortumlamasına aracılık ettiği iddiaları üzerine resmi soruşturma başlattı. FRANSIZ SAVCILARDAN ÖN SUÇLAMA Fransız yargısı, Riad Salameh’in kamu fonlarını zimmetine geçirmesine yardımcı olduğu gerekçesiyle HSBC İsviçre Özel Bankası hakkında ön suçlama kararı aldı. Müfettişlerin incelemelerine göre, 2002-2015 yılları arasında Lübnan Merkez Bankası’ndan İngiliz Virjin Adaları menşeili Forry Associates şirketine 330 milyon dolar aktarıldı. Bu tutarın 204 milyon dolarlık kısmı, 174 farklı transferle Riad Salameh'in kardeşi Raja Salameh’in kişisel HSBC hesaplarına gönderildi. İsviçre Finansal Piyasalar Denetleme Kurulu ise bankanın özen borcunu ciddi şekilde ihlal ettiğini ve uyarı sinyallerini görmezden geldiğini açıkladı. İÇ UYARILAR YILLARCA GÖRMEZDEN GELİNDİ Skandalın arka planında banka içi denetim mekanizmalarının devre dışı bırakıldığı görülüyor. HSBC’nin 2000 yılında Republic National Bank of New York’u satın almasıyla kadroya dahil olan kıdemli bankacı Sobhi Tabbara, Salameh kardeşlerle olan yakın ilişkisini kullanarak uyum görevlilerinin şüphelerini bastırdı. 2009 yılında Lübnan Merkez Bankası’ndan gelen bir SWIFT mesajını gerekçe gösteren Tabbara, işlemlerin yasal olduğunu savunarak denetimleri engelledi. 2013 yılında bir uyum görevlisinin hesaplardaki hareketliliği ""şüpheli"" olarak rapor etmesine rağmen, kıdemli yöneticiler ticari ilişkiyi sürdürme kararı aldı. PARAVAN ŞİRKET VE GEÇİŞ KANALLARI Soruşturma dosyasına göre Panama Belgeleri ile tanınan hukuk firması Mossack Fonseca tarafından yönetilen Forry Associates'in hiçbir gerçek ticari faaliyeti, çalışanı veya müşterisi bulunmuyordu. 2015 yılında bankaya sunulan sözleşmelerdeki imza çelişkileri üzerine Mali İstihbarat Birimi harekete geçti. Yapılan incelemelerde şu sonuçlar elde edildi: Paranın önce paravan şirket hesabına aktarıldığı, Buradan Raja Salameh’in kişisel HSBC hesaplarına transfer edildiği, Son aşamada ise fonların izini kaybettirmek amacıyla Lübnan'daki yerel bankalara gönderildiği saptandı. HSBC, 2016 yılında hesapları kapatsa da bunu resmi makamlara bildirmek yerine kayıtlara ""risk iştahı değişimi"" olarak geçti. GEÇ KALINAN BİLDİRİM VE MİLYARLIK SABIKA Lübnan ekonomisinin 2019 yılında çökmesiyle birlikte Riad Salameh’in yürüttüğü finansal sistem ""devlet destekli bir saadet zinciri"" olarak tanımlandı. HSBC, Salameh ile ilişkisini kestikten dört yıl sonra, yani 2020'de İsviçre makamlarına resmi bildirimde bulundu. Finma, bu adımı ""tamamen geç kalmış"" bir müdahale olarak nitelendirdi. HSBC, geçmişte de Meksikalı uyuşturucu kartellerinin kara para aklama faaliyetlerine göz yumduğu gerekçesiyle 2012 yılında ABD'de 1,9 milyar dolar ceza ödemeyi kabul etmişti. Banka yönetimi, yeni soruşturmaların grup üzerinde önemli finansal etkileri olabileceği konusunda yatırımcılarını uyardı. Bu süreçte HSBC, aralarında Suudi Arabistan ve Lübnan'ın da yer aldığı Orta Doğulu 1.000'den fazla varlıklı müşterisiyle ilişkisini sonlandırdı. Bankacılık grubu ise konuyla ilgili resmi bir yorum yapmaktan kaçındı. HSBC'ye büyük şok: Merkez Bankası fonları için soruşturma başlatıldı HSBC’nin İsviçre birimi, Lübnan Merkez Bankası’nın eski başkanı Riad Salameh ve yakınlarının yüz milyonlarca dolarlık kara para aklama faaliyetlerine göz yummakla suçlanıyor. Yayınlanma: 24 Haziran 2026 - 09:30 Güncellenme: Yayınlanma: 24 Haziran 2026 - 09:30 Güncellenme: Avrupa'nın en büyük bankacılık gruplarından HSBC, İsviçre'deki özel bankacılık birimi üzerinden yürütülen devasa bir yolsuzluk ve kara para aklama skandalının merkezinde yer alıyor. Fransız ve İsviçreli yargı makamları, bankanın Lübnan Merkez Bankası eski Başkanı Riad Salameh ve ortaklarının kamu fonlarını hortumlamasına aracılık ettiği iddiaları üzerine resmi soruşturma başlattı. FRANSIZ SAVCILARDAN ÖN SUÇLAMA Fransız yargısı, Riad Salameh’in kamu fonlarını zimmetine geçirmesine yardımcı olduğu gerekçesiyle HSBC İsviçre Özel Bankası hakkında ön suçlama kararı aldı. Müfettişlerin incelemelerine göre, 2002-2015 yılları arasında Lübnan Merkez Bankası’ndan İngiliz Virjin Adaları menşeili Forry Associates şirketine 330 milyon dolar aktarıldı. Bu tutarın 204 milyon dolarlık kısmı, 174 farklı transferle Riad Salameh'in kardeşi Raja Salameh’in kişisel HSBC hesaplarına gönderildi. İsviçre Finansal Piyasalar Denetleme Kurulu ise bankanın özen borcunu ciddi şekilde ihlal ettiğini ve uyarı sinyallerini görmezden geldiğini açıkladı. İÇ UYARILAR YILLARCA GÖRMEZDEN GELİNDİ Skandalın arka planında banka içi denetim mekanizmalarının devre dışı bırakıldığı görülüyor. HSBC’nin 2000 yılında Republic National Bank of New York’u satın almasıyla kadroya dahil olan kıdemli bankacı Sobhi Tabbara, Salameh kardeşlerle olan yakın ilişkisini kullanarak uyum görevlilerinin şüphelerini bastırdı. 2009 yılında Lübnan Merkez Bankası’ndan gelen bir SWIFT mesajını gerekçe gösteren Tabbara, işlemlerin yasal olduğunu savunarak denetimleri engelledi. 2013 yılında bir uyum görevlisinin hesaplardaki hareketliliği ""şüpheli"" olarak rapor etmesine rağmen, kıdemli yöneticiler ticari ilişkiyi sürdürme kararı aldı. PARAVAN ŞİRKET VE GEÇİŞ KANALLARI Soruşturma dosyasına göre Panama Belgeleri ile tanınan hukuk firması Mossack Fonseca tarafından yönetilen Forry Associates'in hiçbir gerçek ticari faaliyeti, çalışanı veya müşterisi bulunmuyordu. 2015 yılında bankaya sunulan sözleşmelerdeki imza çelişkileri üzerine Mali İstihbarat Birimi harekete geçti. Yapılan incelemelerde şu sonuçlar elde edildi: Paranın önce paravan şirket hesabına aktarıldığı, Buradan Raja Salameh’in kişisel HSBC hesaplarına transfer edildiği, Son aşamada ise fonların izini kaybettirmek amacıyla Lübnan'daki yerel bankalara gönderildiği saptandı. HSBC, 2016 yılında hesapları kapatsa da bunu resmi makamlara bildirmek yerine kayıtlara ""risk iştahı değişimi"" olarak geçti. GEÇ KALINAN BİLDİRİM VE MİLYARLIK SABIKA Lübnan ekonomisinin 2019 yılında çökmesiyle birlikte Riad Salameh’in yürüttüğü finansal sistem ""devlet destekli bir saadet zinciri"" olarak tanımlandı. HSBC, Salameh ile ilişkisini kestikten dört yıl sonra, yani 2020'de İsviçre makamlarına resmi bildirimde bulundu. Finma, bu adımı ""tamamen geç kalmış"" bir müdahale olarak nitelendirdi. HSBC, geçmişte de Meksikalı uyuşturucu kartellerinin kara para aklama faaliyetlerine göz yumduğu gerekçesiyle 2012 yılında ABD'de 1,9 milyar dolar ceza ödemeyi kabul etmişti. Banka yönetimi, yeni soruşturmaların grup üzerinde önemli finansal etkileri olabileceği konusunda yatırımcılarını uyardı. Bu süreçte HSBC, aralarında Suudi Arabistan ve Lübnan'ın da yer aldığı Orta Doğulu 1.000'den fazla varlıklı müşterisiyle ilişkisini sonlandırdı. Bankacılık grubu ise konuyla ilgili resmi bir yorum yapmaktan kaçındı. HSBC'ye büyük şok: Merkez Bankası fonları için soruşturma başlatıldı FRANSIZ SAVCILARDAN ÖN SUÇLAMA İÇ UYARILAR YILLARCA GÖRMEZDEN GELİNDİ PARAVAN ŞİRKET VE GEÇİŞ KANALLARI GEÇ KALINAN BİLDİRİM VE MİLYARLIK SABIKA HSBC’nin İsviçre birimi, Lübnan Merkez Bankası’nın eski başkanı Riad Salameh ve yakınlarının yüz milyonlarca dolarlık kara para aklama faaliyetlerine göz yummakla suçlanıyor. Avrupa'nın en büyük bankacılık gruplarından HSBC, İsviçre'deki özel bankacılık birimi üzerinden yürütülen devasa bir yolsuzluk ve kara para aklama skandalının merkezinde yer alıyor. Fransız ve İsviçreli yargı makamları, bankanın Lübnan Merkez Bankası eski Başkanı Riad Salameh ve ortaklarının kamu fonlarını hortumlamasına aracılık ettiği iddiaları üzerine resmi soruşturma başlattı. Fransız yargısı, Riad Salameh’in kamu fonlarını zimmetine geçirmesine yardımcı olduğu gerekçesiyle HSBC İsviçre Özel Bankası hakkında ön suçlama kararı aldı. Müfettişlerin incelemelerine göre, 2002-2015 yılları arasında Lübnan Merkez Bankası’ndan İngiliz Virjin Adaları menşeili Forry Associates şirketine 330 milyon dolar aktarıldı. Bu tutarın 204 milyon dolarlık kısmı, 174 farklı transferle Riad Salameh'in kardeşi Raja Salameh’in kişisel HSBC hesaplarına gönderildi. İsviçre Finansal Piyasalar Denetleme Kurulu ise bankanın özen borcunu ciddi şekilde ihlal ettiğini ve uyarı sinyallerini görmezden geldiğini açıkladı. Skandalın arka planında banka içi denetim mekanizmalarının devre dışı bırakıldığı görülüyor. HSBC’nin 2000 yılında Republic National Bank of New York’u satın almasıyla kadroya dahil olan kıdemli bankacı Sobhi Tabbara, Salameh kardeşlerle olan yakın ilişkisini kullanarak uyum görevlilerinin şüphelerini bastırdı. 2009 yılında Lübnan Merkez Bankası’ndan gelen bir SWIFT mesajını gerekçe gösteren Tabbara, işlemlerin yasal olduğunu savunarak denetimleri engelledi. 2013 yılında bir uyum görevlisinin hesaplardaki hareketliliği ""şüpheli"" olarak rapor etmesine rağmen, kıdemli yöneticiler ticari ilişkiyi sürdürme kararı aldı. Soruşturma dosyasına göre Panama Belgeleri ile tanınan hukuk firması Mossack Fonseca tarafından yönetilen Forry Associates'in hiçbir gerçek ticari faaliyeti, çalışanı veya müşterisi bulunmuyordu. 2015 yılında bankaya sunulan sözleşmelerdeki imza çelişkileri üzerine Mali İstihbarat Birimi harekete geçti. Yapılan incelemelerde şu sonuçlar elde edildi: Paranın önce paravan şirket hesabına aktarıldığı, Buradan Raja Salameh’in kişisel HSBC hesaplarına transfer edildiği, Son aşamada ise fonların izini kaybettirmek amacıyla Lübnan'daki yerel bankalara gönderildiği saptandı. HSBC, 2016 yılında hesapları kapatsa da bunu resmi makamlara bildirmek yerine kayıtlara ""risk iştahı değişimi"" olarak geçti. Lübnan ekonomisinin 2019 yılında çökmesiyle birlikte Riad Salameh’in yürüttüğü finansal sistem ""devlet destekli bir saadet zinciri"" olarak tanımlandı. HSBC, Salameh ile ilişkisini kestikten dört yıl sonra, yani 2020'de İsviçre makamlarına resmi bildirimde bulundu. Finma, bu adımı ""tamamen geç kalmış"" bir müdahale olarak nitelendirdi. HSBC, geçmişte de Meksikalı uyuşturucu kartellerinin kara para aklama faaliyetlerine göz yumduğu gerekçesiyle 2012 yılında ABD'de 1,9 milyar dolar ceza ödemeyi kabul etmişti. Banka yönetimi, yeni soruşturmaların grup üzerinde önemli finansal etkileri olabileceği konusunda yatırımcılarını uyardı. Bu süreçte HSBC, aralarında Suudi Arabistan ve Lübnan'ın da yer aldığı Orta Doğulu 1.000'den fazla varlıklı müşterisiyle ilişkisini sonlandırdı. Bankacılık grubu ise konuyla ilgili resmi bir yorum yapmaktan kaçındı.","HSBC'ye büyük şok: Merkez Bankası fonları için soruşturma başlatıldı HSBC'ye büyük şok: Merkez Bankası fonları için soruşturma başlatıldı Sözcü Gazetesi Ad Haberler - Ekonomi HSBC'ye büyük şok: Merkez Bankası fonları için soruşturma başlatıldı HSBC’nin İsviçre birimi, Lübnan Merkez Bankası’nın eski başkanı Riad Salameh ve yakınlarının yüz milyonlarca dolarlık kara para aklama faaliyetlerine göz yummakla suçlanıyor. Yayınlanma: 24 Haziran 2026 - 09:30 Güncellenme: Avrupa'nın en büyük bankacılık gruplarından HSBC, İsviçre'deki özel bankacılık birimi üzerinden yürütülen devasa bir yolsuzluk ve kara para aklama skandalının merkezinde yer alıyor. Fransız ve İsviçreli yargı makamları, bankanın Lübnan Merkez Bankası eski Başkanı Riad Salameh ve ortaklarının kamu fonlarını hortumlamasına aracılık ettiği iddiaları üzerine resmi soruşturma başlattı. FRANSIZ SAVCILARDAN ÖN SUÇLAMA Fransız yargısı, Riad Salameh’in kamu fonlarını zimmetine geçirmesine yardımcı olduğu gerekçesiyle HSBC İsviçre Özel Bankası hakkında ön suçlama kararı aldı. Müfettişlerin incelemelerine göre, 2002-2015 yılları arasında Lübnan Merkez Bankası’ndan İngiliz Virjin Adaları menşeili Forry Associates şirketine 330 milyon dolar aktarıldı. Bu tutarın 204 milyon dolarlık kısmı, 174 farklı transferle Riad Salameh'in kardeşi Raja Salameh’in kişisel HSBC hesaplarına gönderildi. İsviçre Finansal Piyasalar Denetleme Kurulu ise bankanın özen borcunu ciddi şekilde ihlal ettiğini ve uyarı sinyallerini görmezden geldiğini açıkladı. HSBC’nin 2000 yılında Republic National Bank of New York’u satın almasıyla kadroya dahil olan kıdemli bankacı Sobhi Tabbara, Salameh kardeşlerle olan yakın ilişkisini kullanarak uyum görevlilerinin şüphelerini bastırdı. 2009 yılında Lübnan Merkez Bankası’ndan gelen bir SWIFT mesajını gerekçe gösteren Tabbara, işlemlerin yasal olduğunu savunarak denetimleri engelledi. PARAVAN ŞİRKET VE GEÇİŞ KANALLARI Soruşturma dosyasına göre Panama Belgeleri ile tanınan hukuk firması Mossack Fonseca tarafından yönetilen Forry Associates'in hiçbir gerçek ticari faaliyeti, çalışanı veya müşterisi bulunmuyordu. Yapılan incelemelerde şu sonuçlar elde edildi: Paranın önce paravan şirket hesabına aktarıldığı, Buradan Raja Salameh’in kişisel HSBC hesaplarına transfer edildiği, Son aşamada ise fonların izini kaybettirmek amacıyla Lübnan'daki yerel bankalara gönderildiği saptandı. HSBC, 2016 yılında hesapları kapatsa da bunu resmi makamlara bildirmek yerine kayıtlara ""risk iştahı değişimi"" olarak geçti. HSBC, Salameh ile ilişkisini kestikten dört yıl sonra, yani 2020'de İsviçre makamlarına resmi bildirimde bulundu. HSBC, geçmişte de Meksikalı uyuşturucu kartellerinin kara para aklama faaliyetlerine göz yumduğu gerekçesiyle 2012 yılında ABD'de 1,9 milyar dolar ceza ödemeyi kabul etmişti. Banka yönetimi, yeni soruşturmaların grup üzerinde önemli finansal etkileri olabileceği konusunda yatırımcılarını uyardı. Bu süreçte HSBC, aralarında Suudi Arabistan ve Lübnan'ın da yer aldığı Orta Doğulu 1.000'den fazla varlıklı müşterisiyle ilişkisini sonlandırdı. HSBC'ye büyük şok: Merkez Bankası fonları için soruşturma başlatıldı HSBC’nin İsviçre birimi, Lübnan Merkez Bankası’nın eski başkanı Riad Salameh ve yakınlarının yüz milyonlarca dolarlık kara para aklama faaliyetlerine göz yummakla suçlanıyor. Yayınlanma: 24 Haziran 2026 - 09:30 Güncellenme: Yayınlanma: 24 Haziran 2026 - 09:30 Güncellenme: Avrupa'nın en büyük bankacılık gruplarından HSBC, İsviçre'deki özel bankacılık birimi üzerinden yürütülen devasa bir yolsuzluk ve kara para aklama skandalının merkezinde yer alıyor. HSBC'ye büyük şok: Merkez Bankası fonları için soruşturma başlatıldı FRANSIZ SAVCILARDAN ÖN SUÇLAMA İÇ UYARILAR YILLARCA GÖRMEZDEN GELİNDİ PARAVAN ŞİRKET VE GEÇİŞ KANALLARI GEÇ KALINAN BİLDİRİM VE MİLYARLIK SABIKA HSBC’nin İsviçre birimi, Lübnan Merkez Bankası’nın eski başkanı Riad Salameh ve yakınlarının yüz milyonlarca dolarlık kara para aklama faaliyetlerine göz yummakla suçlanıyor. Avrupa'nın en büyük bankacılık gruplarından HSBC, İsviçre'deki özel bankacılık birimi üzerinden yürütülen devasa bir yolsuzluk ve kara para aklama skandalının merkezinde yer alıyor. Fransız yargısı, Riad Salameh’in kamu fonlarını zimmetine geçirmesine yardımcı olduğu gerekçesiyle HSBC İsviçre Özel Bankası hakkında ön suçlama kararı aldı. Soruşturma dosyasına göre Panama Belgeleri ile tanınan hukuk firması Mossack Fonseca tarafından yönetilen Forry Associates'in hiçbir gerçek ticari faaliyeti, çalışanı veya müşterisi bulunmuyordu.",browser_full_article,https://www.sozcu.com.tr/amp/hsbc-ye-buyuk-sok-merkez-bankasi-fonlari-icin-sorusturma-baslatildi-p330663,,,,,,,,il yok | ilçe yok | firma yok | faaliyet/tesis yok,,,,maps araması yapılmadı,,,75.75,3
2026-06-23 22:57:00,kara para,Banka / Finansal Kuruluş,Büyük miktarda para transferi: Bankanın işlemi inceleyip kontrol etmesine neden olacak 4 olağandışı işaret.,Büyük miktarda para transferi: Bankanın işlemi inceleyip kontrol etmesine neden olacak 4 olağandışı işaret. Vietnam.vn,https://news.google.com/rss/articles/CBMivgFBVV95cUxOR25jbDVwY0FsU2NlLVgtNkI0TVIwZElkaFkwa0RLY3FSWGZYU1dlY3RwY1g4OTlxa1Z5S0F5Sjk1VFZaN3BtNmV1XzE3OUdqRDByLUg4SWgwakN3VnVFT2RWZURHd2Z2ZzNHTkZqTkRybVkwTHlOSWIzRVN5SWZlYnpnS3d6UTdodnlSNlJRRU1yQ09ERHQ1c1NzWmxPUlIySlAwanVGa2Rmc0d0SWhqNm5lT2k5di1PTVczRlNR?oc=5,"banka, para transferi",finansal kuruluş,Büyük miktarda para transferi: Bankanın işlemi inceleyip kontrol etmesine neden olacak 4 olağandışı işaret. Vietnam.vn,Büyük miktarda para transferi: Bankanın işlemi inceleyip kontrol etmesine neden olacak 4 olağandışı işaret. Büyük miktarda para transferi: Bankanın işlemi inceleyip kontrol etmesine neden olacak 4 olağandışı işaret. Vietnam.vn Büyük miktarda para transferi: Bankanın işlemi inceleyip kontrol etmesine neden olacak 4 olağandışı işaret.,browser_failed,https://news.google.com/rss/articles/CBMivgFBVV95cUxOR25jbDVwY0FsU2NlLVgtNkI0TVIwZElkaFkwa0RLY3FSWGZYU1dlY3RwY1g4OTlxa1Z5S0F5Sjk1VFZaN3BtNmV1XzE3OUdqRDByLUg4SWgwakN3VnVFT2RWZURHd2Z2ZzNHTkZqTkRybVkwTHlOSWIzRVN5SWZlYnpnS3d6UTdodnlSNlJRRU1yQ09ERHQ1c1NzWmxPUlIySlAwanVGa2Rmc0d0SWhqNm5lT2k5di1PTVczRlNR?oc=5&hl=tr&gl=TR&ceid=TR:tr,,,,,,,,il yok | ilçe yok | firma yok | faaliyet/tesis yok,,,,maps araması yapılmadı,,,90.18,4
