published,search_term,category,title,summary,link,matched_words,activity_type,raw_text,entity_source_text,article_fetch_status,resolved_article_url,city_candidates,district_candidates,neighborhood_candidates,street_candidates,facility_candidates,company_candidates,company_candidate_scores,entity_quality_note,maps_queries,maps_candidates,maps_best_guess,maps_status,maps_match_scores,maps_rejected_candidates,record_quality_score,duplicate_group_id
2026-07-06 06:35:00,konkordato,İflas / Konkordato / Mali Sorun,Dünyaca ünlü markalara üretim yapıyordu… İzmirli firmadan konkordato kararı,Dünyaca ünlü markalara üretim yapıyordu… İzmirli firmadan konkordato kararı İz Gazete,https://news.google.com/rss/articles/CBMioAFBVV95cUxOd3V3Yl9SdHNUVC1iVUxSN053dDZ3cFlKR1dOZ0RFN3RLeDZoODJxQ2hkdDNLN2J2MlhuTW8yR0w4NzRTazVVRnNPNzBDNzVkZ2JVNjN5bFBneDlQcVZueEIzWGZ5MjVhWXFfVVpLMjFTcGlma3lIaTVPSWdOUzFIbllfVHhzbG1HWE53VTRRZDdnTDEyUWNWejd5N1pVWmh0?oc=5,"firma, üretim",üretim tesisi | şirket / firma,Dünyaca ünlü markalara üretim yapıyordu… İzmirli firmadan konkordato kararı İz Gazete,Dünyaca ünlü markalara üretim yapıyordu… İzmirli firmadan konkordato kararı Dünyaca ünlü markalara üretim yapıyordu… İzmirli firmadan konkordato kararı İz Gazete Dünyaca ünlü markalara üretim yapıyordu… İzmirli firmadan konkordato kararı İz Gazete,browser_failed,https://news.google.com/rss/articles/CBMioAFBVV95cUxOd3V3Yl9SdHNUVC1iVUxSN053dDZ3cFlKR1dOZ0RFN3RLeDZoODJxQ2hkdDNLN2J2MlhuTW8yR0w4NzRTazVVRnNPNzBDNzVkZ2JVNjN5bFBneDlQcVZueEIzWGZ5MjVhWXFfVVpLMjFTcGlma3lIaTVPSWdOUzFIbllfVHhzbG1HWE53VTRRZDdnTDEyUWNWejd5N1pVWmh0?oc=5&hl=tr&gl=TR&ceid=TR:tr,,,,,,,,il yok | ilçe yok | firma yok | faaliyet/tesis yok,,,,maps araması yapılmadı,,,65.6,98
2026-07-07 08:07:42,konkordato,İflas / Konkordato / Mali Sorun,Tekstil devine konkordato kararı: 3 aylık süre verildi,Tekstil devine konkordato kararı: 3 aylık süre verildi Bursa Hakimiyet,https://news.google.com/rss/articles/CBMipgFBVV95cUxQVk00V084aU5yQ0hBWUdUSlRZX0ZMY3NyMUd4TWhHbnl0b0ZkNkd3UXJEWDllN05ZZkY0N0NOSEVRanFidWY1cGM5UHZBZFJJTUMydy1UZHFFbzBGX3VDUGYwV2d5eWJBYjhmOHl5ZmIzOWNCTk5PeXpsRzBYQ3lybENKR1dKTkFPSENicjhRWmtlMW1mM2JPNjBzMnlzLTN6UjJIQmxR?oc=5,tekstil,,"İzmir’de faaliyet gösteren Sir Hazır Giyim için mahkeme 3 aylık geçici konkordato kararı verdi. Şirketin süreci komiserler eşliğinde yürütülecek. Tekstil devine konkordato kararı: 3 aylık süre verildi İzmir’de faaliyet gösteren Sir Hazır Giyim için mahkeme 3 aylık geçici konkordato kararı verdi. Şirketin süreci komiserler eşliğinde yürütülecek. İzmir’de birçok yerli ve yabancı markaya üretim yapan Sir Hazır Giyim için mahkeme geçici konkordato kararı verdi. Şirkete 3 ay süre tanınırken süreç yakından takip edilecek. İzmir’de faaliyet gösteren Sir Hazır Giyim Tekstil Sanayi ve Ticaret Limited Şirketi hakkında açılan dava kapsamında önemli bir gelişme yaşandı. İzmir 2. Asliye Ticaret Mahkemesi, şirket için 3 ay süreyle geçici konkordato mühleti verilmesine hükmetti. MAHKEMEDEN 3 AYLIK GEÇİCİ MÜHLET KARARI Mahkeme tarafından yapılan incelemede, konkordato başvurusunda İcra ve İflas Kanunu’nun 286’ncı maddesi kapsamında gerekli tüm belgelerin eksiksiz sunulduğu tespit edildi. Bu doğrultuda, şirket için 3 Temmuz 2026 saat 10.00 itibarıyla geçerli olmak üzere 3 aylık geçici mühlet kararı alındı. Süreci denetlemek üzere iki geçici konkordato komiseri de görevlendirildi. BİRÇOK MARKAYA ÜRETİM YAPIYOR Şirketin, erkek hazır giyim alanında üretim faaliyetlerini sürdürdüğü ve hem Türkiye’den hem de yurt dışından çok sayıda markaya üretim yaptığı biliniyor. Bu markalar arasında Kiğılı, Abdullah Kiğılı Exclusive Cut, Armani Collezioni, Versace Collection ve s.Oliver gibi önemli isimler yer alıyor. Gaziemir’de faaliyet gösteren şirketin sahibi iş insanı Birsen Bal olurken, firmada 400’ün üzerinde kişinin çalıştığı ifade ediliyor. Şirket ayrıca 2024 Hazır Giyim ve Konfeksiyon İhracatının Yıldızları Ödül Töreni’nde gümüş ödül kazanmıştı. ALACAKLILARA 7 GÜNLÜK İTİRAZ HAKKI Mahkeme kararında, alacaklıların ilan tarihinden itibaren 7 gün içinde geçici konkordato mühletine itiraz edebileceği ve konkordato talebinin reddini isteyebileceği belirtildi. Konkordato davasının bir sonraki duruşmasının 30 Eylül 2026 saat 14.00’te İzmir 2. Asliye Ticaret Mahkemesi’nde görüleceği bildirildi.","Tekstil devine konkordato kararı: 3 aylık süre verildi Tekstil devine konkordato kararı: 3 aylık süre verildi Bursa Hakimiyet İzmir’de faaliyet gösteren Sir Hazır Giyim için mahkeme 3 aylık geçici konkordato kararı verdi. Şirketin süreci komiserler eşliğinde yürütülecek. Tekstil devine konkordato kararı: 3 aylık süre verildi İzmir’de faaliyet gösteren Sir Hazır Giyim için mahkeme 3 aylık geçici konkordato kararı verdi. İzmir’de birçok yerli ve yabancı markaya üretim yapan Sir Hazır Giyim için mahkeme geçici konkordato kararı verdi. Şirkete 3 ay süre tanınırken süreç yakından takip edilecek. İzmir’de faaliyet gösteren Sir Hazır Giyim Tekstil Sanayi ve Ticaret Limited Şirketi hakkında açılan dava kapsamında önemli bir gelişme yaşandı. Asliye Ticaret Mahkemesi, şirket için 3 ay süreyle geçici konkordato mühleti verilmesine hükmetti. MAHKEMEDEN 3 AYLIK GEÇİCİ MÜHLET KARARI Mahkeme tarafından yapılan incelemede, konkordato başvurusunda İcra ve İflas Kanunu’nun 286’ncı maddesi kapsamında gerekli tüm belgelerin eksiksiz sunulduğu tespit edildi. Bu doğrultuda, şirket için 3 Temmuz 2026 saat 10.00 itibarıyla geçerli olmak üzere 3 aylık geçici mühlet kararı alındı. Süreci denetlemek üzere iki geçici konkordato komiseri de görevlendirildi. BİRÇOK MARKAYA ÜRETİM YAPIYOR Şirketin, erkek hazır giyim alanında üretim faaliyetlerini sürdürdüğü ve hem Türkiye’den hem de yurt dışından çok sayıda markaya üretim yaptığı biliniyor. Bu markalar arasında Kiğılı, Abdullah Kiğılı Exclusive Cut, Armani Collezioni, Versace Collection ve s.Oliver gibi önemli isimler yer alıyor. Gaziemir’de faaliyet gösteren şirketin sahibi iş insanı Birsen Bal olurken, firmada 400’ün üzerinde kişinin çalıştığı ifade ediliyor. Şirket ayrıca 2024 Hazır Giyim ve Konfeksiyon İhracatının Yıldızları Ödül Töreni’nde gümüş ödül kazanmıştı. ALACAKLILARA 7 GÜNLÜK İTİRAZ HAKKI Mahkeme kararında, alacaklıların ilan tarihinden itibaren 7 gün içinde geçici konkordato mühletine itiraz edebileceği ve konkordato talebinin reddini isteyebileceği belirtildi. Konkordato davasının bir sonraki duruşmasının 30 Eylül 2026 saat 14.00’te İzmir 2. Asliye Ticaret Mahkemesi’nde görüleceği bildirildi.",browser_full_article,https://www.bursahakimiyet.com.tr/ekonomi/tekstil-devine-konkordato-karari-3-aylik-sure-verildi-1664627,İzmir,Gaziemir,,,,,,firma yok | faaliyet/tesis yok,,,,maps araması yapılmadı,,,85.5,99
2026-07-03 13:30:00,konkordato,İflas / Konkordato / Mali Sorun,Agon Enerji'den konkordato açıklaması,Agon Enerji'den konkordato açıklaması Enerji Günlüğü,https://news.google.com/rss/articles/CBMisgFBVV95cUxPYUh1a0hCM1cxTUpWZnFqLURBazgwMmdLVkVmRnpuM2diODJseUVhSUh0S2F5TG5qQ1dqcmpoV040YTk4aFBCdlE1TVRFaDFURnhkS3VIaHFoeUJ6cC1DSm5ocHQxLTFkTkdQdlFWbzBYcE5NTzFJd01ENkc1bW91UmlXVjAycTc3dDdBcmtCWUZyVUl3TmIzNmtMZ0ozWHJsMnA4d3Jqak04LURtbWs2U2R30gHCAUFVX3lxTE5mdlg5RGpvaHlHcU05cl9HbGpwdEw0OUhPS05yNEJnWWJ5ZnBHalA1TVY1YUU5Q2RQcF9RODVDNXBRTkhlUkRyTjhIeFUzOGVLQVRKcW44Qnl6WFFsWGM4NkZjQ1lBMFZ4S0hMTlVWcXo3TDhyTEJDRmtIdnRvbFRieGx5ZzZEdW8tRm01VHBkMEVMbFZueWFPX2JLeVdHMlVEWEhSVXJUWVo5eTVtUUx1cTdIdzE4QTJQQ1kyWlZ4QTRR?oc=5,enerji,,Agon Enerji'den konkordato açıklaması Enerji Günlüğü,Agon Enerji'den konkordato açıklaması Agon Enerji'den konkordato açıklaması Enerji Günlüğü Agon Enerji'den konkordato açıklaması Enerji Günlüğü,browser_failed,https://news.google.com/rss/articles/CBMisgFBVV95cUxPYUh1a0hCM1cxTUpWZnFqLURBazgwMmdLVkVmRnpuM2diODJseUVhSUh0S2F5TG5qQ1dqcmpoV040YTk4aFBCdlE1TVRFaDFURnhkS3VIaHFoeUJ6cC1DSm5ocHQxLTFkTkdQdlFWbzBYcE5NTzFJd01ENkc1bW91UmlXVjAycTc3dDdBcmtCWUZyVUl3TmIzNmtMZ0ozWHJsMnA4d3Jqak04LURtbWs2U2R30gHCAUFVX3lxTE5mdlg5RGpvaHlHcU05cl9HbGpwdEw0OUhPS05yNEJnWWJ5ZnBHalA1TVY1YUU5Q2RQcF9RODVDNXBRTkhlUkRyTjhIeFUzOGVLQVRKcW44Qnl6WFFsWGM4NkZjQ1lBMFZ4S0hMTlVWcXo3TDhyTEJDRmtIdnRvbFRieGx5ZzZEdW8tRm01VHBkMEVMbFZueWFPX2JLeVdHMlVEWEhSVXJUWVo5eTVtUUx1cTdIdzE4QTJQQ1kyWlZ4QTRR?oc=5&hl=tr&gl=TR&ceid=TR:tr,,,,,,Agon Enerji,Agon Enerji:292:body+summary+title,il yok | ilçe yok | faaliyet/tesis yok,Agon Enerji Türkiye,Agon Enerji,Agon Enerji,firma adı + güvenli maps adayı var,100.0,,146.02,100
2026-07-06 05:46:20,konkordato,İflas / Konkordato / Mali Sorun,Dünya devlerine üretim yapan İzmirli erkek giyim markası konkordato ilan etti,Dünya devlerine üretim yapan İzmirli erkek giyim markası konkordato ilan etti Tek Referans,https://news.google.com/rss/articles/CBMinAFBVV95cUxNUjZveXM0YU54YUdydlBqcFlYS0p4M3d3T2doem1SOUlIVW9hTks3VDdpV1RRdlJiYUdrODBmNmQ0aUxXMERlbGFhUVlwb2VTajVRX2VDalNGT19BdFNma3VxN3FldUt5RHYweEZoSlpTWXNneGl1RFpnLV9fU0tVZkt1VjRqems2alh2RnNONGlvdi1tNVVmTHhtSms?oc=5,üretim,üretim tesisi,Dünya devlerine üretim yapan İzmirli erkek giyim markası konkordato ilan etti Tek Referans,Dünya devlerine üretim yapan İzmirli erkek giyim markası konkordato ilan etti Dünya devlerine üretim yapan İzmirli erkek giyim markası konkordato ilan etti Tek Referans Dünya devlerine üretim yapan İzmirli erkek giyim markası konkordato ilan etti Tek Referans,browser_failed,https://news.google.com/rss/articles/CBMinAFBVV95cUxNUjZveXM0YU54YUdydlBqcFlYS0p4M3d3T2doem1SOUlIVW9hTks3VDdpV1RRdlJiYUdrODBmNmQ0aUxXMERlbGFhUVlwb2VTajVRX2VDalNGT19BdFNma3VxN3FldUt5RHYweEZoSlpTWXNneGl1RFpnLV9fU0tVZkt1VjRqems2alh2RnNONGlvdi1tNVVmTHhtSms?oc=5&hl=tr&gl=TR&ceid=TR:tr,,,,,,,,il yok | ilçe yok | firma yok | faaliyet/tesis yok,,,,maps araması yapılmadı,,,77.9,101
2026-07-07 06:06:00,konkordato,İflas / Konkordato / Mali Sorun,Bursa'da biyokütle enerji şirketinin konkordato süresi uzatıldı,Bursa'da biyokütle enerji şirketinin konkordato süresi uzatıldı Bursada Bugün,https://news.google.com/rss/articles/CBMisAFBVV95cUxOM0NrMnFIUGlmR1Bsa1pDbnV4ZDVmOTJCYVRUcXF4X1dBbWZRUzZSckFyXzQ1VzZjdlFRUXdGRzVVSmMySmlKMzdKS1EwNEhYWTEwbDFoTTgzOXhsN0l3OUlOLWl4N2I3ZXNTdERtMldEcXBfaWpleWRyTWhDeU0yYUw1SFpSb1lVYjV1RU9MLUwzRmtiOEdOcTR2TEpoNWV2NjlGUVVTa1YxMW8xa19IS9IBswFBVV95cUxNNmlDZnRpQ2FuWWU4YlRncERjUVdZb1NpTnU0NHVXdEZCMGZyOXAyQmJLMDQ4UUxGWVlUMzhvVXZVZjNhenZKcGo1aXNmS2twM3BLUU1JT0p6NDNWRDg5M3lYZnlKREZ5MEFLOWYyRlN0eU5FUkNkRnVNOTd3WFR2SWlwY2FSYzI2aTBBZHdmQVRhbjliRHIyUmFGUXJtTzBEeUNSNktkMkR2T3BubDZfd1A5NA?oc=5,"enerji, şirket",şirket / firma,"Bursa'da ZNP Biyokütle Enerji'nin konkordato geçici mühleti 13 gün uzatıldı. İcra işlemleri dururken, kesin mühlet için duruşma 16 Temmuz 2026'da yapılacak. Bursa'da ZNP Biyokütle Enerji'nin konkordato geçici mühleti 13 gün uzatıldı. İcra işlemleri dururken, kesin mühlet için duruşma 16 Temmuz 2026'da yapılacak. Bursa'da ZNP Biyokütle Enerji'nin konkordato geçici mühleti 13 gün uzatıldı. İcra işlemleri dururken, kesin mühlet için duruşma 16 Temmuz 2026'da yapılacak. Bursa'da biyokütle enerji şirketinin konkordato süresi uzatıldı Geçici Konkordato Mühleti İçin Yeni Mahkeme Kararı İcra ve Haciz İşlemleri Geçici Olarak Askıda Kalacak Konkordato Komiserleri Denetim Görevini Sürdürecek Kesin Mühlet İçin Kritik Duruşma Temmuz Ayında Yapılacak Verilecek Karar Şirketin Geleceğini Doğrudan Etkileyecek Bursa'da ZNP Biyokütle Enerji'nin konkordato geçici mühleti 13 gün uzatıldı. İcra işlemleri dururken, kesin mühlet için duruşma 16 Temmuz 2026'da yapılacak. Bursa'da faaliyetlerini sürdüren ZNP Biyokütle Enerji Sanayi ve Ticaret AŞ hakkında devam eden konkordato yargılamasında önemli bir ara karar çıktı. Mali yapısını yeniden düzenlemek amacıyla konkordato talebinde bulunan şirket için daha önce verilen geçici mühletin süresi mahkeme kararıyla uzatıldı. Alınan kararla birlikte şirketin konkordato kapsamındaki hukuki korumaları da belirlenen süre boyunca geçerliliğini sürdürecek. Şirketin geleceği açısından kritik öneme sahip dosyada, bir sonraki duruşmada verilecek karar ise konkordato sürecinin nasıl ilerleyeceğini belirleyecek. Bursa 2. Asliye Ticaret Mahkemesi tarafından yürütülen konkordato dosyasında yapılan değerlendirme sonucunda, daha önce tanınan geçici mühletin uzatılmasına hükmedildi. Mahkeme, şirketin mevcut durumunun değerlendirilmesi amacıyla sürenin 3 Temmuz 2026 tarihinden itibaren 13 gün daha devam etmesine karar verdi. Bu kararla birlikte ZNP Biyokütle Enerji'nin konkordato süreci kesintiye uğramadan devam edecek. Şirket, mahkemenin sağladığı yasal koruma kapsamında faaliyetlerini sürdürme imkânını korurken, mali yapısının yeniden değerlendirilmesi için de ek zaman kazanmış oldu. Mahkemenin verdiği süre uzatma kararı yalnızca konkordato takvimini değil, şirket hakkında uygulanabilecek hukuki işlemleri de doğrudan etkiliyor. Geçici mühlet boyunca şirket aleyhine yeni icra takipleri başlatılamayacak, devam eden takip işlemleri ise konkordato hükümleri doğrultusunda durdurulmuş olacak. Bunun yanında ihtiyati haciz, ihtiyati tedbir ve muhafaza işlemleri de geçici mühlet süresince uygulanamayacak. Böylece şirket, mali yeniden yapılanma sürecini baskı oluşturan icra işlemlerinden uzak şekilde yürütme fırsatı elde edecek. Ancak mahkeme kararındaki koruma tedbirleri tüm alacak türlerini kapsamıyor. İlgili mevzuatta öncelikli alacak olarak değerlendirilen bazı alacaklar ile rehinle güvence altına alınan alacaklar bakımından mevcut yasal istisnalar geçerliliğini sürdürüyor. Konkordato sürecinin en önemli unsurlarından biri olan komiser heyeti de görevine devam edecek. Mahkemenin ara kararı doğrultusunda görevlendirilen konkordato komiserleri, şirketin mali tablolarını, ticari faaliyetlerini ve konkordato sürecindeki gelişmeleri yakından takip etmeyi sürdürecek. Komiserler tarafından hazırlanacak raporlar ve yapılacak incelemeler, mahkemenin ilerleyen aşamalarda vereceği kararlar açısından önemli değerlendirme kriterleri arasında yer alacak. Şirketin ödeme planına uyumu, mali yapısındaki gelişmeler ve alacaklıların durumu da bu süreçte ayrıntılı şekilde incelenecek. Dosyada bundan sonraki en önemli aşama ise 16 Temmuz 2026 Perşembe günü saat 14.00'te gerçekleştirilecek duruşma olacak. Bursa 2. Asliye Ticaret Mahkemesi'nde görülecek duruşmada, şirketin kesin konkordato mühleti talebi kapsamlı şekilde değerlendirilecek. Bu oturumda yalnızca şirketin sunduğu mali veriler değil, konkordato komiserlerinin hazırladığı raporlar ve dosyadaki tüm belgeler de mahkeme tarafından incelenecek. Aynı zamanda alacaklılar da yasal hakları kapsamında duruşmaya katılarak görüşlerini ve itirazlarını mahkemeye sunabilecek. Konkordato dosyasında verilecek kesin mühlet kararı, ZNP Biyokütle Enerji'nin mali yeniden yapılanma sürecinin devam edip etmeyeceği açısından belirleyici olacak. Mahkemenin değerlendirmesi doğrultusunda şirket ya konkordato sürecine daha uzun vadeli koruma altında devam edecek ya da dosyanın seyri farklı bir aşamaya taşınacak. Enerji sektöründe faaliyet gösteren şirketler açısından konkordato süreçleri yalnızca ilgili işletmeyi değil, alacaklıları, tedarikçileri, iş ortaklarını ve ticari ilişkileri de yakından ilgilendiriyor. Bu nedenle Bursa'da devam eden dosyada alınacak nihai kararın, hem şirketin faaliyet planı hem de tarafların hukuki hakları bakımından önemli sonuçlar doğurması bekleniyor. Mahkemenin verdiği süre uzatma kararıyla birlikte süreç şimdilik mevcut koruma tedbirleri altında devam ederken, gözler şimdi temmuz ayında yapılacak duruşmaya çevrilmiş durumda. Bu duruşmada alınacak karar, konkordato sürecinin bundan sonraki yol haritasını şekillendirecek en kritik gelişme olarak öne çıkıyor. Diğer Bursa Haberleri - Bölge Haberleri için tıklayın Gül Onat'tan duygulandıran paylaşım!","Bursa'da biyokütle enerji şirketinin konkordato süresi uzatıldı Bursa'da biyokütle enerji şirketinin konkordato süresi uzatıldı Bursada Bugün Bursa'da ZNP Biyokütle Enerji'nin konkordato geçici mühleti 13 gün uzatıldı. İcra işlemleri dururken, kesin mühlet için duruşma 16 Temmuz 2026'da yapılacak. Bursa'da biyokütle enerji şirketinin konkordato süresi uzatıldı Geçici Konkordato Mühleti İçin Yeni Mahkeme Kararı İcra ve Haciz İşlemleri Geçici Olarak Askıda Kalacak Konkordato Komiserleri Denetim Görevini Sürdürecek Kesin Mühlet İçin Kritik Duruşma Temmuz Ayında Yapılacak Verilecek Karar Şirketin Geleceğini Doğrudan Etkileyecek Bursa'da ZNP Biyokütle Enerji'nin konkordato geçici mühleti 13 gün uzatıldı. Bursa'da faaliyetlerini sürdüren ZNP Biyokütle Enerji Sanayi ve Ticaret AŞ hakkında devam eden konkordato yargılamasında önemli bir ara karar çıktı. Mali yapısını yeniden düzenlemek amacıyla konkordato talebinde bulunan şirket için daha önce verilen geçici mühletin süresi mahkeme kararıyla uzatıldı. Alınan kararla birlikte şirketin konkordato kapsamındaki hukuki korumaları da belirlenen süre boyunca geçerliliğini sürdürecek. Şirketin geleceği açısından kritik öneme sahip dosyada, bir sonraki duruşmada verilecek karar ise konkordato sürecinin nasıl ilerleyeceğini belirleyecek. Asliye Ticaret Mahkemesi tarafından yürütülen konkordato dosyasında yapılan değerlendirme sonucunda, daha önce tanınan geçici mühletin uzatılmasına hükmedildi. Mahkeme, şirketin mevcut durumunun değerlendirilmesi amacıyla sürenin 3 Temmuz 2026 tarihinden itibaren 13 gün daha devam etmesine karar verdi. Bu kararla birlikte ZNP Biyokütle Enerji'nin konkordato süreci kesintiye uğramadan devam edecek. Şirket, mahkemenin sağladığı yasal koruma kapsamında faaliyetlerini sürdürme imkânını korurken, mali yapısının yeniden değerlendirilmesi için de ek zaman kazanmış oldu. Mahkemenin verdiği süre uzatma kararı yalnızca konkordato takvimini değil, şirket hakkında uygulanabilecek hukuki işlemleri de doğrudan etkiliyor. Geçici mühlet boyunca şirket aleyhine yeni icra takipleri başlatılamayacak, devam eden takip işlemleri ise konkordato hükümleri doğrultusunda durdurulmuş olacak. Böylece şirket, mali yeniden yapılanma sürecini baskı oluşturan icra işlemlerinden uzak şekilde yürütme fırsatı elde edecek. İlgili mevzuatta öncelikli alacak olarak değerlendirilen bazı alacaklar ile rehinle güvence altına alınan alacaklar bakımından mevcut yasal istisnalar geçerliliğini sürdürüyor. Konkordato sürecinin en önemli unsurlarından biri olan komiser heyeti de görevine devam edecek. Mahkemenin ara kararı doğrultusunda görevlendirilen konkordato komiserleri, şirketin mali tablolarını, ticari faaliyetlerini ve konkordato sürecindeki gelişmeleri yakından takip etmeyi sürdürecek. Şirketin ödeme planına uyumu, mali yapısındaki gelişmeler ve alacaklıların durumu da bu süreçte ayrıntılı şekilde incelenecek. Dosyada bundan sonraki en önemli aşama ise 16 Temmuz 2026 Perşembe günü saat 14.00'te gerçekleştirilecek duruşma olacak. Asliye Ticaret Mahkemesi'nde görülecek duruşmada, şirketin kesin konkordato mühleti talebi kapsamlı şekilde değerlendirilecek. Bu oturumda yalnızca şirketin sunduğu mali veriler değil, konkordato komiserlerinin hazırladığı raporlar ve dosyadaki tüm belgeler de mahkeme tarafından incelenecek. Aynı zamanda alacaklılar da yasal hakları kapsamında duruşmaya katılarak görüşlerini ve itirazlarını mahkemeye sunabilecek. Konkordato dosyasında verilecek kesin mühlet kararı, ZNP Biyokütle Enerji'nin mali yeniden yapılanma sürecinin devam edip etmeyeceği açısından belirleyici olacak. Mahkemenin değerlendirmesi doğrultusunda şirket ya konkordato sürecine daha uzun vadeli koruma altında devam edecek ya da dosyanın seyri farklı bir aşamaya taşınacak. Enerji sektöründe faaliyet gösteren şirketler açısından konkordato süreçleri yalnızca ilgili işletmeyi değil, alacaklıları, tedarikçileri, iş ortaklarını ve ticari ilişkileri de yakından ilgilendiriyor. Bu nedenle Bursa'da devam eden dosyada alınacak nihai kararın, hem şirketin faaliyet planı hem de tarafların hukuki hakları bakımından önemli sonuçlar doğurması bekleniyor. Bu duruşmada alınacak karar, konkordato sürecinin bundan sonraki yol haritasını şekillendirecek en kritik gelişme olarak öne çıkıyor.",browser_full_article,https://www.bursadabugun.com/haber/bursa-da-biyokutle-enerji-sirketinin-konkordato-suresi-uzatildi-1933661.html,Bursa,,,,,ZNP Biyokütle Enerji Sanayi ve Ticaret AŞ,ZNP Biyokütle Enerji Sanayi ve Ticaret AŞ:57:body | ZNP Biyokütle Enerji Sanayi ve Ticaret AŞ:raw_legal,ilçe yok | faaliyet/tesis yok,ZNP Biyokütle Enerji Sanayi ve Ticaret AŞ Bursa Türkiye,ZNP Biokütle Enerji,ZNP Biokütle Enerji,firma adı + güvenli maps adayı var,68.9655172413793,,171.15,102
2026-07-07 10:21:43,konkordato,İflas / Konkordato / Mali Sorun,Versace ve Armani’ye Üretiyordu! Dev Türk Tekstil Firmasından Konkordato Kararı,Versace ve Armani’ye Üretiyordu! Dev Türk Tekstil Firmasından Konkordato Kararı Para Analiz,https://news.google.com/rss/articles/CBMitAFBVV95cUxOMGRXTUcxRy01UHZCRE83UU4xWUI1Wlo4X0lEaV81OEtkYWJFVEI4elZZZ3VzSEFLd3ZMbzlrUDlMell2VkxQZU1uSldxTWdDclppTFFTSFpvWmxNcHFIcjNKc0JNMkU0RUFnaEJzLThaR2x6alJ3WjVzM2o5SUdIUW9Qd0R0WU5KY0tabVdKTHFYZzZEX3N5ZmhDZEx6NkVIeUxaS05NVmttNjBxTlZ1U2FsZ3A?oc=5,"firma, tekstil",şirket / firma,Versace ve Armani’ye Üretiyordu! Dev Türk Tekstil Firmasından Konkordato Kararı Para Analiz,Versace ve Armani’ye Üretiyordu! Dev Türk Tekstil Firmasından Konkordato Kararı Versace ve Armani’ye Üretiyordu! Dev Türk Tekstil Firmasından Konkordato Kararı Para Analiz Versace ve Armani’ye Üretiyordu! Dev Türk Tekstil Firmasından Konkordato Kararı Para Analiz,browser_failed,https://news.google.com/rss/articles/CBMitAFBVV95cUxOMGRXTUcxRy01UHZCRE83UU4xWUI1Wlo4X0lEaV81OEtkYWJFVEI4elZZZ3VzSEFLd3ZMbzlrUDlMell2VkxQZU1uSldxTWdDclppTFFTSFpvWmxNcHFIcjNKc0JNMkU0RUFnaEJzLThaR2x6alJ3WjVzM2o5SUdIUW9Qd0R0WU5KY0tabVdKTHFYZzZEX3N5ZmhDZEx6NkVIeUxaS05NVmttNjBxTlZ1U2FsZ3A?oc=5&hl=tr&gl=TR&ceid=TR:tr,,,,,,,,il yok | ilçe yok | firma yok | faaliyet/tesis yok,,,,maps araması yapılmadı,,,69.16,103
2026-07-05 19:15:47,konkordato,İflas / Konkordato / Mali Sorun,Borsa şirketiyle başlayan konkordato dalgası holdinge yayıldı,Borsa şirketiyle başlayan konkordato dalgası holdinge yayıldı ParaMedya,https://news.google.com/rss/articles/CBMipAFBVV95cUxQbmRGcC05eXVsOXFQV01mT3BvZU9CLWJZVF9YUjBpejEzNWRHeTZzaXN4UlFPSU0zNzVLQUVOLWpsMXJOU1lhWGhleGs3WUNCQmZkRUh6bFBDd0ZnSi1OaTJRM2N2TVFmVnkxOFZtbUo2cVF6Um9pMVBGN01Hd2FKODV6ZFhHZ0x1QjdFbkRUamtrUFk4S19YcG1EMnhzZm1FZkI0Q9IBqgFBVV95cUxQeU9HYTlfYXJmSlZ4dlpTNWhtcGg2dG03VFE1SGN3NHBoc1ZpWDdmZ2I2MG9jZ2ZDYWR4WWNZbS1EVTJlWVB1TDFMNzRmNE5nRV9jSk5oNEQxbFV1WV9NUmtzSDY5T0NMWDlPaVNJeldrOGJ5dmg3bWxJOElpTHc1QTJNVmIxcXNvdUsxRjlXSF9MZG9jVXhXQURuV1NsUjZUZ0tWc0g4MWk4Zw?oc=5,"holding, şirket",şirket / firma,"www.paramedya.com Güvenlik doğrulaması yapılıyor Bu web sitesi, kötü niyetli botlara karşı korunmak için bir güvenlik hizmeti kullanıyor. Web sitesi bir bot olmadığınızı doğrularken bu sayfa görüntülenir. Doğrulama başarılı. www.paramedya.com adresinin yanıt vermesi bekleniyor Güvenlik doğrulaması yapılıyor Doğrulama başarılı. www.paramedya.com adresinin yanıt vermesi bekleniyor Bu web sitesi, kötü niyetli botlara karşı korunmak için bir güvenlik hizmeti kullanıyor. Web sitesi bir bot olmadığınızı doğrularken bu sayfa görüntülenir.","Borsa şirketiyle başlayan konkordato dalgası holdinge yayıldı Borsa şirketiyle başlayan konkordato dalgası holdinge yayıldı ParaMedya www.paramedya.com Güvenlik doğrulaması yapılıyor Bu web sitesi, kötü niyetli botlara karşı korunmak için bir güvenlik hizmeti kullanıyor. Web sitesi bir bot olmadığınızı doğrularken bu sayfa görüntülenir. www.paramedya.com adresinin yanıt vermesi bekleniyor Güvenlik doğrulaması yapılıyor Doğrulama başarılı. www.paramedya.com adresinin yanıt vermesi bekleniyor Bu web sitesi, kötü niyetli botlara karşı korunmak için bir güvenlik hizmeti kullanıyor.",browser_full_article,https://www.paramedya.com/devami/142762/borsa-sirketiyle-baslayan-konkordato-dalgasi-holdinge-yayildi/,,,,,,,,il yok | ilçe yok | firma yok | faaliyet/tesis yok,,,,maps araması yapılmadı,,,61.62,104
