published,search_term,category,title,summary,link,matched_words,activity_type,raw_text,entity_source_text,article_fetch_status,resolved_article_url,city_candidates,district_candidates,neighborhood_candidates,street_candidates,facility_candidates,company_candidates,company_candidate_scores,entity_quality_note,maps_queries,maps_candidates,maps_best_guess,maps_status,maps_match_scores,maps_rejected_candidates,record_quality_score,duplicate_group_id
2026-06-05 07:06:28,banka hesaplarına bloke,Kara Para / MASAK / Bahis,11 şirkete el konuldu! 24 ilde yasa dışı bahis operasyonu: 80 gözaltı,11 şirkete el konuldu! 24 ilde yasa dışı bahis operasyonu: 80 gözaltı Bizim Tv,https://news.google.com/rss/articles/CBMiuAFBVV95cUxOWEMtTkUta0NVS3c4aGF6bUNhTGw0ODU2Z1dmcHBPQUZtSGNKOGpCc0IzOElJa2hrU2p6YnBfY3hnUjZsLWxPTnBCVy14VHVMbm41eWxzUklFeGRMZG1IYWZjS2hram1GbmZiMVVVZ0RqS20xaE1wZTFfNGdMTmxRMm5nWXR4Q3FMZjdtbWVxZlk4Q09BYTh2WnpaMjBkVGdCMmFGNTVlcEVGb0tZdC1xRXhlc3IzZ25V0gG4AUFVX3lxTE5YQy1ORS1rQ1VLdzhoYXptQ2FMbDQ4NTZnV2ZwcE9BRm1IY0o4akJzQjM4SUlraGtTanpicF9jeGdSNmwtbE9OcEJXLXhUdUxubjV5bHNSSUV4ZExkbUhhZmNLaGtqbUZuZmIxVVVnRGpLbTFoTXBlMV80Z0xObFEybmdZdHhDcUxmN21tZXFmWThDT0FhOHZaeloyMGRUZ0IyYUY1NWVwRUZvS1l0LXFFeGVzcjNnblU?oc=5,"el konuldu, şirket",şirket / firma,"İstanbul merkezli 24 ilde yasa dışı bahis gelirlerinin aklanmasına yönelik düzenlenen operasyonda 80 kişi gözaltına alındı. Soruşturmada suç ağının 192 milyar liralık işlem hacmine ulaştığı belirlenirken, aralarında 11 şirketin de bulunduğu yaklaşık 350 milyon lira değerindeki mal varlığına el konuldu, banka ve kripto varlık hesapları bloke edildi. İstanbul merkezli 24 ilde yasa dışı bahis gelirlerinin aklanmasına yönelik düzenlenen operasyonda 80 kişi gözaltına alındı. Soruşturmada suç ağının 192 milyar liralık işlem hacmine ulaştığı belirlenirken, aralarında 11 şirketin de bulunduğu yaklaşık 350 milyon lira değerindeki mal varlığına el konuldu, banka ve kripto varlık hesapları bloke edildi. İstanbul merkezli 24 ilde yasa dışı bahis gelirlerinin aklanmasına yönelik düzenlenen operasyonda 80 kişi gözaltına alındı. Soruşturmada suç ağının 192 milyar liralık işlem hacmine ulaştığı belirlenirken, aralarında 11 şirketin de bulunduğu yaklaşık 350 milyon lira değerindeki mal varlığına el konuldu, banka ve kripto varlık hesapları bloke edildi. 11 şirkete el konuldu! 24 ilde yasa dışı bahis operasyonu: 80 gözaltı İstanbul merkezli 24 ilde yasa dışı bahis gelirlerinin aklanmasına yönelik düzenlenen operasyonda 80 kişi gözaltına alındı. Soruşturmada suç ağının 192 milyar liralık işlem hacmine ulaştığı belirlenirken, aralarında 11 şirketin de bulunduğu yaklaşık 350 milyon lira değerindeki mal varlığına el konuldu, banka ve kripto varlık hesapları bloke edildi. 05 Haziran 2026 Cuma 10:06 İstanbul merkezli 24 ilde yasa dışı bahis gelirlerinin aklanmasına yönelik düzenlenen operasyonda 80 şüpheli gözaltına alındı. Soruşturma kapsamında yaklaşık 350 milyon lira değerindeki mal varlığına el konulurken, şüphelilere ait banka ve kripto varlık hesapları da bloke edildi. İstanbul emniyeti Mali Suçlarla Mücadele Şube Müdürlüğü ekipleri, Anadolu Cumhuriyet Başsavcılığı koordinesinde yasa dışı bahis faaliyetlerinden elde edilen gelirlerin aklanmasına yönelik çalışma başlattı. Mali Suçları Araştırma Kurulu'nun (MASAK) yaptığı tespitlerde, şüpheli İ.Ö.Ö. tarafından koordine edilen suç ağının, önceden sonucu üzerinde anlaşma sağlanan müsabakalar ve yasal ile yasa dışı bahis faaliyetlerinden gelir elde ettiği belirlendi. Elde edilen gelirlerin kripto varlık cüzdanları aracılığıyla transfer edilerek kullanıcıları tespit edilemeyen farklı cüzdanlara aktarıldığı ortaya çıktı. Yapılan incelemelerde, suç ağı içerisinde döviz ve kuyumculuk sektöründe faaliyet gösteren kişilerin de yer aldığı, gerçekleştirilen işlemlerin toplam hacminin 192 milyar liraya ulaştığı belirlendi. BANKA VE KRİPTO HESAPLARINA BLOKE Soruşturma kapsamında bu sabah İstanbul merkezli 24 ilde düzenlenen eş zamanlı operasyonda 80 şüpheli yakalanarak gözaltına alındı. Operasyon kapsamında 11 şirkete, 45 araca, 16 konuta ve 11 tarla ile arsaya olmak üzere yaklaşık 350 milyon lira değerindeki toplam 83 menkul ve gayrimenkule el konuldu. Ayrıca şüphelilere ait banka hesapları ile kripto varlık hesaplarına bloke işlemi uygulandı. İlk yorum yazan siz olun Güncel Haberleri Akın Gürlek duyurdu... 27 ilde yasa dışı bahis operasyonu: 130 şüpheli hakkında adli işlem başlatıldı Buca Belediyesi soruşturması: Belediye başkanı Görkem Duman dahil 54 kişi adliyeye sevk edildi Meteoroloji açıkladı: Bugün hava nasıl olacak? 5 bin 300 yıllık mumyadan ekşi mayalı ekmek yaptılar Aziz Yıldırım'dan dikkat çeken Hakan Safi açıklaması: 'Fenerbahçe, gerçeklerle hayalleri ayırsın' İstanbul merkezli 24 ilde yasa dışı bahis gelirlerinin aklanmasına yönelik düzenlenen operasyonda 80 şüpheli gözaltına alındı. Soruşturma kapsamında yaklaşık 350 milyon lira değerindeki mal varlığına el konulurken, şüphelilere ait banka ve kripto varlık hesapları da bloke edildi. İstanbul emniyeti Mali Suçlarla Mücadele Şube Müdürlüğü ekipleri, Anadolu Cumhuriyet Başsavcılığı koordinesinde yasa dışı bahis faaliyetlerinden elde edilen gelirlerin aklanmasına yönelik çalışma başlattı. Mali Suçları Araştırma Kurulu'nun (MASAK) yaptığı tespitlerde, şüpheli İ.Ö.Ö. tarafından koordine edilen suç ağının, önceden sonucu üzerinde anlaşma sağlanan müsabakalar ve yasal ile yasa dışı bahis faaliyetlerinden gelir elde ettiği belirlendi. Elde edilen gelirlerin kripto varlık cüzdanları aracılığıyla transfer edilerek kullanıcıları tespit edilemeyen farklı cüzdanlara aktarıldığı ortaya çıktı. Yapılan incelemelerde, suç ağı içerisinde döviz ve kuyumculuk sektöründe faaliyet gösteren kişilerin de yer aldığı, gerçekleştirilen işlemlerin toplam hacminin 192 milyar liraya ulaştığı belirlendi. BANKA VE KRİPTO HESAPLARINA BLOKE Soruşturma kapsamında bu sabah İstanbul merkezli 24 ilde düzenlenen eş zamanlı operasyonda 80 şüpheli yakalanarak gözaltına alındı. Operasyon kapsamında 11 şirkete, 45 araca, 16 konuta ve 11 tarla ile arsaya olmak üzere yaklaşık 350 milyon lira değerindeki toplam 83 menkul ve gayrimenkule el konuldu. Ayrıca şüphelilere ait banka hesapları ile kripto varlık hesaplarına bloke işlemi uygulandı. 11 şirkete el konuldu! 24 ilde yasa dışı bahis operasyonu: 80 gözaltı İstanbul merkezli 24 ilde yasa dışı bahis gelirlerinin aklanmasına yönelik düzenlenen operasyonda 80 kişi gözaltına alındı. Soruşturmada suç ağının 192 milyar liralık işlem hacmine ulaştığı belirlenirken, aralarında 11 şirketin de bulunduğu yaklaşık 350 milyon lira değerindeki mal varlığına el konuldu, banka ve kripto varlık hesapları bloke edildi. İstanbul merkezli 24 ilde yasa dışı bahis gelirlerinin aklanmasına yönelik düzenlenen operasyonda 80 şüpheli gözaltına alındı. Soruşturma kapsamında yaklaşık 350 milyon lira değerindeki mal varlığına el konulurken, şüphelilere ait banka ve kripto varlık hesapları da bloke edildi. İstanbul emniyeti Mali Suçlarla Mücadele Şube Müdürlüğü ekipleri, Anadolu Cumhuriyet Başsavcılığı koordinesinde yasa dışı bahis faaliyetlerinden elde edilen gelirlerin aklanmasına yönelik çalışma başlattı. Mali Suçları Araştırma Kurulu'nun (MASAK) yaptığı tespitlerde, şüpheli İ.Ö.Ö. tarafından koordine edilen suç ağının, önceden sonucu üzerinde anlaşma sağlanan müsabakalar ve yasal ile yasa dışı bahis faaliyetlerinden gelir elde ettiği belirlendi. Elde edilen gelirlerin kripto varlık cüzdanları aracılığıyla transfer edilerek kullanıcıları tespit edilemeyen farklı cüzdanlara aktarıldığı ortaya çıktı. Yapılan incelemelerde, suç ağı içerisinde döviz ve kuyumculuk sektöründe faaliyet gösteren kişilerin de yer aldığı, gerçekleştirilen işlemlerin toplam hacminin 192 milyar liraya ulaştığı belirlendi. Soruşturma kapsamında bu sabah İstanbul merkezli 24 ilde düzenlenen eş zamanlı operasyonda 80 şüpheli yakalanarak gözaltına alındı. Operasyon kapsamında 11 şirkete, 45 araca, 16 konuta ve 11 tarla ile arsaya olmak üzere yaklaşık 350 milyon lira değerindeki toplam 83 menkul ve gayrimenkule el konuldu. Ayrıca şüphelilere ait banka hesapları ile kripto varlık hesaplarına bloke işlemi uygulandı.","11 şirkete el konuldu! 24 ilde yasa dışı bahis operasyonu: 80 gözaltı 11 şirkete el konuldu! 24 ilde yasa dışı bahis operasyonu: 80 gözaltı Bizim Tv İstanbul merkezli 24 ilde yasa dışı bahis gelirlerinin aklanmasına yönelik düzenlenen operasyonda 80 kişi gözaltına alındı. Soruşturmada suç ağının 192 milyar liralık işlem hacmine ulaştığı belirlenirken, aralarında 11 şirketin de bulunduğu yaklaşık 350 milyon lira değerindeki mal varlığına el konuldu, banka ve kripto varlık hesapları bloke edildi. 24 ilde yasa dışı bahis operasyonu: 80 gözaltı İstanbul merkezli 24 ilde yasa dışı bahis gelirlerinin aklanmasına yönelik düzenlenen operasyonda 80 kişi gözaltına alındı. 05 Haziran 2026 Cuma 10:06 İstanbul merkezli 24 ilde yasa dışı bahis gelirlerinin aklanmasına yönelik düzenlenen operasyonda 80 şüpheli gözaltına alındı. Soruşturma kapsamında yaklaşık 350 milyon lira değerindeki mal varlığına el konulurken, şüphelilere ait banka ve kripto varlık hesapları da bloke edildi. İstanbul emniyeti Mali Suçlarla Mücadele Şube Müdürlüğü ekipleri, Anadolu Cumhuriyet Başsavcılığı koordinesinde yasa dışı bahis faaliyetlerinden elde edilen gelirlerin aklanmasına yönelik çalışma başlattı. Mali Suçları Araştırma Kurulu'nun (MASAK) yaptığı tespitlerde, şüpheli İ.Ö.Ö. tarafından koordine edilen suç ağının, önceden sonucu üzerinde anlaşma sağlanan müsabakalar ve yasal ile yasa dışı bahis faaliyetlerinden gelir elde ettiği belirlendi. Yapılan incelemelerde, suç ağı içerisinde döviz ve kuyumculuk sektöründe faaliyet gösteren kişilerin de yer aldığı, gerçekleştirilen işlemlerin toplam hacminin 192 milyar liraya ulaştığı belirlendi. BANKA VE KRİPTO HESAPLARINA BLOKE Soruşturma kapsamında bu sabah İstanbul merkezli 24 ilde düzenlenen eş zamanlı operasyonda 80 şüpheli yakalanarak gözaltına alındı. Operasyon kapsamında 11 şirkete, 45 araca, 16 konuta ve 11 tarla ile arsaya olmak üzere yaklaşık 350 milyon lira değerindeki toplam 83 menkul ve gayrimenkule el konuldu. 27 ilde yasa dışı bahis operasyonu: 130 şüpheli hakkında adli işlem başlatıldı Buca Belediyesi soruşturması: Belediye başkanı Görkem Duman dahil 54 kişi adliyeye sevk edildi Meteoroloji açıkladı: Bugün hava nasıl olacak? 5 bin 300 yıllık mumyadan ekşi mayalı ekmek yaptılar Aziz Yıldırım'dan dikkat çeken Hakan Safi açıklaması: 'Fenerbahçe, gerçeklerle hayalleri ayırsın' İstanbul merkezli 24 ilde yasa dışı bahis gelirlerinin aklanmasına yönelik düzenlenen operasyonda 80 şüpheli gözaltına alındı. İstanbul merkezli 24 ilde yasa dışı bahis gelirlerinin aklanmasına yönelik düzenlenen operasyonda 80 şüpheli gözaltına alındı. Soruşturma kapsamında bu sabah İstanbul merkezli 24 ilde düzenlenen eş zamanlı operasyonda 80 şüpheli yakalanarak gözaltına alındı.",browser_full_article,https://bizimtv.com.tr/service/amp/guncel/11-sirkete-el-konuldu-24-ilde-yasa-disi-bahis-operasyonu-80-gozalti-122706h,İstanbul | Bursa,Yıldırım,,,,,,firma yok | faaliyet/tesis yok,,,,maps araması yapılmadı,,,105.0,16
2026-06-04 09:29:00,mal varlığına el konuldu,Diğer,Uyuşturucu gelirlerini aklayan şebekeye operasyon: 15 milyar TL'lik mal varlığına el konuldu,Uyuşturucu gelirlerini aklayan şebekeye operasyon: 15 milyar TL'lik mal varlığına el konuldu Sosyal TV,https://news.google.com/rss/articles/CBMiugFBVV95cUxQdUQ5ZlMtRm1vQnJNTTlNZlNpTk5VaGl1bm5RQkdjRE9RYWtGUWJDNnRmTFFMUkhtRDBMYzJmZXpLcGRlc0JmbC1JNE4wQkp2RDlqaWFza0lSQnZKcVFYYnRBa1VVa0hoQUVKcWpTX2FabXlxZVdXSDBjSW1YMTQ1Y0FjZGZCZmJWTHR3YmR3YWptWXl2MUU5Ym9LcU4tRXhranlGRE1iVkFZU3NOUzh3eVhvNTVqaXItWkHSAb8BQVVfeXFMTkZrZzVaR2kzU3cxVzV6TGVEVEpqWEozQ3ExNFlwOWhUODBQT245dzVpbXYyYVViV0VwUVFuOGtBLTVSNkZDQXcySXhsR195aUw0Zng2bzRBaEFlbkpiUnVaNjJfaWQyZm1URVNjb3g0S004bWpfVGFwWHMxdlJmWndlX0RzN05IbFU0UGF2RmpGSEFkVlpfNHJaejA2T3FSaU9OSTRSbGdiUzVCa0pmUWRRZ0J5cllMaVhQY2NTN0E?oc=5,"el konuldu, mal varlığı",,"Diyarbakır’da uyuşturucu ticaretinden elde edilen gelirlerin aklanmasına yönelik düzenlenen operasyonda 18 şüpheli hakkında işlem yapıldı. Şüphelilerin piyasa değeri yaklaşık 15 milyar TL olan otel, arsa, tarla, daire, iş yeri, araç ve banka hesaplarına el konuldu. Diyarbakır’da uyuşturucu ticaretinden elde edilen gelirlerin aklanmasına yönelik düzenlenen operasyonda 18 şüpheli hakkında işlem yapıldı. Şüphelilerin piyasa değeri yaklaşık 15 milyar TL olan otel, arsa, tarla, daire, iş yeri, araç ve banka hesaplarına el konuldu. Diyarbakır’da uyuşturucu ticaretinden elde edilen gelirlerin aklanmasına yönelik düzenlenen operasyonda 18 şüpheli hakkında işlem yapıldı. Şüphelilerin piyasa değeri yaklaşık 15 milyar TL olan otel, arsa, tarla, daire, iş yeri, araç ve banka hesaplarına el konuldu.","Uyuşturucu gelirlerini aklayan şebekeye operasyon: 15 milyar TL'lik mal varlığına el konuldu Uyuşturucu gelirlerini aklayan şebekeye operasyon: 15 milyar TL'lik mal varlığına el konuldu Sosyal TV Diyarbakır’da uyuşturucu ticaretinden elde edilen gelirlerin aklanmasına yönelik düzenlenen operasyonda 18 şüpheli hakkında işlem yapıldı. Şüphelilerin piyasa değeri yaklaşık 15 milyar TL olan otel, arsa, tarla, daire, iş yeri, araç ve banka hesaplarına el konuldu.",browser_full_article,https://www.sosyaltv.com.tr/uyusturucu-gelirlerini-aklayan-sebekeye-operasyon-15-milyar-tllik-mal-varligina-el-konuldu,Diyarbakır,,,,,,,ilçe yok | firma yok | faaliyet/tesis yok,,,,maps araması yapılmadı,,,105.47,17
2026-06-04 17:34:00,mal varlığına el konuldu,Diğer,UYUŞTURUCU PARASINI AKLIYORLARDI: 15 MİLYAR TL'LİK MAL VARLIĞINA EL KONULDU,UYUŞTURUCU PARASINI AKLIYORLARDI: 15 MİLYAR TL'LİK MAL VARLIĞINA EL KONULDU Haber Alternatif,https://news.google.com/rss/articles/CBMipAFBVV95cUxNX1J3Q3R4X2hja1hSZHNyZTB3Um9ydDFUVUZUdGNNTHl5YlVHVXNEdkRrMXFfeElWQ0xfR1B0RzNBOF9udm5iS1VQSXB6ZEZNaWUzNzRXU0VSbGxFeW1qUXVIeW5zblo4RDlFMEVMS3VuZHlrNUJyNXVEcThPby12VW9zcGZwbVdMaTVRSzZFLUVXSV9fR0hyVURFcnMtTnBiU19JNg?oc=5,"el konuldu, mal varlığı",,UYUŞTURUCU PARASINI AKLIYORLARDI: 15 MİLYAR TL'LİK MAL VARLIĞINA EL KONULDU Haber Alternatif,UYUŞTURUCU PARASINI AKLIYORLARDI: 15 MİLYAR TL'LİK MAL VARLIĞINA EL KONULDU UYUŞTURUCU PARASINI AKLIYORLARDI: 15 MİLYAR TL'LİK MAL VARLIĞINA EL KONULDU Haber Alternatif UYUŞTURUCU PARASINI AKLIYORLARDI: 15 MİLYAR TL'LİK MAL VARLIĞINA EL KONULDU Haber Alternatif,browser_failed,https://news.google.com/rss/articles/CBMipAFBVV95cUxNX1J3Q3R4X2hja1hSZHNyZTB3Um9ydDFUVUZUdGNNTHl5YlVHVXNEdkRrMXFfeElWQ0xfR1B0RzNBOF9udm5iS1VQSXB6ZEZNaWUzNzRXU0VSbGxFeW1qUXVIeW5zblo4RDlFMEVMS3VuZHlrNUJyNXVEcThPby12VW9zcGZwbVdMaTVRSzZFLUVXSV9fR0hyVURFcnMtTnBiU19JNg?oc=5&hl=tr&gl=TR&ceid=TR:tr,,,,,,,,il yok | ilçe yok | firma yok | faaliyet/tesis yok,,,,maps araması yapılmadı,,,77.42,18
2026-06-04 15:13:55,para aklama,Banka / Finansal Kuruluş,Siirt’te Telefonlara Peş Peşe Aynı Mesaj Geldi: Bankalardan “Hesabınızı Kullandırmayın” Uyarısı,Siirt’te Telefonlara Peş Peşe Aynı Mesaj Geldi: Bankalardan “Hesabınızı Kullandırmayın” Uyarısı siirthaberci.com,https://news.google.com/rss/articles/CBMizgFBVV95cUxNcVNrVGhmTFFlM044X3M2c1BxVlZmOVA0VWxhc2xGb0dPaUFZVjM5NlVXM1ZlUVQ4YncxZDR5RDRkdmdxWDlDdXpkRzZWUDhzdmNQc1laUmdNRjVBQlQxMlJCcklFRktoLXF4SWZ2Wng3TDRHb3E1TmJpVWdGby1ORU9CWHdXMkZUWUNwQV9ZQXkzYmNIX0lYX25WVVdJRkhyVFJDaTBVaV8tQUVVakNWUkxsaHkyWm1pQjNma3puWjBaNm1DUDJyeEhtN3AzZw?oc=5,banka,finansal kuruluş,"Bankalar, hesap ve IBAN bilgilerini başkalarına kullandıran vatandaşların ciddi hukuki ve mali sorunlarla karşı karşıya kalabileceğine dikkat çekti. Bankalar, hesap ve IBAN bilgilerini başkalarına kullandıran vatandaşların ciddi hukuki ve mali sorunlarla karşı karşıya kalabileceğine dikkat çekti. Bankalar, hesap ve IBAN bilgilerini başkalarına kullandıran vatandaşların ciddi hukuki ve mali sorunlarla karşı karşıya kalabileceğine dikkat çekti.","Siirt’te Telefonlara Peş Peşe Aynı Mesaj Geldi: Bankalardan “Hesabınızı Kullandırmayın” Uyarısı Siirt’te Telefonlara Peş Peşe Aynı Mesaj Geldi: Bankalardan “Hesabınızı Kullandırmayın” Uyarısı siirthaberci.com Bankalar, hesap ve IBAN bilgilerini başkalarına kullandıran vatandaşların ciddi hukuki ve mali sorunlarla karşı karşıya kalabileceğine dikkat çekti.",browser_full_article,https://www.siirthaberci.com/haber/siirtte-telefonlara-pes-pese-ayni-mesaj-geldi-bankalardan-hesabinizi-kullandirmayin-uyarisi-131411,Siirt,,,,,,,ilçe yok | firma yok | faaliyet/tesis yok,,,,maps araması yapılmadı,,,95.96,19
2026-06-04 09:41:34,MASAK,İflas / Konkordato / Mali Sorun,"Banka hesabına 1 trilyon lira geldi, hayatı kabusa döndü: Bu süreç iflasıma neden olabilir","Banka hesabına 1 trilyon lira geldi, hayatı kabusa döndü: Bu süreç iflasıma neden olabilir SonDakika",https://news.google.com/rss/articles/CBMioAFBVV95cUxNZEczZ3Z6TnY0aVdORUxFRFdtaEU3WTZ1Yl92V2R0OE1xTndlOFJLMEw0VlNFTFExeG1ycDBFR2ktYS00Y1lWbUFXeGRZaFYzbFBkenZ6bi1PazE3d2V2VW03ZFZiWnBHYXFOekZBSUNDd3lwU3VvWF9BSlBoWGJjSnM0RW11RHpES0s1VlVZbGpBaDllZ0wwbFQ3d19WT1JE0gGcAUFVX3lxTE1Tdk05NG1LdHdBU0wzSVVqQ0EwSVB0M2Z4a3FCVmd5aWYwbXVXMnktVDZOeDdXUDZPbzJjUkJ2UEx6aXJQeUtNelZuWTJsOXlhWmpTenpjTnlsSENLd1dGVWl4YnNsbmV6SlB0QXVCTEQ5MXJCZGh4eFFoajB1YmgzSXZ4RGNLT0xyOVJWR2dqSFhnM3U5aTB0Q21saw?oc=5,"banka, banka hesabı",finansal kuruluş,"İş için Van'a giden Ahmad Jahangard Takalo, banka hesabında 999 milyar 999 milyon 999 bin 999 lira 99 kuruş bulunduğunu görünce büyük şaşkınlık yaşadı. Kaynağı belirsiz para nedeniyle MASAK tarafından tüm hesapları dondurulan Takalo, hesaplarına erişemediği için işlerinin aksadığını söyledi. İki Ar-Ge şirketi bulunan Takalo, sürecin bir-iki ay daha uzaması halinde iflas edebileceğini belirterek sorunun bir an önce çözülmesini istedi. İş için Van'a giden Ahmad Jahangard Takalo, banka hesabında 999 milyar 999 milyon 999 bin 999 lira 99 kuruş bulunduğunu görünce büyük şaşkınlık yaşadı. Kaynağı belirsiz para nedeniyle MASAK tarafından tüm hesapları dondurulan Takalo, hesaplarına erişemediği için işlerinin aksadığını söyledi. İki Ar-Ge şirketi bulunan Takalo, sürecin bir-iki ay daha uzaması halinde iflas edebileceğini belirterek sorunun bir an önce çözülmesini istedi. İş için Van'a giden Ahmad Jahangard Takalo, banka hesabında 999 milyar 999 milyon 999 bin 999 lira 99 kuruş bulunduğunu görünce büyük şaşkınlık yaşadı. Kaynağı belirsiz para nedeniyle MASAK tarafından tüm hesapları dondurulan Takalo, hesaplarına erişemediği için işlerinin aksadığını söyledi. İki Ar-Ge şirketi bulunan Takalo, sürecin bir-iki ay daha uzaması halinde iflas edebileceğini belirterek sorunun bir an önce çözülmesini istedi. Balıkesir 'de yaşayan ve iş gezisi için Van 'a giden Azerbaycan asıllı girişimci Ahmad Jahangard Takalo, banka hesabında gördüğü rakam karşısında büyük şaşkınlık yaşadı. Hesabında 999 milyar 999 milyon 999 bin 999 lira 99 kuruş bulunduğunu öğrenen Takalo'nun tüm hesapları, kaynağı belirsiz para hareketi nedeniyle MASAK tarafından donduruldu. Yaklaşık 10 yıl önce Türkiye'ye yerleşen Takalo, olayın Van'da alışveriş yaptığı sırada kartlarının çalışmamasıyla ortaya çıktığını anlattı. Sorunun kartlardan kaynaklandığını düşünerek bankaya giden Takalo, hesabına yaklaşık 1 trilyon lira geçtiğini öğrenince hayatının şokunu yaşadığını söyledi. ""HAYATIM 180 DERECE DEĞİŞTİ"" Uluslararası mucit olduğunu ve Türkiye'de iki Ar-Ge şirketi bulunduğunu belirten Takalo, yaşadığı süreci ""hem komik hem de korkunç"" olarak tanımladı. Daha önce annesinin hesabına da yanlışlıkla milyonlarca lira gönderildiğini anlatan Takalo, o olayın kısa sürede çözüldüğünü ancak bu kez durumun çok daha karmaşık olduğunu ifade etti. Hesaplarının dondurulması nedeniyle işlerinin ciddi şekilde aksadığını söyleyen Takalo, ""Hayatım 180 derece değişti. Normal hayatımı ve düzenimi özledim. Hesaplarımın kapalı olması faaliyetlerimi durma noktasına getirdi"" dedi. ""BİR ANDA HERKES AKRABAM OLDU"" Olayın duyulmasının ardından yoğun telefon trafiği yaşadığını belirten Takalo, yeni telefon numarası almasına rağmen sürekli arandığını söyledi. Takalo, ""Herkes para istiyor. Sanki bu parayı kullanabiliyormuşum gibi davranıyorlar. Bir anda herkes benimle akraba olmaya başladı"" ifadelerini kullandı. ""BU SÜREÇ İFLASIMA NEDEN OLABİLİR"" Tüm hesaplarının bloke edilmesi nedeniyle mağdur olduğunu belirten Takalo, sürecin uzaması halinde şirketlerinin faaliyetlerinin ciddi zarar görebileceğini söyledi. Bir-iki ay daha bu şekilde devam etmesi halinde iflas riskiyle karşı karşıya kalabileceğini ifade eden Takalo, olayın bir an önce aydınlatılmasını ve hesaplarının yeniden açılmasını istedi. Konuyla ilgili hukuki sürecin devam ettiği öğrenilirken, Takalo gerçek para sahibinin bulunarak yaşanan karmaşanın sona ermesini beklediğini söyledi. Kaynak: ANKA Mali Suçları Araştırma Kurulu , Yerel Haberler , Azerbaycan , Balıkesir , Alışveriş , 3. Sayfa , Ekonomi , Finans , Güncel , Yaşam , Banka , Van , Son Dakika S","Banka hesabına 1 trilyon lira geldi, hayatı kabusa döndü: Bu süreç iflasıma neden olabilir Banka hesabına 1 trilyon lira geldi, hayatı kabusa döndü: Bu süreç iflasıma neden olabilir SonDakika İş için Van'a giden Ahmad Jahangard Takalo, banka hesabında 999 milyar 999 milyon 999 bin 999 lira 99 kuruş bulunduğunu görünce büyük şaşkınlık yaşadı. Kaynağı belirsiz para nedeniyle MASAK tarafından tüm hesapları dondurulan Takalo, hesaplarına erişemediği için işlerinin aksadığını söyledi. İki Ar-Ge şirketi bulunan Takalo, sürecin bir-iki ay daha uzaması halinde iflas edebileceğini belirterek sorunun bir an önce çözülmesini istedi. Balıkesir 'de yaşayan ve iş gezisi için Van 'a giden Azerbaycan asıllı girişimci Ahmad Jahangard Takalo, banka hesabında gördüğü rakam karşısında büyük şaşkınlık yaşadı. Hesabında 999 milyar 999 milyon 999 bin 999 lira 99 kuruş bulunduğunu öğrenen Takalo'nun tüm hesapları, kaynağı belirsiz para hareketi nedeniyle MASAK tarafından donduruldu. Yaklaşık 10 yıl önce Türkiye'ye yerleşen Takalo, olayın Van'da alışveriş yaptığı sırada kartlarının çalışmamasıyla ortaya çıktığını anlattı. Sorunun kartlardan kaynaklandığını düşünerek bankaya giden Takalo, hesabına yaklaşık 1 trilyon lira geçtiğini öğrenince hayatının şokunu yaşadığını söyledi. ""HAYATIM 180 DERECE DEĞİŞTİ"" Uluslararası mucit olduğunu ve Türkiye'de iki Ar-Ge şirketi bulunduğunu belirten Takalo, yaşadığı süreci ""hem komik hem de korkunç"" olarak tanımladı. Daha önce annesinin hesabına da yanlışlıkla milyonlarca lira gönderildiğini anlatan Takalo, o olayın kısa sürede çözüldüğünü ancak bu kez durumun çok daha karmaşık olduğunu ifade etti. Hesaplarının dondurulması nedeniyle işlerinin ciddi şekilde aksadığını söyleyen Takalo, ""Hayatım 180 derece değişti. Hesaplarımın kapalı olması faaliyetlerimi durma noktasına getirdi"" dedi. ""BİR ANDA HERKES AKRABAM OLDU"" Olayın duyulmasının ardından yoğun telefon trafiği yaşadığını belirten Takalo, yeni telefon numarası almasına rağmen sürekli arandığını söyledi. Bir anda herkes benimle akraba olmaya başladı"" ifadelerini kullandı. ""BU SÜREÇ İFLASIMA NEDEN OLABİLİR"" Tüm hesaplarının bloke edilmesi nedeniyle mağdur olduğunu belirten Takalo, sürecin uzaması halinde şirketlerinin faaliyetlerinin ciddi zarar görebileceğini söyledi. Bir-iki ay daha bu şekilde devam etmesi halinde iflas riskiyle karşı karşıya kalabileceğini ifade eden Takalo, olayın bir an önce aydınlatılmasını ve hesaplarının yeniden açılmasını istedi. Konuyla ilgili hukuki sürecin devam ettiği öğrenilirken, Takalo gerçek para sahibinin bulunarak yaşanan karmaşanın sona ermesini beklediğini söyledi. Kaynak: ANKA Mali Suçları Araştırma Kurulu , Yerel Haberler , Azerbaycan , Balıkesir , Alışveriş , 3.",browser_full_article,https://www.sondakika.com/guncel/haber-azerbaycanli-isadaminin-hesabinda-999-milyar-tl-sa-19910017/,Balıkesir | Van,,,,,,,ilçe yok | firma yok | faaliyet/tesis yok,,,,maps araması yapılmadı,,,101.0,20
