published,search_term,category,title,summary,link,matched_words,activity_type,raw_text,entity_source_text,article_fetch_status,resolved_article_url,city_candidates,district_candidates,neighborhood_candidates,street_candidates,facility_candidates,company_candidates,company_candidate_scores,entity_quality_note,maps_queries,maps_candidates,maps_best_guess,maps_status,maps_match_scores,maps_rejected_candidates,record_quality_score,duplicate_group_id
2026-06-01 08:23:00,fabrika yangını,Fiziksel Risk / Yangın,Bursa'daki fabrika yangını korkuttu,Bursa'daki fabrika yangını korkuttu Türk İnform,https://news.google.com/rss/articles/CBMibEFVX3lxTE5laXp0MHZHeWFUbUo1MWYzSHJGZWpIM3R5RUp6MXhlTHVJZmU1a3RGbVhuamV2VXFPZHFBR21WWlBnaWVxcnJpd04wSTlEM2pDZl9RNnpBOXZDV1JVTlNKeXBJMFU3U1V2Zjc1Yw?oc=5,fabrika,fabrika,Bursa'daki fabrika yangını korkuttu Türk İnform,Bursa'daki fabrika yangını korkuttu Bursa'daki fabrika yangını korkuttu Türk İnform Bursa'daki fabrika yangını korkuttu Türk İnform,browser_failed,https://news.google.com/rss/articles/CBMibEFVX3lxTE5laXp0MHZHeWFUbUo1MWYzSHJGZWpIM3R5RUp6MXhlTHVJZmU1a3RGbVhuamV2VXFPZHFBR21WWlBnaWVxcnJpd04wSTlEM2pDZl9RNnpBOXZDV1JVTlNKeXBJMFU3U1V2Zjc1Yw?oc=5&hl=tr&gl=TR&ceid=TR:tr,,,,,,,,il yok | ilçe yok | firma yok | faaliyet/tesis yok,,,,maps araması yapılmadı,,,37.72,8
2026-06-01 09:43:00,konkordato,İflas / Konkordato / Mali Sorun,Konkordato da kurtarmadı! Ünlü inşaat şirketi iflas etti,Konkordato da kurtarmadı! Ünlü inşaat şirketi iflas etti Bursada Bugün,https://news.google.com/rss/articles/CBMipgFBVV95cUxPN0kyQ0QyZ3hJc0pna25HeUh6dXRrN2pKbWk3UzhoTXVLcURpbnZ4aElZY0pzZ2d0STk5TFFuNFgwZEhwOFhkX3JxUWpPOUJtRlo5blQ4SVVxQUhhdXdWbDJTeFRIRWk3WFV2ZzQ3VzVRWmpzLU5rQVpScTVhYU9xWDg3Q3QwWW12Z0tqWG4taGxaeXozM2h1MXE3NEhGMGxUNm02MUFR0gGoAUFVX3lxTE1jZ3g5Y1ptNXZUREVZUE5pMjFweXlGVENSRHNJc1F0M2NGRWVrSlBzQ2p4bXUyNWk3R0xXSzZCa3lwdUlLMk9xbDQzUUQ5Y2Y2eFY2WGhnNi1vYzh3SHM1R3RsSEoyMlJGbUtzTkJxcVNKNWREaV9wOFlYQnB3c0E2TFQyelp1cGVDWnpGVHIyRll4ckRYNWQxNGtscDVOVUs0Xzltc0ZENw?oc=5,"inşaat, şirket",şirket / firma,"Ankara'da uzun yıllardır konut ve lüks yaşam projeleriyle adından söz ettiren Çakıroğulları İnşaat, yürüttüğü mali yeniden yapılandırma sürecinden olumlu sonuç alamadı. Bir süredir finansal darboğaz nedeniyle konkordato koruması altında faaliyetlerini sürdüren şirket hakkında mahkeme kritik kararını verdi ve iflasına hükmetti. Karar, başkentte gayrimenkul sektöründe dikkatle takip edilen davalardan biri olarak kayıtlara geçti. Ankara'da uzun yıllardır konut ve lüks yaşam projeleriyle adından söz ettiren Çakıroğulları İnşaat, yürüttüğü mali yeniden yapılandırma sürecinden olumlu sonuç alamadı. Bir süredir finansal darboğaz nedeniyle konkordato koruması altında faaliyetlerini sürdüren şirket hakkında mahkeme kritik kararını verdi ve iflasına hükmetti. Karar, başkentte gayrimenkul sektöründe dikkatle takip edilen davalardan biri olarak kayıtlara geçti. Ankara'da uzun yıllardır konut ve lüks yaşam projeleriyle adından söz ettiren Çakıroğulları İnşaat, yürüttüğü mali yeniden yapılandırma sürecinden olumlu sonuç alamadı. Bir süredir finansal darboğaz nedeniyle konkordato koruması altında faaliyetlerini sürdüren şirket hakkında mahkeme kritik kararını verdi ve iflasına hükmetti. Karar, başkentte gayrimenkul sektöründe dikkatle takip edilen davalardan biri olarak kayıtlara geçti. Konkordato da kurtarmadı! Ünlü inşaat şirketi iflas etti Mahkeme Tüm Koruma Tedbirlerini Kaldırdı İflas Kararı Resmen Açıklandı Sektörde Yankı Uyandıran Gelişme Ankara'da uzun yıllardır konut ve lüks yaşam projeleriyle adından söz ettiren Çakıroğulları İnşaat, yürüttüğü mali yeniden yapılandırma sürecinden olumlu sonuç alamadı. Bir süredir finansal darboğaz nedeniyle konkordato koruması altında faaliyetlerini sürdüren şirket hakkında mahkeme kritik kararını verdi ve iflasına hükmetti. Karar, başkentte gayrimenkul sektöründe dikkatle takip edilen davalardan biri olarak kayıtlara geçti. Ankara Ticaret Sicil Müdürlüğü'ne kayıtlı olan ve 2016 yılından bu yana özellikle konut projeleri, çok katlı yapılar ve lüks yaşam alanları inşa eden Çakıroğulları İnşaat Turizm ve Ticaret Limited Şirketi, son dönemde artan mali baskılar nedeniyle konkordato talebinde bulunmuştu. Şirket, borçlarını yeniden yapılandırarak faaliyetlerini sürdürmeyi hedeflerken, süreç boyunca mahkeme tarafından sağlanan koruma tedbirleriyle çalışmalarına devam ediyordu. Ancak Ankara'da görülen davada mahkeme heyeti, yapılan değerlendirmeler sonucunda konkordato sürecinin sürdürülebilir olmadığına kanaat getirdi. Şirketin mali yapısındaki bozulmanın giderilemediği, borçların yeniden yapılandırılması için gerekli koşulların oluşmadığı yönündeki tespitler kararın seyrini belirledi. 2025/1029 esas numarasıyla yürütülen dava kapsamında 21 Mayıs 2026 tarihinde yapılan duruşmada kritik bir dönemeç yaşandı. Mahkeme, daha önce şirketi ekonomik baskılardan korumak amacıyla verilen geçici ve kesin mühlet kararlarını geçersiz kıldı. Böylece Çakıroğulları İnşaat'ın konkordato süreci boyunca yararlandığı tüm hukuki koruma zırhı ortadan kaldırılmış oldu. Kararla birlikte yalnızca mühlet uygulamaları değil, şirketin faaliyetlerini denetlemek üzere görevlendirilen konkordato komiserleri kurulunun da görevine son verildi. Bu gelişme, şirketin yönetim ve mali denetim sürecinde tamamen yeni bir dönemin başladığını ortaya koydu. Mahkeme, İcra ve İflas Kanunu'nun ilgili maddeleri kapsamında değerlendirme yaparak Çakıroğulları İnşaat'ın iflasına hükmetti. Kararda, şirketin mali yükümlülüklerini karşılayamayacak durumda olduğu ve konkordato sürecinin başarı şansını yitirdiği ifade edildi. Alınan karar doğrultusunda şirketin iflası 21 Mayıs 2026 tarihi saat 12.12 itibarıyla resmi olarak açılmış sayıldı. Bu gelişmeyle birlikte şirketin tüm ticari faaliyetleri ve mali süreçleri yasal iflas prosedürüne devredildi. Çakıroğulları İnşaat'ın iflas kararı, Ankara'daki inşaat ve gayrimenkul piyasasında da dikkatle karşılandı. Uzun yıllar boyunca özellikle konut üretimiyle bilinen şirketin konkordato sürecinden çıkamaması, sektörde yaşanan finansal sıkıntıların boyutunu bir kez daha gündeme taşıdı. Uzmanlar, son dönemde inşaat sektöründe artan maliyetler, finansmana erişimde yaşanan zorluklar ve daralan piyasa koşullarının birçok firmayı benzer süreçlere sürükleyebileceğine dikkat çekiyor. Çakıroğulları İnşaat hakkında verilen iflas kararı ise bu tabloyu somutlaştıran en çarpıcı örneklerden biri olarak değerlendiriliyor. Mahkeme kararıyla birlikte şirketin geleceğine ilişkin tüm süreç artık iflas idaresi tarafından yürütülecek. Bu kapsamda şirketin varlıklarının değerlendirilmesi, alacaklıların haklarının korunması ve yasal tasfiye sürecinin işletilmesi bekleniyor. Diğer Ekonomi Haberleri için tıklayın Bursa'da nefes kesen operasyon! Kaçak satışa hazırlıyorlardı 12 Haziran'da Okullar Tatil Mi? 12 Haziran Neden Tatil? MEB Duyurdu Bayram tatilinin acı bilançosu: Bakan Çiftçi açıkladı Bursa'da servis minibüsü kontrolden çıktı! Çok sayıda yaralı var Bursa'da inşaatta ölüm! 30 yıl önceki detay şoke etti... Yargıtay'dan emsal karar! İş yerinde çekilen fotoğraf başını yaktı","Konkordato da kurtarmadı! Ünlü inşaat şirketi iflas etti Konkordato da kurtarmadı! Ünlü inşaat şirketi iflas etti Bursada Bugün Ankara'da uzun yıllardır konut ve lüks yaşam projeleriyle adından söz ettiren Çakıroğulları İnşaat, yürüttüğü mali yeniden yapılandırma sürecinden olumlu sonuç alamadı. Bir süredir finansal darboğaz nedeniyle konkordato koruması altında faaliyetlerini sürdüren şirket hakkında mahkeme kritik kararını verdi ve iflasına hükmetti. Karar, başkentte gayrimenkul sektöründe dikkatle takip edilen davalardan biri olarak kayıtlara geçti. Konkordato da kurtarmadı! Ünlü inşaat şirketi iflas etti Mahkeme Tüm Koruma Tedbirlerini Kaldırdı İflas Kararı Resmen Açıklandı Sektörde Yankı Uyandıran Gelişme Ankara'da uzun yıllardır konut ve lüks yaşam projeleriyle adından söz ettiren Çakıroğulları İnşaat, yürüttüğü mali yeniden yapılandırma sürecinden olumlu sonuç alamadı. Ankara Ticaret Sicil Müdürlüğü'ne kayıtlı olan ve 2016 yılından bu yana özellikle konut projeleri, çok katlı yapılar ve lüks yaşam alanları inşa eden Çakıroğulları İnşaat Turizm ve Ticaret Limited Şirketi, son dönemde artan mali baskılar nedeniyle konkordato talebinde bulunmuştu. Şirket, borçlarını yeniden yapılandırarak faaliyetlerini sürdürmeyi hedeflerken, süreç boyunca mahkeme tarafından sağlanan koruma tedbirleriyle çalışmalarına devam ediyordu. Ancak Ankara'da görülen davada mahkeme heyeti, yapılan değerlendirmeler sonucunda konkordato sürecinin sürdürülebilir olmadığına kanaat getirdi. Şirketin mali yapısındaki bozulmanın giderilemediği, borçların yeniden yapılandırılması için gerekli koşulların oluşmadığı yönündeki tespitler kararın seyrini belirledi. 2025/1029 esas numarasıyla yürütülen dava kapsamında 21 Mayıs 2026 tarihinde yapılan duruşmada kritik bir dönemeç yaşandı. Mahkeme, daha önce şirketi ekonomik baskılardan korumak amacıyla verilen geçici ve kesin mühlet kararlarını geçersiz kıldı. Böylece Çakıroğulları İnşaat'ın konkordato süreci boyunca yararlandığı tüm hukuki koruma zırhı ortadan kaldırılmış oldu. Kararla birlikte yalnızca mühlet uygulamaları değil, şirketin faaliyetlerini denetlemek üzere görevlendirilen konkordato komiserleri kurulunun da görevine son verildi. Bu gelişme, şirketin yönetim ve mali denetim sürecinde tamamen yeni bir dönemin başladığını ortaya koydu. Mahkeme, İcra ve İflas Kanunu'nun ilgili maddeleri kapsamında değerlendirme yaparak Çakıroğulları İnşaat'ın iflasına hükmetti. Kararda, şirketin mali yükümlülüklerini karşılayamayacak durumda olduğu ve konkordato sürecinin başarı şansını yitirdiği ifade edildi. Alınan karar doğrultusunda şirketin iflası 21 Mayıs 2026 tarihi saat 12.12 itibarıyla resmi olarak açılmış sayıldı. Bu gelişmeyle birlikte şirketin tüm ticari faaliyetleri ve mali süreçleri yasal iflas prosedürüne devredildi. Çakıroğulları İnşaat'ın iflas kararı, Ankara'daki inşaat ve gayrimenkul piyasasında da dikkatle karşılandı. Uzun yıllar boyunca özellikle konut üretimiyle bilinen şirketin konkordato sürecinden çıkamaması, sektörde yaşanan finansal sıkıntıların boyutunu bir kez daha gündeme taşıdı. Uzmanlar, son dönemde inşaat sektöründe artan maliyetler, finansmana erişimde yaşanan zorluklar ve daralan piyasa koşullarının birçok firmayı benzer süreçlere sürükleyebileceğine dikkat çekiyor. Çakıroğulları İnşaat hakkında verilen iflas kararı ise bu tabloyu somutlaştıran en çarpıcı örneklerden biri olarak değerlendiriliyor. Mahkeme kararıyla birlikte şirketin geleceğine ilişkin tüm süreç artık iflas idaresi tarafından yürütülecek. Bu kapsamda şirketin varlıklarının değerlendirilmesi, alacaklıların haklarının korunması ve yasal tasfiye sürecinin işletilmesi bekleniyor. Diğer Ekonomi Haberleri için tıklayın Bursa'da nefes kesen operasyon! MEB Duyurdu Bayram tatilinin acı bilançosu: Bakan Çiftçi açıkladı Bursa'da servis minibüsü kontrolden çıktı! Çok sayıda yaralı var Bursa'da inşaatta ölüm! 30 yıl önceki detay şoke etti... İş yerinde çekilen fotoğraf başını yaktı",browser_full_article,https://www.bursadabugun.com/haber/konkordato-da-kurtarmadi-unlu-insaat-sirketi-iflas-etti-1925745.html,Ankara | Bursa,,,,,Çakıroğulları İnşaat Turizm ve Ticaret Limited Şirketi,Çakıroğulları İnşaat Turizm ve Ticaret Limited Şirketi:114:body | Çakıroğulları İnşaat Turizm ve Ticaret Limited Şirketi:raw_legal,ilçe yok | faaliyet/tesis yok,Çakıroğulları İnşaat Turizm ve Ticaret Limited Şirketi Ankara Türkiye,Çakıroğulları İnşaat,Çakıroğulları İnşaat,firma adı + güvenli maps adayı var,100.0,,177.3,9
2026-06-01 08:12:34,konkordato,İflas / Konkordato / Mali Sorun,Türk inşaat devi bayramda iflas etti: Bölgede büyük ses getirdi,Türk inşaat devi bayramda iflas etti: Bölgede büyük ses getirdi Yeniçağ Gazetesi,https://news.google.com/rss/articles/CBMivgFBVV95cUxOVDFabEI4Tmw0MDhuR0p2R2pjellzeXVnTG5IdlRGNjZIaW1EWkZhSUdKd2lOUUVCZlVzdkROdUs3MENXSlI3cVgwWDREWmxtYmlUUk91S084UHVCRjBCQ2stWGhYejcyV3lUeDNLbklDSWtQSTU0RUFEb1JCUFAzRGhuNGpGRlo0YmFoVGYwaHk2b21CWGZGLXYtY2lybnFvYko0UHEydHo0RU9vSmpmVzZaQVNkcFJFclJ3WmtR?oc=5,inşaat,,Türk inşaat devi bayramda iflas etti: Bölgede büyük ses getirdi Yeniçağ Gazetesi,Türk inşaat devi bayramda iflas etti: Bölgede büyük ses getirdi Türk inşaat devi bayramda iflas etti: Bölgede büyük ses getirdi Yeniçağ Gazetesi Türk inşaat devi bayramda iflas etti: Bölgede büyük ses getirdi Yeniçağ Gazetesi,browser_failed,https://www.yenicaggazetesi.com/turk-insaat-devi-cakirogullari-bayramda-iflas-etti-bolgede-buyuk-ses-getirdi-1035820h.htm,,,,,,,,il yok | ilçe yok | firma yok | faaliyet/tesis yok,,,,maps araması yapılmadı,,,60.3,10
2026-05-31 14:17:00,kara para,Banka / Finansal Kuruluş,"Deutsche Bank'tan çarpıcı altın tahmini: Ons fiyatı 8 bin doları görebilir, merkez bankaları dolardan kaçıyor","Deutsche Bank'tan çarpıcı altın tahmini: Ons fiyatı 8 bin doları görebilir, merkez bankaları dolardan kaçıyor T24",https://news.google.com/rss/articles/CBMi2AFBVV95cUxNZ1BYd1UyY2Z3Vm9VNGpjT2N5WWtKUS11Z0NlRUJRWjJET2F3U2piaEN0S2tFY2NIRDdKWTRseW9jc0VzeC03V0dvRDV5b19LTDVXTmduTzctWXVESHBMbUVJRjZsc1l0eWVtZnBRVGNvSl9OSmFYN2pwQl83aDE4b2FWU3pZWEVsOGdGbHhmYTRuNlR3Ni1tcTJUUWZRNGNEcmRBZHcwVDIweVg2TUtKeU8waTNPdXNOekJ1aUp3Y2lTaUgyZ3NCTDBiZlhnUGFTbnoxeVJDeFA?oc=5,banka,finansal kuruluş,"Deutsche Bank'tan çarpıcı altın tahmini: Ons fiyatı 8 bin doları görebilir, merkez bankaları dolardan kaçıyor Deutsche Bank'tan çarpıcı altın tahmini: Ons fiyatı 8 bin doları görebilir, merkez bankaları dolardan kaçıyor Deutsche Bank'tan çarpıcı altın tahmini: Ons fiyatı 8 bin doları görebilir, merkez bankaları dolardan kaçıyor","Deutsche Bank'tan çarpıcı altın tahmini: Ons fiyatı 8 bin doları görebilir, merkez bankaları dolardan kaçıyor Deutsche Bank'tan çarpıcı altın tahmini: Ons fiyatı 8 bin doları görebilir, merkez bankaları dolardan kaçıyor T24 Deutsche Bank'tan çarpıcı altın tahmini: Ons fiyatı 8 bin doları görebilir, merkez bankaları dolardan kaçıyor Deutsche Bank'tan çarpıcı altın tahmini: Ons fiyatı 8 bin doları görebilir, merkez bankaları dolardan kaçıyor Deutsche Bank'tan çarpıcı altın tahmini: Ons fiyatı 8 bin doları görebilir, merkez bankaları dolardan kaçıyor",browser_full_article,"https://t24.com.tr/ekonomi/deutsche-banktan-carpici-altin-tahmini-ons-fiyati-8-bin-dolari-gorebilir-merkez-bankalari-dolardan-kaciyor,1325409",,,,,,,,il yok | ilçe yok | firma yok | faaliyet/tesis yok,,,,maps araması yapılmadı,,,92.04,11
2026-05-31 10:49:57,kara para,Banka / Finansal Kuruluş,"Roman Storm, Adalet Bakanlığı’nı yasal savunmasını baltalamak için banka hesaplarının dondurulmasını bir silah olarak kullandığını iddia ediyor","Roman Storm, Adalet Bakanlığı’nı yasal savunmasını baltalamak için banka hesaplarının dondurulmasını bir silah olarak kullandığını iddia ediyor Bitcoin News",https://news.google.com/rss/articles/CBMi_wFBVV95cUxNcmFMY2JUdjlQVDVjN1p3OXJ1MnhWOXBfUWlvdVFKQkpfZlY1OTZjWTRRWlVTYklrYjc4SV9ZOC11ejBXQmdMOU56VktTbWp0LUs3UDVtbWR2ek1uZUV2dEd0QVRQMFNST0k0encwNkZfeTZtNUI3cTh3NkR4am9WNE94SDJMTnpvZ1diZS1ubkExUTFhaTg3M0ZibTA3XzdXWGJ1UE1hWFBrdGJwWXZSSEM5dHZ3NTAwc3VpaFltYXN6a2VDZURZXzh4bkg5T0x4eTdOd1JkMWJwWFYzODJQZ0FyRm1xQUczU3NGVEJQQkZ4eGhqaXZneWFXeUtZZm8?oc=5,banka,finansal kuruluş,"Roman Storm, Adalet Bakanlığı’nı yasal savunmasını baltalamak için banka hesaplarının dondurulmasını bir silah olarak kullandığını iddia ediyor Bitcoin News","Roman Storm, Adalet Bakanlığı’nı yasal savunmasını baltalamak için banka hesaplarının dondurulmasını bir silah olarak kullandığını iddia ediyor Roman Storm, Adalet Bakanlığı’nı yasal savunmasını baltalamak için banka hesaplarının dondurulmasını bir silah olarak kullandığını iddia ediyor Bitcoin News Roman Storm, Adalet Bakanlığı’nı yasal savunmasını baltalamak için banka hesaplarının dondurulmasını bir silah olarak kullandığını iddia ediyor Bitcoin News",browser_failed,https://news.google.com/rss/articles/CBMi_wFBVV95cUxNcmFMY2JUdjlQVDVjN1p3OXJ1MnhWOXBfUWlvdVFKQkpfZlY1OTZjWTRRWlVTYklrYjc4SV9ZOC11ejBXQmdMOU56VktTbWp0LUs3UDVtbWR2ek1uZUV2dEd0QVRQMFNST0k0encwNkZfeTZtNUI3cTh3NkR4am9WNE94SDJMTnpvZ1diZS1ubkExUTFhaTg3M0ZibTA3XzdXWGJ1UE1hWFBrdGJwWXZSSEM5dHZ3NTAwc3VpaFltYXN6a2VDZURZXzh4bkg5T0x4eTdOd1JkMWJwWFYzODJQZ0FyRm1xQUczU3NGVEJQQkZ4eGhqaXZneWFXeUtZZm8?oc=5&hl=tr&gl=TR&ceid=TR:tr,,,,,,,,il yok | ilçe yok | firma yok | faaliyet/tesis yok,,,,maps araması yapılmadı,,,118.06,12
2026-06-01 06:03:00,iflas,İflas / Konkordato / Mali Sorun,134 yıllık şirketten iflas başvurusu,134 yıllık şirketten iflas başvurusu Gazete Oksijen,https://news.google.com/rss/articles/CBMigwFBVV95cUxNZWZWWXFEVlhpbl9CbFplMEVIN3dCUEY5N1NxcURENFc1NHhlOWlra2FmNDR1M1VIRjFKNHhsRERMSXJkOEdpUjhSME43aVBOczZfdEJ5ZmhucmRPWWdESm5SNWZPT21IQ3psRUs1Q3UteFdNZXkzOHBsVjA4UkJ6X1RVcw?oc=5,şirket,şirket / firma,134 yıllık şirketten iflas başvurusu Gazete Oksijen,134 yıllık şirketten iflas başvurusu 134 yıllık şirketten iflas başvurusu Gazete Oksijen 134 yıllık şirketten iflas başvurusu Gazete Oksijen,browser_failed,https://gazeteoksijen.com/ekonomi/134-yillik-sirketten-iflas-basvurusu-277335,,,,,,,,il yok | ilçe yok | firma yok | faaliyet/tesis yok,,,,maps araması yapılmadı,,,39.26,13
