published,search_term,category,title,summary,link,matched_words,activity_type,raw_text,entity_source_text,article_fetch_status,resolved_article_url,city_candidates,district_candidates,neighborhood_candidates,street_candidates,facility_candidates,company_candidates,company_candidate_scores,entity_quality_note,maps_queries,maps_candidates,maps_best_guess,maps_status,maps_match_scores,maps_rejected_candidates,record_quality_score,duplicate_group_id
2026-06-09 11:06:00,konkordato,İflas / Konkordato / Mali Sorun,Kocaeli'de 3 Şirketin Konkordatosu Uzatıldı,Kocaeli'de 3 Şirketin Konkordatosu Uzatıldı Kocaeli TV,https://news.google.com/rss/articles/CBMigAFBVV95cUxOcklXUkl6YlVwOUlpMGR4WWN1ekFabWxBXzljM1Z2UWlsTjBqd3dvdVhrbzlyQy1LalpsVHpmUFJpV1lLVnVURS11XzB4UjFfLTVqRi1EcEd6d2FER0RlNzk2TElXeFpHOVZsZE9NT2F1U0E4RHduVDBuRlB2ZVpPNNIBgAFBVV95cUxOcklXUkl6YlVwOUlpMGR4WWN1ekFabWxBXzljM1Z2UWlsTjBqd3dvdVhrbzlyQy1LalpsVHpmUFJpV1lLVnVURS11XzB4UjFfLTVqRi1EcEd6d2FER0RlNzk2TElXeFpHOVZsZE9NT2F1U0E4RHduVDBuRlB2ZVpPNA?oc=5,şirket,şirket / firma,"Gebze Asliye Ticaret Mahkemesi; Erkan Ayan, Esayan Grup, Ayanlar Ambalaj ve Turanoğulları Ambalaj hakkında yürütülen konkordato sürecindeki kesin mühlet süresini 3 Haziran'dan itibaren 4 ay daha uzattı. Gebze Asliye Ticaret Mahkemesi; Erkan Ayan, Esayan Grup, Ayanlar Ambalaj ve Turanoğulları Ambalaj hakkında yürütülen konkordato sürecindeki kesin mühlet süresini 3 Haziran'dan itibaren 4 ay daha uzattı. Gebze Asliye Ticaret Mahkemesi; Erkan Ayan, Esayan Grup, Ayanlar Ambalaj ve Turanoğulları Ambalaj hakkında yürütülen konkordato sürecindeki kesin mühlet süresini 3 Haziran'dan itibaren 4 ay daha uzattı. Kocaeli'nin Gebze ilçesinde ambalaj, inşaat, peyzaj ve geri dönüşüm sektörlerinde faaliyet gösteren üç limited şirket ve iş insanı Erkan Ayan’ın konkordato davasında mahkemeden yeni bir karar çıktı. Gebze Asliye Ticaret Mahkemesi, şirketlerin mali yapılandırma süreçlerinin devam edebilmesi için kesin mühlet süresini uzattı. Mali Yapılandırma Süreci Devam Ediyor Gebze Asliye Ticaret Mahkemesi'nin aldığı karar doğrultusunda; Erkan Ayan, Ayanlar Ambalaj İnşaat Peyzaj Mimarlık Sosyal Hizmetler Sanayi Ticaret Limited Şirketi, Esayan Grup İnşaat Ambalaj Peyzaj Turizm Taşımacılık Geri Dönüşüm Hizmetleri Sanayi ve Ticaret Limited Şirketi, Turanoğulları Ambalaj Geri Dönüşüm İnşaat Sanayi Ticaret Limited Şirketi'nin hakkında verilen kesin mühlet kararı, 3 Haziran 2026 saat 16:00'dan itibaren geçerli olmak üzere 4 ay süreyle uzatıldı. Şirketlerin mali faaliyetlerini denetlemek üzere daha önce atanan komiser heyetinin görevine devam etmesine hükmedildi. Bu kapsamda Mali Müşavir Zafer Şanal, Mali Müşavir Bülent Koçak ve Hukukçu Levent Biçer süreç boyunca denetim görevlerini sürdürecek. Alacaklılar İçin İtiraz Süresi ve Duruşma Tarihi İcra ve İflas Kanunu’nun 288. maddesi gereğince, ilanın yayınlanmasıyla birlikte alacaklılar için 7 günlük yasal itiraz süresi başladı. Borçlu şirketlerden alacağı bulunan firmalar veya şahıslar, bu süre içinde mahkemeye dilekçe vererek konkordato mühleti verilmesini gerektiren bir durum olmadığını delilleriyle ileri sürebilecek ve konkordato talebinin reddini isteyebilecekler. Davanın bir sonraki duruşması ise 14 Eylül 2026 günü saat 14:50’de gerçekleştirilecek. Kocaeli'de 3 Şirketin Konkordatosu Uzatıldı Gebze Asliye Ticaret Mahkemesi; Erkan Ayan, Esayan Grup, Ayanlar Ambalaj ve Turanoğulları Ambalaj hakkında yürütülen konkordato sürecindeki kesin mühlet süresini 3 Haziran'dan itibaren 4 ay daha uzattı. Mali Yapılandırma Süreci Devam Ediyor Alacaklılar İçin İtiraz Süresi ve Duruşma Tarihi Kocaeli'nin Gebze ilçesinde ambalaj, inşaat, peyzaj ve geri dönüşüm sektörlerinde faaliyet gösteren üç limited şirket ve iş insanı Erkan Ayan’ın konkordato davasında mahkemeden yeni bir karar çıktı. Gebze Asliye Ticaret Mahkemesi, şirketlerin mali yapılandırma süreçlerinin devam edebilmesi için kesin mühlet süresini uzattı. Gebze Asliye Ticaret Mahkemesi'nin aldığı karar doğrultusunda; Erkan Ayan, Ayanlar Ambalaj İnşaat Peyzaj Mimarlık Sosyal Hizmetler Sanayi Ticaret Limited Şirketi, Esayan Grup İnşaat Ambalaj Peyzaj Turizm Taşımacılık Geri Dönüşüm Hizmetleri Sanayi ve Ticaret Limited Şirketi, Turanoğulları Ambalaj Geri Dönüşüm İnşaat Sanayi Ticaret Limited Şirketi'nin hakkında verilen kesin mühlet kararı, 3 Haziran 2026 saat 16:00'dan itibaren geçerli olmak üzere 4 ay süreyle uzatıldı. Şirketlerin mali faaliyetlerini denetlemek üzere daha önce atanan komiser heyetinin görevine devam etmesine hükmedildi. Bu kapsamda Mali Müşavir Zafer Şanal, Mali Müşavir Bülent Koçak ve Hukukçu Levent Biçer süreç boyunca denetim görevlerini sürdürecek. İcra ve İflas Kanunu’nun 288. maddesi gereğince, ilanın yayınlanmasıyla birlikte alacaklılar için 7 günlük yasal itiraz süresi başladı. Borçlu şirketlerden alacağı bulunan firmalar veya şahıslar, bu süre içinde mahkemeye dilekçe vererek konkordato mühleti verilmesini gerektiren bir durum olmadığını delilleriyle ileri sürebilecek ve konkordato talebinin reddini isteyebilecekler. Davanın bir sonraki duruşması ise 14 Eylül 2026 günü saat 14:50’de gerçekleştirilecek.","Kocaeli'de 3 Şirketin Konkordatosu Uzatıldı Kocaeli'de 3 Şirketin Konkordatosu Uzatıldı Kocaeli TV Gebze Asliye Ticaret Mahkemesi; Erkan Ayan, Esayan Grup, Ayanlar Ambalaj ve Turanoğulları Ambalaj hakkında yürütülen konkordato sürecindeki kesin mühlet süresini 3 Haziran'dan itibaren 4 ay daha uzattı. Kocaeli'nin Gebze ilçesinde ambalaj, inşaat, peyzaj ve geri dönüşüm sektörlerinde faaliyet gösteren üç limited şirket ve iş insanı Erkan Ayan’ın konkordato davasında mahkemeden yeni bir karar çıktı. Gebze Asliye Ticaret Mahkemesi, şirketlerin mali yapılandırma süreçlerinin devam edebilmesi için kesin mühlet süresini uzattı. Mali Yapılandırma Süreci Devam Ediyor Gebze Asliye Ticaret Mahkemesi'nin aldığı karar doğrultusunda; Erkan Ayan, Ayanlar Ambalaj İnşaat Peyzaj Mimarlık Sosyal Hizmetler Sanayi Ticaret Limited Şirketi, Esayan Grup İnşaat Ambalaj Peyzaj Turizm Taşımacılık Geri Dönüşüm Hizmetleri Sanayi ve Ticaret Limited Şirketi, Turanoğulları Ambalaj Geri Dönüşüm İnşaat Sanayi Ticaret Limited Şirketi'nin hakkında verilen kesin mühlet kararı, 3 Haziran 2026 saat 16:00'dan itibaren geçerli olmak üzere 4 ay süreyle uzatıldı. Şirketlerin mali faaliyetlerini denetlemek üzere daha önce atanan komiser heyetinin görevine devam etmesine hükmedildi. Bu kapsamda Mali Müşavir Zafer Şanal, Mali Müşavir Bülent Koçak ve Hukukçu Levent Biçer süreç boyunca denetim görevlerini sürdürecek. Alacaklılar İçin İtiraz Süresi ve Duruşma Tarihi İcra ve İflas Kanunu’nun 288. maddesi gereğince, ilanın yayınlanmasıyla birlikte alacaklılar için 7 günlük yasal itiraz süresi başladı. Borçlu şirketlerden alacağı bulunan firmalar veya şahıslar, bu süre içinde mahkemeye dilekçe vererek konkordato mühleti verilmesini gerektiren bir durum olmadığını delilleriyle ileri sürebilecek ve konkordato talebinin reddini isteyebilecekler. Davanın bir sonraki duruşması ise 14 Eylül 2026 günü saat 14:50’de gerçekleştirilecek. Kocaeli'de 3 Şirketin Konkordatosu Uzatıldı Gebze Asliye Ticaret Mahkemesi; Erkan Ayan, Esayan Grup, Ayanlar Ambalaj ve Turanoğulları Ambalaj hakkında yürütülen konkordato sürecindeki kesin mühlet süresini 3 Haziran'dan itibaren 4 ay daha uzattı. Mali Yapılandırma Süreci Devam Ediyor Alacaklılar İçin İtiraz Süresi ve Duruşma Tarihi Kocaeli'nin Gebze ilçesinde ambalaj, inşaat, peyzaj ve geri dönüşüm sektörlerinde faaliyet gösteren üç limited şirket ve iş insanı Erkan Ayan’ın konkordato davasında mahkemeden yeni bir karar çıktı. Gebze Asliye Ticaret Mahkemesi'nin aldığı karar doğrultusunda; Erkan Ayan, Ayanlar Ambalaj İnşaat Peyzaj Mimarlık Sosyal Hizmetler Sanayi Ticaret Limited Şirketi, Esayan Grup İnşaat Ambalaj Peyzaj Turizm Taşımacılık Geri Dönüşüm Hizmetleri Sanayi ve Ticaret Limited Şirketi, Turanoğulları Ambalaj Geri Dönüşüm İnşaat Sanayi Ticaret Limited Şirketi'nin hakkında verilen kesin mühlet kararı, 3 Haziran 2026 saat 16:00'dan itibaren geçerli olmak üzere 4 ay süreyle uzatıldı. İcra ve İflas Kanunu’nun 288.",browser_full_article,https://www.kocaelitv.com.tr/kocaelide-3-sirketin-konkordatosu-uzatildi/amp,Kocaeli | İstanbul,Gebze,Levent,,,,,firma yok | faaliyet/tesis yok,,,,maps araması yapılmadı,,,108.0,28
2026-06-09 17:02:00,dolandırıcılık,Dolandırıcılık / Sahtecilik,Bolu Caddesi’nde bankada dolandırıcılık girişimi polis tarafından durduruldu,Bolu Caddesi’nde bankada dolandırıcılık girişimi polis tarafından durduruldu Bolu Olay,https://news.google.com/rss/articles/CBMitgFBVV95cUxQVkVaVlBwUWFNWGFIS1JlTzRfSFd1V0tCVGU4LWhiamFkMFQ2aTdEdmU5QUwxYnNEQ3ZJNDh2R2NwVWxtOE9ETHJONEM2aDdXeUM2S3hYMWthc1RiUk0wMzZ5cWFTRHNmaVVLc2RFdGpJbjZfZmpaSXpUWENjX0NMb1laY3ZwR2xEbU81NEZFaXNpZlA1MkZwT0RaY0FnQkZaWGVHY3o4MDlfNWRlM2p1UlAtdUw5Z9IBuwFBVV95cUxQZ242b2dnVWpfaktKMTJaanFiT1dnZXdSbmN0Z2hsbXdBcGNNcVctU2p3VGtYNXY4SjlqUWM4MWtpWlJ2YUJVbWtXZmY2aG1ZNzY2MjRhQk9HTl9TaVJ5elVWd2s4VGFKLU1FbG5YNTJwRF9fVXV2M05zT1BHYW5mNGkxc3dPU2ktN0s2ekRjQTloODM5SGc3Ri1FenJMcWd0bHA4dnlPMVhHUnNPdzM4dG50OEpfMWFEd3lv?oc=5,banka,finansal kuruluş,"Bolu Caddesi’nde polis, telefon dolandırıcılarının tuzağına düşen 77 yaşındaki Aziz S.’nin 350 bin lirasını kurtardı, soruşturma başlatıldı. Bolu Caddesi’nde polis, telefon dolandırıcılarının tuzağına düşen 77 yaşındaki Aziz S.’nin 350 bin lirasını kurtardı, soruşturma başlatıldı. Bolu Caddesi’nde polis, telefon dolandırıcılarının tuzağına düşen 77 yaşındaki Aziz S.’nin 350 bin lirasını kurtardı, soruşturma başlatıldı. Büyütmek için resme tıklayın Düzce merkez Bolu Caddesi’nde bir banka şubesinde, telefon dolandırıcılarının hedefi olan 77 yaşındaki Aziz S., polislerin müdahalesi sayesinde 350 bin lirasını kaybetmekten kurtuldu. Dolandırıcılar, kendilerini polis ve savcı olarak tanıtarak parayı başka bir hesaba yatırmasını istemişti. Dolandırıcılık Girişiminin Detayları Edinilen bilgilere göre, Aziz S. telefonla arandı ve kendisine yasal bir işlem olduğu söylenerek hesabındaki 350 bin liranın başka bir hesaba aktarılması istendi. Paniğe kapılan yaşlı adam, parayı çekip banka şubesine gitmeye karar verdi. Banka ve Polis Müdahalesi Banka şubesinde görevli özel güvenlik personeli, yaşlı adamın dolandırılacağını fark ederek Kaan uygulaması üzerinden polis ekiplerini bilgilendirdi. Polisler şubeye gelerek durumu kontrol etti ve 350 bin liranın gönderilmesini engelledi. Soruşturma Başlatıldı Olayın ardından yetkililer, telefon dolandırıcılarının tespit edilmesi için soruşturma başlattı. Polis ekipleri vatandaşları benzer dolandırıcılık girişimlerine karşı dikkatli olmaları konusunda uyardı. 09 Haz 2026 - 20:02 - Asayiş Bolu Caddesi’nde bankada dolandırıcılık girişimi polis tarafından durduruldu Bolu Caddesi’nde polis, telefon dolandırıcılarının tuzağına düşen 77 yaşındaki Aziz S.’nin 350 bin lirasını kurtardı, soruşturma başlatıldı. Arzu Sarı Tüm Haberleri Büyütmek için resme tıklayın Düzce merkez Bolu Caddesi’nde bir banka şubesinde, telefon dolandırıcılarının hedefi olan 77 yaşındaki Aziz S., polislerin müdahalesi sayesinde 350 bin lirasını kaybetmekten kurtuldu. Dolandırıcılar, kendilerini polis ve savcı olarak tanıtarak parayı başka bir hesaba yatırmasını istemişti. Dolandırıcılık Girişiminin Detayları Edinilen bilgilere göre, Aziz S. telefonla arandı ve kendisine yasal bir işlem olduğu söylenerek hesabındaki 350 bin liranın başka bir hesaba aktarılması istendi. Paniğe kapılan yaşlı adam, parayı çekip banka şubesine gitmeye karar verdi. Banka ve Polis Müdahalesi Banka şubesinde görevli özel güvenlik personeli, yaşlı adamın dolandırılacağını fark ederek Kaan uygulaması üzerinden polis ekiplerini bilgilendirdi. Polisler şubeye gelerek durumu kontrol etti ve 350 bin liranın gönderilmesini engelledi. Soruşturma Başlatıldı Olayın ardından yetkililer, telefon dolandırıcılarının tespit edilmesi için soruşturma başlattı. Polis ekipleri vatandaşları benzer dolandırıcılık girişimlerine karşı dikkatli olmaları konusunda uyardı. 09 Haz 2026 - 20:02 Düzce - Asayiş Yazdır Muhabir Arzu Sarı GİRİŞ YAP Yorum yazarak Bolu Olay Topluluk Kuralları’nı kabul etmiş bulunuyor ve yorumunuzla ilgili doğrudan veya dolaylı tüm sorumluluğu tek başınıza üstleniyorsunuz. Yazılan yo","Bolu Caddesi’nde bankada dolandırıcılık girişimi polis tarafından durduruldu Bolu Caddesi’nde bankada dolandırıcılık girişimi polis tarafından durduruldu Bolu Olay Bolu Caddesi’nde polis, telefon dolandırıcılarının tuzağına düşen 77 yaşındaki Aziz S.’nin 350 bin lirasını kurtardı, soruşturma başlatıldı. Büyütmek için resme tıklayın Düzce merkez Bolu Caddesi’nde bir banka şubesinde, telefon dolandırıcılarının hedefi olan 77 yaşındaki Aziz S., polislerin müdahalesi sayesinde 350 bin lirasını kaybetmekten kurtuldu. Dolandırıcılar, kendilerini polis ve savcı olarak tanıtarak parayı başka bir hesaba yatırmasını istemişti. Dolandırıcılık Girişiminin Detayları Edinilen bilgilere göre, Aziz S. telefonla arandı ve kendisine yasal bir işlem olduğu söylenerek hesabındaki 350 bin liranın başka bir hesaba aktarılması istendi. Paniğe kapılan yaşlı adam, parayı çekip banka şubesine gitmeye karar verdi. Banka ve Polis Müdahalesi Banka şubesinde görevli özel güvenlik personeli, yaşlı adamın dolandırılacağını fark ederek Kaan uygulaması üzerinden polis ekiplerini bilgilendirdi. Polisler şubeye gelerek durumu kontrol etti ve 350 bin liranın gönderilmesini engelledi. Soruşturma Başlatıldı Olayın ardından yetkililer, telefon dolandırıcılarının tespit edilmesi için soruşturma başlattı. Polis ekipleri vatandaşları benzer dolandırıcılık girişimlerine karşı dikkatli olmaları konusunda uyardı. 09 Haz 2026 - 20:02 - Asayiş Bolu Caddesi’nde bankada dolandırıcılık girişimi polis tarafından durduruldu Bolu Caddesi’nde polis, telefon dolandırıcılarının tuzağına düşen 77 yaşındaki Aziz S.’nin 350 bin lirasını kurtardı, soruşturma başlatıldı. Arzu Sarı Tüm Haberleri Büyütmek için resme tıklayın Düzce merkez Bolu Caddesi’nde bir banka şubesinde, telefon dolandırıcılarının hedefi olan 77 yaşındaki Aziz S., polislerin müdahalesi sayesinde 350 bin lirasını kaybetmekten kurtuldu. 09 Haz 2026 - 20:02 Düzce - Asayiş Yazdır Muhabir Arzu Sarı GİRİŞ YAP Yorum yazarak Bolu Olay Topluluk Kuralları’nı kabul etmiş bulunuyor ve yorumunuzla ilgili doğrudan veya dolaylı tüm sorumluluğu tek başınıza üstleniyorsunuz.",browser_full_article,https://www.boluolay.com/haber/28141272/bolu-caddesinde-bankada-dolandiricilik-girisimi-polis-tarafindan-durduruldu,Düzce,Merkez,,Bolu Caddesi | polis tarafından durduruldu Bolu Caddesi | durduruldu Bolu Olay Bolu Caddesi | tıklayın Düzce merkez Bolu Caddesi | Asayiş Bolu Caddesi,,,,firma yok | faaliyet/tesis yok,,,,maps araması yapılmadı,,,120.5,29
2026-06-10 07:44:56,yangın,Fiziksel Risk / Yangın,Yangın güvenliği denetimi ve kabul prosedürleri 1 Temmuz'dan itibaren kaldırılacaktır; sakinlerin ve işletmelerin bunu dikkate alması gerekmektedir.,Yangın güvenliği denetimi ve kabul prosedürleri 1 Temmuz'dan itibaren kaldırılacaktır; sakinlerin ve işletmelerin bunu dikkate alması gerekmektedir. Vietnam.vn,https://news.google.com/rss/articles/CBMiuAFBVV95cUxOZEhRWTBEUko1aUppaGw4dVlIcG1lYXVBUzc5QXY5RjhzOGw0TkpScmgtc0R1enk1YmhmUnNkQ2M0ZTZOY1pRTG1QWTIwSnVuZ29hVFFNbkVvOWdTTWVmVi1KcUxoWXR2RWhMUzZuaWwzNThiQ2dUVjRYckpKQ3d3V2EzVzFDSjlISWw3MFpkSUlFc1BnVWdEOFNqcjVJRk9tY0U2V3hJeVZpLVE4X1FFV2hxQkI2b2l2?oc=5,işletme,,Yangın güvenliği denetimi ve kabul prosedürleri 1 Temmuz'dan itibaren kaldırılacaktır; sakinlerin ve işletmelerin bunu dikkate alması gerekmektedir. Vietnam.vn,Yangın güvenliği denetimi ve kabul prosedürleri 1 Temmuz'dan itibaren kaldırılacaktır; sakinlerin ve işletmelerin bunu dikkate alması gerekmektedir. Yangın güvenliği denetimi ve kabul prosedürleri 1 Temmuz'dan itibaren kaldırılacaktır; sakinlerin ve işletmelerin bunu dikkate alması gerekmektedir. Vietnam.vn Yangın güvenliği denetimi ve kabul prosedürleri 1 Temmuz'dan itibaren kaldırılacaktır; sakinlerin ve işletmelerin bunu dikkate alması gerekmektedir.,browser_failed,https://news.google.com/rss/articles/CBMiuAFBVV95cUxOZEhRWTBEUko1aUppaGw4dVlIcG1lYXVBUzc5QXY5RjhzOGw0TkpScmgtc0R1enk1YmhmUnNkQ2M0ZTZOY1pRTG1QWTIwSnVuZ29hVFFNbkVvOWdTTWVmVi1KcUxoWXR2RWhMUzZuaWwzNThiQ2dUVjRYckpKQ3d3V2EzVzFDSjlISWw3MFpkSUlFc1BnVWdEOFNqcjVJRk9tY0U2V3hJeVZpLVE4X1FFV2hxQkI2b2l2?oc=5&hl=tr&gl=TR&ceid=TR:tr,,,,,,,,il yok | ilçe yok | firma yok | faaliyet/tesis yok,,,,maps araması yapılmadı,,,131.34,30
2026-06-10 07:56:15,yangın,Fiziksel Risk / Yangın,"Yangın, 17.000 metrekareden fazla bir alana sahip ahşap işleme fabrikasını yok etti.","Yangın, 17.000 metrekareden fazla bir alana sahip ahşap işleme fabrikasını yok etti. Vietnam.vn",https://news.google.com/rss/articles/CBMihgFBVV95cUxOelB5cVh6WEl6ZWZBbGJwX0xldlhsSlpfS3hqSjh4VDk1UU54bVB3S2pWcTFUSy1VLW83ZnMxN0U0aE9tRDZuQjl6bWZjSFhKdi1rdUFIZGdKck1hZmYwd0dUVHhBS1JZYk1YdjQ2RGdVSHBqR3phOG40VnFoekdBUTJIeG5tQQ?oc=5,fabrika,fabrika,"Yangın, 17.000 metrekareden fazla bir alana sahip ahşap işleme fabrikasını yok etti. Vietnam.vn","Yangın, 17.000 metrekareden fazla bir alana sahip ahşap işleme fabrikasını yok etti. Yangın, 17.000 metrekareden fazla bir alana sahip ahşap işleme fabrikasını yok etti. Vietnam.vn Yangın, 17.000 metrekareden fazla bir alana sahip ahşap işleme fabrikasını yok etti.",browser_failed,https://news.google.com/rss/articles/CBMihgFBVV95cUxOelB5cVh6WEl6ZWZBbGJwX0xldlhsSlpfS3hqSjh4VDk1UU54bVB3S2pWcTFUSy1VLW83ZnMxN0U0aE9tRDZuQjl6bWZjSFhKdi1rdUFIZGdKck1hZmYwd0dUVHhBS1JZYk1YdjQ2RGdVSHBqR3phOG40VnFoekdBUTJIeG5tQQ?oc=5&hl=tr&gl=TR&ceid=TR:tr,,,,,,,,il yok | ilçe yok | firma yok | faaliyet/tesis yok,,,,maps araması yapılmadı,,,82.7,31
2026-06-10 03:02:37,banka hesapları bloke,Banka / Finansal Kuruluş,15 Haziran'dan sonra SIM kartınızın bloke edilmesi banka hesabınızı ve dijital hizmetlerinizi nasıl etkileyecek?,15 Haziran'dan sonra SIM kartınızın bloke edilmesi banka hesabınızı ve dijital hizmetlerinizi nasıl etkileyecek? Vietnam.vn,https://news.google.com/rss/articles/CBMipAFBVV95cUxQTXp5RThLc3BWQTE4QjRtNGdLU1NXcWFyN0JuMlRONGVDbTVsN01RUE9hY0NwWTAzZ2xPQ21kMGp2Q3dVa1VIbGVKUF9GSTFlUDc0VXB0VkZBY0hsLWZnNV95eWF6aldsTzRKZWk2S0Z5SEVGWVZyejE2ck1yVUxjUnVBYmIyYzlwNDVWbk5RaV9BcVFJUjdXUFlVSGZHNlBsdXVtYw?oc=5,"banka, banka hesabı",finansal kuruluş,15 Haziran'dan sonra SIM kartınızın bloke edilmesi banka hesabınızı ve dijital hizmetlerinizi nasıl etkileyecek? Vietnam.vn,15 Haziran'dan sonra SIM kartınızın bloke edilmesi banka hesabınızı ve dijital hizmetlerinizi nasıl etkileyecek? 15 Haziran'dan sonra SIM kartınızın bloke edilmesi banka hesabınızı ve dijital hizmetlerinizi nasıl etkileyecek? Vietnam.vn 15 Haziran'dan sonra SIM kartınızın bloke edilmesi banka hesabınızı ve dijital hizmetlerinizi nasıl etkileyecek?,browser_failed,https://news.google.com/rss/articles/CBMipAFBVV95cUxQTXp5RThLc3BWQTE4QjRtNGdLU1NXcWFyN0JuMlRONGVDbTVsN01RUE9hY0NwWTAzZ2xPQ21kMGp2Q3dVa1VIbGVKUF9GSTFlUDc0VXB0VkZBY0hsLWZnNV95eWF6aldsTzRKZWk2S0Z5SEVGWVZyejE2ck1yVUxjUnVBYmIyYzlwNDVWbk5RaV9BcVFJUjdXUFlVSGZHNlBsdXVtYw?oc=5&hl=tr&gl=TR&ceid=TR:tr,,,,,,,,il yok | ilçe yok | firma yok | faaliyet/tesis yok,,,,maps araması yapılmadı,,,93.98,32
2026-06-09 20:53:46,bankaya soruşturma,Banka / Finansal Kuruluş,Bankacılıkta Büyük Utanç! Bankaların Kar Masasında Bankacı Yokmuş!,Bankacılıkta Büyük Utanç! Bankaların Kar Masasında Bankacı Yokmuş! ParaMedya,https://news.google.com/rss/articles/CBMiqAFBVV95cUxONG0wVjBQdEhaaHdpRFkxOW5IR1MtcWNKN1RESnVQWE9QdEFybTAxVVJaclFKTjhlUElKckkxN0k3dzY1UVhFUHdZSm1KSUt1S2ZmVDdHUlNpV0ktUmItanlvR3o5WmJNYVVqUHp2RGhvRDdTd0txb2tybkJ2eTlyUjFkLS1tWHZaNk9JUFlsWHQwY2FwRkV0eExRa3ZBN0hPWk1uaTNPN1bSAa4BQVVfeXFMT2NkX0dZQ1A2TngxYmk0SWFrSVFDMHF1UlRQM1FhdXlZQURpNVFJX2wtMjRXSUNjSTdNUjJTclU0VGdQdlVMQVY0b0RVZnNlU0ktN1pWbmpFZ19BTzQ5UjRnbGx1UksxSU1BVzlEQ1pVV2JjaE5tWWlJWEhpS2xURy1CRUJ5QXk0THNCY0phd2drS2NMaTlhMU9oV2Y0YUhiaHZhR0ItUDNfMTJRVWR3?oc=5,"banka, bankacılık",finansal kuruluş,"www.paramedya.com Güvenlik doğrulaması yapılıyor Bu web sitesi, kötü niyetli botlara karşı korunmak için bir güvenlik hizmeti kullanıyor. Web sitesi bir bot olmadığınızı doğrularken bu sayfa görüntülenir. Doğrulama başarılı. www.paramedya.com adresinin yanıt vermesi bekleniyor Güvenlik doğrulaması yapılıyor Doğrulama başarılı. www.paramedya.com adresinin yanıt vermesi bekleniyor Bu web sitesi, kötü niyetli botlara karşı korunmak için bir güvenlik hizmeti kullanıyor. Web sitesi bir bot olmadığınızı doğrularken bu sayfa görüntülenir.","Bankacılıkta Büyük Utanç! Bankaların Kar Masasında Bankacı Yokmuş! Bankacılıkta Büyük Utanç! Bankaların Kar Masasında Bankacı Yokmuş! ParaMedya www.paramedya.com Güvenlik doğrulaması yapılıyor Bu web sitesi, kötü niyetli botlara karşı korunmak için bir güvenlik hizmeti kullanıyor. Web sitesi bir bot olmadığınızı doğrularken bu sayfa görüntülenir. www.paramedya.com adresinin yanıt vermesi bekleniyor Güvenlik doğrulaması yapılıyor Doğrulama başarılı. www.paramedya.com adresinin yanıt vermesi bekleniyor Bu web sitesi, kötü niyetli botlara karşı korunmak için bir güvenlik hizmeti kullanıyor.",browser_full_article,https://www.paramedya.com/devami/142132/bankacilikta-buyuk-utanc-bankalarin-kar-masasinda-bankaci-yokmus/,,,,,,,,il yok | ilçe yok | firma yok | faaliyet/tesis yok,,,,maps araması yapılmadı,,,55.37,33
2026-06-09 13:25:04,bankaya soruşturma,Banka / Finansal Kuruluş,Yine aynı ilimiz! Koç Grubu'na bağlı bankaya bir saldırı daha,Yine aynı ilimiz! Koç Grubu'na bağlı bankaya bir saldırı daha MSN,https://news.google.com/rss/articles/CBMi2gFBVV95cUxNcUpFWHkxcTZ4a3FtUUF0bnpBS2xKaDhtN0ZWVFdGeTgzSU1qOTB3RmE2VU03UEx3VllxNnpHN2VDT0w4MlRZX3EtWU9sRTVRb1Y4VVpyUldPMG1QTWpTM2NFdXRLM0d0ZmpzQURxZDhwUjlkZklGS1I3anZSUXBJTFgybGk3dXhOdlFfd1UtT2lYRDQxaHBnbkRJVGV2SXZkSFFnSGg3dXNfckdiZ2F0V0d4M09YT3l6Q0JpNGNualM2Rko4bHJJbkx0RFA4THRTdnJJMk9wbU9vZw?oc=5,banka,finansal kuruluş,Diyarbakır'da Koç Grubu'na bağlı Yapı Kredi Bankası'na bu sabah ikinci kez silahlı saldırı düzenlendi. Kimliği belirsiz kişilerce bankanın iki ATM'si kurşunlandı. Polis olayla ilgili geniş çaplı soruşturma başlattı. Diyarbakır'da Koç Grubu'na bağlı Yapı Kredi Bankası'na bu sabah ikinci kez silahlı saldırı düzenlendi. Kimliği belirsiz kişilerce bankanın iki ATM'si kurşunlandı. Polis olayla ilgili geniş çaplı soruşturma başlattı.,Yine aynı ilimiz! Koç Grubu'na bağlı bankaya bir saldırı daha Yine aynı ilimiz! Koç Grubu'na bağlı bankaya bir saldırı daha MSN Diyarbakır'da Koç Grubu'na bağlı Yapı Kredi Bankası'na bu sabah ikinci kez silahlı saldırı düzenlendi. Polis olayla ilgili geniş çaplı soruşturma başlattı.,browser_full_article,https://www.msn.com/tr-tr/video/populer/yine-ayn%C4%B1-ilimiz-ko%C3%A7-grubu-na-ba%C4%9Fl%C4%B1-bankaya-bir-sald%C4%B1r%C4%B1-daha/vi-AA25aPPn,Diyarbakır,,,,,,,ilçe yok | firma yok | faaliyet/tesis yok,,,,maps araması yapılmadı,,,59.06,34
2026-06-09 13:52:02,banka soruşturma,Banka / Finansal Kuruluş,Diyarbakır'da banka ATM'lerine yönelik saldırılar sürüyor Yenişehir'de hedef Yapı Kredi,Diyarbakır'da banka ATM'lerine yönelik saldırılar sürüyor Yenişehir'de hedef Yapı Kredi Diyarbakir.Net,https://news.google.com/rss/articles/CBMiyAFBVV95cUxOX2o5MFBrc1loVV9pZFF0d0ZoNGF6N3B2RzRVMDR4OU1BMGxncm1fS243cTBLLUNnSlNjVmEwYWJHSnhhYkFiSl80dGlHWko1bTlwMXBrNWZUdHRLMDlVYndvLXFGLU8yZ3c0a0Z2UGxpV1djbUY3akE1M19zRE5wMjN2LUgwUmFBeHpBTjlrOGFlYXRXbWFlbWlkUHJ4a3F4M2dzSDRqakdwWF9mS3JMcXZmcEhWTmtUUDJrVGlaQUZVcVV6QlEtcw?oc=5,banka,finansal kuruluş,Diyarbakır'da banka ATM'lerine yönelik saldırılar sürüyor Yenişehir'de hedef Yapı Kredi Diyarbakir.Net,Diyarbakır'da banka ATM'lerine yönelik saldırılar sürüyor Yenişehir'de hedef Yapı Kredi Diyarbakır'da banka ATM'lerine yönelik saldırılar sürüyor Yenişehir'de hedef Yapı Kredi Diyarbakir.Net Diyarbakır'da banka ATM'lerine yönelik saldırılar sürüyor Yenişehir'de hedef Yapı Kredi Diyarbakir.Net,browser_failed,https://news.google.com/rss/articles/CBMiyAFBVV95cUxOX2o5MFBrc1loVV9pZFF0d0ZoNGF6N3B2RzRVMDR4OU1BMGxncm1fS243cTBLLUNnSlNjVmEwYWJHSnhhYkFiSl80dGlHWko1bTlwMXBrNWZUdHRLMDlVYndvLXFGLU8yZ3c0a0Z2UGxpV1djbUY3akE1M19zRE5wMjN2LUgwUmFBeHpBTjlrOGFlYXRXbWFlbWlkUHJ4a3F4M2dzSDRqakdwWF9mS3JMcXZmcEhWTmtUUDJrVGlaQUZVcVV6QlEtcw?oc=5&hl=tr&gl=TR&ceid=TR:tr,Diyarbakır | Bursa | Mersin,Yenişehir,,,,,,firma yok | faaliyet/tesis yok,,,,maps araması yapılmadı,,,104.02,35
