published,search_term,category,title,summary,link,matched_words,activity_type,raw_text,entity_source_text,article_fetch_status,resolved_article_url,city_candidates,district_candidates,neighborhood_candidates,street_candidates,facility_candidates,company_candidates,company_candidate_scores,entity_quality_note,maps_queries,maps_candidates,maps_best_guess,maps_status,maps_match_scores,maps_rejected_candidates,record_quality_score,duplicate_group_id
2026-07-06 12:19:51,yangın,Fiziksel Risk / Yangın,Menemen'de geri dönüşüm tesisinde yangın,Menemen'de geri dönüşüm tesisinde yangın Mahalli Gündem,https://news.google.com/rss/articles/CBMigAFBVV95cUxQcjdQY3NZdDdJQloxQmw3TWtRS1FLTTItSHdiXzBzbUNVN0V5UVpid1JxeFpzY2x4alRKRHZ6QUp2WEZwWFNzelY5bG81SWUyR2hrcVJ4M1VTWjBuWjlpYy0xcTJHRWJZc2I4RXdOV3ZWM0xnakRaQzM4TDJUZ3BWcA?oc=5,tesis,,"Menemen'in Camiikebir Mahallesi'ndeki geri dönüşüm tesisinde saat 13.00 sıralarında yangın çıktı. İtfaiye ekipleri alevlere dört koldan müdahale ediyor. Menemen'in Camiikebir Mahallesi'ndeki geri dönüşüm tesisinde saat 13.00 sıralarında yangın çıktı. İtfaiye ekipleri alevlere dört koldan müdahale ediyor. Menemen'in Camiikebir Mahallesi'ndeki geri dönüşüm tesisinde saat 13.00 sıralarında yangın çıktı. İtfaiye ekipleri alevlere dört koldan müdahale ediyor. Menemen'de geri dönüşüm tesisinde yangın Menemen'in Camiikebir Mahallesi'ndeki geri dönüşüm tesisinde saat 13.00 sıralarında yangın çıktı. İtfaiye ekipleri alevlere dört koldan müdahale ediyor. Menemen’deki Geri Dönüşüm Tesisi Yangınına Yoğun Müdahale İzmir Büyükşehir Belediyesi İtfaiye Daire Başkanlığı, Menemen'de bir geri dönüşüm tesisinde çıkan yangını kontrol altına almak için çok sayıda araç ve personelle çalışma yürütüyor. Yangının çevredeki ev ve yapılara sıçrama riskine karşı ekipler dört koldan müdahalesini sürdürüyor. İzmir'in Menemen ilçesi Camiikebir Mahallesi'nde bulunan bir geri dönüşüm tesisinde saat 13.00 sıralarında yangın çıktı . Tesisten yükselen yoğun dumanı fark eden çevre sakinlerinin ihbarı üzerine İzmir Büyükşehir Belediyesi İtfaiye Dairesi Başkanlığı ekipleri olay yerine sevk edildi. Yangına 5 arazöz , 1 merdivenli araç, 2 tonaj aracı, 1 endüstriyel araç ve 1 köpük kulesi aracıyla müdahale edilirken, söndürme çalışmalarına ilçe belediyeleri de su tankerleri ve iş makineleriyle destek verdi. Yangının çıktığı geri dönüşüm tesisinin çevresinde evler ve çeşitli yapılar bulunması nedeniyle ekipler, alevlerin sıçrama riskine karşı geniş güvenlik önlemleri aldı. Geri dönüşüm malzemelerinin yüksek yanıcılığı nedeniyle kısa sürede büyüyen yangına , çevredeki yapılara ulaşmasını önlemek amacıyla dört koldan müdahale edildi. Tesisin farklı noktalarında eş zamanlı çalışma yürüten ekipler, söndürme çalışmalarını aralıksız sürdürüyor.","Menemen'de geri dönüşüm tesisinde yangın Menemen'de geri dönüşüm tesisinde yangın Mahalli Gündem Menemen'in Camiikebir Mahallesi'ndeki geri dönüşüm tesisinde saat 13.00 sıralarında yangın çıktı. İtfaiye ekipleri alevlere dört koldan müdahale ediyor. Menemen'de geri dönüşüm tesisinde yangın Menemen'in Camiikebir Mahallesi'ndeki geri dönüşüm tesisinde saat 13.00 sıralarında yangın çıktı. Menemen’deki Geri Dönüşüm Tesisi Yangınına Yoğun Müdahale İzmir Büyükşehir Belediyesi İtfaiye Daire Başkanlığı, Menemen'de bir geri dönüşüm tesisinde çıkan yangını kontrol altına almak için çok sayıda araç ve personelle çalışma yürütüyor. Yangının çevredeki ev ve yapılara sıçrama riskine karşı ekipler dört koldan müdahalesini sürdürüyor. İzmir'in Menemen ilçesi Camiikebir Mahallesi'nde bulunan bir geri dönüşüm tesisinde saat 13.00 sıralarında yangın çıktı . Tesisten yükselen yoğun dumanı fark eden çevre sakinlerinin ihbarı üzerine İzmir Büyükşehir Belediyesi İtfaiye Dairesi Başkanlığı ekipleri olay yerine sevk edildi. Yangına 5 arazöz , 1 merdivenli araç, 2 tonaj aracı, 1 endüstriyel araç ve 1 köpük kulesi aracıyla müdahale edilirken, söndürme çalışmalarına ilçe belediyeleri de su tankerleri ve iş makineleriyle destek verdi. Yangının çıktığı geri dönüşüm tesisinin çevresinde evler ve çeşitli yapılar bulunması nedeniyle ekipler, alevlerin sıçrama riskine karşı geniş güvenlik önlemleri aldı. Geri dönüşüm malzemelerinin yüksek yanıcılığı nedeniyle kısa sürede büyüyen yangına , çevredeki yapılara ulaşmasını önlemek amacıyla dört koldan müdahale edildi. Tesisin farklı noktalarında eş zamanlı çalışma yürüten ekipler, söndürme çalışmalarını aralıksız sürdürüyor.",browser_full_article,https://www.mahalligundem.com/menemende-geri-donusum-tesisinde-yangin/82936,İzmir,Menemen,in Camiikebir Mahallesi | in Menemen ilçesi Camiikebir Mahallesi,,deki Geri Dönüşüm Tesisi,,,firma yok,deki Geri Dönüşüm Tesisi in Camiikebir Mahallesi Menemen İzmir Türkiye,Aktaşlar geri dönüşüm | Yiğit Geri Dönüşüm | İZMİR GERİ KAZANIM SAN. TİC. LTD. ŞTİ | Ünsan Geri Dönüşüm Hurdacılık & Fabrika Söküm | İzmir Geri Kazanım - İGK,Aktaşlar geri dönüşüm,"firma adı yok, tesis/lokasyon ile maps tahmini var",72.72727272727272 | 80.0 | 49.18032786885246 | 66.66666666666666 | 52.17391304347826,,172.75,15
2026-07-05 13:58:11,fabrika yangını,Fiziksel Risk / Yangın,Fabrika yangınında ölenlerin ailesinden Dilovası Belediyesi önünde eylem!,Fabrika yangınında ölenlerin ailesinden Dilovası Belediyesi önünde eylem! Bağımsız Kocaeli Gazetesi,https://news.google.com/rss/articles/CBMixgFBVV95cUxNU0lIVlo3ZzJ2X3lQTjVBZjNpZDA0VEJaLUVfeUEzMTBrRmdUV1E0N1Y5b0FMNmc1a2p0S29LVkVib0xoVFBuVzlaODF2ZUk0ZmsxbVFuSHE4d011ZEZlY0ZhR0ZWYWtKWlpzOXZEWkk3VUFmVWZYNGVubmQtZmhoOWxvckNmUEQ0c0J2WXBWcnY1WUowTnlrdWNUWHhpa1E2UVpZTHEwUEIwUmxXR295QXhDNFZVNTNoeGppejRUQl9MZHJMY3c?oc=5,fabrika,fabrika,Fabrika yangınında ölenlerin ailesinden Dilovası Belediyesi önünde eylem! Bağımsız Kocaeli Gazetesi,Fabrika yangınında ölenlerin ailesinden Dilovası Belediyesi önünde eylem! Fabrika yangınında ölenlerin ailesinden Dilovası Belediyesi önünde eylem! Bağımsız Kocaeli Gazetesi Fabrika yangınında ölenlerin ailesinden Dilovası Belediyesi önünde eylem! Bağımsız Kocaeli Gazetesi,browser_failed,https://www.bagimsizkocaeli.com.tr/gundem/fabrika-yangininda-olenlerin-ailesinden-dilovasi-belediyesi-onunde-eylem-h351488.html,,,,,,,,il yok | ilçe yok | firma yok | faaliyet/tesis yok,,,,maps araması yapılmadı,,,78.24,16
2026-07-06 12:23:25,tesis yangını,Fiziksel Risk / Yangın,Menemen’deki geri dönüşüm tesisi yangınına yoğun müdahale,Menemen’deki geri dönüşüm tesisi yangınına yoğun müdahale Ege Postası,https://news.google.com/rss/articles/CBMinAFBVV95cUxNU2txOE4wRTk2SEFzWl80TnZJSlZpSlQ4OFNOV3UzUWhXemRQaDNRNE1MX2dHaWozT2JjSFdYdGU0WFhlWVdnb21rX2VDQzBHOUJPdHVfOWhteWpHZ3N0VUhmUkNUZnRSUDFXR3FvN2pQWWticTJnckNYa3FSUDJ6bE9oaHlUWmM2cjdJbjVDUzdlUHpldGF3bkJBSkM?oc=5,tesis,,"İzmir Büyükşehir Belediyesi İtfaiye Daire Başkanlığı, Menemen de bir geri dönüşüm tesisinde çıkan yangını kontrol altına almak için çok sayıda araç ve personelle çalışma yürütüyor. Yangının çevredeki ev ve yapılara sıçrama riskine karşı ekipler dört koldan müdahalesini sürdürüyor. İzmir Büyükşehir Belediyesi İtfaiye Daire Başkanlığı, Menemen de bir geri dönüşüm tesisinde çıkan yangını kontrol altına almak için çok sayıda araç ve personelle çalışma yürütüyor. Yangının çevredeki ev ve yapılara sıçrama riskine karşı ekipler dört koldan müdahalesini sürdürüyor. Anasayfa İzmir Menemen’deki geri dönüşüm tesisi yangınına yoğun müdahale Menemen’deki geri dönüşüm tesisi yangınına yoğun müdahale İzmir Büyükşehir Belediyesi İtfaiye Daire Başkanlığı, Menemen'de bir geri dönüşüm tesisinde çıkan yangını kontrol altına almak için çok sayıda araç ve personelle çalışma yürütüyor. Yangının çevredeki ev ve yapılara sıçrama riskine karşı ekipler dört koldan müdahalesini sürdürüyor. Ege Postası 06.07.2026 - 15:18 Telegram ile paylaş Google News'te takip et İzmir'in Menemen ilçesi Camiikebir Mahallesi'nde bulunan bir geri dönüşüm tesisinde saat 13.00 sıralarında yangın çıktı. Tesisten yükselen yoğun dumanı fark eden çevre sakinlerinin ihbarı üzerine İzmir Büyükşehir Belediyesi İtfaiye Dairesi Başkanlığı ekipleri olay yerine sevk edildi. Yangına 5 arazöz, 1 merdivenli araç, 2 tonaj aracı, 1 endüstriyel araç ve 1 köpük kulesi aracıyla müdahale edilirken, söndürme çalışmalarına ilçe belediyeleri de su tankerleri ve iş makineleriyle destek verdi. Alevlere dört koldan müdahale Yangının çıktığı geri dönüşüm tesisinin çevresinde evler ve çeşitli yapılar bulunması nedeniyle ekipler, alevlerin sıçrama riskine karşı geniş güvenlik önlemleri aldı. Geri dönüşüm malzemelerinin yüksek yanıcılığı nedeniyle kısa sürede büyüyen yangına, çevredeki yapılara ulaşmasını önlemek amacıyla dört koldan müdahale edildi. Tesisin farklı noktalarında eş zamanlı çalışma yürüten ekipler, söndürme çalışmalarını aralıksız sürdürüyor. İzmir Geri dönüşüm farikasında korkutan yangın! İzmir Bornova’da ot yangını büyümeden söndürüldü İzmir Saya Holding, ‘Klaros Antik Kazı Alanı’ sponsorluk sözleşmesini yeniledi İzmir İzmir Ticaret Tarihi Müzesi'nde 'kültür ve tarih' buluşması İzmir Aliağa’daki orman yangını dakikalar içinde kontrol altına alındı İzmir İzmir'deki yangında evini kaybetmişti; afet konutlarındaki yeni evi için gün sayıyor İzmir Ödemiş'te tarihi okula anlamlı kütüphane Anasayfa İzmir Menemen’deki geri dönüşüm tesisi yangınına yoğun müdahale Menemen’deki geri dönüşüm tesisi yangınına yoğun müdahale İzmir Büyükşehir Belediyesi İtfaiye Daire Başkanlığı, Menemen'de bir geri dönüşüm tesisinde çıkan yangını kontrol altına almak için çok sayıda araç ve personelle çalışma yürütüyor. Yangının çevredeki ev ve yapılara sıçrama riskine karşı ekipler dört koldan müdahalesini sürdürüyor. Ege Postası 06.07.2026 - 15:18 Telegram ile paylaş Google News'te takip et İzmir'in Menemen ilçesi Camiikebir Mahallesi'nde bulunan bir geri dönüşüm tesisinde saat 13.00 sıralarında yangın çıktı. Tesisten yükselen yoğun dumanı fark eden çevre sakinlerinin ihbarı üzerine İzmir Büyükşehir Belediyesi İtfaiye Dairesi Başkanlığı ekipleri olay yerine sevk edildi. Yangına 5 arazöz, 1 merdivenli araç, 2 tonaj aracı, 1 endüstriyel araç ve 1 köpük kulesi aracıyla müdahale edilirken, söndürme çalışmalarına ilçe belediyeleri de su tankerleri ve iş makineleriyle destek verdi. Alevlere dört koldan müdahale Yangının çıktığı geri dönüşüm tesisinin çevresinde evler ve çeşitli yapılar bulunması nedeniyle ekipler, alevlerin sıçrama riskine karşı geniş güvenlik önlemleri aldı. Geri dönüşüm malzemelerinin yüksek yanıcılığı nedeniyle kısa sürede büyüyen yangına, çevredeki yapılara ulaşmasını önlemek amacıyla dört koldan müdahale edildi. Tesisin farklı noktalarında eş zamanlı çalışma yürüten ekipler, söndürme çalışmalarını aralıksız sürdürüyor. İlginizi çekebilir İzmir Geri dönüşüm farikasında korkutan yangın! İzmir Bornova’da ot yangını büyümeden söndürüldü İzmir Saya Holding, ‘Klaros Antik Kazı Alanı’ sponsorluk sözleşmesini yeniledi Whatsapp ile paylaş Facebook ile paylaş Twitter ile paylaş Yorum Yap Yorum Yazın Yorumlar Yeniden eskiye Eskid","Menemen’deki geri dönüşüm tesisi yangınına yoğun müdahale Menemen’deki geri dönüşüm tesisi yangınına yoğun müdahale Ege Postası İzmir Büyükşehir Belediyesi İtfaiye Daire Başkanlığı, Menemen de bir geri dönüşüm tesisinde çıkan yangını kontrol altına almak için çok sayıda araç ve personelle çalışma yürütüyor. Yangının çevredeki ev ve yapılara sıçrama riskine karşı ekipler dört koldan müdahalesini sürdürüyor. Anasayfa İzmir Menemen’deki geri dönüşüm tesisi yangınına yoğun müdahale Menemen’deki geri dönüşüm tesisi yangınına yoğun müdahale İzmir Büyükşehir Belediyesi İtfaiye Daire Başkanlığı, Menemen'de bir geri dönüşüm tesisinde çıkan yangını kontrol altına almak için çok sayıda araç ve personelle çalışma yürütüyor.",browser_full_article,https://www.egepostasi.com/haber/Menemendeki-geri-donusum-tesisi-yanginina-yogun-mudahale/393196,İzmir,Menemen,,,deki geri dönüşüm tesisi,,,firma yok,deki geri dönüşüm tesisi Menemen İzmir Türkiye,"Ünsan Geri Dönüşüm Hurdacılık & Fabrika Söküm | Ünsan Geri Dönüşüm Hurdacılık ve Hafriyat, Fabrika Sökümü | Yalınsu Geri Kazanım | İzmir Geri Kazanım - İGK | Sezer Geri Dönüşüm",Ünsan Geri Dönüşüm Hurdacılık & Fabrika Söküm,"firma adı yok, tesis/lokasyon ile maps tahmini var",66.66666666666666 | 66.66666666666666 | 50.0 | 52.17391304347826 | 80.0,,162.75,17
2026-07-06 10:25:41,MASAK,Kara Para / MASAK / Bahis,İzmir Merkezli Dev Vurgun: 200 Milyon Liralık Oyunu MASAK Çözdü!,İzmir Merkezli Dev Vurgun: 200 Milyon Liralık Oyunu MASAK Çözdü! Muğla Yenigün Gazetesi,https://news.google.com/rss/articles/CBMilwFBVV95cUxNOU9WdTB4Tm1GUWlxOGp5X0lKSkdFY0RLRVhMWVFhQVFoTjRDdVBweVM4cU5kUmtnNnJLaUg4Wi11R3EyQktRWGxZUldpMHZQNjMwZzV3a09sRVhKMkRXOUMtYzE2VXdXazExWWkzMnVua3BBUmlLX2ZJNWJaTW1pR3NtUE1ka0U1QkRCUkYtd3lTRTQ4dnk4?oc=5,masak,,"İzmir merkezli 5 ilde düzenlenen eş zamanlı operasyonda, kurgu trafik kazaları düzenleyerek sigorta şirketlerini yaklaşık 200 milyon lira dolandıran suç örgütü üyesi 48 şüpheli gözaltına alındı. İzmir merkezli 5 ilde düzenlenen eş zamanlı operasyonda, kurgu trafik kazaları düzenleyerek sigorta şirketlerini yaklaşık 200 milyon lira dolandıran suç örgütü üyesi 48 şüpheli gözaltına alındı. İzmir merkezli 5 ilde düzenlenen eş zamanlı operasyonda, kurgu trafik kazaları düzenleyerek sigorta şirketlerini yaklaşık 200 milyon lira dolandıran suç örgütü üyesi 48 şüpheli gözaltına alındı. Ana Sayfa › Haber › İzmir Merkezli Dev Vurgun: 200 Milyon Liralık Oyunu MASAK Çözdü! İzmir Cumhuriyet Başsavcılığı koordinesinde yürütülen soruşturma kapsamında, kurgu trafik kazalarıyla sigorta şirketleri üzerinden haksız kazanç sağlayan bir suç örgütüne yönelik İzmir merkezli İstanbul, Ankara, Ağrı ve Antalya illerinde eş zamanlı operasyon düzenlendi. İl Emniyet Müdürlüğü Mali Suçlarla Mücadele Şube Müdürlüğü ekiplerince gerçekleştirilen baskınlarda, hakkında gözaltı kararı verilen 62 şüpheliden 48’i yakalanarak gözaltına alındı. MASAK hesap hareketleri ve kaza raporlarının detaylı incelenmesiyle ortaya çıkarılan dolandırıcılık ağında, toplam 240 şüphelinin ismi geçiyor. Polis ekiplerinin firari durumda olan diğer şüphelileri yakalamaya yönelik saha çalışmaları ise kesintisiz devam ediyor. Kameraların Olmadığı Bölgeleri Seçmişler Suç örgütü üyelerinin dolandırıcılık yöntemine dair çarpıcı detaylar netleşti. Şüphelilerin özellikle kent güvenlik kameralarının bulunmadığı kör noktaları tercih ederek araçları kaza yapmış gibi konumlandırdıkları belirlendi. Araçların fotoğraflarını çeken şebeke üyelerinin, kendi aralarında sahte maddi hasarlı kaza tutanağı düzenledikleri tespit edildi. Bu yöntemle eksperlerin detaylı inceleme yapma imkanını ortadan kaldıran şüphelilerin, hasarlı araçları tamir ettirdikten sonra sigorta şirketlerine başvurdukları öğrenildi. Sigorta şirketlerinin ödeme yapmaktan kaçındığı durumlarda ise şebekenin tahkim komisyonlarını, mahkemeleri ve icra dairelerini devreye sokarak tahsilat baskısı kurduğu açığa çıkarıldı. Örgüt Yöneticisi Avukat Çıktı Yapılan bütçe ve hesap incelemelerinde, örgüt lideri olduğu değerlendirilen E.G. ile yöneticiler Ç.İ. ve avukat A.A.’nın bu yöntemle yaklaşık 200 milyon TL haksız kazanç elde ettiği saptandı. Soruşturma dosyasında hasar bedellerinin tahsilat sürecini yöneten 17 avukatın ismi yer alırken, MASAK raporlarında avukat A.A.’nın doğrudan örgüt adına hareket ettiği belirlendi. Soruşturmaya dahil olan diğer avukatların ise örgüt üyeleriyle doğrudan bir hesap hareketine rastlanmadığı için dosyada bilgi sahibi sıfatıyla yer aldıkları aktarıldı. Şüphelilerin ikamet ve iş yeri adreslerinde yapılan aramalarda çok sayıda maddi hasarlı kaza tutanağı, sigorta poliçesi, vekaletname, kaza taraflarına ait özel notlar, kimlik belgeleri, temlikname ve ibraname ele geçirildi. Olayla ilgili adli süreç devam ediyor. İhlas Haber Ajansı TÜM YAZILARI İzmir Merkezli Dev Vurgun: 200 Milyon Liralık Oyunu MASAK Çözdü! İzmir merkezli 5 ilde düzenlenen eş zamanlı operasyonda, kurgu trafik kazaları düzenleyerek sigorta şirketlerini yaklaşık 200 milyon lira dolandıran suç örgütü üyesi 48 şüpheli gözaltına alındı. İzmir Cumhuriyet Başsavcılığı koordinesinde yürütülen soruşturma kapsamında, kurgu trafik kazalarıyla sigorta şirketleri üzerinden haksız kazanç sağlayan bir suç örgütüne yönelik İzmir merkezli İstanbul, Ankara, Ağrı ve Antalya illerinde eş zamanlı operasyon düzenlendi. İl Emniyet Müdürlüğü Mali Suçlarla Mücadele Şube Müdürlüğü ekiplerince gerçekleştirilen baskınlarda, hakkında gözaltı kararı verilen 62 şüpheliden 48’i yakalanarak gözaltına alındı. MASAK hesap hareketleri ve kaza raporlarının detaylı incelenmesiyle ortaya çıkarılan dolandırıcılık ağında, toplam 240 şüphelinin ismi geçiyor. Polis ekiplerinin firari durumda olan diğer şüphelileri yakalamaya yönelik saha çalışmaları ise kesintisiz devam ediyor. Suç örgütü üyelerinin dolandırıcılık yöntemine dair çarpıcı detaylar netleşti. Şüphelilerin özellikle kent güvenlik kameralarının bulunmadığı kör noktaları tercih ederek araçları kaza yapmış gibi konumlandırdıkları belirlendi. Araçların fotoğraflarını çeken şebeke üyelerinin, kendi aralarında sahte maddi hasarlı kaza tutanağı düzenledikleri tespit edildi. Bu yöntemle eksperlerin detaylı inceleme yapma imkanını ortadan kaldıran şüphelilerin, hasarlı araçları tamir ettirdikten sonra sigorta şirketlerine başvurdukları öğrenildi. Sigorta şirketlerinin ödeme yapmaktan kaçındığı durumlarda ise şebekenin tahkim komisyonlarını, mahkemeleri ve icra dairelerini devreye sokarak tahsilat baskısı kurduğu açığa çıkarıldı. Yapılan bütçe ve hesap incelemelerinde, örgüt lideri olduğu değerlendirilen E.G. ile yöneticiler Ç.İ. ve avukat A.A.’nın bu yöntemle yaklaşık 200 milyon TL haksız kazanç elde ettiği saptandı. Soruşturma dosyasında hasar bedellerinin tahsilat sürecini yöneten 17 avukatın ismi yer alırken, MASAK raporlarında avukat A.A.’nın doğrudan örgüt adına hareket ettiği belirlendi. Soruşturmaya dahil olan diğer avukatların ise örgüt üyeleriyle doğrudan bir hesap hareketine rastlanmadığı için dosyada bilgi sahibi sıfatıyla yer aldıkları aktarıldı. Şüphelilerin ikamet ve iş yeri adreslerinde yapılan aramalarda çok sayıda maddi hasarlı kaza tutanağı, sigorta poliçesi, vekaletname, kaza taraflarına ait özel notlar, kimlik belgeleri, temlikname ve ibraname ele geçirildi. Olayla ilgili adli süreç devam ediyor.","İzmir Merkezli Dev Vurgun: 200 Milyon Liralık Oyunu MASAK Çözdü! İzmir Merkezli Dev Vurgun: 200 Milyon Liralık Oyunu MASAK Çözdü! Muğla Yenigün Gazetesi İzmir merkezli 5 ilde düzenlenen eş zamanlı operasyonda, kurgu trafik kazaları düzenleyerek sigorta şirketlerini yaklaşık 200 milyon lira dolandıran suç örgütü üyesi 48 şüpheli gözaltına alındı. Ana Sayfa › Haber › İzmir Merkezli Dev Vurgun: 200 Milyon Liralık Oyunu MASAK Çözdü! İzmir Cumhuriyet Başsavcılığı koordinesinde yürütülen soruşturma kapsamında, kurgu trafik kazalarıyla sigorta şirketleri üzerinden haksız kazanç sağlayan bir suç örgütüne yönelik İzmir merkezli İstanbul, Ankara, Ağrı ve Antalya illerinde eş zamanlı operasyon düzenlendi. İl Emniyet Müdürlüğü Mali Suçlarla Mücadele Şube Müdürlüğü ekiplerince gerçekleştirilen baskınlarda, hakkında gözaltı kararı verilen 62 şüpheliden 48’i yakalanarak gözaltına alındı. MASAK hesap hareketleri ve kaza raporlarının detaylı incelenmesiyle ortaya çıkarılan dolandırıcılık ağında, toplam 240 şüphelinin ismi geçiyor. Polis ekiplerinin firari durumda olan diğer şüphelileri yakalamaya yönelik saha çalışmaları ise kesintisiz devam ediyor. Kameraların Olmadığı Bölgeleri Seçmişler Suç örgütü üyelerinin dolandırıcılık yöntemine dair çarpıcı detaylar netleşti. Şüphelilerin özellikle kent güvenlik kameralarının bulunmadığı kör noktaları tercih ederek araçları kaza yapmış gibi konumlandırdıkları belirlendi. Araçların fotoğraflarını çeken şebeke üyelerinin, kendi aralarında sahte maddi hasarlı kaza tutanağı düzenledikleri tespit edildi. Bu yöntemle eksperlerin detaylı inceleme yapma imkanını ortadan kaldıran şüphelilerin, hasarlı araçları tamir ettirdikten sonra sigorta şirketlerine başvurdukları öğrenildi. Sigorta şirketlerinin ödeme yapmaktan kaçındığı durumlarda ise şebekenin tahkim komisyonlarını, mahkemeleri ve icra dairelerini devreye sokarak tahsilat baskısı kurduğu açığa çıkarıldı. ve avukat A.A.’nın bu yöntemle yaklaşık 200 milyon TL haksız kazanç elde ettiği saptandı. Soruşturma dosyasında hasar bedellerinin tahsilat sürecini yöneten 17 avukatın ismi yer alırken, MASAK raporlarında avukat A.A.’nın doğrudan örgüt adına hareket ettiği belirlendi. Soruşturmaya dahil olan diğer avukatların ise örgüt üyeleriyle doğrudan bir hesap hareketine rastlanmadığı için dosyada bilgi sahibi sıfatıyla yer aldıkları aktarıldı. Şüphelilerin ikamet ve iş yeri adreslerinde yapılan aramalarda çok sayıda maddi hasarlı kaza tutanağı, sigorta poliçesi, vekaletname, kaza taraflarına ait özel notlar, kimlik belgeleri, temlikname ve ibraname ele geçirildi. İhlas Haber Ajansı TÜM YAZILARI İzmir Merkezli Dev Vurgun: 200 Milyon Liralık Oyunu MASAK Çözdü! Suç örgütü üyelerinin dolandırıcılık yöntemine dair çarpıcı detaylar netleşti.",browser_full_article,https://www.muglayenigun.com/izmir-merkezli-dev-vurgun-200-milyon-liralik-oyunu-masak-cozdu/,İzmir,,,,,,,ilçe yok | firma yok | faaliyet/tesis yok,,,,maps araması yapılmadı,,,94.75,18
2026-07-06 00:43:29,MASAK,Kara Para / MASAK / Bahis,MASAK'tan Akman'a inceleme,MASAK'tan Akman'a inceleme Haber61,https://news.google.com/rss/articles/CBMibkFVX3lxTE0wYkdCTE1zUmxWWW9kU3hLUElHMUsxaTk0bzY1SU9paFNCRkF2ODY0NWV5dE1wYnUtcFdwRVIzUnZDNkY5Q0xmYUZwcURRNnVfdkxTcGxVakNRLXlXdnVRWUNtYzhDSTVjVGtmR01R0gFzQVVfeXFMTU9TR0tteGJlUTFYazRoNDB6bUJHZ1hCM19LRmZKVTlWNDl6eHA0NzRQQ190U2RWc0RwX19lUVJKRlFfNUk1bTRlWFc5U3dla09mcnc1V3h6c0wtUHpsX2RldjhnN0QtaUQyWWR5QjlDczl6bw?oc=5,masak,,"Ankara Cumhuriyet Başsavcılığının talimatı ile harekete geçen Maliye Bakanlığı Mali Suçları Araştırma Kurulu (MASAK) Başkanlığı, Deniz Feneri soruşturmasında adları geçen RTÜK Başkanı Zahid Akman'ın da aralarında bulunduğu 6 kişinin mal varlıkları ile v Ankara Cumhuriyet Başsavcılığının talimatı ile harekete geçen Maliye Bakanlığı Mali Suçları Araştırma Kurulu (MASAK) Başkanlığı, Deniz Feneri soruşturmasında adları geçen RTÜK Başkanı Zahid Akman'ın da aralarında bulunduğu 6 kişinin mal varlıkları ile v Ankara Cumhuriyet Başsavcılığının talimatı ile harekete geçen Maliye Bakanlığı Mali Suçları Araştırma Kurulu (MASAK) Başkanlığı, Deniz Feneri soruşturmasında adları geçen RTÜK Başkanı Zahid Akman'ın da aralarında bulunduğu 6 kişinin mal varlıkları ile v","MASAK'tan Akman'a inceleme MASAK'tan Akman'a inceleme Haber61 Ankara Cumhuriyet Başsavcılığının talimatı ile harekete geçen Maliye Bakanlığı Mali Suçları Araştırma Kurulu (MASAK) Başkanlığı, Deniz Feneri soruşturmasında adları geçen RTÜK Başkanı Zahid Akman'ın da aralarında bulunduğu 6 kişinin mal varlıkları ile v Ankara Cumhuriyet Başsavcılığının talimatı ile harekete geçen Maliye Bakanlığı Mali Suçları Araştırma Kurulu (MASAK) Başkanlığı, Deniz Feneri soruşturmasında adları geçen RTÜK Başkanı Zahid Akman'ın da aralarında bulunduğu 6 kişinin mal varlıkları ile v Ankara Cumhuriyet Başsavcılığının talimatı ile harekete geçen Maliye Bakanlığı Mali Suçları Araştırma Kurulu (MASAK) Başkanlığı, Deniz Feneri soruşturmasında adları geçen RTÜK Başkanı Zahid Akman'ın da aralarında bulunduğu 6 kişinin mal varlıkları ile v",browser_full_article,https://www.haber61.net/gundem/masaktan-akmana-inceleme/27711,,,,,,,,il yok | ilçe yok | firma yok | faaliyet/tesis yok,,,,maps araması yapılmadı,,,37.17,19
