published,search_term,category,title,summary,link,matched_words,activity_type,raw_text,entity_source_text,article_fetch_status,resolved_article_url,city_candidates,district_candidates,neighborhood_candidates,street_candidates,facility_candidates,company_candidates,company_candidate_scores,entity_quality_note,maps_queries,maps_candidates,maps_best_guess,maps_status,maps_match_scores,maps_rejected_candidates,record_quality_score,duplicate_group_id
2026-06-04 21:07:04,yangın,Fiziksel Risk / Yangın,"Sri Lanka'da bakımevinde yangın: 12 kişi öldü, işletme sahibi gözaltında","Sri Lanka'da bakımevinde yangın: 12 kişi öldü, işletme sahibi gözaltında Euronews.com",https://news.google.com/rss/articles/CBMipwFBVV95cUxQb2tEVXhTa2JsOXBIZzhVQlZfeWpMaFhfOXNLc0Z5QnRLQ0pJWjlXUFBwamlZZXZsRFExVXRDWXBfYnhpQjVNN2tXWUJpSXlqNnBPaDNVSGpvUTMxbUgwWG9fbFZiVE56VmdFR0JBdWphT2FZM19uZVQyWGl0LXJKNlBiTkJPeldGOGVwZjZUbllEZXhRbmIycy1YbEo0MXJCaGUwSVk0Yw?oc=5,işletme,,"Yetkililer, Sri Lanka'da gece saatlerinde çıkan ve 12 bakımevi sakininin ölümüne neden olan yangının ardından kaçak işletilen tesisin sahibinin gözaltına alındığını açıkladı. Yetkililer, Sri Lanka'da gece saatlerinde çıkan ve 12 bakımevi sakininin ölümüne neden olan yangının ardından kaçak işletilen tesisin sahibinin gözaltına alındığını açıkladı. Yetkililer, Sri Lanka'da gece saatlerinde çıkan ve 12 bakımevi sakininin ölümüne neden olan yangının ardından kaçak işletilen tesisin sahibinin gözaltına alındığını açıkladı. Europe Today Costa'dan AB'ye katılım kurallarının 'basitleştirilmesi' çağrısı Kültür Ajandası Dünya 'Beatles Günü' için resmi tarih açıklandı: 25 Haziran No Comment Venezuela'nın Dans Eden Şeytanları asırlık Korpus Christi ritüelini canlandırdı No Comment Kudüs Onur Yürüyüşü'ne binlerce kişi sıkı güvenlik önlemleri altında katıldı Sri Lanka polisi ve yargı yetkilileri, Anguruwatota’da 4 Haziran 2026’da gece çıkan yangının ardından kül olmuş bir huzurevinde inceleme yapıyor. - © AP Photo © AP Photo Sri Lanka polisi ve yargı yetkilileri, Anguruwatota’da 4 Haziran 2026’da gece çıkan yangının ardından kül olmuş bir huzurevinde inceleme yapıyor. - © AP Photo By Gavin Blackburn Yayınlanma Tarihi 04/06/2026 - 23:07 GMT+2 Yayınlanma Tarihi 04/06/2026 - 23:07 GMT+2 Bu haberler de ilginizi çekebilir Sri Lanka, 40'tan fazla ülkenin turistlerine vize ücretini kaldırdı Sri Lanka sel ve toprak kaymalarıyla boğuşuyor: Devlet daireleri ve okullar kapatıldı Vatikan, Sri Lanka'daki Paskalya bombalamasının 167 kurbanını 'inanç tanıkları' olarak kabul etti Sri Lanka, 40'tan fazla ülkenin turistlerine vize ücretini kaldırdı Sri Lanka sel ve toprak kaymalarıyla boğuşuyor: Devlet daireleri ve okullar kapatıldı Vatikan, Sri Lanka'daki Paskalya bombalamasının 167 kurbanını 'inanç tanıkları' olarak kabul etti Sri Lankalı polisler, Anguruwatota’da gece çıkan yangının ardından küle dönmüş bir bakımevini inceliyor, 4 Haziran 2026 AP Photo Sri Lanka'da bakımevinde yangın: 12 kişi öldü, işletme sahibi gözaltında Yetkililer, Sri Lanka'da gece saatlerinde çıkan ve 12 bakımevi sakininin ölümüne neden olan yangının ardından kaçak işletilen tesisin sahibinin gözaltına alındığını açıkladı. Bu haberler de ilginizi çekebilir Önyargısız, sansürsüz, yorumsuz, No Comment. Haberleri yorumsuz izleyin. Size dünyanın önde gelen kaynaklarının son iklim verilerini sunuyoruz. İklim değişikliğinin etkilerini azaltmak için yeni stratejiler arayan uzmanlarla görüşerek, son durumu analiz ediyor ve gezegenimizin değişimini açıklıyoruz. Sri Lanka’nın başkenti Kolombo'nun güneyindeki 'Maupiya Sewana' adlı bakımevinde dün gece saatlerinde yangın çıktı. Yangında 12 kişi hayatını kaybederken, 6 kişi de yaralandı. Ülkede son yılların en ölümcül yangınlarından biri olarak kayıtlara geçen felakete ilişkin soruşturma sürerken, işletme sahibi Isuru Anushka'nın tutuklu yargılanmak üzere cezaevine gönderildiği bildirildi. Olayla ilgili yürütülen adli soruşturmada yetkililer, tesisin bakımevi olarak faaliyet gösterme izni bulunmadığını ve düzenleyici kurumların belirlediği asgari standartları karşılamadığını belirtti. İlk mahkeme duruşmasının ardından gazetecilere açıklama yapan bir polis memuru, ""Polise, yaşlı bakımıyla ilgili yönetmeliklerin ihlal edilip edilmediğini araştırma talimatı verildi,"" dedi. Soruşturmada ayrıca, bakımevi sakinlerinden 11'inin olay yerinde yanarak can verdiği, 12'nci kurbanın ise kaldırıldığı yerel bir hastanede hayatını kaybettiği aktarıldı. Dumandan etkilenerek hastaneye kaldırılan diğer 6 kişinin ise hayati tehlikesinin sürdüğü bildirildi. Adli tıp uzmanları, tek katlı binanın enkazında yaptıkları incelemelerde perşembe sabahı 7 kişinin daha cansız bedenine ulaştı. Böylece çarşamba günü 5 olarak açıklanan ölü sayısı 12'ye yükseldi. AFP haber ajansı, polisin hayatta kalanlar ve komşularla görüştüğü sırada, kelepçeli tesis sahibinin olay yerine getirildiğini aktardı. Tesiste yaşlıların yanı sıra zihinsel sağlık sorunları olan gençlerin de barındığı öğrenildi. Polisin verdiği bilgiye göre, hayatını kaybeden en genç kurban 17 yaşında bir çocuktu. Polis, ilk tanık ifadelerine göre yangının, onlarca yatağın üst üste yığılı olduğu bir depoda başladığını belirtti. Polis Sözcüsü Frederick Wootler, çarşamba günü kurtarılan 51 sakin ve personelin yakınlardaki bir devlet okuluna yerleştirildiğini açıkladı.","Sri Lanka'da bakımevinde yangın: 12 kişi öldü, işletme sahibi gözaltında Sri Lanka'da bakımevinde yangın: 12 kişi öldü, işletme sahibi gözaltında Euronews.com Yetkililer, Sri Lanka'da gece saatlerinde çıkan ve 12 bakımevi sakininin ölümüne neden olan yangının ardından kaçak işletilen tesisin sahibinin gözaltına alındığını açıkladı. Europe Today Costa'dan AB'ye katılım kurallarının 'basitleştirilmesi' çağrısı Kültür Ajandası Dünya 'Beatles Günü' için resmi tarih açıklandı: 25 Haziran No Comment Venezuela'nın Dans Eden Şeytanları asırlık Korpus Christi ritüelini canlandırdı No Comment Kudüs Onur Yürüyüşü'ne binlerce kişi sıkı güvenlik önlemleri altında katıldı Sri Lanka polisi ve yargı yetkilileri, Anguruwatota’da 4 Haziran 2026’da gece çıkan yangının ardından kül olmuş bir huzurevinde inceleme yapıyor. - © AP Photo © AP Photo Sri Lanka polisi ve yargı yetkilileri, Anguruwatota’da 4 Haziran 2026’da gece çıkan yangının ardından kül olmuş bir huzurevinde inceleme yapıyor. - © AP Photo By Gavin Blackburn Yayınlanma Tarihi 04/06/2026 - 23:07 GMT+2 Yayınlanma Tarihi 04/06/2026 - 23:07 GMT+2 Bu haberler de ilginizi çekebilir Sri Lanka, 40'tan fazla ülkenin turistlerine vize ücretini kaldırdı Sri Lanka sel ve toprak kaymalarıyla boğuşuyor: Devlet daireleri ve okullar kapatıldı Vatikan, Sri Lanka'daki Paskalya bombalamasının 167 kurbanını 'inanç tanıkları' olarak kabul etti Sri Lanka, 40'tan fazla ülkenin turistlerine vize ücretini kaldırdı Sri Lanka sel ve toprak kaymalarıyla boğuşuyor: Devlet daireleri ve okullar kapatıldı Vatikan, Sri Lanka'daki Paskalya bombalamasının 167 kurbanını 'inanç tanıkları' olarak kabul etti Sri Lankalı polisler, Anguruwatota’da gece çıkan yangının ardından küle dönmüş bir bakımevini inceliyor, 4 Haziran 2026 AP Photo Sri Lanka'da bakımevinde yangın: 12 kişi öldü, işletme sahibi gözaltında Yetkililer, Sri Lanka'da gece saatlerinde çıkan ve 12 bakımevi sakininin ölümüne neden olan yangının ardından kaçak işletilen tesisin sahibinin gözaltına alındığını açıkladı. Size dünyanın önde gelen kaynaklarının son iklim verilerini sunuyoruz. İklim değişikliğinin etkilerini azaltmak için yeni stratejiler arayan uzmanlarla görüşerek, son durumu analiz ediyor ve gezegenimizin değişimini açıklıyoruz. Sri Lanka’nın başkenti Kolombo'nun güneyindeki 'Maupiya Sewana' adlı bakımevinde dün gece saatlerinde yangın çıktı. Yangında 12 kişi hayatını kaybederken, 6 kişi de yaralandı. Ülkede son yılların en ölümcül yangınlarından biri olarak kayıtlara geçen felakete ilişkin soruşturma sürerken, işletme sahibi Isuru Anushka'nın tutuklu yargılanmak üzere cezaevine gönderildiği bildirildi. Olayla ilgili yürütülen adli soruşturmada yetkililer, tesisin bakımevi olarak faaliyet gösterme izni bulunmadığını ve düzenleyici kurumların belirlediği asgari standartları karşılamadığını belirtti. Soruşturmada ayrıca, bakımevi sakinlerinden 11'inin olay yerinde yanarak can verdiği, 12'nci kurbanın ise kaldırıldığı yerel bir hastanede hayatını kaybettiği aktarıldı. Dumandan etkilenerek hastaneye kaldırılan diğer 6 kişinin ise hayati tehlikesinin sürdüğü bildirildi. Tesiste yaşlıların yanı sıra zihinsel sağlık sorunları olan gençlerin de barındığı öğrenildi. Polisin verdiği bilgiye göre, hayatını kaybeden en genç kurban 17 yaşında bir çocuktu. Polis, ilk tanık ifadelerine göre yangının, onlarca yatağın üst üste yığılı olduğu bir depoda başladığını belirtti.",browser_full_article,https://tr.euronews.com/2026/06/04/sri-lankada-bakimevinde-yangin-12-kisi-oldu-isletme-sahibi-gozaltinda,,,,,,,,il yok | ilçe yok | firma yok | faaliyet/tesis yok,,,,maps araması yapılmadı,,,78.25,39
2026-06-05 06:48:00,yangın,Fiziksel Risk / Yangın,Altın Kiraz’da çeyrek final biletleri sahiplerini buldu: Cenksan Yangın ve Maçka Otomotiv devrede!,Altın Kiraz’da çeyrek final biletleri sahiplerini buldu: Cenksan Yangın ve Maçka Otomotiv devrede! Çağdaş Kocaeli Gazetesi,https://news.google.com/rss/articles/CBMi3wFBVV95cUxPUmJ6QVd0MUdpSFBJWW0tZndtT2tHaVltQkY3M0N1U2NYa0pVeDFwUHAwYVBneDJ0ZGMwV3VhSF9vZU5rWTd2YXBod3RzYjBQbkJqXzlOYkhkck1Ic0MzN3FWZFF5NktmaTJaOW9CTF85ZG1CSU00OWxOZnEwdUpIZk9LUFVSYVMzREJBT2s4R3k4UmtnOFRJbGE2clVoMmdZOXhNSnRyTnZzNU9zVXRTNDBpZTVsZWxWSmw4U1FhQTI3WHAzSFhfRzdMV3FWbTkwSnZqUV9WclUzMWIwcGFR0gHfAUFVX3lxTE9SYnpBV3QxR2lIUElZbS1md21Pa0dpWW1CRjczQ3VTY1hrSlV4MXBQcDBhUGd4MnRkYzBXdWFIX29lTmtZN3ZhcGh3dHNiMFBuQmpfOU5iSGRyTUhzQzM3cVZkUXk2S2ZpMlo5b0JMXzlkbUJJTTQ5bE5mcTB1SkhmT0tQVVJhUzNEQkFPazhHeThSa2c4VElsYTZyVWgyZ1k5eE1KdHJOdnM1T3NVdFM0MGllNWxlbFZKbDhTUWFBMjdYcDNIWF9HN0xXcVZtOTBKdmpRX1ZyVTMxYjBwYVE?oc=5,otomotiv,,"14. Altın Kiraz Dostluk Futbol Turnuvası’nda ikinci tur heyecanı, futbolseverlere unutulmaz anlar yaşatan kapanış maçlarıyla noktalandı. Körfez Belediyesi Çim Halı Tesisleri’nde oynanan eleme turunun son gününde sahadan galibiyetle ayrılan Cenksan Yangın ve Maçka Otomotiv, çeyrek finale yükselen son takımlar oldu. 14. Altın Kiraz Dostluk Futbol Turnuvası’nda ikinci tur heyecanı, futbolseverlere unutulmaz anlar yaşatan kapanış maçlarıyla noktalandı. Körfez Belediyesi Çim Halı Tesisleri’nde oynanan eleme turunun son gününde sahadan galibiyetle ayrılan Cenksan Yangın ve Maçka Otomotiv, çeyrek finale yükselen son takımlar oldu. 14. Altın Kiraz Dostluk Futbol Turnuvası’nda ikinci tur heyecanı, futbolseverlere unutulmaz anlar yaşatan kapanış maçlarıyla noktalandı. Körfez Belediyesi Çim Halı Tesisleri’nde oynanan eleme turunun son gününde sahadan galibiyetle ayrılan Cenksan Yangın ve Maçka Otomotiv, çeyrek finale yükselen son takımlar oldu. 05 Haziran 2026 - Spor Altın Kiraz’da çeyrek final biletleri sahiplerini buldu: Cenksan Yangın ve Maçka Otomotiv devrede! 14. Altın Kiraz Dostluk Futbol Turnuvası’nda ikinci tur heyecanı, futbolseverlere unutulmaz anlar yaşatan kapanış maçlarıyla noktalandı. Körfez Belediyesi Çim Halı Tesisleri’nde oynanan eleme turunun son gününde sahadan galibiyetle ayrılan Cenksan Yangın ve Maçka Otomotiv, çeyrek finale yükselen son takımlar oldu. FULL Medya ana sponsorluğunda düzenlenen ve bölgenin en saygın spor organizasyonları arasında yer alan turnuvada, çeyrek final öncesi son düzlük nefes kesti. Hakem Abdurrahman Uçak’ın başarıyla yönettiği karşılaşmalarda, oyuncuların sergilediği yüksek mücadele gücü tribünlerden tam not aldı. SON ŞAMPİYONUN GÜÇ GÖSTERİSİ Turnuvanın son şampiyonu unvanını taşıyan Cenksan Yangın, çeyrek final yolunda Ciğerci İbo ile karşılaştı. Sahaya şampiyonluk özgüveniyle çıkan Cenksan Yangın, baştan sona domine ettiği karşılaşmayı 10-3 gibi net bir skorla kazandı. Mücadeleye damgasını vuran isim ise rakip fileleri tam 7 kez havalandıran Erdi Söğüt oldu. Sefa Örgüç, Doğan Şirin ve Ömer Gören’in de skor katkısı sağladığı maçta, Ciğerci İbo cephesinde Mehmet Aktaş’ın 3 gollük çabası skoru değiştirmeye yetmedi. MAÇKA OTOMOTİV TAKTİK SAVAŞINI KAZANDI Günün diğer mücadelesinde ise Maçka Otomotiv ile Esser Yıkım İnşaat kozlarını paylaştı","Altın Kiraz’da çeyrek final biletleri sahiplerini buldu: Cenksan Yangın ve Maçka Otomotiv devrede! Altın Kiraz’da çeyrek final biletleri sahiplerini buldu: Cenksan Yangın ve Maçka Otomotiv devrede! Çağdaş Kocaeli Gazetesi Altın Kiraz Dostluk Futbol Turnuvası’nda ikinci tur heyecanı, futbolseverlere unutulmaz anlar yaşatan kapanış maçlarıyla noktalandı. Körfez Belediyesi Çim Halı Tesisleri’nde oynanan eleme turunun son gününde sahadan galibiyetle ayrılan Cenksan Yangın ve Maçka Otomotiv, çeyrek finale yükselen son takımlar oldu. 05 Haziran 2026 - Spor Altın Kiraz’da çeyrek final biletleri sahiplerini buldu: Cenksan Yangın ve Maçka Otomotiv devrede! FULL Medya ana sponsorluğunda düzenlenen ve bölgenin en saygın spor organizasyonları arasında yer alan turnuvada, çeyrek final öncesi son düzlük nefes kesti. Hakem Abdurrahman Uçak’ın başarıyla yönettiği karşılaşmalarda, oyuncuların sergilediği yüksek mücadele gücü tribünlerden tam not aldı. SON ŞAMPİYONUN GÜÇ GÖSTERİSİ Turnuvanın son şampiyonu unvanını taşıyan Cenksan Yangın, çeyrek final yolunda Ciğerci İbo ile karşılaştı. Sahaya şampiyonluk özgüveniyle çıkan Cenksan Yangın, baştan sona domine ettiği karşılaşmayı 10-3 gibi net bir skorla kazandı. Mücadeleye damgasını vuran isim ise rakip fileleri tam 7 kez havalandıran Erdi Söğüt oldu. Sefa Örgüç, Doğan Şirin ve Ömer Gören’in de skor katkısı sağladığı maçta, Ciğerci İbo cephesinde Mehmet Aktaş’ın 3 gollük çabası skoru değiştirmeye yetmedi.",browser_full_article,https://www.cagdaskocaeli.com.tr/amp/foto/28115330/altin-kirazda-ceyrek-final-biletleri-sahiplerini-buldu-cenksan-yangin-ve-macka-otomotiv-devrede,İzmir,Kiraz,,,,,,firma yok | faaliyet/tesis yok,,,,maps araması yapılmadı,,,138.5,40
2026-06-05 06:21:38,yangın,Fiziksel Risk / Yangın,"İzmir’in çevre karnesi: Yangın, rant ve enerji baskısı","İzmir’in çevre karnesi: Yangın, rant ve enerji baskısı İlkses Gazetesi",https://news.google.com/rss/articles/CBMikAFBVV95cUxOcEcwNnJDb1ZnejdUbjhKUm1pNnJlZlVseTV1cGVCM2RQc0FtSE9VT0pPLVdROXJfTlZZekJMZng2V3VpUDQ5ZXJaeE5mZmdWYURjUzBIX21vQUtWLUNuNi05V0prOFlxRDQ1Y3BFMUtENE9xb21Femd1a3ZjNWduVjFQRHNMdk5aNVlmdC1hU3fSAZYBQVVfeXFMTzljSjZ3OVJfaGdvdGdIOG5ibDVOU3h6S2x4enpBSDRSSmJwa2FCMHlXTFdrWHJ0QWo5c19VZmFtMmM1Vm9IeFlnb0lUY1FnSVY3Ymc1R3NBZG5ROWZJeW1WVkJiOFl1a25zLU5fREdrUW4taDB1Z0ZXYUNvdVpCSVhsVDZVQWlNSEVGbXBHMWJCWDZJRzlB?oc=5,enerji,,"İzmir’in çevre karnesi: Yangın, rant ve enerji baskısı İlkses Gazetesi","İzmir’in çevre karnesi: Yangın, rant ve enerji baskısı İzmir’in çevre karnesi: Yangın, rant ve enerji baskısı İlkses Gazetesi İzmir’in çevre karnesi: Yangın, rant ve enerji baskısı İlkses Gazetesi",browser_failed,https://news.google.com/rss/articles/CBMikAFBVV95cUxOcEcwNnJDb1ZnejdUbjhKUm1pNnJlZlVseTV1cGVCM2RQc0FtSE9VT0pPLVdROXJfTlZZekJMZng2V3VpUDQ5ZXJaeE5mZmdWYURjUzBIX21vQUtWLUNuNi05V0prOFlxRDQ1Y3BFMUtENE9xb21Femd1a3ZjNWduVjFQRHNMdk5aNVlmdC1hU3fSAZYBQVVfeXFMTzljSjZ3OVJfaGdvdGdIOG5ibDVOU3h6S2x4enpBSDRSSmJwa2FCMHlXTFdrWHJ0QWo5c19VZmFtMmM1Vm9IeFlnb0lUY1FnSVY3Ymc1R3NBZG5ROWZJeW1WVkJiOFl1a25zLU5fREdrUW4taDB1Z0ZXYUNvdVpCSVhsVDZVQWlNSEVGbXBHMWJCWDZJRzlB?oc=5&hl=tr&gl=TR&ceid=TR:tr,İzmir,,,,,,,ilçe yok | firma yok | faaliyet/tesis yok,,,,maps araması yapılmadı,,,63.2,41
2026-06-04 20:50:09,yangın,Fiziksel Risk / Yangın,Mersin'de otomatik kepenk üretimi yapan işletmede çıkan yangın söndürüldü,Mersin'de otomatik kepenk üretimi yapan işletmede çıkan yangın söndürüldü Habername.com,https://news.google.com/rss/articles/CBMitgFBVV95cUxNNWJjNE1hSXNSRzdGZXhIRjNXNi1kVU1PaDlfRTdsbVRRbkNSeWtvWE12YmwzUEtPRUhNQ2l0TkJNZEY5YkVQWWFmYjhqRDZyWGRPbG9BeW1DTW1Qc3I5WFdHbGRBWUdiT0JnY2hJLUdGbFRMbU1ScVdLT3ZTTGZDRkdXcURtTldzSmVhUGtHWEZaTVEwR0ZjSjRfQTFWOWFPTzRkZ2plTlI0X0hMREx0Wnc0TEFwQdIBxgFBVV95cUxPbS1BU2NUenpwdHZJemg5djRFVUhFdk1uN0lWVjhGMXRYdk5NX282UWRkQk1mc0FtWDFuUWRwZzdOOXAxc1lLMk5wVWpNakhPYzlERDIzbHBjWlJ6ZHFSUkZROEU1UEk2Z01fV1BJd1g5WEFCZEJlX1pmdmhibWF3NWt1WUo0ODZEWWx2MXZjcWJqbkViWERWdzhKM1JNa0N0SjEwUTg4cFdvUnVaVDBSdUNqM0Z5bVpVSEFtZ1JUQ3ZkMVF3NWc?oc=5,"işletme, üretim",üretim tesisi,"Mersin'in Tarsus ilçesinde otomatik kepenk üretimi yapan işletmede çıkan yangın, itfaiye ekiplerince söndürüldü Mersin'in Tarsus ilçesinde otomatik kepenk üretimi yapan işletmede çıkan yangın, itfaiye ekiplerince söndürüldü Mersin'in Tarsus ilçesinde otomatik kepenk üretimi yapan işletmede çıkan yangın, itfaiye ekiplerince söndürüldü","Mersin'de otomatik kepenk üretimi yapan işletmede çıkan yangın söndürüldü Mersin'de otomatik kepenk üretimi yapan işletmede çıkan yangın söndürüldü Habername.com Mersin'in Tarsus ilçesinde otomatik kepenk üretimi yapan işletmede çıkan yangın, itfaiye ekiplerince söndürüldü Mersin'in Tarsus ilçesinde otomatik kepenk üretimi yapan işletmede çıkan yangın, itfaiye ekiplerince söndürüldü Mersin'in Tarsus ilçesinde otomatik kepenk üretimi yapan işletmede çıkan yangın, itfaiye ekiplerince söndürüldü",browser_full_article,https://www.habername.com/haber-mersinde-otomatik-kepenk-uretimi-yapan-isletmede-cikan-yangin-sonduruldu-280924.htm,Mersin,Tarsus,,,,,,firma yok | faaliyet/tesis yok,,,,maps araması yapılmadı,,,105.6,42
2026-06-04 18:14:00,yangın,Fiziksel Risk / Yangın,Şanlıurfa'da Motosiklet Deposunda Yangın: Her Şey Küle Döndü,Şanlıurfa'da Motosiklet Deposunda Yangın: Her Şey Küle Döndü urfadasin.com,https://news.google.com/rss/articles/CBMijAFBVV95cUxQWVhiNlZvUENuRmJ4aENnenJCYW92SG1RR01rWWJTaVBRdEY4eW9SMHhZeW52UDJ2bWZ5c2tvcjZUQ2hrZUVuTDhDa1VGdWdzY3hONnNFa1VkZzl3Q2NHbGY3WlZza1p4ODI4b19yeDFUSDFBMEcxZnRCZEJZcHg0Mkt0MFVKQk9fbjZiU9IBkgFBVV95cUxQSHhNYUsxcy1lNnNDZGNVVW5JQlgzel9tOFZ2WDFkTHpVZmZsQU91WE1ud1BxQjlFeTUtNFlrdEhJem9NM3F0eVA2OHRYbkcxaUpPOURBYVh2WkMxem1Fb2doS0pLSHluUXJQSFNFekVmd2ZuU0tvU2tVNWpKMEpZeFhmazBmVUExY184alNjSGo1QQ?oc=5,depo,depo,Şanlıurfa'da Motosiklet Deposunda Yangın: Her Şey Küle Döndü urfadasin.com,Şanlıurfa'da Motosiklet Deposunda Yangın: Her Şey Küle Döndü Şanlıurfa'da Motosiklet Deposunda Yangın: Her Şey Küle Döndü urfadasin.com Şanlıurfa'da Motosiklet Deposunda Yangın: Her Şey Küle Döndü urfadasin.com,browser_failed,https://news.google.com/rss/articles/CBMijAFBVV95cUxQWVhiNlZvUENuRmJ4aENnenJCYW92SG1RR01rWWJTaVBRdEY4eW9SMHhZeW52UDJ2bWZ5c2tvcjZUQ2hrZUVuTDhDa1VGdWdzY3hONnNFa1VkZzl3Q2NHbGY3WlZza1p4ODI4b19yeDFUSDFBMEcxZnRCZEJZcHg0Mkt0MFVKQk9fbjZiU9IBkgFBVV95cUxQSHhNYUsxcy1lNnNDZGNVVW5JQlgzel9tOFZ2WDFkTHpVZmZsQU91WE1ud1BxQjlFeTUtNFlrdEhJem9NM3F0eVA2OHRYbkcxaUpPOURBYVh2WkMxem1Fb2doS0pLSHluUXJQSFNFekVmd2ZuU0tvU2tVNWpKMEpZeFhmazBmVUExY184alNjSGo1QQ?oc=5&hl=tr&gl=TR&ceid=TR:tr,Şanlıurfa,,,,,,,ilçe yok | firma yok | faaliyet/tesis yok,,,,maps araması yapılmadı,,,67.24,43
