published,search_term,category,title,summary,link,matched_words,activity_type,raw_text,entity_source_text,article_fetch_status,resolved_article_url,city_candidates,district_candidates,neighborhood_candidates,street_candidates,facility_candidates,company_candidates,company_candidate_scores,entity_quality_note,maps_queries,maps_candidates,maps_best_guess,maps_status,maps_match_scores,maps_rejected_candidates,record_quality_score,duplicate_group_id
2026-06-04 09:46:39,fabrika yangını,Fiziksel Risk / Yangın,Denizli’de Fabrika Yangını: Geriye Bu Görüntüler Kaldı,Denizli’de Fabrika Yangını: Geriye Bu Görüntüler Kaldı Denizli Sanal Basın,https://news.google.com/rss/articles/CBMiiwFBVV95cUxPeUxrSUs2VmlrY1V3Tjl6TW9qbUU2UU1rWnE5TGNSVThteEc5OGpENUc4aGI1SkQ0Nm44TmR3aFNDcEtjb1NUVEZrMnQ3OHhJSUYyODhzaE5KUm1TMTdZZllXbGNfZHJqVWp0V2dCMlF3ODY0Qk1nSTlOclFmZUdvVVlVZ0VNZlVYWnNF?oc=5,fabrika,fabrika,Denizli’de Fabrika Yangını: Geriye Bu Görüntüler Kaldı Denizli Sanal Basın,Denizli’de Fabrika Yangını: Geriye Bu Görüntüler Kaldı Denizli’de Fabrika Yangını: Geriye Bu Görüntüler Kaldı Denizli Sanal Basın Denizli’de Fabrika Yangını: Geriye Bu Görüntüler Kaldı Denizli Sanal Basın,browser_failed,https://news.google.com/rss/articles/CBMiiwFBVV95cUxPeUxrSUs2VmlrY1V3Tjl6TW9qbUU2UU1rWnE5TGNSVThteEc5OGpENUc4aGI1SkQ0Nm44TmR3aFNDcEtjb1NUVEZrMnQ3OHhJSUYyODhzaE5KUm1TMTdZZllXbGNfZHJqVWp0V2dCMlF3ODY0Qk1nSTlOclFmZUdvVVlVZ0VNZlVYWnNF?oc=5&hl=tr&gl=TR&ceid=TR:tr,Denizli,,,,,,,ilçe yok | firma yok | faaliyet/tesis yok,,,,maps araması yapılmadı,,,64.24,28
2026-06-04 15:54:26,fabrika yangını,Fiziksel Risk / Yangın,Esenyurt’taki fabrika yangınından dönen itfaiye aracı devrildi: 3 yaralı,Esenyurt’taki fabrika yangınından dönen itfaiye aracı devrildi: 3 yaralı TGRT Haber,https://news.google.com/rss/articles/CBMixAFBVV95cUxOdVVZR3FfRmdMNENEc3gtMUg0TWxvR0J1anVfTGUtRGtSRXg2YTNjN3c5MVhGMXJ4QTU2eVBWZ0p2QVkxbG4waTJrSHlaQ1JHRTUtTXItM1FMbXFNdDc2dzloVE9MTll1TDFmME1aenZPTGY2QTRjdW5aWTBGT0xVTEhzZnJLMzkzZVB4enBiZkU0b2xxeVNDVVZpcE5jYmR4ZnF5R2R2WGh0SDZKLWNXTmRndEM1WElYd2QxN2FBa0xnZ1pR?oc=5,fabrika,fabrika,Esenyurt’taki fabrika yangınından dönen itfaiye aracı devrildi: 3 yaralı TGRT Haber,Esenyurt’taki fabrika yangınından dönen itfaiye aracı devrildi: 3 yaralı Esenyurt’taki fabrika yangınından dönen itfaiye aracı devrildi: 3 yaralı TGRT Haber Esenyurt’taki fabrika yangınından dönen itfaiye aracı devrildi: 3 yaralı TGRT Haber,browser_failed,https://news.google.com/rss/articles/CBMixAFBVV95cUxOdVVZR3FfRmdMNENEc3gtMUg0TWxvR0J1anVfTGUtRGtSRXg2YTNjN3c5MVhGMXJ4QTU2eVBWZ0p2QVkxbG4waTJrSHlaQ1JHRTUtTXItM1FMbXFNdDc2dzloVE9MTll1TDFmME1aenZPTGY2QTRjdW5aWTBGT0xVTEhzZnJLMzkzZVB4enBiZkU0b2xxeVNDVVZpcE5jYmR4ZnF5R2R2WGh0SDZKLWNXTmRndEM1WElYd2QxN2FBa0xnZ1pR?oc=5&hl=tr&gl=TR&ceid=TR:tr,,,,,,,,il yok | ilçe yok | firma yok | faaliyet/tesis yok,,,,maps araması yapılmadı,,,73.58,29
2026-06-05 06:41:00,mali kriz,İflas / Konkordato / Mali Sorun,Hürmüz kriziyle havada iflas korkusu,Hürmüz kriziyle havada iflas korkusu İstanbul Ticaret Gazetesi,https://news.google.com/rss/articles/CBMifEFVX3lxTE5EQmI1Q2lmdGRic3dhRjVfdEtrbmZQYml6by1sNVA0TXZDSXkybF9YdTVodHZvNk9wQ1V5bmpaWEo2NHpIdHBXbnN4M0ZmZXNtaFpOc1pQTnZYS0RCWmMyNTRRMnowbVRoNWxNSmhTSktIbWtDRnhnbnNOOEo?oc=5,ticaret,,Hürmüz kriziyle havada iflas korkusu İstanbul Ticaret Gazetesi,Hürmüz kriziyle havada iflas korkusu Hürmüz kriziyle havada iflas korkusu İstanbul Ticaret Gazetesi Hürmüz kriziyle havada iflas korkusu İstanbul Ticaret Gazetesi,browser_failed,https://news.google.com/rss/articles/CBMifEFVX3lxTE5EQmI1Q2lmdGRic3dhRjVfdEtrbmZQYml6by1sNVA0TXZDSXkybF9YdTVodHZvNk9wQ1V5bmpaWEo2NHpIdHBXbnN4M0ZmZXNtaFpOc1pQTnZYS0RCWmMyNTRRMnowbVRoNWxNSmhTSktIbWtDRnhnbnNOOEo?oc=5&hl=tr&gl=TR&ceid=TR:tr,,,,,,İstanbul Ticaret,İstanbul Ticaret:161:body+summary,il yok | ilçe yok | faaliyet/tesis yok,İstanbul Ticaret Türkiye,İstanbul Ticaret Üniversitesi | İstanbul Ticaret Merkezi | İstanbul Ticaret İl Müdürlüğü | İstanbul Ticaret İş Güvenliği ve Endüstriyel Ürünler San. A.Ş | İstanbul Ticaret Üniversitesi Küçükyalı Kampüsü,İstanbul Ticaret Üniversitesi,firma adı + güvenli maps adayı var,100.0 | 100.0 | 100.0 | 100.0 | 100.0,,148.12,30
2026-06-04 09:48:03,iflas,İflas / Konkordato / Mali Sorun,Davos’ta Emmanuel Macron’un taktığı güneş gözlüklerinin camlarını üreten Fransız şirket Dalloz Creations iflas etti,Davos’ta Emmanuel Macron’un taktığı güneş gözlüklerinin camlarını üreten Fransız şirket Dalloz Creations iflas etti Patronlar Dünyası,https://news.google.com/rss/articles/CBMi3wFBVV95cUxNeWE0WHJIVDBFZVRKZTgtN1NiZ3lqYWt5OUllSlBTdlFfYkU1T3EycnpBUGJUc1JuMFdyUkRKTWJZR19BdGVOUXFMQU1TMnJxUVI2bEctQVlMY2doRTRuRzZaNUtCQXFZVERlRWpKWjBuX2J3RG1YZUpYRTRJdmNrcWNwNll0czJzYktrYkdEMzRWMzM5SUhBblhvU1BxeWNDWTlNSERwbXZxbktYTXljVGlrN1FNYml3VGp6ckhBMmdXVTQ1Sk9XcV82OGJTR09EVS1Mb3JWQTZqZVZ2VzZj?oc=5,şirket,şirket / firma,"Davos’ta Emmanuel Macron’un taktığı güneş gözlüklerinin camlarını üreten Fransız şirket Dalloz Creations iflas etti Fransa Cumhurbaşkanı Emmanuel Macron’un Davos’ta taktığı ve sosyal medyada gündem olan lüks güneş gözlüklerinin camlarını üreten Fransız şirket Dalloz Creations iflas etti. Şirket, artan mali baskılar karşısında ayakta kalamadı. 04.06.2026 09:48 • Güncelleme: 04.06.2026 09:57 #Emmanuel Macron#Davos#Dalloz Creations Haberi paylaşın Yazı Boyutu: 16px 32px Yazdır Davos’ta Emmanuel Macron’un taktığı ve dünya çapında ilgi gören güneş gözlüklerinin camlarını üreten Fransız Dalloz Creations, mali sıkıntılara yenik düştü. 69 YILLIK HİKAYENİN SONUNA GELİNDİ Fransa’nın Jura bölgesindeki Saint-Claude kentinde faaliyet gösteren Dalloz Creations hakkında Lons-le-Saunier Ticaret Mahkemesi tarafından tasfiye kararı verildi. Kararla birlikte 69 yıllık şirketin faaliyetleri sona ererken, 29 çalışan da işini kaybedecek. DAVOS'TA MACRON'UN TAKTIĞI GÖZLÜĞÜN CAMINI ÜRETMİŞTİ Dalloz Creations’ın adı, Ocak ayında İsviçre’nin Davos kentinde düzenlenen Dünya Ekonomik Forumu sırasında yeniden gündeme gelmişti. Macron’un kullandığı yaklaşık 650 euro değerindeki mavi aynalı güneş gözlüklerinin camlarının şirket tarafından üretildiğinin ortaya çıkması, Fransız üreticiye uluslararası ölçekte dikkat çekmişti. Ancak bu tanıtım etkisi şirketin mali sorunlarını çözmeye yetmedi. Mahkeme kayıtlarına göre şirketin ödeme güçlüğüne düştüğü tarih 20 Mart 2026 olarak belirlendi. Ticari varlıkları satışa çıkarılan şirket için kurtarma formülü bulunamadı. AVRUPA'NIN ÖNEMLİ GÜNEŞ GÖZLÜĞÜ CAMI ÜRETİCİLERİNDEN BİRİYDİ 1957 yılında Christian Dalloz tarafından kurulan Dalloz Creations, Avrupa’nın önemli güneş gözlüğü camı üreticileri arasında yer alıyordu. Polikarbonat gözlük camlarının geliştirilmesinde öncü rol üstlenen şirket, son yıllarda biyolojik döngüsel malzemeler ve değerli metallerin camlara entegre edilmesi gibi yüksek katma değerli ürünlere yönelmişti. Buna rağmen satışlar düzenli olarak geriledi. Şirketin cirosu 2023’te 3,8 milyon euro seviyesindeyken, 2024’te 3,6 milyon euroya düştü. Gelirler 2025 yılında ise 2,5 milyon euroya kadar geriledi. Uzmanlar, Asya merkezli üreticilerden gelen rekabet, yükselen üretim maliyetleri ve optik sektöründeki dönüşümün şirket üzerindeki baskıyı artırdığına dikkat çekiyor. Dalloz Creations’ın kapanışı, yalnızca 29 kişinin işsiz kalması anlamına gelmiyor. Karar aynı zamanda Fransa’nın geleneksel gözlük üretim merkezi olarak bilinen Jura bölgesindeki sanayinin yaşadığı zorlukların da son örneklerinden biri olarak görülüyor. patronlardunyasi.com Dolar 45,9595 0,04% Euro 53,351 -0,13% Sterlin 61,7774 -0,18% Bitcoin 3.078.112 -0,94% BİST-100 14.139,71 -0,43% Gram Altın 6.590,036 -0,59% Gümüş 74,23 -1,21% Faiz 43,45 0,12% Yazı Boyutu: 16px 32px Yazdır Davos’ta Emmanuel Macron’un taktığı ve dünya çapında ilgi gören güneş gözlüklerinin camlarını üreten Fransız Dalloz Creations, mali sıkıntılara yenik düştü. 69 YILLIK HİKAYENİN SONUNA GELİNDİ Fransa’nın Jura bölgesindeki Saint-Claude kentinde faaliyet gösteren Dalloz Creations hakkında Lons-le-Saunier Ticaret Mahkemesi tarafından tasfiye kararı verildi. Kararla birlikte 69 yıllık şirketin faaliyetleri sona ererken, 29 çalışan da işini kaybedecek. DAVOS'TA MACRON'UN TAKTIĞI GÖZLÜĞÜN CAMINI ÜRETMİŞTİ Dalloz Creations’ın adı, Ocak ayında İsviçre’nin Davos kentinde düzenlenen Dünya Ekonomik Forumu sırasında yeniden gündeme gelmişti. Macron’un kullandığı yaklaşık 650 euro değerindeki mavi aynalı güneş gözlüklerinin camlarının şirket tarafından üretildiğinin ortaya çıkması, Fransız üreticiye uluslararası ölçekte dikkat çekmişti. Ancak bu tanıtım etkisi şirketin mali sorunlarını çözmeye yetmedi. Mahkeme kayıtlarına göre şirketin ödeme güçlüğüne düştüğü tarih 20 Mart 2026 olarak belirlendi. Ticari varlıkları satışa çıkarılan şirket için kurtarma formülü bulunamadı. AVRUPA'NIN ÖNEMLİ GÜNEŞ GÖZLÜĞÜ CAMI ÜRETİCİLERİNDEN BİRİYDİ 1957 yılında Christian Dalloz tarafından kurulan Dalloz Creations, Avrupa’nın önemli güneş gözlüğü camı üreticileri arasında yer alıyordu. Polikarbonat gözlük camlarının geliştirilmesinde öncü rol üstlenen şirket, son yıllarda biyolojik döngüsel malzemeler ve değerli metallerin camlara entegre edilmesi gibi yüksek katma değerli ürünlere yönelmişti. Buna rağmen satışlar düzenli olarak geriledi. Şirketin cirosu 2023’te 3,8 milyon euro seviyesindeyken, 2024’te 3,6 milyon euroya düştü. Gelirler 2025 yılında ise 2,5 milyon euroya kadar geriledi. Uzmanlar, Asya merkezli üreticilerden gelen rekabet, yükselen üretim maliyetleri ve optik sektöründeki dönüşümün şirket üzerindeki baskıyı artırdığına dikkat çekiyor. Dalloz Creations’ın kapanışı, yalnızca 29 kişinin işsiz kalması anlamına gelmiyor. Karar aynı zamanda Fransa’nın geleneksel gözlük üretim merkezi olarak bilinen Jura bölgesindeki sanayinin yaşadığı zorlukların da son örneklerinden biri olarak görülüyor. patronlardunyasi.com Davos’ta Emmanuel Macron’un taktığı ve dünya çapında ilgi gören güneş gözlüklerinin camlarını üreten Fransız Dalloz Creations, mali sıkıntılara yenik düştü. 69 YILLIK HİKAYENİN SONUNA GELİNDİ Fransa’nın Jura bölgesindeki Saint-Claude kentinde faaliyet gösteren Dalloz Creations hakkında Lons-le-Saunier Ticaret Mahkemesi tarafından tasfiye kararı verildi. Kararla birlikte 69 yıllık şirketin faaliyetleri sona ererken, 29 çalışan da işini kaybedecek. DAVOS'TA MACRON'UN TAKTIĞI GÖZLÜĞÜN CAMINI ÜRETMİŞTİ Dalloz Creations’ın adı, Ocak ayında İsviçre’nin Davos kentinde düzenlenen Dünya Ekonomik Forumu sırasında yeniden gündeme gelmişti. Macron’un kullandığı yaklaşık 650 euro değerindeki mavi aynalı güneş gözlüklerinin camlarının şirket tarafından üretildiğinin ortaya çıkması, Fransız üreticiye uluslararası ölçekte dikkat çekmişti. Ancak bu tanıtım etkisi şirketin mali sorunlarını çözmeye yetmedi. Mahkeme kayıtlarına göre şirketin ödeme güçlüğüne düştüğü tarih 20 Mart 2026 olarak belirlendi. Ticari varlıkları satışa çıkarılan şirket için kurtarma formülü bulunamadı. AVRUPA'NIN ÖNEMLİ GÜNEŞ GÖZLÜĞÜ CAMI ÜRETİCİLERİNDEN BİRİYDİ 1957 yılında Christian Dalloz tarafından kurulan Dalloz Creations, Avrupa’nın önemli güneş gözlüğü camı üreticileri arasında yer alıyordu. Polikarbonat gözlük camlarının geliştirilmesinde öncü rol üstlenen şirket, son yıllarda biyolojik döngüsel malzemeler ve değerli metallerin camlara entegre edilmesi gibi yüksek katma değerli ürünlere yönelmişti. Buna rağmen satışlar düzenli olarak geriledi. Şirketin cirosu 2023’te 3,8 milyon euro seviyesindeyken, 2024’te 3,6 milyon euroya düştü. Gelirler 2025 yılında ise 2,5 milyon euroya kadar geriledi. Uzmanlar, Asya merkezli üreticilerden gelen rekabet, yükselen üretim maliyetleri ve optik sektöründeki dönüşümün şirket üzerindeki baskıyı artırdığına dikkat çekiyor. Dalloz Creations’ın kapanışı, yalnızca 29 kişinin işsiz kalması anlamına gelmiyor. Karar aynı zamanda Fransa’nın geleneksel gözlük üretim merkezi olarak bilinen Jura bölgesindeki sanayinin yaşadığı zorlukların da son örneklerinden biri olarak görülüyor. patronlardunyasi.com Davos’ta Emmanuel Macron’un taktığı güneş gözlüklerinin camlarını üreten Fransız şirket Dalloz Creations iflas etti Fransa Cumhurbaşkanı Emmanuel Macron’un Davos’ta taktığı ve sosyal medyada gündem olan lüks güneş gözlüklerinin camlarını üreten Fransız şirket Dalloz Creations iflas etti. Şirket, artan mali baskılar karşısında ayakta kalamadı. Davos’ta Emmanuel Macron’un taktığı ve dünya çapında ilgi gören güneş gözlüklerinin camlarını üreten Fransız Dalloz Creations, mali sıkıntılara yenik düştü. 69 YILLIK HİKAYENİN SONUNA GELİNDİ Fransa’nın Jura bölgesindeki Saint-Claude kentinde faaliyet gösteren Dalloz Creations hakkında Lons-le-Saunier Ticaret Mahkemesi tarafından tasfiye kararı verildi. Kararla birlikte 69 yıllık şirketin faaliyetleri sona ererken, 29 çalışan da işini kaybedecek. DAVOS'TA MACRON'UN TAKTIĞI GÖZLÜĞÜN CAMINI ÜRETMİŞTİ Dalloz Creations’ın adı, Ocak ayında İsviçre’nin Davos kentinde düzenlenen Dünya Ekonomik Forumu sırasında yeniden gündeme gelmişti. Macron’un kullandığı yaklaşık 650 euro değerindeki mavi aynalı güneş gözlüklerinin camlarının şirket tarafından üretildiğinin ortaya çıkması, Fransız üreticiye uluslararası ölçekte dikkat çekmişti. Ancak bu tanıtım etkisi şirketin mali sorunlarını çözmeye yetmedi. Mahkeme kayıtlarına göre şirketin ödeme güçlüğüne düştüğü tarih 20 Mart 2026 olarak belirlendi. Ticari varlıkları satışa çıkarılan şirket için kurtarma formülü bulunamadı. AVRUPA'NIN ÖNEMLİ GÜNEŞ GÖZLÜĞÜ CAMI ÜRETİCİLERİNDEN BİRİYDİ 1957 yılında Christian Dalloz tarafından kurulan Dalloz Creations, Avrupa’nın önemli güneş gözlüğü camı üreticileri arasında yer alıyordu. Polikarbonat gözlük camlarının geliştirilmesinde öncü rol üstlenen şirket, son yıllarda biyolojik döngüsel malzemeler ve değerli metallerin camlara entegre edilmesi gibi yüksek katma değerli ürünlere yönelmişti. Buna rağmen satışlar düzenli olarak geriledi. Şirketin cirosu 2023’te 3,8 milyon euro seviyesindeyken, 2024’te 3,6 milyon euroya düştü. Gelirler 2025 yılında ise 2,5 milyon euroya kadar geriledi. Uzmanlar, Asya merkezli üreticilerden gelen rekabet, yükselen üretim maliyetleri ve optik sektöründeki dönüşümün şirket üzerindeki baskıyı artırdığına dikkat çekiyor. Dalloz Creations’ın kapanışı, yalnızca 29 kişinin işsiz kalması anlamına gelmiyor. Karar aynı zamanda Fransa’nın geleneksel gözlük üretim merkezi olarak bilinen Jura bölgesindeki sanayinin yaşadığı zorlukların da son örneklerinden biri olarak görülüyor. Koç Holding’in 100’üncü yıl resepsiyonu Ankara’da siyaset dünyasını buluştururken, Güler Sabancı ve Cavit Çağlar’ın da aralarında olduğu iş dünyasının birçok önemli ismi Aydın Doğan ailesinin Hilton davetinde bir araya geldi. Gecenin esprisi ise Güler Sabancı’nın 70’nci yaşını kutlayan Hilton ile yaşıt çıkması oldu. Epstein bağlantıları ortaya çıkınca İngiliz Kraliyet Ailesi'ndeki tüm görevlerinden el çektirilen Prens Andrew'un, kraliyete ait Royal Lodge malikanesinde çok düşük bir bedelle oturması ve çevresindeki mülkleri gizlice kiraya vermesi İngiltere'de yeni bir tartışma başlattı. The Telegraph gazetesi bugün, ""Andrew gizli kira anlaşmalarıyla kazanç sağladı"" manşetiyle yayımlandı. PATRONLAR DÜNYASI 2004 yılında kuruldu. İş dünyası, patronlar, finans ve genel ekonomi haberciliği alanında özgün yayıncılık yapmaktadır.","Davos’ta Emmanuel Macron’un taktığı güneş gözlüklerinin camlarını üreten Fransız şirket Dalloz Creations iflas etti Davos’ta Emmanuel Macron’un taktığı güneş gözlüklerinin camlarını üreten Fransız şirket Dalloz Creations iflas etti Patronlar Dünyası Davos’ta Emmanuel Macron’un taktığı güneş gözlüklerinin camlarını üreten Fransız şirket Dalloz Creations iflas etti Fransa Cumhurbaşkanı Emmanuel Macron’un Davos’ta taktığı ve sosyal medyada gündem olan lüks güneş gözlüklerinin camlarını üreten Fransız şirket Dalloz Creations iflas etti. Şirket, artan mali baskılar karşısında ayakta kalamadı. 04.06.2026 09:48 • Güncelleme: 04.06.2026 09:57 #Emmanuel Macron#Davos#Dalloz Creations Haberi paylaşın Yazı Boyutu: 16px 32px Yazdır Davos’ta Emmanuel Macron’un taktığı ve dünya çapında ilgi gören güneş gözlüklerinin camlarını üreten Fransız Dalloz Creations, mali sıkıntılara yenik düştü. 69 YILLIK HİKAYENİN SONUNA GELİNDİ Fransa’nın Jura bölgesindeki Saint-Claude kentinde faaliyet gösteren Dalloz Creations hakkında Lons-le-Saunier Ticaret Mahkemesi tarafından tasfiye kararı verildi. Kararla birlikte 69 yıllık şirketin faaliyetleri sona ererken, 29 çalışan da işini kaybedecek. DAVOS'TA MACRON'UN TAKTIĞI GÖZLÜĞÜN CAMINI ÜRETMİŞTİ Dalloz Creations’ın adı, Ocak ayında İsviçre’nin Davos kentinde düzenlenen Dünya Ekonomik Forumu sırasında yeniden gündeme gelmişti. Macron’un kullandığı yaklaşık 650 euro değerindeki mavi aynalı güneş gözlüklerinin camlarının şirket tarafından üretildiğinin ortaya çıkması, Fransız üreticiye uluslararası ölçekte dikkat çekmişti. Ancak bu tanıtım etkisi şirketin mali sorunlarını çözmeye yetmedi. Mahkeme kayıtlarına göre şirketin ödeme güçlüğüne düştüğü tarih 20 Mart 2026 olarak belirlendi. Ticari varlıkları satışa çıkarılan şirket için kurtarma formülü bulunamadı. AVRUPA'NIN ÖNEMLİ GÜNEŞ GÖZLÜĞÜ CAMI ÜRETİCİLERİNDEN BİRİYDİ 1957 yılında Christian Dalloz tarafından kurulan Dalloz Creations, Avrupa’nın önemli güneş gözlüğü camı üreticileri arasında yer alıyordu. Polikarbonat gözlük camlarının geliştirilmesinde öncü rol üstlenen şirket, son yıllarda biyolojik döngüsel malzemeler ve değerli metallerin camlara entegre edilmesi gibi yüksek katma değerli ürünlere yönelmişti. Şirketin cirosu 2023’te 3,8 milyon euro seviyesindeyken, 2024’te 3,6 milyon euroya düştü. Uzmanlar, Asya merkezli üreticilerden gelen rekabet, yükselen üretim maliyetleri ve optik sektöründeki dönüşümün şirket üzerindeki baskıyı artırdığına dikkat çekiyor. Dalloz Creations’ın kapanışı, yalnızca 29 kişinin işsiz kalması anlamına gelmiyor. Karar aynı zamanda Fransa’nın geleneksel gözlük üretim merkezi olarak bilinen Jura bölgesindeki sanayinin yaşadığı zorlukların da son örneklerinden biri olarak görülüyor. patronlardunyasi.com Dolar 45,9595 0,04% Euro 53,351 -0,13% Sterlin 61,7774 -0,18% Bitcoin 3.078.112 -0,94% BİST-100 14.139,71 -0,43% Gram Altın 6.590,036 -0,59% Gümüş 74,23 -1,21% Faiz 43,45 0,12% Yazı Boyutu: 16px 32px Yazdır Davos’ta Emmanuel Macron’un taktığı ve dünya çapında ilgi gören güneş gözlüklerinin camlarını üreten Fransız Dalloz Creations, mali sıkıntılara yenik düştü. patronlardunyasi.com Davos’ta Emmanuel Macron’un taktığı ve dünya çapında ilgi gören güneş gözlüklerinin camlarını üreten Fransız Dalloz Creations, mali sıkıntılara yenik düştü. patronlardunyasi.com Davos’ta Emmanuel Macron’un taktığı güneş gözlüklerinin camlarını üreten Fransız şirket Dalloz Creations iflas etti Fransa Cumhurbaşkanı Emmanuel Macron’un Davos’ta taktığı ve sosyal medyada gündem olan lüks güneş gözlüklerinin camlarını üreten Fransız şirket Dalloz Creations iflas etti. Davos’ta Emmanuel Macron’un taktığı ve dünya çapında ilgi gören güneş gözlüklerinin camlarını üreten Fransız Dalloz Creations, mali sıkıntılara yenik düştü. Koç Holding’in 100’üncü yıl resepsiyonu Ankara’da siyaset dünyasını buluştururken, Güler Sabancı ve Cavit Çağlar’ın da aralarında olduğu iş dünyasının birçok önemli ismi Aydın Doğan ailesinin Hilton davetinde bir araya geldi. Gecenin esprisi ise Güler Sabancı’nın 70’nci yaşını kutlayan Hilton ile yaşıt çıkması oldu. Epstein bağlantıları ortaya çıkınca İngiliz Kraliyet Ailesi'ndeki tüm görevlerinden el çektirilen Prens Andrew'un, kraliyete ait Royal Lodge malikanesinde çok düşük bir bedelle oturması ve çevresindeki mülkleri gizlice kiraya vermesi İngiltere'de yeni bir tartışma başlattı. PATRONLAR DÜNYASI 2004 yılında kuruldu. İş dünyası, patronlar, finans ve genel ekonomi haberciliği alanında özgün yayıncılık yapmaktadır.",browser_full_article_dom,https://news.google.com/rss/articles/CBMi3wFBVV95cUxNeWE0WHJIVDBFZVRKZTgtN1NiZ3lqYWt5OUllSlBTdlFfYkU1T3EycnpBUGJUc1JuMFdyUkRKTWJZR19BdGVOUXFMQU1TMnJxUVI2bEctQVlMY2doRTRuRzZaNUtCQXFZVERlRWpKWjBuX2J3RG1YZUpYRTRJdmNrcWNwNll0czJzYktrYkdEMzRWMzM5SUhBblhvU1BxeWNDWTlNSERwbXZxbktYTXljVGlrN1FNYml3VGp6ckhBMmdXVTQ1Sk9XcV82OGJTR09EVS1Mb3JWQTZqZVZ2VzZj?oc=5&hl=tr&gl=TR&ceid=TR:tr,Ankara,,,,,,,ilçe yok | firma yok | faaliyet/tesis yok,,,,maps araması yapılmadı,,,131.75,31
2026-06-05 07:50:18,iflas,İflas / Konkordato / Mali Sorun,Bursa'da geri dönüşüm firması için iflas sürecinde kritik aşama! Sıra cetveli ilan edildi...,Bursa'da geri dönüşüm firması için iflas sürecinde kritik aşama! Sıra cetveli ilan edildi... Bursa Hakimiyet,https://news.google.com/rss/articles/CBMi0gFBVV95cUxOSzhhX211MFlteGNYUk1ELVZDQXplYmlKVm5pUXFwcWdLRGRFY3k2Z2pGSlMxbGVnaTBCNHBuWDFFR3pYV19WcFNZNS02SUhDWVRkS25KMy14Z1lKbjZ4ZDE0NEg4TUVWQk11MzhrelR6dUt3bjl2RFRBbnBQSEVWbG1kTzA5d2w2UjM4TWp4WWpsUENyT21lMVBRaWxJdmxrWHA3LUJaVU03dzZIVHJlYTNlMFVsMExxSnBVVUNxOEtJalA4TFJnbDU4Nkx6ZHNwZkE?oc=5,firma,şirket / firma,Bursa'da geri dönüşüm firması için iflas sürecinde kritik aşama! Sıra cetveli ilan edildi... Bursa Hakimiyet,Bursa'da geri dönüşüm firması için iflas sürecinde kritik aşama! Sıra cetveli ilan edildi... Bursa'da geri dönüşüm firması için iflas sürecinde kritik aşama! Sıra cetveli ilan edildi... Bursa Hakimiyet Bursa'da geri dönüşüm firması için iflas sürecinde kritik aşama! Sıra cetveli ilan edildi...,browser_failed,https://news.google.com/rss/articles/CBMi0gFBVV95cUxOSzhhX211MFlteGNYUk1ELVZDQXplYmlKVm5pUXFwcWdLRGRFY3k2Z2pGSlMxbGVnaTBCNHBuWDFFR3pYV19WcFNZNS02SUhDWVRkS25KMy14Z1lKbjZ4ZDE0NEg4TUVWQk11MzhrelR6dUt3bjl2RFRBbnBQSEVWbG1kTzA5d2w2UjM4TWp4WWpsUENyT21lMVBRaWxJdmxrWHA3LUJaVU03dzZIVHJlYTNlMFVsMExxSnBVVUNxOEtJalA4TFJnbDU4Nkx6ZHNwZkE?oc=5&hl=tr&gl=TR&ceid=TR:tr,Bursa,,,,,,,ilçe yok | firma yok | faaliyet/tesis yok,,,,maps araması yapılmadı,,,100.08,32
