published,search_term,category,title,summary,link,matched_words,activity_type,raw_text,entity_source_text,article_fetch_status,resolved_article_url,city_candidates,district_candidates,neighborhood_candidates,street_candidates,facility_candidates,company_candidates,company_candidate_scores,entity_quality_note,maps_queries,maps_candidates,maps_best_guess,maps_status,maps_match_scores,maps_rejected_candidates,record_quality_score,duplicate_group_id
2026-06-01 05:22:14,üretim tesisi yangını,Fiziksel Risk / Yangın,Güney Kore: Çip fabrikasında çıkan yangın sonucu zehirli gaz sızıntısı meydana geldi.,Güney Kore: Çip fabrikasında çıkan yangın sonucu zehirli gaz sızıntısı meydana geldi. Vietnam.vn,https://news.google.com/rss/articles/CBMif0FVX3lxTE1QM2dzdXNWeGxUdTgxamtyMjE0b1Y2NzZ6R254VVVsay1ibHhrTl9rMHRPQUlmY3lJUjRESXV0OVVPYTBaUHpkWmliVlduN0U3UTdoa0JBWGtSRlVIMElnSWxKeTZVUS05RE05cUVWaS12Qi1iUlVuOWVuR2JZVEk?oc=5,fabrika,fabrika,Güney Kore: Çip fabrikasında çıkan yangın sonucu zehirli gaz sızıntısı meydana geldi. Vietnam.vn,Güney Kore: Çip fabrikasında çıkan yangın sonucu zehirli gaz sızıntısı meydana geldi. Güney Kore: Çip fabrikasında çıkan yangın sonucu zehirli gaz sızıntısı meydana geldi. Vietnam.vn Güney Kore: Çip fabrikasında çıkan yangın sonucu zehirli gaz sızıntısı meydana geldi.,browser_failed,https://news.google.com/rss/articles/CBMif0FVX3lxTE1QM2dzdXNWeGxUdTgxamtyMjE0b1Y2NzZ6R254VVVsay1ibHhrTl9rMHRPQUlmY3lJUjRESXV0OVVPYTBaUHpkWmliVlduN0U3UTdoa0JBWGtSRlVIMElnSWxKeTZVUS05RE05cUVWaS12Qi1iUlVuOWVuR2JZVEk?oc=5&hl=tr&gl=TR&ceid=TR:tr,,,,,,,,il yok | ilçe yok | firma yok | faaliyet/tesis yok,,,,maps araması yapılmadı,,,83.46,1
2026-05-31 23:36:02,depo yangını,Fiziksel Risk / Yangın,Esenler'de Depo Yangını: 3 Bina Zarar Gördü,Esenler'de Depo Yangını: 3 Bina Zarar Gördü Son Dakika,https://news.google.com/rss/articles/CBMikgFBVV95cUxOOHhtbU9pNDZtRlBpRjd1R1QwNXY2VXEyUEhzUlh1aHowT2p3UVRWekgycFZtZGJpRlNseVVkaENEakRRWG5LZ0FHcDlYQldwaVMtbEJ4Ql9MWERILWNPVFMtSWFoSjBDdlBza2psNEtCMjA3WUZYZ3QwZnFEaWtZcW9PLTZDVlJqTlBvbk1VN0dwUdIBkgFBVV95cUxOOHhtbU9pNDZtRlBpRjd1R1QwNXY2VXEyUEhzUlh1aHowT2p3UVRWekgycFZtZGJpRlNseVVkaENEakRRWG5LZ0FHcDlYQldwaVMtbEJ4Ql9MWERILWNPVFMtSWFoSjBDdlBza2psNEtCMjA3WUZYZ3QwZnFEaWtZcW9PLTZDVlJqTlBvbk1VN0dwUQ?oc=5,depo,depo,"Esenler'deki depoda çıkan yangın, 3 binanın dış cephesine sıçrayarak itfaiye tarafından söndürüldü. Esenler'deki depoda çıkan yangın, 3 binanın dış cephesine sıçrayarak itfaiye tarafından söndürüldü. Esenler'deki depoda çıkan yangın, 3 binanın dış cephesine sıçrayarak itfaiye tarafından söndürüldü. Esenler'de Depo Yangını: 3 Bina Zarar Gördü Son Güncelleme: 01.06.2026 02:36 Esenler'deki depoda çıkan yangın, 3 binanın dış cephesine sıçrayarak itfaiye tarafından söndürüldü. Esenler 'de bir depoda çıkan ve 3 binanın dış cephesi ile bir çatıya sıçrayan yangın itfaiye ekiplerince söndürüldü. Atışalanı Mahallesi Gaye Sokak'ta içinde iplik rulosu ve hurda eşyaların bulunduğu depoda henüz bilinmeyen bir nedenle yangın çıktı. Kısa sürede büyüyen alevler deponun yanındaki 3 binanın dış cephesine ve bir çatıya sıçradı. Vatandaşların ihbarı üzerine bölgeye itfaiye, polis ve sağlık ekipleri sevk edildi. Polis ekipleri şerit çekerek çevrede güvenlik önlemi aldı. Yangın, itfaiyenin müdahalesiyle söndürüldü. Yangın nedeniyle depo kullanılamaz hale gelirken, binaların dış cephesi ve çatı da zarar gördü. Ekipler, yangının çıkış sebebini belirlemek üzere çalışma başlattı. Kaynak: AA Esenler 'de bir depoda çıkan ve 3 binanın dış cephesi ile bir çatıya sıçrayan yangın itfaiye ekiplerince söndürüldü. Atışalanı Mahallesi Gaye Sokak'ta içinde iplik rulosu ve hurda eşyaların bulunduğu depoda henüz bilinmeyen bir nedenle yangın çıktı. Kısa sürede büyüyen alevler deponun yanındaki 3 binanın dış cephesine ve bir çatıya sıçradı. Vatandaşların ihbarı üzerine bölgeye itfaiye, polis ve sağlık ekipleri sevk edildi. Polis ekipleri şerit çekerek çevrede güvenlik önlemi aldı. Yangın, itfaiyenin müdahalesiyle söndürüldü. Yangın nedeniyle depo kullanılamaz hale gelirken, binaların dış cephesi ve çatı da zarar gördü. Ekipler, yangının çıkış sebebini belirlemek üzere çalışma başlattı. Esenler'de Depo Yangını: 3 Bina Zarar Gördü Esenler'deki depoda çıkan yangın, 3 binanın dış cephesine sıçrayarak itfaiye tarafından söndürüldü. Esenler 'de bir depoda çıkan ve 3 binanın dış cephesi ile bir çatıya sıçrayan yangın itfaiye ekiplerince söndürüldü. Atışalanı Mahallesi Gaye Sokak'ta içinde iplik rulosu ve hurda eşyaların bulunduğu depoda henüz bilinmeyen bir nedenle yangın çıktı. Kısa sürede büyüyen alevler deponun yanındaki 3 binanın dış cephesine ve bir çatıya sıçradı. Vatandaşların ihbarı üzerine bölgeye itfaiye, polis ve sağlık ekipleri sevk edildi. Polis ekipleri şerit çekerek çevrede güvenlik önlemi aldı. Yangın, itfaiyenin müdahalesiyle söndürüldü. Yangın nedeniyle depo kullanılamaz hale gelirken, binaların dış cephesi ve çatı da zarar gördü. Ekipler, yangının çıkış sebebini belirlemek üzere çalışma başlattı.","Esenler'de Depo Yangını: 3 Bina Zarar Gördü Esenler'de Depo Yangını: 3 Bina Zarar Gördü Son Dakika Esenler'deki depoda çıkan yangın, 3 binanın dış cephesine sıçrayarak itfaiye tarafından söndürüldü. Esenler'de Depo Yangını: 3 Bina Zarar Gördü Son Güncelleme: 01.06.2026 02:36 Esenler'deki depoda çıkan yangın, 3 binanın dış cephesine sıçrayarak itfaiye tarafından söndürüldü. Esenler 'de bir depoda çıkan ve 3 binanın dış cephesi ile bir çatıya sıçrayan yangın itfaiye ekiplerince söndürüldü. Atışalanı Mahallesi Gaye Sokak'ta içinde iplik rulosu ve hurda eşyaların bulunduğu depoda henüz bilinmeyen bir nedenle yangın çıktı. Kısa sürede büyüyen alevler deponun yanındaki 3 binanın dış cephesine ve bir çatıya sıçradı. Vatandaşların ihbarı üzerine bölgeye itfaiye, polis ve sağlık ekipleri sevk edildi. Polis ekipleri şerit çekerek çevrede güvenlik önlemi aldı. Yangın, itfaiyenin müdahalesiyle söndürüldü. Yangın nedeniyle depo kullanılamaz hale gelirken, binaların dış cephesi ve çatı da zarar gördü. Ekipler, yangının çıkış sebebini belirlemek üzere çalışma başlattı. Kaynak: AA Esenler 'de bir depoda çıkan ve 3 binanın dış cephesi ile bir çatıya sıçrayan yangın itfaiye ekiplerince söndürüldü. Esenler'de Depo Yangını: 3 Bina Zarar Gördü Esenler'deki depoda çıkan yangın, 3 binanın dış cephesine sıçrayarak itfaiye tarafından söndürüldü.",browser_full_article,https://www.sondakika.com/amp/haber-esenler-de-depo-yangini-3-bina-zarar-gordu-19897635/,İstanbul,Esenler,Atışalanı Mahallesi,,,,,firma yok | faaliyet/tesis yok,,,,maps araması yapılmadı,,,108.0,2
2026-05-31 23:21:00,depo yangını,Fiziksel Risk / Yangın,"İstanbul Esenler'de Bir Depoda Çıkan Yangın, Yanındaki İki Bina ile Üçüncü Bina Çatısını Zarar Verdi","İstanbul Esenler'de Bir Depoda Çıkan Yangın, Yanındaki İki Bina ile Üçüncü Bina Çatısını Zarar Verdi Mersin Haber",https://news.google.com/rss/articles/CBMi1gFBVV95cUxNMHpvdF90TFViMXI5U0NLQXRyLTljNXJuX05MVEZtS2UyU01Yd1ZSNHI4TldEREczZFpyNUNUamlPRWF5Y2F2MjJmcWJscHd1OGpfemI1YUM0VWRidXZQdVZ6OXZIWFI4SVZFQ2pOcVJyc2ZWQ1RtdXdSRkFTOFFRVXJHcUV6WEZKZkRubllSM0VtZklXRDJ5dkV0RE5XaVFRRGpVbGdOZ0twaVVvbE52ZDRnYzAxMzFlUGdtOVBrMmp3ZmRVREF1VjJIYUFzTnJ2dm1jTENB0gFXQVVfeXFMT21mSVE3WDYxS2tHV0NLelUyUWYzMEU4Mk9EaFlRZnJlSUMyQTVkT1U3akJ1N1pyejNnM1ZJODFncnQ0emNGTEU0d2h5T0ZlRk9yZGp5dmlB?oc=5,depo,depo,"İstanbul Esenler'de Bir Depoda Çıkan Yangın, Yanındaki İki Bina ile Üçüncü Bina Çatısını Zarar Verdi Mersin Haber","İstanbul Esenler'de Bir Depoda Çıkan Yangın, Yanındaki İki Bina ile Üçüncü Bina Çatısını Zarar Verdi İstanbul Esenler'de Bir Depoda Çıkan Yangın, Yanındaki İki Bina ile Üçüncü Bina Çatısını Zarar Verdi Mersin Haber İstanbul Esenler'de Bir Depoda Çıkan Yangın, Yanındaki İki Bina ile Üçüncü Bina Çatısını Zarar Verdi Mersin Haber",browser_failed,https://news.google.com/rss/articles/CBMi1gFBVV95cUxNMHpvdF90TFViMXI5U0NLQXRyLTljNXJuX05MVEZtS2UyU01Yd1ZSNHI4TldEREczZFpyNUNUamlPRWF5Y2F2MjJmcWJscHd1OGpfemI1YUM0VWRidXZQdVZ6OXZIWFI4SVZFQ2pOcVJyc2ZWQ1RtdXdSRkFTOFFRVXJHcUV6WEZKZkRubllSM0VtZklXRDJ5dkV0RE5XaVFRRGpVbGdOZ0twaVVvbE52ZDRnYzAxMzFlUGdtOVBrMmp3ZmRVREF1VjJIYUFzTnJ2dm1jTENB0gFXQVVfeXFMT21mSVE3WDYxS2tHV0NLelUyUWYzMEU4Mk9EaFlRZnJlSUMyQTVkT1U3akJ1N1pyejNnM1ZJODFncnQ0emNGTEU0d2h5T0ZlRk9yZGp5dmlB?oc=5&hl=tr&gl=TR&ceid=TR:tr,İstanbul,Esenler,,,,,,firma yok | faaliyet/tesis yok,,,,maps araması yapılmadı,,,123.38,3
2026-05-31 14:29:02,borç krizi,Banka / Finansal Kuruluş,"Bankalar yarışa girdi, mevduat faiz oranları güncellendi! 250 bin TL’nin aylık getirisi belli oldu","Bankalar yarışa girdi, mevduat faiz oranları güncellendi! 250 bin TL’nin aylık getirisi belli oldu Halk TV",https://news.google.com/rss/articles/CBMizwFBVV95cUxPZjFHczI1dldQQ282STFLSkhzaWVnWEgyV0pHS0tIMTFUMVduMktnOUdxNWlyR05xMlJyYUUyQXVfakhXdUhYY3UzNVhETnNSNlpVejNQaDRTYzROamhYX2JYZUV0RllyZTBRTkh3TURjbW1oV3hZTzVETmNNY1VwSm5kS0t2Tzl0YkVwSFhncnVsTktLMXV4ZFZGY3Q1SHZXcUxUbmRPTGNDVnZ2Mk5UWjBZRWNHX0NBRWs5YWVyZXNFb2xIY1Z3cV9hOFBiZTA?oc=5,banka,finansal kuruluş,"Bankalar, müşteri kazanmak amacıyla mevduat faiz oranlarını güncellemeyi sürdürüyor. Değişen oranlarla birlikte 250 bin TL’lik birikimin 32 günlük getirisi de bankalara göre farklı seviyelere ulaştı. Bankalar, müşteri kazanmak amacıyla mevduat faiz oranlarını güncellemeyi sürdürüyor. Değişen oranlarla birlikte 250 bin TL’lik birikimin 32 günlük getirisi de bankalara göre farklı seviyelere ulaştı. Bankalar, müşteri kazanmak amacıyla mevduat faiz oranlarını güncellemeyi sürdürüyor. Değişen oranlarla birlikte 250 bin TL’lik birikimin 32 günlük getirisi de bankalara göre farklı seviyelere ulaştı.","Bankalar yarışa girdi, mevduat faiz oranları güncellendi! 250 bin TL’nin aylık getirisi belli oldu Bankalar yarışa girdi, mevduat faiz oranları güncellendi! 250 bin TL’nin aylık getirisi belli oldu Halk TV Bankalar, müşteri kazanmak amacıyla mevduat faiz oranlarını güncellemeyi sürdürüyor. Değişen oranlarla birlikte 250 bin TL’lik birikimin 32 günlük getirisi de bankalara göre farklı seviyelere ulaştı.",browser_full_article,https://halktv.com.tr/ekonomi/bankalar-yarisa-girdi-mevduat-faiz-oranlari-guncellendi-250-bin-tlnin-aylik-getirisi-belli-oldu-1033049h,,,,,,,,il yok | ilçe yok | firma yok | faaliyet/tesis yok,,,,maps araması yapılmadı,,,87.49,4
2026-06-01 08:10:00,fabrika yangını,Fiziksel Risk / Yangın,Bursa Demirtaş Organize Sanayi Bölgesi'nde fabrika yangını,Bursa Demirtaş Organize Sanayi Bölgesi'nde fabrika yangını turkhaber.com,https://news.google.com/rss/articles/CBMiogFBVV95cUxPc1kxSHMzZnF5LWdKWVh5am05cEM3LTVrRlNBckJ0UEFIVzhQcDdnVllRa1hMbUpiWjF1dllPb1o2bUpFeF9tUEtKcVVPMHpwR3RQVGV6enhsajVyN296dVBkcWltZktLTzBjem9hMS1nZFJpRUU1NjFFSW12cVpuekRjbnkxOWNkUzdIRUlia3FCdFNSeHRJeHRKVEhxbkk0SEE?oc=5,"fabrika, organize sanayi, sanayi",fabrika,Bursa Demirtaş Organize Sanayi Bölgesi'nde fabrika yangını turkhaber.com,Bursa Demirtaş Organize Sanayi Bölgesi'nde fabrika yangını Bursa Demirtaş Organize Sanayi Bölgesi'nde fabrika yangını turkhaber.com Bursa Demirtaş Organize Sanayi Bölgesi'nde fabrika yangını turkhaber.com,browser_failed,https://news.google.com/rss/articles/CBMiogFBVV95cUxPc1kxSHMzZnF5LWdKWVh5am05cEM3LTVrRlNBckJ0UEFIVzhQcDdnVllRa1hMbUpiWjF1dllPb1o2bUpFeF9tUEtKcVVPMHpwR3RQVGV6enhsajVyN296dVBkcWltZktLTzBjem9hMS1nZFJpRUU1NjFFSW12cVpuekRjbnkxOWNkUzdIRUlia3FCdFNSeHRJeHRKVEhxbkk0SEE?oc=5&hl=tr&gl=TR&ceid=TR:tr,Bursa,,Demirtaş | Bursa Demirtaş Organize Sanayi,,,Bursa Demirtaş Organize Sanayi,Bursa Demirtaş Organize Sanayi:292:body+summary+title,ilçe yok | faaliyet/tesis yok,Bursa Demirtaş Organize Sanayi Demirtaş Bursa Türkiye,Demirtaş Dumlupınar OSB | Demirtaş | Demirtaş Organize Sanayi Cami,Demirtaş Dumlupınar OSB,firma adı + güvenli maps adayı var,52.83018867924528 | 100.0 | 90.56603773584905,DOSAB Bölge Müdürlüğü | DOSAB OSGB,193.72,5
2026-06-01 07:36:33,fabrika yangını,Fiziksel Risk / Yangın,Bursa'da fabrika yangını! Organize Sanayi Bölgesinde korku dolu anlar...,Bursa'da fabrika yangını! Organize Sanayi Bölgesinde korku dolu anlar... Bursa Hakimiyet,https://news.google.com/rss/articles/CBMitwFBVV95cUxNcUZET3FValVUc2o4eW5fZGpjak5UVDY4RkZpOS14LS1UejdlSVhWVkFxaEtTTHpaNmlScXlhb2Z0NlZ2bzg1NHB2SUdKaWJfazJsLWZZN3ppR1BFSS0tcDFjZjhVd1l0WDhGcUNNQ2N3bF9KWTR4WGZGVEdVdGVVQnZyQlhrVGVEaHFwZlI2djFVOUVOM2xjZ2F6TERJc0NJdElUU2Y1bGNZcHo3UlpiODc5S0FaUlE?oc=5,"fabrika, organize sanayi, sanayi",fabrika,Bursa'da fabrika yangını! Organize Sanayi Bölgesinde korku dolu anlar... Bursa Hakimiyet,Bursa'da fabrika yangını! Organize Sanayi Bölgesinde korku dolu anlar... Bursa'da fabrika yangını! Organize Sanayi Bölgesinde korku dolu anlar... Bursa Hakimiyet Bursa'da fabrika yangını! Organize Sanayi Bölgesinde korku dolu anlar...,browser_failed,https://www.bursahakimiyet.com.tr/bursa/bursa-da-fabrika-yangini-organize-sanayi-bolgesinde-korku-dolu-anlar-1640063,Bursa,,,,,Organize Sanayi,Organize Sanayi:292:body+summary+title,ilçe yok | faaliyet/tesis yok,Organize Sanayi Bursa Türkiye,Bursa Organize Sanayi Bölgesi,Bursa Organize Sanayi Bölgesi,firma adı + güvenli maps adayı var,100.0,,190.88,6
