published,search_term,category,title,summary,link,matched_words,activity_type,raw_text,entity_source_text,article_fetch_status,resolved_article_url,city_candidates,district_candidates,neighborhood_candidates,street_candidates,facility_candidates,company_candidates,company_candidate_scores,entity_quality_note,maps_queries,maps_candidates,maps_best_guess,maps_status,maps_match_scores,maps_rejected_candidates,record_quality_score,duplicate_group_id
2026-06-04 14:40:00,fabrika yangını,Fiziksel Risk / Yangın,İstanbul'da Korkutan Yangın! Esenyurt'ta İki Katlı Fabrika Alev Alev Yanıyor! İşte Olay Yerinden İlk Detaylar!,İstanbul'da Korkutan Yangın! Esenyurt'ta İki Katlı Fabrika Alev Alev Yanıyor! İşte Olay Yerinden İlk Detaylar! politikam.com,https://news.google.com/rss/articles/CBMiywFBVV95cUxQMy0tc1pZOG5PS3luRWFNelpwaTlkSVk5NkNaVmtTLWI3VTJOVm5NOU5hNTNIWUxyN1BOSEpqQ290dXhiTk1nUmxFR09KYWtQbVNPWDNKd1p4T3dpb25xLXBHbjlJN1dkZGFjdzJpcnJ0eVR1V3dGNFlLV05fbkE4ODEwbC1aNnlwOXpXLU5iMEZ5eEkybGJiNDBxV1BpNjJhdjBtT01kNU1NYmVNbkdVcHJDZFhuekZvMzQ5RU1TaHVOdGQ5UGMyTUhudw?oc=5,fabrika,fabrika,"Son dakika Esenyurt yangın haberi! Fatih Mahallesi 19 Mayıs Bulvarı üzerindeki fabrikada çıkan yangına müdahale sürüyor. İşte ilk bilgiler! Son dakika Esenyurt yangın haberi! Fatih Mahallesi 19 Mayıs Bulvarı üzerindeki fabrikada çıkan yangına müdahale sürüyor. İşte ilk bilgiler! Son dakika Esenyurt yangın haberi! Fatih Mahallesi 19 Mayıs Bulvarı üzerindeki fabrikada çıkan yangına müdahale sürüyor. İşte ilk bilgiler! İstanbul'da Korkutan Yangın! Esenyurt'ta İki Katlı Fabrika Alev Alev Yanıyor! İşte Olay Yerinden İlk Detaylar! Son dakika Esenyurt yangın haberi! Fatih Mahallesi 19 Mayıs Bulvarı üzerindeki fabrikada çıkan yangına müdahale sürüyor. İşte ilk bilgiler! Kevser Yoldaş Editör 04.06.2026 - 17:40 Yayınlanma 2 Dk Okunma Süresi Paylaş Linkedin Pinterest Telegram Yazdır Kopyala A - A + Paylaş Linkedin Pinterest Telegram Yazdır Kopyala A - A + Son Dakika: İstanbul Esenyurt'ta Dev Fabrika Yangını! Olay Yerine Çok Sayıda Ekip Sevk Edildi! İstanbul'un en yoğun sanayi ve üretim merkezlerinden biri olan Esenyurt ilçesinden korkutan bir son dakika haberi geldi. Edinilen bilgilere göre, Esenyurt'ta faaliyet gösteren iki katlı bir fabrikada henüz belirlenemeyen bir nedenle yangın çıktı. Kısa sürede büyüyen alevler fabrikanın büyük bir bölümünü sararken, gökyüzünü kaplayan yoğun dumanlar çevre ilçelerden de çıplak gözle görülebiliyor. Peki, Esenyurt'taki yangın nerede çıktı, hangi fabrikada yangın var? Can kaybı veya yaralı var mı? Esenyurt Fatih Mahallesi 19 Mayıs Bulvarı'nda Korkutan Dakikalar! Korkutan yangın, İstanbul Esenyurt ilçesi Fatih Mahallesi 19 Mayıs Bulvarı üzerinde konumlanan hidrofor tankı üretimi yapılan iki katlı bir fabrikada meydana geldi. Fabrika binasından yükselen alevleri ve dumanları gören işçiler ile çevredeki vatandaşlar büyük panik yaşadı. Durumun hemen bildirilmesi üzerine bölgeye adeta ekip yağdı. İhbarın ardından olay yerine İstanbul'un çevre ilçelerinden de destek olmak üzere çok sayıda itfaiye, polis ve sağlık ekibi sevk edildi. Polis ekipleri fabrikanın çevresinde geniş güvenlik önlemleri alarak bulvarı trafiğe kapatırken, sağlık ekipleri de olası bir dumandan etkilenme veya yaralanma ihtimaline karşı hazır bekletiliyor. İtfaiye Ekiplerinin Yoğun Müdahalesi Sürüyor İki katlı fabrikanın içerisindeki yanıcı maddelerin de etkisiyle alevlerin kontrol altına alınması için itfaiye erleri yoğun bir mesai harcıyor. Fabrikanın hidrofor tankı üretimi yapması nedeniyle içeride patlama riskine karşı ekiplerin son derece titiz ve koordineli bir şekilde yangına müdahale ettiği öğrenildi. Yangının çıkış nedeni henüz netlik kazanmazken, söndürme çalışmalarının tamamlanmasının ardından kundaklama, elektrik kontağı veya üretim hatası ihtimalleri üzerine geniş çaplı bir inceleme başlatılacağı belirtildi. Yangında ilk belirlemelere göre herhangi bir can kaybı veya yaralanma olup olmadığına dair resmi makamlardan henüz net bir açıklama yapılmadı. Kaynak: Anadolu Ajansı Editör Kevser Yoldaş Bunlar da ilgin",İstanbul'da Korkutan Yangın! Esenyurt'ta İki Katlı Fabrika Alev Alev Yanıyor! İşte Olay Yerinden İlk Detaylar! İstanbul'da Korkutan Yangın! Esenyurt'ta İki Katlı Fabrika Alev Alev Yanıyor! İşte Olay Yerinden İlk Detaylar! politikam.com Son dakika Esenyurt yangın haberi! Fatih Mahallesi 19 Mayıs Bulvarı üzerindeki fabrikada çıkan yangına müdahale sürüyor. İstanbul'da Korkutan Yangın! Esenyurt'ta İki Katlı Fabrika Alev Alev Yanıyor! İşte Olay Yerinden İlk Detaylar!,browser_full_article,https://www.politikam.com/istanbulda-korkutan-yangin-esenyurtta-iki-katli-fabrika-alev-alev-yaniyor-iste-olay-yerinden-ilk-detaylar,İstanbul,Esenyurt | Fatih,Fatih Mahallesi,Fatih Mahallesi 19 Mayıs Bulvarı,,,,firma yok | faaliyet/tesis yok,,,,maps araması yapılmadı,,,179.0,1
2026-06-05 08:20:38,MASAK raporu,Banka / Finansal Kuruluş,Banka hesabındaki dekont notu ortaya çıktı: ROK'un 'katmanlama' oyunu... '50 binin yüzde 178'i',Banka hesabındaki dekont notu ortaya çıktı: ROK'un 'katmanlama' oyunu... '50 binin yüzde 178'i' Odatv,https://news.google.com/rss/articles/CBMi2gFBVV95cUxNUktNeHFkUGRjX1RRd2pobXBoYUpjelh3NlBtREJ6RHNJVWtxbmF2M19qNzN1bkVNVm1rWmxZT2FnTU5SZldka3hsVkJzcEpiRHJqRVhUMXhyejlIcHhSN2hqbXluVHRJTmJ6d2R3ZEtlRmxjZGc3T0VDM3JJUFVYQ0IzWjFhRC12TS1kc250X09tNXRyM3NDY242V1lKMHFSajRYbFVsTzJsb1VXTnpqZklfc3kxeGR2MHZfc1hrbGJGLW9fLUQ0YjVKSHA0MEMwcWhZVHkzSWZTdw?oc=5,"banka, banka hesabı",finansal kuruluş,Banka hesabındaki dekont notu ortaya çıktı: ROK'un 'katmanlama' oyunu... '50 binin yüzde 178'i' Odatv,Banka hesabındaki dekont notu ortaya çıktı: ROK'un 'katmanlama' oyunu... '50 binin yüzde 178'i' Banka hesabındaki dekont notu ortaya çıktı: ROK'un 'katmanlama' oyunu... '50 binin yüzde 178'i' Odatv Banka hesabındaki dekont notu ortaya çıktı: ROK'un 'katmanlama' oyunu... '50 binin yüzde 178'i' Odatv,browser_failed,https://www.odatv.com/guncel/rasim-ozan-kutahyali-masak-raporu-parayi-nasil-aklayacagini-dekont-aciklamasina-yazmis-katmanlama-oyunu-120148916,,,,,,,,il yok | ilçe yok | firma yok | faaliyet/tesis yok,,,,maps araması yapılmadı,,,79.76,2
2026-06-04 09:55:00,MASAK raporu,Kara Para / MASAK / Bahis,Silivri’de hayvan barınağı adı altında vurgun yapan derneğin MASAK raporu ortaya çıktı,Silivri’de hayvan barınağı adı altında vurgun yapan derneğin MASAK raporu ortaya çıktı Malatya Güncel,https://news.google.com/rss/articles/CBMivwFBVV95cUxNWWdQbE9jWHZOUGFfN3d5VGpNWUgyYnMwamdHMTlPbmpjSjVlNVRzVFFxVkNBQkdGNU11LXhNUkxfNWs5ZDYyT0NYbGpWcFlfNGwzcnByVjRkbTk5bGR2Z2VtZzRKNksxbVRQQ1VIRHJnUjZhckludGFuNlFUN3duWGRtLWNLN0oxN0tuRkhJWlZXTElwMTAzeDlpVGw2UWRDaDVDZ3lyLUhFNWw1MU01RmdNb3Jqazd3aGdOdWJDMNIBxAFBVV95cUxQY2owaWdJRmUtc0NJWlFzbEJ0SzFZN1lpYzBDNkxDbDNPMDdRQnBZNlFtZ2JabE5vem5sUDg5aWlGaHdXM1RFNUNRUWVjSVZNcDRXU1lFdGVaa05hdlFZNGp4RU14dTIzQWNKenc3QjlHVVUxalJfRTRlVlRBclhXX09fbXFwWUpHeXFyRk4tOExxZVlHOUg2LXFwUnhGVGQyaEV1UzlFMF85YU1sc2NaWWc1YnlCQUZvd3pGNENpT3VNTEdK?oc=5,masak,,Silivri’de hayvan barınağı sorumlusu ve ‘Silivri Canları 2. Hayat Melekleri’ adlı derneğin MASAK raporu ortaya çıktı. Rapor’da derneğin hesaplarına 2021-2024 yılları arasında 37 Milyar 323 Milyon 777 Bin 21 TL tutarında para girişinin old... Silivri’de hayvan barınağı sorumlusu ve ‘Silivri Canları 2. Hayat Melekleri’ adlı derneğin MASAK raporu ortaya çıktı. Rapor’da derneğin hesaplarına 2021-2024 yılları arasında 37 Milyar 323 Milyon 777 Bin 21 TL tutarında para girişinin old... Silivri’de hayvan barınağı sorumlusu ve ‘Silivri Canları 2. Hayat Melekleri’ adlı derneğin MASAK raporu ortaya çıktı. Rapor’da derneğin hesaplarına 2021-2024 yılları arasında 37 Milyar 323 Milyon 777 Bin 21 TL tutarında para girişinin old...,Silivri’de hayvan barınağı adı altında vurgun yapan derneğin MASAK raporu ortaya çıktı Silivri’de hayvan barınağı adı altında vurgun yapan derneğin MASAK raporu ortaya çıktı Malatya Güncel Silivri’de hayvan barınağı sorumlusu ve ‘Silivri Canları 2. Hayat Melekleri’ adlı derneğin MASAK raporu ortaya çıktı. Rapor’da derneğin hesaplarına 2021-2024 yılları arasında 37 Milyar 323 Milyon 777 Bin 21 TL tutarında para girişinin old...,browser_full_article,https://www.malatyaguncel.com/silivride-hayvan-barinagi-adi-altinda-vurgun-yapan-dernegin-masak-raporu-ortaya-2600247h.htm,İstanbul,Silivri,,,,,,firma yok | faaliyet/tesis yok,,,,maps araması yapılmadı,,,119.5,3
2026-06-04 12:42:00,depo yangını,Fiziksel Risk / Yangın,Şanlıurfa Haliliye'de Depoda Çıkan Yangın İtfaiye Ekiplerini Alarm Durumuna Geçirdi,Şanlıurfa Haliliye'de Depoda Çıkan Yangın İtfaiye Ekiplerini Alarm Durumuna Geçirdi Mersin Haber,https://news.google.com/rss/articles/CBMiwAFBVV95cUxPVzllY0JaSG1tel9EVDNKNFB0MmxPREJ3ZkhVaXVHbXctYnpmNGkybnJzY0lVVUd1Z2dZYlEtT01BUS1idk1GWkdxQWlhcXpwMFphQllkSk8yTk43Y1c5MGpxaVF1QnFUeXAxZEU0VG9veFE4TGVwR0NmSG5QQ2txRzlZMXFMay0wQXQ4MmNURl9DdFg1aF9xb2ljNlRCaU45U2RGZ1l4cGlqNXBTTG5KX0k4SVFNU0k4OWJWRnR2UFPSAVdBVV95cUxNcmZvQlRMSklxaXFHSGItX2F4SDBkMHB1RkFsYVd0Z0NUOUI4Tl9xZ0gyNWdySXhJMDZiaG1oNjZuNk1BX2FpckpUUVJodGM5MjBiS0xxT1k?oc=5,depo,depo,"Mersin'den haberiniz olsun! Mersin ve ilçelerinden son dakika ve önemli haberler, gelişmeler olayları sunar. Şanlıurfa Haliliye'de bir depoda meydana gelen yangın, itfaiye ekiplerini harekete geçirdi. Olay, öğle saatlerinde Kamberiye Mahallesi'nde yaşandı. Mersin'den haberiniz olsun! Mersin ve ilçelerinden son dakika ve önemli haberler, gelişmeler olayları sunar. Şanlıurfa Haliliye'de Depoda Çıkan Yangın İtfaiye Ekiplerini Alarm Durumuna Geçirdi Haber Merkezi • 04 Haziran 2026 15:42 • Güncellendi: 04 Haziran 2026 15:45 Şanlıurfa Haliliye'de bir depoda meydana gelen yangın, itfaiye ekiplerini harekete geçirdi. Olay, öğle saatlerinde Kamberiye Mahallesi'nde yaşandı. Şanlıurfa Haliliye'de bir depoda meydana gelen yangın, itfaiye ekiplerini harekete geçirdi. Olay, öğle saatlerinde Kamberiye Mahallesi'nde yaşandı. Facebook X WhatsApp 20sa 2dk önce Edinilen bilgilere göre, yangın, Haliliye ilçesine bağlı Kamberiye Mahallesi Seyfettin Sucu Sokak'ta, giriş katında bulunan bir depoda, henüz belirlenemeyen bir sebepten dolayı başladı. Yangını gören mahalle sakinleri, durumu hemen yetkililere bildirdi. Olay yerine intikal eden itfaiye ekipleri, yangına müdahale ederek alevleri kontrol altına aldı. Yangın, ekiplerin hızlı müdahalesi sayesinde söndürüldü ancak çeşitli maddi hasara yol açtı. Yangının çıkış sebebiyle ilgili araştırmalar sürerken, ekipler olay yerinde detaylı incelemeler yapıyor. Yangının büyümesine engel olunması, itfaiye ekiplerinin etkin müdahalesiyle mümkün oldu. Yerel halk, müdahale sırasında ekiplerin hızlı davranışları için teşekkürlerini iletti. Samsun Atakum'da 19 Mayıs Stadyumu'nda Bakım ve Onarım Çalışmaları Başladı Samsun'da Prostat Kanseri Tedavisindeki Gecikmenin Sonuçları Üzerine Bilgilendirme Şanlıurfa Kaynak: Mersin Haber + IHA İlgili Haberler Edinilen bilgilere göre, yangın, Haliliye ilçesine bağlı Kamberiye Mahallesi Seyfettin Sucu Sokak'ta, giriş katında bulunan bir depoda, henüz belirlenemeyen bir sebepten dolayı başladı. Yangını gören mahalle sakinleri, durumu hemen yetkililere bildirdi. Olay yerine intikal eden itfaiye ekipleri, yangına müdahale ederek alevleri kontrol altına aldı. Yangın, ekiplerin hızlı müdahalesi sayesinde söndürüldü ancak çeşitli maddi hasara yol açtı. Yangının çıkış sebebiyle ilgili araştırmalar sürerken, ekipler olay yerinde detaylı incelemeler yapıyor. Yangının büyümesine engel olunması, itfaiye ekiplerinin etkin müdahalesiyle mümkün oldu. Yerel halk, müdahale sırasında ekiplerin hızlı davranışları için teşekkürlerini iletti. Şanlıurfa Haliliye'de Depoda Çıkan Yangın İtfaiye Ekiplerini Alarm Durumuna Geçirdi Haber Merkezi • 04 Haziran 2026 15:42 • Güncellendi: 04 Haziran 2026 15:45 Şanlıurfa Haliliye'de bir depoda meydana gelen yangın, itfaiye ekiplerini harekete geçirdi. Olay, öğle saatlerinde Kamberiye Mahallesi'nde yaşandı. Haber Merkezi • 04 Haziran 2026 15:42 • Güncellendi: 04 Haziran 2026 15:45 Şanlıurfa Haliliye'de bir depoda meydana gelen yangın, itfaiye ekiplerini harekete geçirdi. Olay, öğle saatlerinde Kamberiye Mahallesi'nde yaşandı. Şanlıurfa Haliliye'de Depoda Çıkan Yangın İtfaiye Ekiplerini Alarm Durumuna Geçirdi Edinilen bilgilere göre, yangın, Haliliye ilçesine bağlı Kamberiye Mahallesi Seyfettin Sucu Sokak'ta, giriş katında bulunan bir depoda, henüz belirlenemeyen bir sebepten dolayı başladı. Yangını gören mahalle sakinleri, durumu hemen yetkililere bildirdi. Olay yerine intikal eden itfaiye ekipleri, yangına müdahale ederek alevleri kontrol altına aldı. Yangın, ekiplerin hızlı müdahalesi sayesinde söndürüldü ancak çeşitli maddi hasara yol açtı. Yangının çıkış sebebiyle ilgili araştırmalar sürerken, ekipler olay yerinde detaylı incelemeler yapıyor. Yangının büyümesine engel olunması, itfaiye ekiplerinin etkin müdahalesiyle mümkün oldu. Yerel halk, müdahale sırasında ekiplerin hızlı davranışları için teşekkürlerini iletti.","Şanlıurfa Haliliye'de Depoda Çıkan Yangın İtfaiye Ekiplerini Alarm Durumuna Geçirdi Şanlıurfa Haliliye'de Depoda Çıkan Yangın İtfaiye Ekiplerini Alarm Durumuna Geçirdi Mersin Haber Mersin'den haberiniz olsun! Şanlıurfa Haliliye'de bir depoda meydana gelen yangın, itfaiye ekiplerini harekete geçirdi. Olay, öğle saatlerinde Kamberiye Mahallesi'nde yaşandı. Şanlıurfa Haliliye'de Depoda Çıkan Yangın İtfaiye Ekiplerini Alarm Durumuna Geçirdi Haber Merkezi • 04 Haziran 2026 15:42 • Güncellendi: 04 Haziran 2026 15:45 Şanlıurfa Haliliye'de bir depoda meydana gelen yangın, itfaiye ekiplerini harekete geçirdi. Facebook X WhatsApp 20sa 2dk önce Edinilen bilgilere göre, yangın, Haliliye ilçesine bağlı Kamberiye Mahallesi Seyfettin Sucu Sokak'ta, giriş katında bulunan bir depoda, henüz belirlenemeyen bir sebepten dolayı başladı. Yangını gören mahalle sakinleri, durumu hemen yetkililere bildirdi. Olay yerine intikal eden itfaiye ekipleri, yangına müdahale ederek alevleri kontrol altına aldı. Yangın, ekiplerin hızlı müdahalesi sayesinde söndürüldü ancak çeşitli maddi hasara yol açtı. Yangının çıkış sebebiyle ilgili araştırmalar sürerken, ekipler olay yerinde detaylı incelemeler yapıyor. Yangının büyümesine engel olunması, itfaiye ekiplerinin etkin müdahalesiyle mümkün oldu. Yerel halk, müdahale sırasında ekiplerin hızlı davranışları için teşekkürlerini iletti. Samsun Atakum'da 19 Mayıs Stadyumu'nda Bakım ve Onarım Çalışmaları Başladı Samsun'da Prostat Kanseri Tedavisindeki Gecikmenin Sonuçları Üzerine Bilgilendirme Şanlıurfa Kaynak: Mersin Haber + IHA İlgili Haberler Edinilen bilgilere göre, yangın, Haliliye ilçesine bağlı Kamberiye Mahallesi Seyfettin Sucu Sokak'ta, giriş katında bulunan bir depoda, henüz belirlenemeyen bir sebepten dolayı başladı. Haber Merkezi • 04 Haziran 2026 15:42 • Güncellendi: 04 Haziran 2026 15:45 Şanlıurfa Haliliye'de bir depoda meydana gelen yangın, itfaiye ekiplerini harekete geçirdi. Şanlıurfa Haliliye'de Depoda Çıkan Yangın İtfaiye Ekiplerini Alarm Durumuna Geçirdi Edinilen bilgilere göre, yangın, Haliliye ilçesine bağlı Kamberiye Mahallesi Seyfettin Sucu Sokak'ta, giriş katında bulunan bir depoda, henüz belirlenemeyen bir sebepten dolayı başladı.",browser_full_article,https://www.mersinhaber.com/haber-sanliurfa-haliliyede-depoda-cikan-yangin-itfaiye-ekiplerini-alarm-durumuna-gecirdi/660708,Mersin | Samsun | Şanlıurfa,Atakum | Haliliye,öğle saatlerinde Kamberiye Mahallesi | Haliliye ilçesine bağlı Kamberiye Mahallesi,,,,,firma yok | faaliyet/tesis yok,,,,maps araması yapılmadı,,,146.5,4
2026-06-04 12:55:19,depo yangını,Fiziksel Risk / Yangın,Şanlıurfa'da Depo Yangını: İtfaiye Ekipleri Hızla Müdahale Etti,Şanlıurfa'da Depo Yangını: İtfaiye Ekipleri Hızla Müdahale Etti Haber365,https://news.google.com/rss/articles/CBMinwFBVV95cUxQeGF0VEloU0diZ2tJU1ZoNzZGQ2J0LXRnQVJWZDdKRTk4T29ZWFZ6NGc0XzM4ajRjalJrelZpcFNFLVRhMnVRUXRiTUhkOGZNYmU0Z1UtMWh1TWdNNVZoRVVBWEtRa2JPbHgtVlc2Mm02d1VnQ1ZINUpyMk9RemdyMk1keFJhSVFPZWNsM2RVY3haeEJNMHl5ZkJwMmRyb1XSAZ8BQVVfeXFMUHhhdFRJaFNHYmdrSVNWaDc2RkNidC10Z0FSVmQ3SkU5OE9vWVhWejRnNF8zOGo0Y2pSa3pWaXBTRS1UYTJ1UVF0Yk1IZDhmTWJlNGdVLTFodU1nTTVWaEVVQVhLUWtiT2x4LVZXNjJtNndVZ0NWSDVKcjJPUXpncjJNZHhSYUlRT2VjbDNkVWN4WnhCTTB5eWZCcDJkcm9V?oc=5,depo,depo,Şanlıurfa'da Depo Yangını: İtfaiye Ekipleri Hızla Müdahale Etti Haber365,Şanlıurfa'da Depo Yangını: İtfaiye Ekipleri Hızla Müdahale Etti Şanlıurfa'da Depo Yangını: İtfaiye Ekipleri Hızla Müdahale Etti Haber365 Şanlıurfa'da Depo Yangını: İtfaiye Ekipleri Hızla Müdahale Etti Haber365,browser_failed,https://news.google.com/rss/articles/CBMinwFBVV95cUxQeGF0VEloU0diZ2tJU1ZoNzZGQ2J0LXRnQVJWZDdKRTk4T29ZWFZ6NGc0XzM4ajRjalJrelZpcFNFLVRhMnVRUXRiTUhkOGZNYmU0Z1UtMWh1TWdNNVZoRVVBWEtRa2JPbHgtVlc2Mm02d1VnQ1ZINUpyMk9RemdyMk1keFJhSVFPZWNsM2RVY3haeEJNMHl5ZkJwMmRyb1XSAZ8BQVVfeXFMUHhhdFRJaFNHYmdrSVNWaDc2RkNidC10Z0FSVmQ3SkU5OE9vWVhWejRnNF8zOGo0Y2pSa3pWaXBTRS1UYTJ1UVF0Yk1IZDhmTWJlNGdVLTFodU1nTTVWaEVVQVhLUWtiT2x4LVZXNjJtNndVZ0NWSDVKcjJPUXpncjJNZHhSYUlRT2VjbDNkVWN4WnhCTTB5eWZCcDJkcm9V?oc=5&hl=tr&gl=TR&ceid=TR:tr,Şanlıurfa,,,,,,,ilçe yok | firma yok | faaliyet/tesis yok,,,,maps araması yapılmadı,,,68.22,5
2026-06-04 12:32:42,depo yangını,Fiziksel Risk / Yangın,Mobilya deposunda yangın paniği,Mobilya deposunda yangın paniği Gazette.com.tr,https://news.google.com/rss/articles/CBMigAFBVV95cUxOd3QxUi00WWlkbHdTZlkxMGx6TER4TnlNV1gzZVJITmREU2x0NUx2ODNIanpNdVpjckY1MTlJaFoySE94UW9ZbDNUVVB2VTFpclk5bUlSNGp6WjNjbDhjbVdDbm1Bc3FqUkRRUG9TYVpEdGRTVG9WSGpxdjd2SXgyWA?oc=5,depo,depo,Mobilya deposunda yangın paniği Gazette.com.tr,Mobilya deposunda yangın paniği Mobilya deposunda yangın paniği Gazette.com.tr Mobilya deposunda yangın paniği Gazette.com.tr,browser_failed,https://news.google.com/rss/articles/CBMigAFBVV95cUxOd3QxUi00WWlkbHdTZlkxMGx6TER4TnlNV1gzZVJITmREU2x0NUx2ODNIanpNdVpjckY1MTlJaFoySE94UW9ZbDNUVVB2VTFpclk5bUlSNGp6WjNjbDhjbVdDbm1Bc3FqUkRRUG9TYVpEdGRTVG9WSGpxdjd2SXgyWA?oc=5&hl=tr&gl=TR&ceid=TR:tr,,,,,,,,il yok | ilçe yok | firma yok | faaliyet/tesis yok,,,,maps araması yapılmadı,,,35.46,6
2026-06-04 18:42:00,depo yangını,Fiziksel Risk / Yangın,Kocaeli Karamürsel'de Yangın! Yumurta Deposu Kül Oldu,Kocaeli Karamürsel'de Yangın! Yumurta Deposu Kül Oldu politikam.com,https://news.google.com/rss/articles/CBMigwFBVV95cUxNdDJuWWxkbVphRVdiYTNWaERRQ2FmZkpFZXBLem14b2VYVEZMSlJWTU9SNlpNVVlvd0xWV2RTTFdTc2FRdi1DdHNlUlpucmV1ZzdKdjRBSk4zNi1abDFmSXM2T0FmNDJuUnJZNHdnQWFkR1JVY1F6bVhDYXAtYzdjQ3Rabw?oc=5,depo,depo,Kocaeli Karamürsel'de Yangın! Yumurta Deposu Kül Oldu politikam.com,Kocaeli Karamürsel'de Yangın! Yumurta Deposu Kül Oldu Kocaeli Karamürsel'de Yangın! Yumurta Deposu Kül Oldu politikam.com Kocaeli Karamürsel'de Yangın! Yumurta Deposu Kül Oldu politikam.com,browser_failed,https://news.google.com/rss/articles/CBMigwFBVV95cUxNdDJuWWxkbVphRVdiYTNWaERRQ2FmZkpFZXBLem14b2VYVEZMSlJWTU9SNlpNVVlvd0xWV2RTTFdTc2FRdi1DdHNlUlpucmV1ZzdKdjRBSk4zNi1abDFmSXM2T0FmNDJuUnJZNHdnQWFkR1JVY1F6bVhDYXAtYzdjQ3Rabw?oc=5&hl=tr&gl=TR&ceid=TR:tr,Kocaeli,Karamürsel,,,Yumurta Deposu,,,firma yok,Yumurta Deposu Karamürsel Kocaeli Türkiye,Birlik Yumurta | Başaran Yumurta,Birlik Yumurta,"firma adı yok, tesis/lokasyon ile maps tahmini var",66.66666666666666 | 66.66666666666666,KOCAELİ YALOVA CİVCİV TAVUK YARKA (Doğal Tavuk | Peynirci Baba Karamürsel | Karamursel Gida Kahvaltilik,145.92,7
