published,search_term,category,title,summary,link,matched_words,activity_type,raw_text,entity_source_text,article_fetch_status,resolved_article_url,city_candidates,district_candidates,neighborhood_candidates,street_candidates,facility_candidates,company_candidates,company_candidate_scores,entity_quality_note,maps_queries,maps_candidates,maps_best_guess,maps_status,maps_match_scores,maps_rejected_candidates,record_quality_score,duplicate_group_id
2026-06-30 08:55:00,MASAK raporu,Kara Para / MASAK / Bahis,Bakan Gürlek Duyurdu! MASAK Raporu Dev Vurgunu Ortaya Çıkardı! 5 Milyar TL'lik Kara Para Zinciri,Bakan Gürlek Duyurdu! MASAK Raporu Dev Vurgunu Ortaya Çıkardı! 5 Milyar TL'lik Kara Para Zinciri Gerçek Gündem,https://news.google.com/rss/articles/CBMi0AFBVV95cUxPNkhjYm1nbFdoREd6ZkJKcWNua0t3SlNBRVV1X1F5UFctTjZzYTdOQVpDNEszUVdRYUVBMDN2MXpEcVlkUEVrTC01ZmVGbnRZUERZQm9vRnctOVB5dFNlSmJWWkswcTFzTVJJN2VuZjlSZmhqbjNDSDhwbDhNNkMzNUc0QXQtV2xnV3RabEJRZllNLVlERzh6VDlTSGxtdEZHVGo4aHFHMEo5ZGhjTnJNTGt4LTI1WGp5ZWRPcjZkdVBCZ1pqNm10Q2x4Q2JxaGdX0gHWAUFVX3lxTFBGYTdDRDhpSENVTGw4WWhWQlNpdDFDdkVhUGxJeUJqdTJZY1BLMWpBUGFuV1lLVUFydUI3TDM3Y1I4MkFyOUI3cG44bmFRMjd2RTl0a0VVdUExUVhPWDg2OGZ0NVZubk85SU80cE9GNHJLTnA0TlNLb3NRMWt1RGp6UlNhbC1EWEFmY01lLUhkTlY3VW5RVktNSDBST2NhMi01ZHNzVlpJcEtMRGRtV1o4YS00djU5UzdVV25PYWl4Rnk0WGJna2F1MWRkdlpyWEZjdktDV3c?oc=5,masak,,"Gerçek Gündem Adalet Bakanı Akın Gürlek X hesabından yaptığı paylaşımda, ""Ankara Cumhuriyet Başsavcılığımızın koordinesinde; yeni nesil suç örgütlerine eleman temin ettiği, gençlerimizi suça itmeye çalıştığı ve çetelerle irtibatlı olduğu tespit edilen 117 şüpheliye yönelik kapsamlı bir operasyon başlatıldı"" ifadelerine yer verdi. Gerçek Gündem Bakan Gürlek Duyurdu! MASAK Raporu Dev Vurgunu Ortaya Çıkardı! 5 Milyar TL'lik Kara Para Zinciri Adalet Bakanı Akın Gürlek X hesabından yaptığı paylaşımda, ""Ankara Cumhuriyet Başsavcılığımızın koordinesinde; yeni nesil suç örgütlerine eleman temin ettiği, gençlerimizi suça itmeye çalıştığı ve çetelerle irtibatlı olduğu tespit edilen 117 şüpheliye yönelik kapsamlı bir operasyon başlatıldı"" ifadelerine yer verdi. 30 Haziran 2026 11:55 Son Güncelleme: 30 Haziran 2026 12:28 Yazıyı Paylaş: A + Yazı Boyutunu Büyüt A - Yazı Boyutunu Küçült Adalet Bakanı Akın Gürlek'in sosyal medya paylaşımı şu şekilde: Adalet Bakanı Akın Gürlek , sosyal medya hesabı X üzerinden yaptığı paylaşımda yeni nesil suç örgütlerine, sokak çetelerine ve organize suç yapılarına karşı mücadelenin kararlılıkla sürdüğünü ifade ederek, ""Sokaklarımızı çetelerden ve gençlerimizi bu karanlık yapıların ağından arındırmakta kararlıyız! Geçen hafta 81 ilimizdeki 175 Ağır Ceza Cumhuriyet Başsavcılığımıza gönderdiğimiz genelge ve cuma günü ülke çapında sokak çetelerine yönelik eş zamanlı gerçekleştirilen operasyonların ardından, bu sabah da Ankara ve Bakırköy Cumhuriyet Başsavcılıklarımızın koordinesinde iki önemli operasyon için düğmeye basıldı. Ankara Cumhuriyet Başsavcılığımızın koordinesinde; yeni nesil suç örgütlerine eleman temin ettiği, gençlerimizi suça itmeye çalıştığı ve çetelerle irtibatlı olduğu tespit edilen 117 şüpheliye yönelik kapsamlı bir operasyon başlatıldı"" dedi. Yeni nesil suç örgütlerine, sokak çetelerine ve organize suç yapılarına karşı mücadelemizi kararlılıkla sürdürüyoruz. Sokaklarımızı çetelerden ve gençlerimizi bu karanlık yapıların ağından arındırmakta kararlıyız! Geçen hafta 81 ilimizdeki 175 Ağır Ceza Cumhuriyet… — Akın Gürlek (@abakingurlek) June 30, 2026 Gürlek paylaşımında, Bakırköy Cumhuriyet Başsavcılığının titizlikle yürüttüğü soruşturma kapsamında ise yeni nesil bir suç örgütünün yasa dışı bahis gelirlerini elektronik para kuruluşları ve kripto varlıklar üzerinden soğuk cüzdanlara aktararak akladığının tespit edildiğini ifade etti. MASAK raporlarıyla 5 milyar 66 milyon lirayı bulan kara para trafiğini yönettiği anlaşılan 28 şüpheli hakkında İstanbul merkezli olmak üzere Ankara, Sivas, Diyarbakır ve Batman'da arama ve gözaltı işlemleri için harekete geçildiğini vurgulayan Gürlek, ""Çetelerin sadece sokaktaki tetikçilerini değil, finansal şah damarlarını da kökünden kesiyoruz! Milletimizin huzurunu bozan, haksız kazançla vatandaşlarımızı mağdur eden ve gençlerimizi suça sürükleyen kim varsa hukukun sınırları içinde takipçisi olmaya devam ediyoruz"" paylaşımında bulundu. Kaynak: İHA Et","Bakan Gürlek Duyurdu! MASAK Raporu Dev Vurgunu Ortaya Çıkardı! 5 Milyar TL'lik Kara Para Zinciri Bakan Gürlek Duyurdu! MASAK Raporu Dev Vurgunu Ortaya Çıkardı! 5 Milyar TL'lik Kara Para Zinciri Gerçek Gündem Gerçek Gündem Adalet Bakanı Akın Gürlek X hesabından yaptığı paylaşımda, ""Ankara Cumhuriyet Başsavcılığımızın koordinesinde; yeni nesil suç örgütlerine eleman temin ettiği, gençlerimizi suça itmeye çalıştığı ve çetelerle irtibatlı olduğu tespit edilen 117 şüpheliye yönelik kapsamlı bir operasyon başlatıldı"" ifadelerine yer verdi. Gerçek Gündem Bakan Gürlek Duyurdu! MASAK Raporu Dev Vurgunu Ortaya Çıkardı! 5 Milyar TL'lik Kara Para Zinciri Adalet Bakanı Akın Gürlek X hesabından yaptığı paylaşımda, ""Ankara Cumhuriyet Başsavcılığımızın koordinesinde; yeni nesil suç örgütlerine eleman temin ettiği, gençlerimizi suça itmeye çalıştığı ve çetelerle irtibatlı olduğu tespit edilen 117 şüpheliye yönelik kapsamlı bir operasyon başlatıldı"" ifadelerine yer verdi.",browser_full_article,https://www.gercekgundem.com/guncel/bakan-gurlek-duyurdu-5-milyar-tllik-kara-para-agina-dev-operasyon-145-supheli-hakkinda-islem-574115,,,,,,,,il yok | ilçe yok | firma yok | faaliyet/tesis yok,,,,maps araması yapılmadı,,,106.5,7
2026-06-30 05:39:06,MASAK,Kara Para / MASAK / Bahis,"9 ilde yasa dışı bahis ve kara para aklama operasyonu: 32 şirkete el konuldu, 37 şüpheli yakalandı","9 ilde yasa dışı bahis ve kara para aklama operasyonu: 32 şirkete el konuldu, 37 şüpheli yakalandı Takvim",https://news.google.com/rss/articles/CBMiuwFBVV95cUxON0NSMzB1ZDlJRFpDYmlweE9hRm9HYTNGSzg1dWh5MDZMaEo5cFZ3dlpHcUxRVjc0am9EcXl4RVRqN1ZkM2VIVDZSdjgycHdta0wtQzBHWlVUVE43d3VhRmF5WGhaYzhFdWo3MHMyZUhZRmRFVGRkMGFLdjhHcVVGTERDdkFHX1lBdkVIUmNvQnJOMFJxY0IwRERZUnAxZ3lQeDdNV05pYTZOcS1vVGd2Vy1lZG03Z04zMmJz?oc=5,"el konuldu, şirket",şirket / firma,"İstanbul merkezli 9 ilde, yasa dışı bahis ve kumar şebekelerine yönelik Cumhuriyet tarihinin en büyük mali operasyonlarından birine imza atıldı. İstanbul Emniyet Müdürlüğü Mali Suçlarla Mücadele Şube Müdürlüğü ekiplerinin, İstanbul Cumhuriyet Başsavcılığı koordinesinde yürüttüğü titiz çalışmalar sonucunda devasa bir kara para aklama ağı çökertildi. İstanbul merkezli 9 ilde, yasa dışı bahis ve kumar şebekelerine yönelik Cumhuriyet tarihinin en büyük mali operasyonlarından birine imza atıldı. İstanbul Emniyet Müdürlüğü Mali Suçlarla Mücadele Şube Müdürlüğü ekiplerinin, İstanbul Cumhuriyet Başsavcılığı koordinesinde yürüttüğü titiz çalışmalar sonucunda devasa bir kara para aklama ağı çökertildi. İstanbul merkezli 9 ilde, yasa dışı bahis ve kumar şebekelerine yönelik Cumhuriyet tarihinin en büyük mali operasyonlarından birine imza atıldı. İstanbul Emniyet Müdürlüğü Mali Suçlarla Mücadele Şube Müdürlüğü ekiplerinin, İstanbul Cumhuriyet Başsavcılığı koordinesinde yürüttüğü titiz çalışmalar sonucunda devasa bir kara para aklama ağı çökertildi. İstanbul merkezli 9 ilde yasa dışı bahis ve kara para aklama operasyonu Giriş Tarihi: 30 Haziran 2026 08:39 Güncelleme Tarihi: 30 Haziran 2026 08:40 Facebook X NSosyal Linki Kopyala Yazı Boyutu İstanbul merkezli 9 ilde, yasa dışı bahis ve kumar şebekelerine yönelik Cumhuriyet tarihinin en büyük mali operasyonlarından birine imza atıldı. İstanbul Emniyet Müdürlüğü Mali Suçlarla Mücadele Şube Müdürlüğü ekiplerinin, İstanbul Cumhuriyet Başsavcılığı koordinesinde yürüttüğü titiz çalışmalar sonucunda devasa bir kara para aklama ağı çökertildi. MASAK Raporları Korkunç Vurgunu Ortaya Çıkardı Mali Suçları Araştırma Kurulu (MASAK) tarafından hazırlanan ayrıntılı mali analiz raporları, şüpheli banka hareketleri ile aylarca süren teknik ve fiziki takip, organize suç ağını deşifre etti. Yasa dışı bahis ve kumardan elde edilen milyarlarca liralık suç gelirinin, paravan şirketler üzerinden finansal sisteme sokulduğu, aklandığı ve ardından yurt dışına transfer edildiği belirlendi. Yapılan incelemelerde, birbiriyle yoğun para trafiği içinde olan paravan şirketlerin toplam işlem hacminin yaklaşık 30 milyar TL'ye ulaştığı saptandı. Bu devasa rakamın, şirketlerin beyan ettiği resmi ticari faaliyetlerle hiçbir şekilde uyuşmadığı netlik kazandı. 9 İlde Eş Zamanlı Baskın: Şirketlere ve Lüks Araçlara El Konuldu Düğmeye basan emniyet güçleri; İstanbul merkezli olmak üzere Ankara, Gaziantep, Hatay, İzmir, Kilis, Kırklareli, Kocaeli ve Tokat illerinde belirlenen adreslere eş zamanlı baskınlar düzenledi. Operasyon kapsamında 37 şüpheli kıskıvrak yakalanarak gözaltına alındı. Suçtan elde edilen mal varlıklarının gasp edilmesini önlemek amacıyla mahkeme kararıyla adli tedbir uygulandı. Şebekeye ait; 32 şirkete , 19 konut ve 1 iş yerine , 9 arsaya , 31 lüks motorlu araca resmen el konuldu. Gözaltına alınan 37 şüphelinin emniyetteki sorgu ve işlemlerinin çok yönlü olarak devam ettiği bildirildi. Hasan Demir Takvim.com.tr Haber MASAK Raporları Korkunç Vurgunu Ortaya Çıkardı Mali Suçları Araştırma Kurulu (MASAK) tarafından hazırlanan ayrıntılı mali analiz raporları, şüpheli banka hareketleri ile aylarca süren teknik ve fiziki takip, organize suç ağını deşifre etti. Yasa dışı bahis ve kumardan elde edilen milyarlarca liralık suç gelirinin, paravan şirketler üzerinden finansal sisteme sokulduğu, aklandığı ve ardından yurt dışına transfer edildiği belirlendi. Yapılan incelemelerde, birbiriyle yoğun para trafiği içinde olan paravan şirketlerin toplam işlem hacminin yaklaşık 30 milyar TL'ye ulaştığı saptandı. Bu devasa rakamın, şirketlerin beyan ettiği resmi ticari faaliyetlerle hiçbir şekilde uyuşmadığı netlik kazandı. 9 İlde Eş Zamanlı Baskın: Şirketlere ve Lüks Araçlara El Konuldu Düğmeye basan emniyet güçleri; İstanbul merkezli olmak üzere Ankara, Gaziantep, Hatay, İzmir, Kilis, Kırklareli, Kocaeli ve Tokat illerinde belirlenen adreslere eş zamanlı baskınlar düzenledi. Operasyon kapsamında 37 şüpheli kıskıvrak yakalanarak gözaltına alındı. Suçtan elde edilen mal varlıklarının gasp edilmesini önlemek amacıyla mahkeme kararıyla adli tedbir uygulandı. Şebekeye ait; 32 şirkete , 19 konut ve 1 iş yerine , 9 arsaya , 31 lüks motorlu araca resmen el konuldu. Gözaltına alınan 37 şüphelinin emniyetteki sorgu ve işlemlerinin çok yönlü olarak devam ettiği bildirildi. Suruç'ta patlama anı kamerada: 2 çocuk yaralandı 30.06.2026 Salı Batman'da mezrada silahlı kavga: 4 kişi yaralandı 30.06.2026 Salı Hastane müdürünün personele şiddeti kameralarda: Valilik geniş çaplı inceleme başlattı 30.06.2026 Salı Eskişehir'de 5 kişiyi bıçaklayan Arda Küçükyetim cezaevinde intihar etti 30.06.2026 Salı İstanbul merkezli 9 ilde yasa dışı bahis ve kara para aklama operasyonu İstanbul merkezli 9 ilde, yasa dışı bahis ve kumar şebekelerine yönelik Cumhuriyet tarihinin en büyük mali operasyonlarından birine imza atıldı. İstanbul Emniyet Müdürlüğü Mali Suçlarla Mücadele Şube Müdürlüğü ekiplerinin, İstanbul Cumhuriyet Başsavcılığı koordinesinde yürüttüğü titiz çalışmalar sonucunda devasa bir kara para aklama ağı çökertildi. MASAK Raporları Korkunç Vurgunu Ortaya Çıkardı Mali Suçları Araştırma Kurulu (MASAK) tarafından hazırlanan ayrıntılı mali analiz raporları, şüpheli banka hareketleri ile aylarca süren teknik ve fiziki takip, organize suç ağını deşifre etti. Yasa dışı bahis ve kumardan elde edilen milyarlarca liralık suç gelirinin, paravan şirketler üzerinden finansal sisteme sokulduğu, aklandığı ve ardından yurt dışına transfer edildiği belirlendi. Yapılan incelemelerde, birbiriyle yoğun para trafiği içinde olan paravan şirketlerin toplam işlem hacminin yaklaşık 30 milyar TL'ye ulaştığı saptandı. Bu devasa rakamın, şirketlerin beyan ettiği resmi ticari faaliyetlerle hiçbir şekilde uyuşmadığı netlik kazandı. 9 İlde Eş Zamanlı Baskın: Şirketlere ve Lüks Araçlara El Konuldu Düğmeye basan emniyet güçleri; İstanbul merkezli olmak üzere Ankara, Gaziantep, Hatay, İzmir, Kilis, Kırklareli, Kocaeli ve Tokat illerinde belirlenen adreslere eş zamanlı baskınlar düzenledi. Operasyon kapsamında 37 şüpheli kıskıvrak yakalanarak gözaltına alındı. Suçtan elde edilen mal varlıklarının gasp edilmesini önlemek amacıyla mahkeme kararıyla adli tedbir uygulandı. Şebekeye ait; 19 konut ve 1 iş yerine , 31 lüks motorlu araca resmen el konuldu. Gözaltına alınan 37 şüphelinin emniyetteki sorgu ve işlemlerinin çok yönlü olarak devam ettiği bildirildi.","9 ilde yasa dışı bahis ve kara para aklama operasyonu: 32 şirkete el konuldu, 37 şüpheli yakalandı 9 ilde yasa dışı bahis ve kara para aklama operasyonu: 32 şirkete el konuldu, 37 şüpheli yakalandı Takvim İstanbul merkezli 9 ilde, yasa dışı bahis ve kumar şebekelerine yönelik Cumhuriyet tarihinin en büyük mali operasyonlarından birine imza atıldı. İstanbul Emniyet Müdürlüğü Mali Suçlarla Mücadele Şube Müdürlüğü ekiplerinin, İstanbul Cumhuriyet Başsavcılığı koordinesinde yürüttüğü titiz çalışmalar sonucunda devasa bir kara para aklama ağı çökertildi. İstanbul merkezli 9 ilde yasa dışı bahis ve kara para aklama operasyonu Giriş Tarihi: 30 Haziran 2026 08:39 Güncelleme Tarihi: 30 Haziran 2026 08:40 Facebook X NSosyal Linki Kopyala Yazı Boyutu İstanbul merkezli 9 ilde, yasa dışı bahis ve kumar şebekelerine yönelik Cumhuriyet tarihinin en büyük mali operasyonlarından birine imza atıldı. MASAK Raporları Korkunç Vurgunu Ortaya Çıkardı Mali Suçları Araştırma Kurulu (MASAK) tarafından hazırlanan ayrıntılı mali analiz raporları, şüpheli banka hareketleri ile aylarca süren teknik ve fiziki takip, organize suç ağını deşifre etti. Yasa dışı bahis ve kumardan elde edilen milyarlarca liralık suç gelirinin, paravan şirketler üzerinden finansal sisteme sokulduğu, aklandığı ve ardından yurt dışına transfer edildiği belirlendi. Yapılan incelemelerde, birbiriyle yoğun para trafiği içinde olan paravan şirketlerin toplam işlem hacminin yaklaşık 30 milyar TL'ye ulaştığı saptandı. Bu devasa rakamın, şirketlerin beyan ettiği resmi ticari faaliyetlerle hiçbir şekilde uyuşmadığı netlik kazandı. 9 İlde Eş Zamanlı Baskın: Şirketlere ve Lüks Araçlara El Konuldu Düğmeye basan emniyet güçleri; İstanbul merkezli olmak üzere Ankara, Gaziantep, Hatay, İzmir, Kilis, Kırklareli, Kocaeli ve Tokat illerinde belirlenen adreslere eş zamanlı baskınlar düzenledi. Operasyon kapsamında 37 şüpheli kıskıvrak yakalanarak gözaltına alındı. Şebekeye ait; 32 şirkete , 19 konut ve 1 iş yerine , 9 arsaya , 31 lüks motorlu araca resmen el konuldu. Hasan Demir Takvim.com.tr Haber MASAK Raporları Korkunç Vurgunu Ortaya Çıkardı Mali Suçları Araştırma Kurulu (MASAK) tarafından hazırlanan ayrıntılı mali analiz raporları, şüpheli banka hareketleri ile aylarca süren teknik ve fiziki takip, organize suç ağını deşifre etti. Suruç'ta patlama anı kamerada: 2 çocuk yaralandı 30.06.2026 Salı Batman'da mezrada silahlı kavga: 4 kişi yaralandı 30.06.2026 Salı Hastane müdürünün personele şiddeti kameralarda: Valilik geniş çaplı inceleme başlattı 30.06.2026 Salı Eskişehir'de 5 kişiyi bıçaklayan Arda Küçükyetim cezaevinde intihar etti 30.06.2026 Salı İstanbul merkezli 9 ilde yasa dışı bahis ve kara para aklama operasyonu İstanbul merkezli 9 ilde, yasa dışı bahis ve kumar şebekelerine yönelik Cumhuriyet tarihinin en büyük mali operasyonlarından birine imza atıldı. Şebekeye ait; 19 konut ve 1 iş yerine , 31 lüks motorlu araca resmen el konuldu.",browser_full_article,https://www.takvim.com.tr/video/haber-videolari/istanbul-merkezli-9-ilde-yasa-disi-bahis-ve-kara-para-aklama-operasyonu,Batman | Eskişehir | İstanbul | Şanlıurfa,Suruç,,,,,,firma yok | faaliyet/tesis yok,,,,maps araması yapılmadı,,,134.25,8
2026-06-29 13:45:37,depo yangını,Fiziksel Risk / Yangın,Bornova’da market depo yangını kontrol altına alındı,Bornova’da market depo yangını kontrol altına alındı urfadabugun.com,https://news.google.com/rss/articles/CBMiowFBVV95cUxObndsSTJhbzAyLWxHU3ZzOVZyV1NnYl9rTFpRQWxBVEZMMkV6ZFJ0VlRuRHVuQnhLdEM0RnR0cFVDMEp1MjI1UjJCSEFTcG9MTFh4TTJDSEhZOWpEelhuNVB3c3BmZnMybkkyRHNwODdfMEVUSm8yU3d2LTlZbTBnRWh3V1g5T2s3QU9UeWlZb3pIRmJBR0E5c2ZtRmFqTDZFZVkw?oc=5,depo,depo,"İzmir’in Bornova ilçesi Yeşilova Mahallesi’nde bir binanın zemin katında faaliyet gösteren marketin depo bölümünde yangın çıktı. Saat 13.30 sıralarında başlayan yangın, çalışanların ihbarı üzerine olay yerine sevk edilen İzmir Büyükşehir Belediyesi İtfaiye Daire Başkanlığı ekiplerince müdahale edilerek kontrol altına alındı. Yangına 2 tonaj araç, 1 merdivenli araç ve 3 arazözle müdahale edilirken, ekiplerin deponun duvarını kırarak içeri girdiği ve alevleri kısa sürede söndürdüğü bildirildi. Olayda can kaybı ya da yaralanma yaşanmazken, yangının binaya sıçramadan kontrol altına alınmasıyla olası bir facianın önüne geçildi. Hibya Haber Ajansı Bornova’da market depo yangını kontrol altına alındı İzmir’in Bornova ilçesinde bir marketin depo bölümünde çıkan yangın, itfaiye ekiplerinin müdahalesiyle binaya sıçramadan söndürüldü. GÜNCEL - 29-06-2026 16:29 İzmir’in Bornova ilçesi Yeşilova Mahallesi’nde bir binanın zemin katında faaliyet gösteren marketin depo bölümünde yangın çıktı. Saat 13.30 sıralarında başlayan yangın, çalışanların ihbarı üzerine olay yerine sevk edilen İzmir Büyükşehir Belediyesi İtfaiye Daire Başkanlığı ekiplerince müdahale edilerek kontrol altına alındı. Yangına 2 tonaj araç, 1 merdivenli araç ve 3 arazözle müdahale edilirken, ekiplerin deponun duvarını kırarak içeri girdiği ve alevleri kısa sürede söndürdüğü bildirildi. Olayda can kaybı ya da yaralanma yaşanmazken, yangının binaya sıçramadan kontrol altına alınmasıyla olası bir facianın önüne geçildi. Hibya Haber Ajansı Bornova’da market depo yangını kontrol altına alındı GÜNCEL - 29-06-2026 16:29 İzmir’in Bornova ilçesi Yeşilova Mahallesi’nde bir binanın zemin katında faaliyet gösteren marketin depo bölümünde yangın çıktı. Saat 13.30 sıralarında başlayan yangın, çalışanların ihbarı üzerine olay yerine sevk edilen İzmir Büyükşehir Belediyesi İtfaiye Daire Başkanlığı ekiplerince müdahale edilerek kontrol altına alındı. Yangına 2 tonaj araç, 1 merdivenli araç ve 3 arazözle müdahale edilirken, ekiplerin deponun duvarını kırarak içeri girdiği ve alevleri kısa sürede söndürdüğü bildirildi. Olayda can kaybı ya da yaralanma yaşanmazken, yangının binaya sıçramadan kontrol altına alınmasıyla olası bir facianın önüne geçildi.","Bornova’da market depo yangını kontrol altına alındı Bornova’da market depo yangını kontrol altına alındı urfadabugun.com İzmir’in Bornova ilçesi Yeşilova Mahallesi’nde bir binanın zemin katında faaliyet gösteren marketin depo bölümünde yangın çıktı. Saat 13.30 sıralarında başlayan yangın, çalışanların ihbarı üzerine olay yerine sevk edilen İzmir Büyükşehir Belediyesi İtfaiye Daire Başkanlığı ekiplerince müdahale edilerek kontrol altına alındı. Yangına 2 tonaj araç, 1 merdivenli araç ve 3 arazözle müdahale edilirken, ekiplerin deponun duvarını kırarak içeri girdiği ve alevleri kısa sürede söndürdüğü bildirildi. Olayda can kaybı ya da yaralanma yaşanmazken, yangının binaya sıçramadan kontrol altına alınmasıyla olası bir facianın önüne geçildi. Hibya Haber Ajansı Bornova’da market depo yangını kontrol altına alındı İzmir’in Bornova ilçesinde bir marketin depo bölümünde çıkan yangın, itfaiye ekiplerinin müdahalesiyle binaya sıçramadan söndürüldü. GÜNCEL - 29-06-2026 16:29 İzmir’in Bornova ilçesi Yeşilova Mahallesi’nde bir binanın zemin katında faaliyet gösteren marketin depo bölümünde yangın çıktı. Hibya Haber Ajansı Bornova’da market depo yangını kontrol altına alındı GÜNCEL - 29-06-2026 16:29 İzmir’in Bornova ilçesi Yeşilova Mahallesi’nde bir binanın zemin katında faaliyet gösteren marketin depo bölümünde yangın çıktı.",browser_full_article_dom,https://news.google.com/rss/articles/CBMiowFBVV95cUxObndsSTJhbzAyLWxHU3ZzOVZyV1NnYl9rTFpRQWxBVEZMMkV6ZFJ0VlRuRHVuQnhLdEM0RnR0cFVDMEp1MjI1UjJCSEFTcG9MTFh4TTJDSEhZOWpEelhuNVB3c3BmZnMybkkyRHNwODdfMEVUSm8yU3d2LTlZbTBnRWh3V1g5T2s3QU9UeWlZb3pIRmJBR0E5c2ZtRmFqTDZFZVkw?oc=5&hl=tr&gl=TR&ceid=TR:tr,İzmir | Burdur,Yeşilova | Bornova,in Bornova ilçesi Yeşilova Mahallesi,,,,,firma yok | faaliyet/tesis yok,,,,maps araması yapılmadı,,,116.0,9
