published,search_term,category,title,summary,link,matched_words,activity_type,raw_text,entity_source_text,article_fetch_status,resolved_article_url,city_candidates,district_candidates,neighborhood_candidates,street_candidates,facility_candidates,company_candidates,company_candidate_scores,entity_quality_note,maps_queries,maps_candidates,maps_best_guess,maps_status,maps_match_scores,maps_rejected_candidates,record_quality_score,duplicate_group_id
2026-06-30 10:00:02,üretim tesisi yangını,Fiziksel Risk / Yangın,Sanayi yangınlarında patlama yaşanıyor,Sanayi yangınlarında patlama yaşanıyor Kadırga TV,https://news.google.com/rss/articles/CBMihAFBVV95cUxOa2Q2VmV4c3VqdTJUbnNsak00QjlORldLdy1Pd1dOSVlMSG1XQmtvcWlWY1pLWTdWNmpyS1FWbW1WOWpvN1oxVlJKQnowUkFDOEF3ZDZJZF9sczRyOUhfUlBCd2xFd1VQNmNvMjRudElPWVlud0dFekF5RW5leFdsc3FiN2Y?oc=5,sanayi,,"2025 yılında İstanbul’da 323, Kocaeli’nde 100 sanayi yangını yaşanırken, ülke genelinde bu sayı yılın tamamında atölyelerle birlikte 3 bini aştı. Temmuz ve Ağustos aylarında artan kavurucu sıcaklar ile tatil dönemi kaynaklı personel eksikliği, fabrikaları daha da açık hedef haline getiriyor. 2025 yılında İstanbul’da 323, Kocaeli’nde 100 sanayi yangını yaşanırken, ülke genelinde bu sayı yılın tamamında atölyelerle birlikte 3 bini aştı. Temmuz ve Ağustos aylarında artan kavurucu sıcaklar ile tatil dönemi kaynaklı personel eksikliği, fabrikaları daha da açık hedef haline getiriyor. Sanayi yangınlarında patlama yaşanıyor 2025 yılında İstanbul'da 323, Kocaeli'nde 100 sanayi yangını yaşanırken, ülke genelinde bu sayı yılın tamamında atölyelerle birlikte 3 bini aştı. Temmuz ve Ağustos aylarında artan kavurucu sıcaklar ile tatil dönemi kaynaklı personel eksikliği, fabrikaları daha da açık hedef haline getiriyor. 30.06.2026 08:05 Sanayi yangınlarında patlama yaşanıyor","Sanayi yangınlarında patlama yaşanıyor Sanayi yangınlarında patlama yaşanıyor Kadırga TV 2025 yılında İstanbul’da 323, Kocaeli’nde 100 sanayi yangını yaşanırken, ülke genelinde bu sayı yılın tamamında atölyelerle birlikte 3 bini aştı. Temmuz ve Ağustos aylarında artan kavurucu sıcaklar ile tatil dönemi kaynaklı personel eksikliği, fabrikaları daha da açık hedef haline getiriyor. Sanayi yangınlarında patlama yaşanıyor 2025 yılında İstanbul'da 323, Kocaeli'nde 100 sanayi yangını yaşanırken, ülke genelinde bu sayı yılın tamamında atölyelerle birlikte 3 bini aştı. 30.06.2026 08:05 Sanayi yangınlarında patlama yaşanıyor",browser_full_article,https://www.kadirga.com.tr/sanayi-yanginlarinda-patlama-yasaniyor-H1909415.htm,İstanbul,,,,,,,ilçe yok | firma yok | faaliyet/tesis yok,,,,maps araması yapılmadı,,,58.98,1
2026-06-30 09:14:02,tesis yangını,Fiziksel Risk / Yangın,SEDAŞ’tan Enerji Nakil Hatlarında Orman Yangını Önlemleri,SEDAŞ’tan Enerji Nakil Hatlarında Orman Yangını Önlemleri Kocaeli Kent Gazetesi,https://news.google.com/rss/articles/CBMikwFBVV95cUxNTUdmTGREaEM4MDE1ZmtQXzdCbzY0TGY3NVJjVUpqc05XU1lBWkUtRUZJUE5uclJKQ1NBMHUzMnBSa0JuTW56X2dwLUtGTTNzdzhvUUxKc05ZSFh6T2QtTXBRdzdBZ0ViOFZob2NuRXlHcndDNFNpVUozaEJYWEQ3cmVrY2hfeUdKUmJiV1JfaWFyNGM?oc=5,enerji,,SEDAŞ’tan Enerji Nakil Hatlarında Orman Yangını Önlemleri Kocaeli Kent Gazetesi,SEDAŞ’tan Enerji Nakil Hatlarında Orman Yangını Önlemleri SEDAŞ’tan Enerji Nakil Hatlarında Orman Yangını Önlemleri Kocaeli Kent Gazetesi SEDAŞ’tan Enerji Nakil Hatlarında Orman Yangını Önlemleri Kocaeli Kent Gazetesi,browser_failed,https://kocaelikentgazetesi.com/sedastan-enerji-nakil-hatlarinda-orman-yangini-onlemleri/,,,,,,,,il yok | ilçe yok | firma yok | faaliyet/tesis yok,,,,maps araması yapılmadı,,,57.04,2
2026-06-29 21:57:00,depo yangını,Fiziksel Risk / Yangın,Manavgat'ta depo olarak kullanılan serada yangın çıktı,Manavgat'ta depo olarak kullanılan serada yangın çıktı Evrensel.net,https://news.google.com/rss/articles/CBMilwFBVV95cUxNanpCZ0I5NnQ3aHkyUEJjcm1yaGc0ZWV6ekJpQkg0WnVxLW1fNFVVTWV0UlF3NEVmQTFiOVdOM3hybVNqbzRVM1MzQzJkdEFoOFhnaW5lYVljdFFDNkFOQ3dHaEFBd0M5dUhaZGlmVnRmSnVaWUNVRTFSMkFkN3VqM2pDMHo1N09kZEFKbzd0aEgwWG1MaTcw?oc=5,depo,depo,"Antalya'nın Manavgat ilçesinde depo olarak kullanılan serada çıkan yangında maddi zarar oluştu. 30.06.2026 00:57 Manavgat'ta depo olarak kullanılan serada yangın çıktı Antalya'nın Manavgat ilçesinde depo olarak kullanılan serada çıkan yangında maddi zarar oluştu. Fotoğraf: AA Antalya – Manavgat ilçesi Aşağı Işıklar Mahallesi Kaplan Koyağı mevkisinde, depo olarak kullanılan bir muz serasında henüz bilinmeyen sebeple yangın çıktı. İçerisinde motosiklet yedek parçaları ve yakıt bulunan seradaki alevler kısa sürede büyüdü. İhbar üzerine olay yerine Antalya Büyükşehir Belediyesi ve Manavgat Orman İşletme Müdürlüğüne bağlı 2 arazöz ve 1 su tankeri sevk edildi. Yanıcı maddelerin etkisiyle müdahalenin güçleştiği yangın, ekiplerin yoğun çalışması sonucu yaklaşık 2 saatte kontrol altına alındı. Söndürme çalışmalarının ardından sera ve içerisindeki malzemelerin tamamen yandığı ve maddi zarar oluştuğu görüldü. (AA) Evrensel'i, Google'da tercih edilen kaynak olarak ekleyin 29.06.2026 15:40 AB’den Ukraynalı erkekleri 'ölüme gönderme' düzenlemesi AB Komisyonunun düzenlemesine göre, ‘gerekli izne’ sahip olmayan Ukraynalı erkeklere oturum verilmeyecek. Düzenleme Ukraynalı erkekler için iltica hakkının askıya alınması demek. Halbuki Almanya anayasasına göre ‘vicdani ret’ bir insan hakkı. Fotoğraf: Pixabay Yücel Özdemir yucel@evrensel.de İçerik yükleniyor... Evrensel'i, Google'da tercih edilen kaynak olarak ekleyin 30.06.2026 00:57 Manavgat'ta depo olarak kullanılan serada yangın çıktı Antalya'nın Manavgat ilçesinde depo olarak kullanılan serada çıkan yangında maddi zarar oluştu. Fotoğraf: AA Antalya – Manavgat ilçesi Aşağı Işıklar Mahallesi Kaplan Koyağı mevkisinde, depo olarak kullanılan bir muz serasında henüz bilinmeyen sebeple yangın çıktı. İçerisinde motosiklet yedek parçaları ve yakıt bulunan seradaki alevler kısa sürede büyüdü. İhbar üzerine olay yerine Antalya Büyükşehir Belediyesi ve Manavgat Orman İşletme Müdürlüğüne bağlı 2 arazöz ve 1 su tankeri sevk edildi. Yanıcı maddelerin etkisiyle müdahalenin güçleştiği yangın, ekiplerin yoğun çalışması sonucu yaklaşık 2 saatte kontrol altına alındı. Söndürme çalışmalarının ardından sera ve içerisindeki malzemelerin tamamen yandığı ve maddi zarar oluştuğu görüldü. (AA) Evrensel'i, Google'da tercih edilen kaynak olarak ekleyin 29.06.2026 15:40 AB’den Ukraynalı erkekleri 'ölüme gönderme' düzenlemesi AB Komisyonunun düzenlemesine göre, ‘gerekli izne’ sahip olmayan Ukraynalı erkeklere oturum verilmeyecek. Düzenleme Ukraynalı erkekler için iltica hakkının askıya alınması demek. Halbuki Almanya anayasasına göre ‘vicdani ret’ bir insan hakkı. Fotoğraf: Pixabay Yücel Özdemir yucel@evrensel.de İçerik yükleniyor... Evrensel'i, Google'da tercih edilen kaynak olarak ekleyin 29.06.2026 22:26 / Güncelleme: 22:52 Selahattin Demirtaş'tan komedyen Deniz Göktaş’a mektup: 'Koltuğuma göz dikmeni takdirle karşıladım' Tutuklu eski HDP Genel Başkanı Selahattin Demirtaş hakkında soruşturma başlatılan komedyen Deniz Göktaş’a sosyal medyadan yayımladığı mektupla seslendi; ""Koltuğuma göz dikmeni takdirle karşıladım Fotoğraf: Selahattin Demirtaş'ın Twitter hesabından alınmıştır İçerik yükleniyor... (Haber Merkezi) Evrensel'i, Google'da tercih edilen kaynak olarak ekleyin 30.06.2026 00:48 TCDD'ye ait arazi ticaret alanına çevrilmek isteniyor | BTS İzmir Şubesi: Demiryolları ranta teslim edilemez Konak ilçesi Kuruçay Mahallesi’nde TCDD'ye ait yaklaşık 10,6 dönümlük stratejik arazinin ticaret alanına çevrilmek istenmesine tepki gösteren BTS İzmir Şubesi; “Demiryolları ranta teslim edilemez” dedi. Fotoğraf: BTS İzmir Şube İçerik yükleniyor... (Evrensel) Evrensel'i, Google'da tercih edilen kaynak olarak ekleyin 29.06.2026 23:13 Sokakta 5 kişiyi bıçaklayıp 75 yıl ceza almıştı: Cezaevinde intihar etti Eskişehir'de sokakta karşılaştığı 5 kişiyi bıçakla yaralayıp 75 yıl 5 ay hapis cezasına çarptırılan Arda Küçükyetim'in cezaevinde intihar ettiği bildirildi. Fotoğraf: DHA İçerik yükleniyor... (DHA) Evrensel'i, Google'da tercih edilen kaynak olarak ekleyin 29.06.2026 15:15 Vedat Muriqi'den Fenerbahçe'yi üzen haber: Antrenmanda sakatlandı Fenerbahçe'nin yeni transferi Vedat Muriqi, antrenmanda yaşadığı adale ağrısı nedeniyle çalışmayı yarıda bıraktı. Futbolcunun durumu yapılacak kontrollerin ardından belli olacak. Fotoğraf: Fenerbahçe&nbsp; İçerik yükleniyor... (Spor Servisi) Evrensel'i, Google'da tercih edilen kaynak olarak ekleyin Antalya'nın Manavgat ilçesinde depo olarak kullanılan serada çıkan yangında maddi zarar oluştu. Fotoğraf: AA Antalya – Manavgat ilçesi Aşağı Işıklar Mahallesi Kaplan Koyağı mevkisinde, depo olarak kullanılan bir muz serasında henüz bilinmeyen sebeple yangın çıktı. İçerisinde motosiklet yedek parçaları ve yakıt bulunan seradaki alevler kısa sürede büyüdü. İhbar üzerine olay yerine Antalya Büyükşehir Belediyesi ve Manavgat Orman İşletme Müdürlüğüne bağlı 2 arazöz ve 1 su tankeri sevk edildi. Yanıcı maddelerin etkisiyle müdahalenin güçleştiği yangın, ekiplerin yoğun çalışması sonucu yaklaşık 2 saatte kontrol altına alındı. Söndürme çalışmalarının ardından sera ve içerisindeki malzemelerin tamamen yandığı ve maddi zarar oluştuğu görüldü. (AA) Evrensel'i, Google'da tercih edilen kaynak olarak ekleyin AB Komisyonunun düzenlemesine göre, ‘gerekli izne’ sahip olmayan Ukraynalı erkeklere oturum verilmeyecek. Düzenleme Ukraynalı erkekler için iltica hakkının askıya alınması demek. Halbuki Almanya anayasasına göre ‘vicdani ret’ bir insan hakkı. Fotoğraf: Pixabay Tutuklu eski HDP Genel Başkanı Selahattin Demirtaş hakkında soruşturma başlatılan komedyen Deniz Göktaş’a sosyal medyadan yayımladığı mektupla seslendi; ""Koltuğuma göz dikmeni takdirle karşıladım Fotoğraf: Selahattin Demirtaş'ın Twitter hesabından alınmıştır Konak ilçesi Kuruçay Mahallesi’nde TCDD'ye ait yaklaşık 10,6 dönümlük stratejik arazinin ticaret alanına çevrilmek istenmesine tepki gösteren BTS İzmir Şubesi; “Demiryolları ranta teslim edilemez” dedi. Fotoğraf: BTS İzmir Şube Eskişehir'de sokakta karşılaştığı 5 kişiyi bıçakla yaralayıp 75 yıl 5 ay hapis cezasına çarptırılan Arda Küçükyetim'in cezaevinde intihar ettiği bildirildi. Fotoğraf: DHA Fenerbahçe'nin yeni transferi Vedat Muriqi, antrenmanda yaşadığı adale ağrısı nedeniyle çalışmayı yarıda bıraktı. Futbolcunun durumu yapılacak kontrollerin ardından belli olacak. Fotoğraf: Fenerbahçe&nbsp; Antalya – Manavgat ilçesi Aşağı Işıklar Mahallesi Kaplan Koyağı mevkisinde, depo olarak kullanılan bir muz serasında henüz bilinmeyen sebeple yangın çıktı. İçerisinde motosiklet yedek parçaları ve yakıt bulunan seradaki alevler kısa sürede büyüdü. İhbar üzerine olay yerine Antalya Büyükşehir Belediyesi ve Manavgat Orman İşletme Müdürlüğüne bağlı 2 arazöz ve 1 su tankeri sevk edildi. Yanıcı maddelerin etkisiyle müdahalenin güçleştiği yangın, ekiplerin yoğun çalışması sonucu yaklaşık 2 saatte kontrol altına alındı. Söndürme çalışmalarının ardından sera ve içerisindeki malzemelerin tamamen yandığı ve maddi zarar oluştuğu görüldü. (AA) Yücel Özdemir yucel@evrensel.de İçerik yükleniyor... İçerik yükleniyor... (Haber Merkezi) İçerik yükleniyor... (Evrensel) İçerik yükleniyor... (DHA) İçerik yükleniyor... (Spor Servisi) Manavgat'ta depo olarak kullanılan serada yangın çıktı Antalya'nın Manavgat ilçesinde depo olarak kullanılan serada çıkan yangında maddi zarar oluştu. AB’den Ukraynalı erkekleri 'ölüme gönderme' düzenlemesi AB Komisyonunun düzenlemesine göre, ‘gerekli izne’ sahip olmayan Ukraynalı erkeklere oturum verilmeyecek. Düzenleme Ukraynalı erkekler için iltica hakkının askıya alınması demek. Halbuki Almanya anayasasına göre ‘vicdani ret’ bir insan hakkı. Selahattin Demirtaş'tan komedyen Deniz Göktaş’a mektup: 'Koltuğuma göz dikmeni takdirle karşıladım' Tutuklu eski HDP Genel Başkanı Selahattin Demirtaş hakkında soruşturma başlatılan komedyen Deniz Göktaş’a sosyal medyadan yayımladığı mektupla seslendi; ""Koltuğuma göz dikmeni takdirle karşıladım TCDD'ye ait arazi ticaret alanına çevrilmek isteniyor | BTS İzmir Şubesi: Demiryolları ranta teslim edilemez Konak ilçesi Kuruçay Mahallesi’nde TCDD'ye ait yaklaşık 10,6 dönümlük stratejik arazinin ticaret alanına çevrilmek istenmesine tepki gösteren BTS İzmir Şubesi; “Demiryolları ranta teslim edilemez” dedi. Sokakta 5 kişiyi bıçaklayıp 75 yıl ceza almıştı: Cezaevinde intihar etti Eskişehir'de sokakta karşılaştığı 5 kişiyi bıçakla yaralayıp 75 yıl 5 ay hapis cezasına çarptırılan Arda Küçükyetim'in cezaevinde intihar ettiği bildirildi. Vedat Muriqi'den Fenerbahçe'yi üzen haber: Antrenmanda sakatlandı Fenerbahçe'nin yeni transferi Vedat Muriqi, antrenmanda yaşadığı adale ağrısı nedeniyle çalışmayı yarıda bıraktı. Futbolcunun durumu yapılacak kontrollerin ardından belli olacak. Antalya – Manavgat ilçesi Aşağı Işıklar Mahallesi Kaplan Koyağı mevkisinde, depo olarak kullanılan bir muz serasında henüz bilinmeyen sebeple yangın çıktı. İçerisinde motosiklet yedek parçaları ve yakıt bulunan seradaki alevler kısa sürede büyüdü. İhbar üzerine olay yerine Antalya Büyükşehir Belediyesi ve Manavgat Orman İşletme Müdürlüğüne bağlı 2 arazöz ve 1 su tankeri sevk edildi. Yanıcı maddelerin etkisiyle müdahalenin güçleştiği yangın, ekiplerin yoğun çalışması sonucu yaklaşık 2 saatte kontrol altına alındı. Söndürme çalışmalarının ardından sera ve içerisindeki malzemelerin tamamen yandığı ve maddi zarar oluştuğu görüldü. Yücel Özdemir yucel@evrensel.de Fotoğraf: Selahattin Demirtaş'ın Twitter hesabından alınmıştır Fotoğraf: Fenerbahçe&nbsp; Önemli haberlerden ve gelişmelerden haberdar olmak ister misiniz?","Manavgat'ta depo olarak kullanılan serada yangın çıktı Manavgat'ta depo olarak kullanılan serada yangın çıktı Evrensel.net Antalya'nın Manavgat ilçesinde depo olarak kullanılan serada çıkan yangında maddi zarar oluştu. 30.06.2026 00:57 Manavgat'ta depo olarak kullanılan serada yangın çıktı Antalya'nın Manavgat ilçesinde depo olarak kullanılan serada çıkan yangında maddi zarar oluştu. Fotoğraf: AA Antalya – Manavgat ilçesi Aşağı Işıklar Mahallesi Kaplan Koyağı mevkisinde, depo olarak kullanılan bir muz serasında henüz bilinmeyen sebeple yangın çıktı. İçerisinde motosiklet yedek parçaları ve yakıt bulunan seradaki alevler kısa sürede büyüdü. İhbar üzerine olay yerine Antalya Büyükşehir Belediyesi ve Manavgat Orman İşletme Müdürlüğüne bağlı 2 arazöz ve 1 su tankeri sevk edildi. Yanıcı maddelerin etkisiyle müdahalenin güçleştiği yangın, ekiplerin yoğun çalışması sonucu yaklaşık 2 saatte kontrol altına alındı. Söndürme çalışmalarının ardından sera ve içerisindeki malzemelerin tamamen yandığı ve maddi zarar oluştuğu görüldü. (AA) Evrensel'i, Google'da tercih edilen kaynak olarak ekleyin 29.06.2026 15:40 AB’den Ukraynalı erkekleri 'ölüme gönderme' düzenlemesi AB Komisyonunun düzenlemesine göre, ‘gerekli izne’ sahip olmayan Ukraynalı erkeklere oturum verilmeyecek. Düzenleme Ukraynalı erkekler için iltica hakkının askıya alınması demek. Halbuki Almanya anayasasına göre ‘vicdani ret’ bir insan hakkı. Fotoğraf: Pixabay Yücel Özdemir yucel@evrensel.de İçerik yükleniyor... Evrensel'i, Google'da tercih edilen kaynak olarak ekleyin 30.06.2026 00:57 Manavgat'ta depo olarak kullanılan serada yangın çıktı Antalya'nın Manavgat ilçesinde depo olarak kullanılan serada çıkan yangında maddi zarar oluştu. Evrensel'i, Google'da tercih edilen kaynak olarak ekleyin 29.06.2026 22:26 / Güncelleme: 22:52 Selahattin Demirtaş'tan komedyen Deniz Göktaş’a mektup: 'Koltuğuma göz dikmeni takdirle karşıladım' Tutuklu eski HDP Genel Başkanı Selahattin Demirtaş hakkında soruşturma başlatılan komedyen Deniz Göktaş’a sosyal medyadan yayımladığı mektupla seslendi; ""Koltuğuma göz dikmeni takdirle karşıladım Fotoğraf: Selahattin Demirtaş'ın Twitter hesabından alınmıştır İçerik yükleniyor... (Haber Merkezi) Evrensel'i, Google'da tercih edilen kaynak olarak ekleyin 30.06.2026 00:48 TCDD'ye ait arazi ticaret alanına çevrilmek isteniyor | BTS İzmir Şubesi: Demiryolları ranta teslim edilemez Konak ilçesi Kuruçay Mahallesi’nde TCDD'ye ait yaklaşık 10,6 dönümlük stratejik arazinin ticaret alanına çevrilmek istenmesine tepki gösteren BTS İzmir Şubesi; “Demiryolları ranta teslim edilemez” dedi. Fotoğraf: BTS İzmir Şube İçerik yükleniyor... (Evrensel) Evrensel'i, Google'da tercih edilen kaynak olarak ekleyin 29.06.2026 23:13 Sokakta 5 kişiyi bıçaklayıp 75 yıl ceza almıştı: Cezaevinde intihar etti Eskişehir'de sokakta karşılaştığı 5 kişiyi bıçakla yaralayıp 75 yıl 5 ay hapis cezasına çarptırılan Arda Küçükyetim'in cezaevinde intihar ettiği bildirildi. (DHA) Evrensel'i, Google'da tercih edilen kaynak olarak ekleyin 29.06.2026 15:15 Vedat Muriqi'den Fenerbahçe'yi üzen haber: Antrenmanda sakatlandı Fenerbahçe'nin yeni transferi Vedat Muriqi, antrenmanda yaşadığı adale ağrısı nedeniyle çalışmayı yarıda bıraktı. (Spor Servisi) Evrensel'i, Google'da tercih edilen kaynak olarak ekleyin Antalya'nın Manavgat ilçesinde depo olarak kullanılan serada çıkan yangında maddi zarar oluştu. Fotoğraf: Pixabay Tutuklu eski HDP Genel Başkanı Selahattin Demirtaş hakkında soruşturma başlatılan komedyen Deniz Göktaş’a sosyal medyadan yayımladığı mektupla seslendi; ""Koltuğuma göz dikmeni takdirle karşıladım Fotoğraf: Selahattin Demirtaş'ın Twitter hesabından alınmıştır Konak ilçesi Kuruçay Mahallesi’nde TCDD'ye ait yaklaşık 10,6 dönümlük stratejik arazinin ticaret alanına çevrilmek istenmesine tepki gösteren BTS İzmir Şubesi; “Demiryolları ranta teslim edilemez” dedi. Fotoğraf: BTS İzmir Şube Eskişehir'de sokakta karşılaştığı 5 kişiyi bıçakla yaralayıp 75 yıl 5 ay hapis cezasına çarptırılan Arda Küçükyetim'in cezaevinde intihar ettiği bildirildi. Fotoğraf: Fenerbahçe&nbsp; Antalya – Manavgat ilçesi Aşağı Işıklar Mahallesi Kaplan Koyağı mevkisinde, depo olarak kullanılan bir muz serasında henüz bilinmeyen sebeple yangın çıktı. (Spor Servisi) Manavgat'ta depo olarak kullanılan serada yangın çıktı Antalya'nın Manavgat ilçesinde depo olarak kullanılan serada çıkan yangında maddi zarar oluştu. Selahattin Demirtaş'tan komedyen Deniz Göktaş’a mektup: 'Koltuğuma göz dikmeni takdirle karşıladım' Tutuklu eski HDP Genel Başkanı Selahattin Demirtaş hakkında soruşturma başlatılan komedyen Deniz Göktaş’a sosyal medyadan yayımladığı mektupla seslendi; ""Koltuğuma göz dikmeni takdirle karşıladım TCDD'ye ait arazi ticaret alanına çevrilmek isteniyor | BTS İzmir Şubesi: Demiryolları ranta teslim edilemez Konak ilçesi Kuruçay Mahallesi’nde TCDD'ye ait yaklaşık 10,6 dönümlük stratejik arazinin ticaret alanına çevrilmek istenmesine tepki gösteren BTS İzmir Şubesi; “Demiryolları ranta teslim edilemez” dedi. Sokakta 5 kişiyi bıçaklayıp 75 yıl ceza almıştı: Cezaevinde intihar etti Eskişehir'de sokakta karşılaştığı 5 kişiyi bıçakla yaralayıp 75 yıl 5 ay hapis cezasına çarptırılan Arda Küçükyetim'in cezaevinde intihar ettiği bildirildi. Vedat Muriqi'den Fenerbahçe'yi üzen haber: Antrenmanda sakatlandı Fenerbahçe'nin yeni transferi Vedat Muriqi, antrenmanda yaşadığı adale ağrısı nedeniyle çalışmayı yarıda bıraktı. Antalya – Manavgat ilçesi Aşağı Işıklar Mahallesi Kaplan Koyağı mevkisinde, depo olarak kullanılan bir muz serasında henüz bilinmeyen sebeple yangın çıktı.",browser_full_article,https://www.evrensel.net/haber/5990374/manavgatta-depo-olarak-kullanilan-serada-yangin-cikti,Antalya | Eskişehir | Bursa | İzmir,Manavgat | Konak,Demirtaş | Manavgat ilçesi Aşağı Işıklar Mahallesi | edilemez Konak ilçesi Kuruçay Mahallesi | alınmıştır Konak ilçesi Kuruçay Mahallesi,,,,,firma yok | faaliyet/tesis yok,,,,maps araması yapılmadı,,,116.75,3
