published,search_term,category,title,summary,link,matched_words,activity_type,raw_text,entity_source_text,article_fetch_status,resolved_article_url,city_candidates,district_candidates,neighborhood_candidates,street_candidates,facility_candidates,company_candidates,company_candidate_scores,entity_quality_note,maps_queries,maps_candidates,maps_best_guess,maps_status,maps_match_scores,maps_rejected_candidates,record_quality_score,duplicate_group_id
2026-06-30 06:36:01,konkordato,İflas / Konkordato / Mali Sorun,Bursa'da 20 yıllık inşaat firmasının konkordato süresi uzatıldı! 2 aylık yeni karar...,Bursa'da 20 yıllık inşaat firmasının konkordato süresi uzatıldı! 2 aylık yeni karar... Bursa Hakimiyet,https://news.google.com/rss/articles/CBMiygFBVV95cUxNU25ISTdnVGwtTU0wSTJKbXFKejNqc3FsRlgzNktDamVweGxXTWxnSENjbVBrOXhBZVVNaEtYNUgyWDBia0xETjhRTERwZmdZTl84TGo0SHNwR0ptdDlzajZvX2pEeGdKczA0ejk3TGNkWURTQlY1QnladFByZWhXQzB6bjEyM2dxOEhEV0Nsai1NajFMTDEwVkpESmFnenQtOTRjLW9LRGxnZlpway1mOERzQTM0eWJIdWlpLTJjNEJCTTlCVWUzOGRn?oc=5,"firma, inşaat",şirket / firma,"Bursa'da 20 yıldır faaliyet gösteren inşaat firması hakkında konkordato sürecinde yeni aşamaya geçildi. Mahkeme, şirket için geçici mühleti uzatırken mevcut koruma tedbirlerinin de yürürlükte kalmasına karar verdi. Bursa'da 20 yıllık inşaat firmasının konkordato süresi uzatıldı! 2 aylık yeni karar... Bursa'da 20 yıldır faaliyet gösteren inşaat firması hakkında konkordato sürecinde yeni aşamaya geçildi. Mahkeme, şirket için geçici mühleti uzatırken mevcut koruma tedbirlerinin de yürürlükte kalmasına karar verdi. Bursa'da faaliyet gösteren Diyaroğlu Yapı Proje Mühendislik İnşaat Limited Şirketi ile şirket ortağı Sinan Diyaroğlu'nun konkordato dosyasında yeni bir gelişme yaşandı. Bursa 1. Asliye Ticaret Mahkemesi, şirkete verilen geçici konkordato mühletini 2 ay daha uzatırken, koruma tedbirlerinin de devamına karar verdi. Bursa'da konkordato süreci devam eden firmalardan biri hakkında mahkemeden yeni karar çıktı. Bursa 1. Asliye Ticaret Mahkemesi, Diyaroğlu Yapı Proje Mühendislik İnşaat İnşaat Malzemeleri Isıtma Soğutma Makina Otomotiv Eğitim Tekstil Sanayi ve Ticaret Limited Şirketi ile şirket ortağı Sinan Diyaroğlu hakkında yürütülen konkordato davasında geçici mühlet süresini uzattı. Mahkemenin 2026/39 Esas sayılı dosyasında alınan karara göre, daha önce 1 Nisan 2026 tarihinde verilen 3 aylık geçici konkordato mühleti, 1 Temmuz 2026 tarihinden itibaren geçerli olmak üzere 2 ay daha uzatıldı. KORUMA TEDBİRLERİ YÜRÜRLÜKTE KALACAK Mahkeme kararına göre konkordato kapsamında daha önce uygulanan tüm koruma tedbirleri geçerliliğini sürdürecek. Buna göre Şirket aleyhine yeni icra takipleri başlatılamayacak. 6183 sayılı Kanun kapsamındaki kamu alacakları dahil olmak üzere takip işlemleri durdurulacak. İhtiyati haciz, ihtiyati tedbir ve muhafaza işlemleri uygulanamayacak. Ancak İcra ve İflas Kanunu'nun 206'ncı maddesinin birinci sırasında yer alan imtiyazlı alacaklar ile rehinli alacaklar bu kapsamın dışında tutulacak. KONKORDATO KOMİSERİNİN GÖREVİ DEVAM EDECEK Mahkeme, konkordato sürecini denetlemek üzere görevlendirilen konkordato komiseri Atilla Aksu'nun görevine de devam etmesine karar verdi. Komiser, şirketin mali durumunu inceleyerek hazırlayacağı raporlarla mahkemenin karar sürecine katkı sunmayı sürdürecek. KESİN MÜHLET KARARI EYLÜL AYINDA GÖRÜŞÜLECEK Geçici konkordato mühletinin uzatılmasının ardından mahkeme, kesin mühlet talebini değerlendirmek üzere duruşma tarihini de belirledi. Dosyanın bir sonraki duruşması 1 Eylül 2026 Salı günü saat 14.00'te, Bursa 1. Asliye Ticaret Mahkemesi'nin B Blok 2. kattaki duruşma salonunda yapılacak. Mahkeme ayrıca, isteyen alacaklıların duruşmaya katılarak süreci takip edebileceğini ilan etti.","Bursa'da 20 yıllık inşaat firmasının konkordato süresi uzatıldı! 2 aylık yeni karar... Bursa'da 20 yıllık inşaat firmasının konkordato süresi uzatıldı! 2 aylık yeni karar... Bursa Hakimiyet Bursa'da 20 yıldır faaliyet gösteren inşaat firması hakkında konkordato sürecinde yeni aşamaya geçildi. Mahkeme, şirket için geçici mühleti uzatırken mevcut koruma tedbirlerinin de yürürlükte kalmasına karar verdi. Bursa'da 20 yıllık inşaat firmasının konkordato süresi uzatıldı! Bursa'da faaliyet gösteren Diyaroğlu Yapı Proje Mühendislik İnşaat Limited Şirketi ile şirket ortağı Sinan Diyaroğlu'nun konkordato dosyasında yeni bir gelişme yaşandı. Asliye Ticaret Mahkemesi, şirkete verilen geçici konkordato mühletini 2 ay daha uzatırken, koruma tedbirlerinin de devamına karar verdi. Bursa'da konkordato süreci devam eden firmalardan biri hakkında mahkemeden yeni karar çıktı. Asliye Ticaret Mahkemesi, Diyaroğlu Yapı Proje Mühendislik İnşaat İnşaat Malzemeleri Isıtma Soğutma Makina Otomotiv Eğitim Tekstil Sanayi ve Ticaret Limited Şirketi ile şirket ortağı Sinan Diyaroğlu hakkında yürütülen konkordato davasında geçici mühlet süresini uzattı. Mahkemenin 2026/39 Esas sayılı dosyasında alınan karara göre, daha önce 1 Nisan 2026 tarihinde verilen 3 aylık geçici konkordato mühleti, 1 Temmuz 2026 tarihinden itibaren geçerli olmak üzere 2 ay daha uzatıldı. KORUMA TEDBİRLERİ YÜRÜRLÜKTE KALACAK Mahkeme kararına göre konkordato kapsamında daha önce uygulanan tüm koruma tedbirleri geçerliliğini sürdürecek. Buna göre Şirket aleyhine yeni icra takipleri başlatılamayacak. Ancak İcra ve İflas Kanunu'nun 206'ncı maddesinin birinci sırasında yer alan imtiyazlı alacaklar ile rehinli alacaklar bu kapsamın dışında tutulacak. KONKORDATO KOMİSERİNİN GÖREVİ DEVAM EDECEK Mahkeme, konkordato sürecini denetlemek üzere görevlendirilen konkordato komiseri Atilla Aksu'nun görevine de devam etmesine karar verdi. Komiser, şirketin mali durumunu inceleyerek hazırlayacağı raporlarla mahkemenin karar sürecine katkı sunmayı sürdürecek. KESİN MÜHLET KARARI EYLÜL AYINDA GÖRÜŞÜLECEK Geçici konkordato mühletinin uzatılmasının ardından mahkeme, kesin mühlet talebini değerlendirmek üzere duruşma tarihini de belirledi. Dosyanın bir sonraki duruşması 1 Eylül 2026 Salı günü saat 14.00'te, Bursa 1. Asliye Ticaret Mahkemesi'nin B Blok 2. kattaki duruşma salonunda yapılacak.",browser_full_article,https://www.bursahakimiyet.com.tr/bursa/bursa-da-20-yillik-insaat-firmasinin-konkordato-suresi-uzatildi-2-aylik-yeni-karar-1659560,Bursa | Antalya | Isparta,Aksu,,,,Diyaroğlu Yapı Proje Mühendislik İnşaat Limited Şirketi,Diyaroğlu Yapı Proje Mühendislik İnşaat Limited Şirketi:114:body | Diyaroğlu Yapı Proje Mühendislik İnşaat Limited Şirketi:raw_legal,faaliyet/tesis yok,Diyaroğlu Yapı Proje Mühendislik İnşaat Limited Şirketi Aksu Bursa Türkiye,,,maps sonucu düşük güven nedeniyle elendi,,Bursa Yiğido İnşaat ve altyapı,174.3,30
2026-06-29 20:00:00,konkordato,İflas / Konkordato / Mali Sorun,"Turizm, inşaat ve enerji sektöründe yeni gelişme: 4 firma konkordato ilan etti!","Turizm, inşaat ve enerji sektöründe yeni gelişme: 4 firma konkordato ilan etti! Son Mühür",https://news.google.com/rss/articles/CBMiqAFBVV95cUxNRkpMNkY2SWxMTDBPQ3ZsVjU4QVowZTkzVGdSX3FySEVab3QzQ21yUm1PYnVOSjRFM05tYi1yaEkzSkk1WWJOOVF4ODYtTFliQUYzUFE2MFBWaDMyV3pIV0I4MFdUc1JxeUdDVHhLTUtGMWNadV9WeUJYY1pPTTFRREd5VGJNR3FYWHAzLUUtXzE4amNuQmZnbEFubldTMENkWXpwM3FPN0bSAagBQVVfeXFMTUZKTDZGNklsTEwwT0N2bFY1OEFaMGU5M1RnUl9xckhFWm90M0NtclJtT2J1Tko0RTNObWItcmhJM0pJNVliTjlReDg2LUxZYkFGM1BRNjBQVmgzMld6SFdCODBXVHNScXlHQ1R4S01LRjFjWnVfVnlCWGNaT00xUURHeVRiTUdxWFhwMy1FLV8xOGpjbkJmZ2xBbm5XUzBDZFl6cDNxTzdG?oc=5,"enerji, firma, inşaat, turizm",şirket / firma,"Türkiye'de 29 Haziran 2026 tarihinde yayımlanan konkordato kararları kapsamında farklı sektörlerde faaliyet gösteren 4 şirket hakkında geçici mühlet kararı verildi. İnşaat, turizm ve enerji alanında faaliyet gösteren firmalar için konkordato süreci resmen başladı. Türkiye'de 29 Haziran 2026 tarihinde yayımlanan konkordato kararları kapsamında farklı sektörlerde faaliyet gösteren 4 şirket hakkında geçici mühlet kararı verildi. İnşaat, turizm ve enerji alanında faaliyet gösteren firmalar için konkordato süreci resmen başladı. Türkiye'de 29 Haziran 2026 tarihinde yayımlanan konkordato kararları kapsamında farklı sektörlerde faaliyet gösteren 4 şirket hakkında geçici mühlet kararı verildi. İnşaat, turizm ve enerji alanında faaliyet gösteren firmalar için konkordato süreci resmen başladı. Ekonomide meydana gelen finansal sıkıntılar sebebiyle konkordato başvuruları devam ederken, 29 Haziran tarihinde yayımlanan yeni kararlar çerçevesinde dört şirketin daha konkordato kapsamına alındığı öğrenildi. Mahkemeler tarafından verilen geçici mühlet kararları ile birlikte söz konusu firmaların mali durumlarının incelenmesi ve konkordatonun başarı şansının değerlendirilmesi sürecine start verilmiş oldu. Söz konusu şirketler şu","Turizm, inşaat ve enerji sektöründe yeni gelişme: 4 firma konkordato ilan etti! Turizm, inşaat ve enerji sektöründe yeni gelişme: 4 firma konkordato ilan etti! Son Mühür Türkiye'de 29 Haziran 2026 tarihinde yayımlanan konkordato kararları kapsamında farklı sektörlerde faaliyet gösteren 4 şirket hakkında geçici mühlet kararı verildi. İnşaat, turizm ve enerji alanında faaliyet gösteren firmalar için konkordato süreci resmen başladı. Ekonomide meydana gelen finansal sıkıntılar sebebiyle konkordato başvuruları devam ederken, 29 Haziran tarihinde yayımlanan yeni kararlar çerçevesinde dört şirketin daha konkordato kapsamına alındığı öğrenildi. Mahkemeler tarafından verilen geçici mühlet kararları ile birlikte söz konusu firmaların mali durumlarının incelenmesi ve konkordatonun başarı şansının değerlendirilmesi sürecine start verilmiş oldu.",browser_full_article,https://www.sonmuhur.com/turizm-insaat-ve-enerji-sektorunde-yeni-gelisme-4-firma-konkordato-ilan-etti/amp,,,,,,,,il yok | ilçe yok | firma yok | faaliyet/tesis yok,,,,maps araması yapılmadı,,,90.04,31
2026-06-29 12:34:00,konkordato,İflas / Konkordato / Mali Sorun,Aydın'ın inşaat devi Perinçek Group Ceo'su Konkordato başvurusunda bulundu,Aydın'ın inşaat devi Perinçek Group Ceo'su Konkordato başvurusunda bulundu Yeni Kıroba,https://news.google.com/rss/articles/CBMioAFBVV95cUxPU0VQNFRGS0F1NWEwSlJmSndjZ2RVa2JXOC1JQk1Ob1hSaUp0V2JNaVpjTTBNclFUdS0wRUtJdGIxTklwSk9JN3NITnVrMlNQRGZHd1R3MGhiVTJGMGhHR0dBa1FUbHJFMG5pUExsSkZsVEFlVmlKeUhhSmhyRXA0Nk5GS3Fmcm80Y3dHXzJTN1QtT0R5ZkgzX3RQSWdPcDF40gGmAUFVX3lxTE42eEY3SkVjY2ZBbUlYckJxWlE2anFsSjRZU2d4dHJtSWNycFp3NVhNRjFBeVlfdjk4VElZay1Vazg2UTM1MFpRcGtsOUNPMmN2OXB1QXhaV3FJQjVhT015NW5fQnVob19BZ3RwYllRSDhsOEdnVW5TZFlwdjRZSjB4UGNwdFlqdEZHUzZ6SkNzTlhLODdXS05MMTVYQmpCZjRTeXFzNHc?oc=5,inşaat,,Aydın ve İzmir'de hayata geçirilen çok sayıda konut projesiyle tanınan Perinçek Group'un CEO'su Hakkı Görken Perinçek'in konkordato başvurusunda bulunduğu öğrenildi. İzmir 3. Asliye Ticaret Mahkemesi'nin başvuruyu değerlendirerek geçici mühlet kararı verdiği belirtildi. Aydın ve İzmir'de hayata geçirilen çok sayıda konut projesiyle tanınan Perinçek Group'un CEO'su Hakkı Görken Perinçek'in konkordato başvurusunda bulunduğu öğrenildi. İzmir 3. Asliye Ticaret Mahkemesi'nin başvuruyu değerlendirerek geçici mühlet kararı verdiği belirtildi. Aydın ve İzmir'de hayata geçirilen çok sayıda konut projesiyle tanınan Perinçek Group'un CEO'su Hakkı Görken Perinçek'in konkordato başvurusunda bulunduğu öğrenildi. İzmir 3. Asliye Ticaret Mahkemesi'nin başvuruyu değerlendirerek geçici mühlet kararı verdiği belirtildi. Kuşadası Ekonomi Aydın Güncel Germencik Efeler Nazilli Genel Spor Asayiş Karacasu Gündem Yaşam Sultanhisar Söke Aydın'ın inşaat devi Perinçek Group Ceo'su Konkordato başvurusunda bulundu Aydın ve İzmir'de hayata geçirilen çok sayıda konut projesiyle tanınan Perinçek Group'un CEO'su Hakkı Görken Perinçek'in konkordato başvurusunda bulunduğu öğrenildi. İzmir 3. Asliye Ticaret Mahkemesi'nin başvuruyu değerlendirerek geçici mühlet kararı verdiği belirtildi. 29.06.2026 - 15:34 Yayınlanma 1 Dk Okunma Süresi Paylaş L,Aydın'ın inşaat devi Perinçek Group Ceo'su Konkordato başvurusunda bulundu Aydın'ın inşaat devi Perinçek Group Ceo'su Konkordato başvurusunda bulundu Yeni Kıroba Aydın ve İzmir'de hayata geçirilen çok sayıda konut projesiyle tanınan Perinçek Group'un CEO'su Hakkı Görken Perinçek'in konkordato başvurusunda bulunduğu öğrenildi. Asliye Ticaret Mahkemesi'nin başvuruyu değerlendirerek geçici mühlet kararı verdiği belirtildi. Kuşadası Ekonomi Aydın Güncel Germencik Efeler Nazilli Genel Spor Asayiş Karacasu Gündem Yaşam Sultanhisar Söke Aydın'ın inşaat devi Perinçek Group Ceo'su Konkordato başvurusunda bulundu Aydın ve İzmir'de hayata geçirilen çok sayıda konut projesiyle tanınan Perinçek Group'un CEO'su Hakkı Görken Perinçek'in konkordato başvurusunda bulunduğu öğrenildi.,browser_full_article,https://www.yenikiroba.com/aydinin-insaat-devi-perincek-group-ceosu-konkordato-basvurusunda-bulundu,Aydın | İzmir,,,,,,,ilçe yok | firma yok | faaliyet/tesis yok,,,,maps araması yapılmadı,,,97.78,32
2026-06-29 15:34:00,konkordato,İflas / Konkordato / Mali Sorun,Gaziantep'te konkordato başvuruları durulmuyor! 10 günde 8 firmadan başvuru...,Gaziantep'te konkordato başvuruları durulmuyor! 10 günde 8 firmadan başvuru... reformhaber.com,https://news.google.com/rss/articles/CBMiqAFBVV95cUxNZnlYM1NUMERUTU1hNV9OOEdWc0I5eEdnQWVQOUg4ZUp1SjdXVEhoby1qbUY1Y3lMMXFmc2tGSjFKa0JnQ1JncExCNkl6VTNKV3ZHdDhhT3E0TVJSdDVxd0xaZVlwMFp1SVZ5WEY3ZmpuV3FBOGR6YmVRWUhpdnBfRUtrMHpRdk11N3JhUmVneEdpal96X1RaSHBRQXFIamJoRzhyODlnZzbSAagBQVVfeXFMTWZ5WDNTVDBEVE1NYTVfTjhHVnNCOXhHZ0FlUDlIOGVKdUo3V1RIaG8tam1GNWN5TDFxZnNrRkoxSmtCZ0NSZ3BMQjZJelUzSld2R3Q4YU9xNE1SUnQ1cXdMWmVZcDBadUlWeVhGN2ZqbldxQThkemJlUVlIaXZwX0VLazB6UXZNdTdyYVJlZ3hHaWpfel9UWkhwUUFxSGpiaEc4cjg5Z2c2?oc=5,firma,şirket / firma,"Gaziantep'te ekonomik daralma ve finansmana erişimde yaşanan sıkıntılar, konkordato başvurularındaki artışı sürdürüyor. Son 10 gün içerisinde konkordato talebinde bulunan 8 firma ve şirket yetkilisi hakkında mahkemeler tarafından çeşitli kararlar verildi. Gaziantep'te ekonomik daralma ve finansmana erişimde yaşanan sıkıntılar, konkordato başvurularındaki artışı sürdürüyor. Son 10 gün içerisinde konkordato talebinde bulunan 8 firma ve şirket yetkilisi hakkında mahkemeler tarafından çeşitli kararlar verildi. Gaziantep'te ekonomik daralma ve finansmana erişimde yaşanan sıkıntılar, konkordato başvurularındaki artışı sürdürüyor. Son 10 gün içerisinde konkordato talebinde bulunan 8 firma ve şirket yetkilisi hakkında mahkemeler tarafından çeşitli kararlar verildi. Gaziantep Gaziantep'te konkordato başvuruları durulmuyor! 10 günde 8 firmadan başvuru... Gaziantep'te ekonomik daralma ve finansmana erişimde yaşanan sıkıntılar, konkordato başvurularındaki artışı sürdürüyor. Son 10 gün içerisinde konkordato talebinde bulunan 8 firma ve şirket yetkilisi hakkında mahkemeler tarafından çeşitli kararlar verildi. 29.06.2026 - 18:34 29.06.2026 - 18:34 Edinilen bilgilere göre, tekstil sektöründe faaliyet gösteren BMA Hilton Tekstil Sanayi ve Ticaret A.Ş. için mahkeme tarafından 3 aylık geçici mühlet kararı verildi. Aynı kapsamda şirket sahibi Aydın Yüksel hakkında da geçici mühlet uygulanmasına hükmedildi. Çanta ve aksesuar alanında faaliyet gösteren Müge Plus Çanta ve Aksesuar Ticaret A.Ş. ile şirket yetkilisi Hakan Demirçubuk için ise alacaklıların davet edildiği konkordato ilan süreci başlatıldı. Öte yandan, Afara Plastik İthalat Ltd. Şti. de mahkemenin 3 aylık geçici mühlet verdiği şirketler arasında yer aldı. Mobilya sektöründe faaliyet gösteren Notte Mobilya Tekstil Gıda İnşaat Petrol Sanayi ve Ticaret A.Ş. hakkında da 3 aylık geçici mühlet kararı alınırken, şirket sahibi Mehmet Sayar için de aynı yönde karar verildi. Son olarak Stars Metal Plastik Sanayi ve Ticaret Ltd. Şti. hakkında da mahkeme tarafından 3 aylık geçici mühlet kararı uygulanmasına hükmedildi. Bu","Gaziantep'te konkordato başvuruları durulmuyor! 10 günde 8 firmadan başvuru... Gaziantep'te konkordato başvuruları durulmuyor! 10 günde 8 firmadan başvuru... reformhaber.com Gaziantep'te ekonomik daralma ve finansmana erişimde yaşanan sıkıntılar, konkordato başvurularındaki artışı sürdürüyor. Son 10 gün içerisinde konkordato talebinde bulunan 8 firma ve şirket yetkilisi hakkında mahkemeler tarafından çeşitli kararlar verildi. Gaziantep Gaziantep'te konkordato başvuruları durulmuyor! 10 günde 8 firmadan başvuru... 29.06.2026 - 18:34 29.06.2026 - 18:34 Edinilen bilgilere göre, tekstil sektöründe faaliyet gösteren BMA Hilton Tekstil Sanayi ve Ticaret A.Ş. için mahkeme tarafından 3 aylık geçici mühlet kararı verildi. Aynı kapsamda şirket sahibi Aydın Yüksel hakkında da geçici mühlet uygulanmasına hükmedildi. Çanta ve aksesuar alanında faaliyet gösteren Müge Plus Çanta ve Aksesuar Ticaret A.Ş. ile şirket yetkilisi Hakan Demirçubuk için ise alacaklıların davet edildiği konkordato ilan süreci başlatıldı. Öte yandan, Afara Plastik İthalat Ltd. Şti. de mahkemenin 3 aylık geçici mühlet verdiği şirketler arasında yer aldı. Mobilya sektöründe faaliyet gösteren Notte Mobilya Tekstil Gıda İnşaat Petrol Sanayi ve Ticaret A.Ş. hakkında da 3 aylık geçici mühlet kararı alınırken, şirket sahibi Mehmet Sayar için de aynı yönde karar verildi. Son olarak Stars Metal Plastik Sanayi ve Ticaret Ltd. Şti. hakkında da mahkeme tarafından 3 aylık geçici mühlet kararı uygulanmasına hükmedildi.",browser_full_article,https://www.reformhaber.com/gaziantepte-konkordato-basvurulari-durulmuyor-10-gunde-8-firmadan-basvuru/amp,Gaziantep,,,,,Afara Plastik İthalat Ltd. Şti | BMA Hilton Tekstil Sanayi ve Ticaret A.Ş | Müge Plus Çanta ve Aksesuar Ticaret A.Ş | Tekstil Gıda İnşaat Petrol Sanayi ve Ticaret A.Ş | Stars Metal Plastik Sanayi ve Ticaret Ltd. Şti,Afara Plastik İthalat Ltd. Şti:63:body | BMA Hilton Tekstil Sanayi ve Ticaret A.Ş:raw_legal | Müge Plus Çanta ve Aksesuar Ticaret A.Ş:raw_legal | Afara Plastik İthalat Ltd. Şti:raw_legal | Tekstil Gıda İnşaat Petrol Sanayi ve Ticaret A.Ş:raw_legal | Stars Metal Plastik Sanayi ve Ticaret Ltd. Şti:raw_legal,ilçe yok | faaliyet/tesis yok,Afara Plastik İthalat Ltd. Şti Gaziantep Türkiye | BMA Hilton Tekstil Sanayi ve Ticaret A.Ş Gaziantep Türkiye,,,maps sonucu düşük güven nedeniyle elendi,,AFFURA PLAST AMBALJ SAN VE DİŞ TİC معمل عفورة بلاستيك | Flora Plast | auraplast | HİLTON HALI,150.1,33
2026-06-30 08:01:43,bahis operasyonu,Kara Para / MASAK / Bahis,"Gaziantep'in de Aralarında Bulunduğu 9 İlde Yasa Dışı Bahis Operasyonu: 32 Şirket, 37 Gözaltı","Gaziantep'in de Aralarında Bulunduğu 9 İlde Yasa Dışı Bahis Operasyonu: 32 Şirket, 37 Gözaltı sirinnar.net",https://news.google.com/rss/articles/CBMiwAFBVV95cUxONlhpcVo2X1FlU2J6SFIxZ2gzb1A3UWk3SHA2cFY4amhYcmEzU050STExbWVxYVVHcld0ZGZlUURGR1o0WElhQzFHckVHb0VwMlVKaXdVczA1STB6cTV1Rlp5U05qc2kzWEk2LWNmbVBkMFQ5OFV5cHg3VlJEZU1pMWw0R05RSXYwdDlHNE9LeW9lbFVVTzgzMUxuQnRJNTBHSW1PQjV3bndfYTZDT0hlaGxDVmJlaGlxdDNpMUVGMmk?oc=5,şirket,şirket / firma,"Gaziantep'in de Aralarında Bulunduğu 9 İlde Yasa Dışı Bahis Operasyonu: 32 Şirket, 37 Gözaltı sirinnar.net","Gaziantep'in de Aralarında Bulunduğu 9 İlde Yasa Dışı Bahis Operasyonu: 32 Şirket, 37 Gözaltı Gaziantep'in de Aralarında Bulunduğu 9 İlde Yasa Dışı Bahis Operasyonu: 32 Şirket, 37 Gözaltı sirinnar.net Gaziantep'in de Aralarında Bulunduğu 9 İlde Yasa Dışı Bahis Operasyonu: 32 Şirket, 37 Gözaltı sirinnar.net",browser_failed,https://news.google.com/rss/articles/CBMiwAFBVV95cUxONlhpcVo2X1FlU2J6SFIxZ2gzb1A3UWk3SHA2cFY4amhYcmEzU050STExbWVxYVVHcld0ZGZlUURGR1o0WElhQzFHckVHb0VwMlVKaXdVczA1STB6cTV1Rlp5U05qc2kzWEk2LWNmbVBkMFQ5OFV5cHg3VlJEZU1pMWw0R05RSXYwdDlHNE9LeW9lbFVVTzgzMUxuQnRJNTBHSW1PQjV3bndfYTZDT0hlaGxDVmJlaGlxdDNpMUVGMmk?oc=5&hl=tr&gl=TR&ceid=TR:tr,Gaziantep,,,,,,,ilçe yok | firma yok | faaliyet/tesis yok,,,,maps araması yapılmadı,,,100.06,34
