published,search_term,category,title,summary,link,matched_words,activity_type,raw_text,entity_source_text,article_fetch_status,resolved_article_url,city_candidates,district_candidates,neighborhood_candidates,street_candidates,facility_candidates,company_candidates,company_candidate_scores,entity_quality_note,maps_queries,maps_candidates,maps_best_guess,maps_status,maps_match_scores,maps_rejected_candidates,record_quality_score,duplicate_group_id
2026-05-14 07:00:00,fabrika yangını,Fiziksel Risk / Yangın,Mobilya Fabrikası Yangını Davasında Kritik Duruşma,Mobilya Fabrikası Yangını Davasında Kritik Duruşma sivas360.com,https://news.google.com/rss/articles/CBMikAFBVV95cUxQaGNmMUtzc1NGQ1dpeDNYMWFmZlFvaHR1M05FLTRTSHlGQ2ptNmtoN29lZF9zWGhYd3g1Q21aVnNUc2tSM3JDU0Q4eFUxSzlRbVVDLXhScWtSVkxleGFyQU9KZnRBS19rVjJHeG1BVnJteDF1bmFqdEh0R3BNNEJjakw2MUFybmlWOEVFUmpPaXI?oc=5,fabrika,fabrika,Mobilya Fabrikası Yangını Davasında Kritik Duruşma sivas360.com,Mobilya Fabrikası Yangını Davasında Kritik Duruşma Mobilya Fabrikası Yangını Davasında Kritik Duruşma sivas360.com Mobilya Fabrikası Yangını Davasında Kritik Duruşma sivas360.com,browser_failed,https://news.google.com/rss/articles/CBMikAFBVV95cUxQaGNmMUtzc1NGQ1dpeDNYMWFmZlFvaHR1M05FLTRTSHlGQ2ptNmtoN29lZF9zWGhYd3g1Q21aVnNUc2tSM3JDU0Q4eFUxSzlRbVVDLXhScWtSVkxleGFyQU9KZnRBS19rVjJHeG1BVnJteDF1bmFqdEh0R3BNNEJjakw2MUFybmlWOEVFUmpPaXI?oc=5&hl=tr&gl=TR&ceid=TR:tr,,,,,Mobilya Fabrikası,,,il yok | ilçe yok | firma yok,,,,maps araması yapılmadı,,,73.38,1
2026-05-14 07:00:00,depo yangını,Fiziksel Risk / Yangın,Maltepe’de korkutan depo yangını İhlas Haber Ajansı,Maltepe’de korkutan depo yangını İhlas Haber Ajansı İhlas Haber Ajansı,https://news.google.com/rss/articles/CBMiiwFBVV95cUxQTGJjY190UU1FbEVoN0xVVy00TE9Db1VCUjFwMTF1M2J5VUdSMVlpWHRlMXFjM3ltb3FFdDVwZ1ZRRzNKQzAwS3YwbkNtN3BKVWZjb3VYRjkwOFR1U19iNTRmNjhoTFNCNVc2eDYtWlRqRXFrZWdNSTMxZXA0TDJKeUduMlpQOHNfVzZr?oc=5,depo,depo,"... Maltepe’de bulunan tekstil malzemeleri deposunda çıkan yangın paniğe neden oldu. Yangın, itfaiye ekiplerinin müdahalesi ile büyümeden kontrol altına alındı Maltepe’de bulunan tekstil malzemeleri deposunda çıkan yangın paniğe neden oldu. Yangın, itfaiye ekiplerinin müdahalesi ile büyümeden kontrol altına alındı ASAYİŞ - 14 Mayıs 2026 Perşembe 16:22 Maltepe’de korkutan depo yangını A A A Maltepe’de bulunan tekstil malzemeleri deposunda çıkan yangın paniğe neden oldu. Yangın, itfaiye ekiplerinin müdahalesi ile büyümeden kontrol altına alındı. Yangın , saat 15:00 sıralarında Bağlarbaşı Mahallesi Feyzullah Caddesi üzerinde bulunan bir marketin altındaki tekstil deposunda henüz bilinmeyen bir sebeple meydana geldi. Deponun bodrum katta bulunması nedeniyle içeriyi yoğun duman kaplayınca yapılan ihbarlar üzerine olay yerine çok sayıda itfaiye ambulans ve polis ekibi sevk edildi. İtfaiye ekipleri yangına su ve köpükle müdahale etti. Polis ekipleri ise caddeye giriş ve çıkışları kapatarak güvenlik önlemi aldı. Ekiplerin hızlı müdahalesiyle yangın kontrol altına alınırken çevrede kısa süreli panik yaşandı. Olayda ölen ya da yaralanan olmazken depo içinde maddi hasar meydana geldi. Yangının çıkış sebebine ilişkin inceleme başlatıldı. Maltepe’de bulunan tekstil malzemeleri deposunda çıkan yangın paniğe neden oldu. Yangın, itfaiye ekiplerinin müdahalesi ile büyümeden kontrol altına alındı. Yangın , saat 15:00 sıralarında Bağlarbaşı Mahallesi Feyzullah Caddesi üzerinde bulunan bir marketin altındaki tekstil deposunda henüz bilinmeyen bir sebeple meydana geldi. Deponun bodrum katta bulunması nedeniyle içeriyi yoğun duman kaplayınca yapılan ihbarlar üzerine olay yerine çok sayıda itfaiye ambulans ve polis ekibi sevk edildi. İtfaiye ekipleri yangına su ve köpükle müdahale etti. Polis ekipleri ise caddeye giriş ve çıkışları kapatarak güvenlik önlemi aldı. Ekiplerin hızlı müdahalesiyle yangın kontrol altına alınırken çevrede kısa süreli panik yaşandı. Olayda ölen ya da yaralanan olmazken depo içinde maddi hasar meydana geldi. Yangının çıkış sebebine ilişkin inceleme başlatıldı. Maltepe’de korkutan depo yangını Maltepe’de bulunan tekstil malzemeleri deposunda çıkan yangın paniğe neden oldu. Yangın, itfaiye ekiplerinin müdahalesi ile büyümeden kontrol altına alındı. Yangın , saat 15:00 sıralarında Bağlarbaşı Mahallesi Feyzullah Caddesi üzerinde bulunan bir marketin altındaki tekstil deposunda henüz bilinmeyen bir sebeple meydana geldi. Deponun bodrum katta bulunması nedeniyle içeriyi yoğun duman kaplayınca yapılan ihbarlar üzerine olay yerine çok sayıda itfaiye ambulans ve polis ekibi sevk edildi. İtfaiye ekipleri yangına su ve köpükle müdahale etti. Polis ekipleri ise caddeye giriş ve çıkışları kapatarak güvenlik önlemi aldı. Ekiplerin hızlı müdahalesiyle yangın kontrol altına alınırken çevrede kısa süreli panik yaşandı. Olayda ölen ya da yaralanan olmazken depo içinde maddi hasar meydana geldi. Yangının çıkış sebebine ilişkin inceleme başlatıldı.","Maltepe’de korkutan depo yangını İhlas Haber Ajansı Maltepe’de korkutan depo yangını İhlas Haber Ajansı İhlas Haber Ajansı Maltepe’de bulunan tekstil malzemeleri deposunda çıkan yangın paniğe neden oldu. Yangın, itfaiye ekiplerinin müdahalesi ile büyümeden kontrol altına alındı Maltepe’de bulunan tekstil malzemeleri deposunda çıkan yangın paniğe neden oldu. Yangın, itfaiye ekiplerinin müdahalesi ile büyümeden kontrol altına alındı ASAYİŞ - 14 Mayıs 2026 Perşembe 16:22 Maltepe’de korkutan depo yangını A A A Maltepe’de bulunan tekstil malzemeleri deposunda çıkan yangın paniğe neden oldu. Yangın, itfaiye ekiplerinin müdahalesi ile büyümeden kontrol altına alındı. Yangın , saat 15:00 sıralarında Bağlarbaşı Mahallesi Feyzullah Caddesi üzerinde bulunan bir marketin altındaki tekstil deposunda henüz bilinmeyen bir sebeple meydana geldi. Deponun bodrum katta bulunması nedeniyle içeriyi yoğun duman kaplayınca yapılan ihbarlar üzerine olay yerine çok sayıda itfaiye ambulans ve polis ekibi sevk edildi. İtfaiye ekipleri yangına su ve köpükle müdahale etti. Polis ekipleri ise caddeye giriş ve çıkışları kapatarak güvenlik önlemi aldı. Ekiplerin hızlı müdahalesiyle yangın kontrol altına alınırken çevrede kısa süreli panik yaşandı. Olayda ölen ya da yaralanan olmazken depo içinde maddi hasar meydana geldi. Yangının çıkış sebebine ilişkin inceleme başlatıldı. Maltepe’de korkutan depo yangını Maltepe’de bulunan tekstil malzemeleri deposunda çıkan yangın paniğe neden oldu.",browser_full_article,https://www.iha.com.tr/istanbul-haberleri/maltepede-korkutan-depo-yangini-423176772,İstanbul,Maltepe,00 sıralarında Bağlarbaşı Mahallesi,sıralarında Bağlarbaşı Mahallesi Feyzullah Caddesi,,,,firma yok | faaliyet/tesis yok,,,,maps araması yapılmadı,,,118.0,2
2026-05-14 07:00:00,depo yangını,Fiziksel Risk / Yangın,Bandırma'da Depo Yangını Kontrol Altına Alındı,Bandırma'da Depo Yangını Kontrol Altına Alındı Son Dakika,https://news.google.com/rss/articles/CBMimwFBVV95cUxQYTVHRDZzR1N3Q1A5cllDaVlqRUhiclJMUWUxNmNDWTJWaDR3YWg1UmtHOTQ0eFgwVy1PaTFicUh1T2p4bktpRnNrMjJNSmx5em5ZQmFSTUthMkx1SmZhSl9YbDBJSnV4Tm1UaklQOHZMSGYzTXJKWWQtUThYNUhvWm40NnZQUWF0dnhUdjNrV2ozLV9fUy1pekloQdIBlwFBVV95cUxPNE5PMnplWmE5bmRHNXNxcTVFTWJiZ2tkR2pTWXhBQnpaR1FLUGVTTE5aczJMQ2lVMmwzQS1wNzNqdTQ5NjBkQklIRnFrZnBVVEd4LUVRNDBsZjg5Tm5SNHFtdF9zdFJLaDJheUVYZG9oRmg3TDNfYjZoaFJYTmJBSS1OZFlJM3JYcEJTanlyajk0R1RST1ZN?oc=5,depo,depo,Bandırma'da Depo Yangını Kontrol Altına Alındı Son Dakika,Bandırma'da Depo Yangını Kontrol Altına Alındı Bandırma'da Depo Yangını Kontrol Altına Alındı Son Dakika Bandırma'da Depo Yangını Kontrol Altına Alındı Son Dakika,browser_failed,https://news.google.com/rss/articles/CBMimwFBVV95cUxQYTVHRDZzR1N3Q1A5cllDaVlqRUhiclJMUWUxNmNDWTJWaDR3YWg1UmtHOTQ0eFgwVy1PaTFicUh1T2p4bktpRnNrMjJNSmx5em5ZQmFSTUthMkx1SmZhSl9YbDBJSnV4Tm1UaklQOHZMSGYzTXJKWWQtUThYNUhvWm40NnZQUWF0dnhUdjNrV2ozLV9fUy1pekloQdIBlwFBVV95cUxPNE5PMnplWmE5bmRHNXNxcTVFTWJiZ2tkR2pTWXhBQnpaR1FLUGVTTE5aczJMQ2lVMmwzQS1wNzNqdTQ5NjBkQklIRnFrZnBVVEd4LUVRNDBsZjg5Tm5SNHFtdF9zdFJLaDJheUVYZG9oRmg3TDNfYjZoaFJYTmJBSS1OZFlJM3JYcEJTanlyajk0R1RST1ZN?oc=5&hl=tr&gl=TR&ceid=TR:tr,Balıkesir,Bandırma,,,,,,firma yok | faaliyet/tesis yok,,,,maps araması yapılmadı,,,73.82,3
2026-05-14 07:00:00,mal varlığına el konuldu,Operasyon / Soruşturma / Suç,"3 banka yöneticisi, 8 polis ve 4 avukat gözaltında","3 banka yöneticisi, 8 polis ve 4 avukat gözaltında Sözcü Gazetesi",https://news.google.com/rss/articles/CBMijwFBVV95cUxNcDh1SWN5SFdsdl8wa3dqdmJXZFZvWjR3TTZHY2VGM1lXNXVLRzhib3E2bjlaTE95M3A3cF9mU2JkbDFSOVJpRzBLaktJRXVpRmJBQmRnaUVoa1oxeWlDRTFLNVJmVk11OU0zQzZGdENVeDN0Zk5TS1BseGp3NFpldDBsWG5xT1NvOHdoTVp2VQ?oc=5,banka,finansal kuruluş,"Haberler - Gündem 3 banka yöneticisi, 8 polis ve 4 avukat gözaltında Adana Cumhuriyet Başsavcılığı koordinesinde yürütülen soruşturma kapsamında; 'yasa dışı bahis', 'nitelikli dolandırıcılık', 'rüşvet' ve 'kara para aklama' suçlarına yönelik düzenlenen eş zamanlı operasyonlarda aralarında 3 banka yöneticisi, 8 polis memuru ve 4 avukat Yayınlanma: 14 Mayıs 2026 - 09:48 Güncellenme: 14 Mayıs 2026 - 14:13 Adana merkezli yürütülen 'yasa dışı bahis', 'nitelikli dolandırıcılık', 'rüşvet' ve 'kara para aklama' suçlarına ilişkin soruşturmada bu sabah 21 şehirde yüzlerce farklı adrese operasyon düzenlendi. 200 kişilik gözaltı listesinde televizyon yorumcusu Rasim Ozan Kütahyalı'nın yanı sıra 3 banka yöneticisi, 8 polis memuru ve 4 avukat olduğu öğrenildi. MİLYARLARCA LİRALIK MAL VARLIĞINA EL KONULDU Operasyon kapsamında 3 elektronik para ödeme kuruluşu, Adana’da 3 kuyumcu ve 1 döviz bürosuna kayyum atanırken, 221 taşınmaz, 120 araç ve 3 tekneye el konuldu. Gözaltına alınan bazı isimler şu şekilde: Selahattin Akın UZUN — Örgüt Lideri Asmin Ayşe PALA — Paladyum/Pep Para Genel Müdürü Zekeriya Başar ÖZBİLEN — Paladyum/Pep Para Yönetim Kurulu Başkan Vekili Mehmet SADİOĞLU — Paladyum/Pep Para Yönetim Kurulu Üyesi Tolgahan KAPANCI — Paladyum/Pep Para Uyum ve Risk Müdürü Deniz USULOĞLU — Paladyum/Pep Para Finans Genel Müdür Yardımcısı Özlem OKTAREŞKARA SEFER — Paladyum Satış ve Operasyon Genel Müdür Yardımcısı Sadık GENÇ — CMT-BSM Ödeme Kuruluşu Eski Sahibi Buğra SÖNMEZ — Eski Visa Müdürü Aykut USTALAR — Güncel kayıt bulunamadı Sadullah AYDIN — Güncel kayıt bulunamadı Ferhat ALTUNKAYNAK — KRİPDOME KRİPTO İç Denetçisi Soner GÜLLECİ — Banka Çalışanı Emrullah GÜVEN — Kuyumcu Hayrullah GÜVEN — Kuyumcu Tahir BAKIRCI — Bereket TB Emlak Bilişim Teknolojileri Ticaret Ltd. Şti. Sahibi Ertuğrul KOÇAK — Banka müdürü Engin YALÇIN — Banka çalışanı İbrahim SIRMA — Öğretim Görevlisi Rasim Ozan KÜTAHYALI — Yazar / Gazeteci Kemal Oğuz PALA — Paladyum Ödeme Kuruluşu %50 Hisseli Ortağı Çayan ZENGİN — Avukat (Adana Barosu) Taylan Perver YALNIZ — Avukat (Adana Barosu) Günay UZUN — Avukat (Adana Barosu / Aktif Değil / Firari) Mehmet Emin UZUN — Avukat (Adana Barosu / Aktif Değil / Firari) Yusuf OĞUZ — İhraç Polis Memuru Fatih SEVGİLİ — Polis Memuru (Adana Destek Hizmet Şube) Hamdi BALOĞLU — İhraç Polis Memuru Mustafa Ali YILDIRIM — Komiser (Denizli Pamukkale Sevindik PMA) Emin ELMAS — Polis Memuru (Manisa Yunus Emre Organize Sanayi Bölgesi PMA) Murat KALA — Polis Memuru (Adana Seyhan Devriye Ekipler Amirliği) Özhan KARGAOĞLU — Emekli Polis Memuru Tamer AKKUŞ — Polis Memuru (Adana TEM Şube) 100 MİLYAR LİRALIK PARA TRAFİĞİ Adalet Bakanı Akın Gürlek, şüpheliler arasında 100 milyar TL'yi aşan para trafiği tespit edildiğini belirterek, operasyona yönelik şu detayları paylaştı: ""Adana C","3 banka yöneticisi, 8 polis ve 4 avukat gözaltında 3 banka yöneticisi, 8 polis ve 4 avukat gözaltında Sözcü Gazetesi Haberler - Gündem 3 banka yöneticisi, 8 polis ve 4 avukat gözaltında Adana Cumhuriyet Başsavcılığı koordinesinde yürütülen soruşturma kapsamında; 'yasa dışı bahis', 'nitelikli dolandırıcılık', 'rüşvet' ve 'kara para aklama' suçlarına yönelik düzenlenen eş zamanlı operasyonlarda aralarında 3 banka yöneticisi, 8 polis memuru ve 4 avukat Yayınlanma: 14 Mayıs 2026 - 09:48 Güncellenme: 14 Mayıs 2026 - 14:13 Adana merkezli yürütülen 'yasa dışı bahis', 'nitelikli dolandırıcılık', 'rüşvet' ve 'kara para aklama' suçlarına ilişkin soruşturmada bu sabah 21 şehirde yüzlerce farklı adrese operasyon düzenlendi.",browser_full_article,https://www.sozcu.com.tr/amp/3-banka-yoneticisi-8-polis-ve-4-avukat-gozaltinda-p319494,Adana,,,,,Bereket TB Emlak Bilişim Teknolojileri Ticaret Ltd. Şti,Bereket TB Emlak Bilişim Teknolojileri Ticaret Ltd. Şti:raw_legal,ilçe yok | faaliyet/tesis yok,Bereket TB Emlak Bilişim Teknolojileri Ticaret Ltd. Şti Adana Türkiye,Bereket Ticaret,Bereket Ticaret,firma adı + güvenli maps adayı var,100.0,,140.25,4
2026-05-14 07:00:39,mal varlığına el konuldu,Operasyon / Soruşturma / Suç,Kütahyalı soruşturmasında bankacılar gözaltında!,Kütahyalı soruşturmasında bankacılar gözaltında! Kocaeli Çınar,https://news.google.com/rss/articles/CBMifkFVX3lxTFBteHZoUlBJVll6WjZvRHpkOXR0RTV3WEo5c2NrTHptTTlhSXlfTkl5OHRWRDBJclJjMTdta1BjN1p2d0QxNHVtTFhlTzZ5N2dvQWh4MWk2QVJLX3FvWHRsckxHbVJwaWR2TWZ1NEN4RUx3enNlN0l3bG1tSUJlUQ?oc=5,banka,finansal kuruluş,Kütahyalı soruşturmasında bankacılar gözaltında! Kocaeli Çınar,Kütahyalı soruşturmasında bankacılar gözaltında! Kütahyalı soruşturmasında bankacılar gözaltında! Kocaeli Çınar Kütahyalı soruşturmasında bankacılar gözaltında!,browser_failed,https://kocaelicinar.com/kutahyali-sorusturmasinda-bankacilar-gozaltinda/,,,,,,,,il yok | ilçe yok | firma yok | faaliyet/tesis yok,,,,maps araması yapılmadı,,,38.12,5
2026-05-14 07:00:00,MASAK raporu,Kara Para / MASAK / Bahis,Gözaltına alınan Rasim Ozan Kütahyalı ile ilgili çarpıcı ayrıntılar: MASAK raporunda milyonlarca liralık para trafiği!,Gözaltına alınan Rasim Ozan Kütahyalı ile ilgili çarpıcı ayrıntılar: MASAK raporunda milyonlarca liralık para trafiği! Cumhuriyet,https://news.google.com/rss/articles/CBMi9AFBVV95cUxNUUs2bER0OWRTUEEzQzZyY3BHQ0Juem81cDgtdFl6djVPaFlfTUxnNjI1b05haDlYd0tHaEdidEJBbDBKNGJJa1lNVF8xdjlkaVRjS2tKWmJBQXZ3NHZQb0Zpb1JvaDd4VGRnc0FySVUwbkRTcnp0NTd3WGVSWlZ5bG93aXVDUmdyWG1SOFItZERKdEdZeWhteU9vOWc3VUM3QnRzWXl6eU51V0dUY0JDZkt0U19iQU1EUnIyX1lydE1kSm9DT0dTa0lzT3FCbURxMXRNd2V2NTE1Q3BSVEsyWktiMDhmWmw3Vk9LMEFvTFFXbWtf?oc=5,masak,,"Yasa dışı bahis operasyonunda sabah saatlerinde gözaltına alınan alınan Rasim Ozan Kütahyalı ile ilgili hazırlanan MASAK raporunda kritik ayrıntılar yer aldı. Gazetemiz yazarı Murat Ağırel, Kütahyalı'nın hesaplarının MASAK tarafından 'kasa hesap' olarak incelendiğini ve çok yüksek meblağlarda para transferlerinin tespit edildiğini yazdı. Yasa dışı bahis operasyonunda sabah saatlerinde gözaltına alınan alınan Rasim Ozan Kütahyalı ile ilgili hazırlanan MASAK raporunda kritik ayrıntılar yer aldı. Gazetemiz yazarı Murat Ağırel, Kütahyalı'nın hesaplarının MASAK tarafından 'kasa hesap' olarak incelendiğini ve çok yüksek meblağlarda para transferlerinin tespit edildiğini yazdı. Yasa dışı bahis operasyonunda sabah saatlerinde gözaltına alınan alınan Rasim Ozan Kütahyalı ile ilgili hazırlanan MASAK raporunda kritik ayrıntılar yer aldı. Gazetemiz yazarı Murat Ağırel, Kütahyalı'nın hesaplarının MASAK tarafından 'kasa hesap' olarak incelendiğini ve çok yüksek meblağlarda para transferlerinin tespit edildiğini yazdı.","Gözaltına alınan Rasim Ozan Kütahyalı ile ilgili çarpıcı ayrıntılar: MASAK raporunda milyonlarca liralık para trafiği! Gözaltına alınan Rasim Ozan Kütahyalı ile ilgili çarpıcı ayrıntılar: MASAK raporunda milyonlarca liralık para trafiği! Cumhuriyet Yasa dışı bahis operasyonunda sabah saatlerinde gözaltına alınan alınan Rasim Ozan Kütahyalı ile ilgili hazırlanan MASAK raporunda kritik ayrıntılar yer aldı. Gazetemiz yazarı Murat Ağırel, Kütahyalı'nın hesaplarının MASAK tarafından 'kasa hesap' olarak incelendiğini ve çok yüksek meblağlarda para transferlerinin tespit edildiğini yazdı.",browser_full_article,https://www.cumhuriyet.com.tr/turkiye/gozaltina-alinan-rasim-ozan-kutahyali-ile-ilgili-carpici-ayrintilar-masak-raporunda-milyonlarca-liralik-para-trafigi-2503771,,,,,,,,il yok | ilçe yok | firma yok | faaliyet/tesis yok,,,,maps araması yapılmadı,,,117.44,6
2026-05-14 07:00:00,MASAK raporu,Kara Para / MASAK / Bahis,Rasim Ozan Kütahyalı'nın MASAK Raporu Ortaya Çıktı! Banka Hesabına 2 Yılda 35 Milyon TL'lik Para Girişi Tespit Edildi!,Rasim Ozan Kütahyalı'nın MASAK Raporu Ortaya Çıktı! Banka Hesabına 2 Yılda 35 Milyon TL'lik Para Girişi Tespit Edildi! politikam.com,https://news.google.com/rss/articles/CBMilwFBVV95cUxQVlVMT2RIUjA5MS1sc0gyQmEzemtrRDFhZVFWTzlLNEE4Z05VNUpmVUtsdHdtU1lmM0pMUFhWUGNaMGpyU25yRGVUY09uU3c5a2EwMWNsSGtWeE5ocHlUaGQ5aVozcVpxaGRyOW9IZXNwTWREejNBWTJ5RUNNX1F2YUJkQnRqa2F4VWV0SWVGSVRxeGJkVW1Z?oc=5,"banka, banka hesabı, masak",finansal kuruluş,Rasim Ozan Kütahyalı'nın MASAK Raporu Ortaya Çıktı! Banka Hesabına 2 Yılda 35 Milyon TL'lik Para Girişi Tespit Edildi! politikam.com,Rasim Ozan Kütahyalı'nın MASAK Raporu Ortaya Çıktı! Banka Hesabına 2 Yılda 35 Milyon TL'lik Para Girişi Tespit Edildi! Rasim Ozan Kütahyalı'nın MASAK Raporu Ortaya Çıktı! Banka Hesabına 2 Yılda 35 Milyon TL'lik Para Girişi Tespit Edildi! politikam.com Rasim Ozan Kütahyalı'nın MASAK Raporu Ortaya Çıktı! Banka Hesabına 2 Yılda 35 Milyon TL'lik Para Girişi Tespit Edildi!,browser_failed,https://news.google.com/rss/articles/CBMilwFBVV95cUxQVlVMT2RIUjA5MS1sc0gyQmEzemtrRDFhZVFWTzlLNEE4Z05VNUpmVUtsdHdtU1lmM0pMUFhWUGNaMGpyU25yRGVUY09uU3c5a2EwMWNsSGtWeE5ocHlUaGQ5aVozcVpxaGRyOW9IZXNwTWREejNBWTJ5RUNNX1F2YUJkQnRqa2F4VWV0SWVGSVRxeGJkVW1Z?oc=5&hl=tr&gl=TR&ceid=TR:tr,,,,,,,,il yok | ilçe yok | firma yok | faaliyet/tesis yok,,,,maps araması yapılmadı,,,99.32,7
2026-05-14 07:00:00,MASAK,Kara Para / MASAK / Bahis,Bahis çetesinin kasası Rasim Ozan Kütahyalı mı? MASAK raporlarında çarpıcı detaylar ortaya çıktı,Bahis çetesinin kasası Rasim Ozan Kütahyalı mı? MASAK raporlarında çarpıcı detaylar ortaya çıktı Yeniçağ Gazetesi,https://news.google.com/rss/articles/CBMi1wFBVV95cUxOcFFnMEhDVjNtQ2xXTlNkNlBWQUdGRzhmRHUwNldoTDFSc3ZFTEwzUVczd2RQZFNPWEJveFd6Rm1WNXlBckptSGJ0NEZVS0M0TkxsUWNUeWhZeTJaSGRUMFJaRmZEb2kyRWVEZUR2MWw5S3lHMVYycEowMGFIczRoODUxSjlkd1B5VnVRZ1pIV0xjNUJteXhZbFhZY1BfbmNKa2FnT1pFUzNLMjNUQ3lzbFA3NDFFYzFXanVJd0htT1hOUGV6cjhrTTN3a3llX05VekZPM1RKMA?oc=5,masak,,Bahis çetesinin kasası Rasim Ozan Kütahyalı mı? MASAK raporlarında çarpıcı detaylar ortaya çıktı Yeniçağ Gazetesi,Bahis çetesinin kasası Rasim Ozan Kütahyalı mı? MASAK raporlarında çarpıcı detaylar ortaya çıktı Bahis çetesinin kasası Rasim Ozan Kütahyalı mı? MASAK raporlarında çarpıcı detaylar ortaya çıktı Yeniçağ Gazetesi Bahis çetesinin kasası Rasim Ozan Kütahyalı mı? MASAK raporlarında çarpıcı detaylar ortaya çıktı Yeniçağ Gazetesi,browser_failed,https://www.yenicaggazetesi.com/bahis-cetesinin-kasasi-rasim-ozan-kutahyali-mi-masak-raporlarinda-carpici-detaylar-ortaya-cikti-1029869h.htm,,,,,,,,il yok | ilçe yok | firma yok | faaliyet/tesis yok,,,,maps araması yapılmadı,,,93.38,8
