published,search_term,category,title,summary,link,matched_words,activity_type,raw_text,entity_source_text,article_fetch_status,resolved_article_url,city_candidates,district_candidates,neighborhood_candidates,street_candidates,facility_candidates,company_candidates,company_candidate_scores,entity_quality_note,maps_queries,maps_candidates,maps_best_guess,maps_status,maps_match_scores,maps_rejected_candidates,record_quality_score,duplicate_group_id
2026-07-06 05:50:05,yangın,Fiziksel Risk / Yangın,Bursa'da yangın paniği! Geri dönüşüm tesisi alevlere teslim oldu,Bursa'da yangın paniği! Geri dönüşüm tesisi alevlere teslim oldu | Video videosunu izle | Son Dakika Haberleri Sabah,https://news.google.com/rss/articles/CBMiqwFBVV95cUxNblBwYlB6b3h4VlM4c2VMVXJUTjU2TnhrMmNpRlpXR1JFNURGSjQ4dGVYUER0LWoxOUhVUGhIVHNJdFJzZ0tMT2FlejVaOUhpNmJiNzJ2bDN1UzNMRERPczc1ZVpBRURaOHVJRzE0d2lJQ0ZIcGFyWjVZZWV1UklGTm9fWDdFQnlKQTVuWnBmWEtXeXgxZ3o0b3IzTTN3cXRQVmRtbUtpY1ZrSjTSAasBQVVfeXFMTW5QcGJQem94eFZTOHNlTFVyVE41Nk54azJjaUZaV0dSRTVERko0OHRlWFBEdC1qMTlIVVBoSFRzSXRSc2dLTE9hZXo1WjlIaTZiYjcydmwzdVMzTERET3M3NWVaQUVEWjh1SUcxNHdpSUNGSHBhclo1WWVldVJJRk5vX1g3RUJ5SkE1blpwZlhLV3l4MWd6NG9yM00zd3F0UFZkbW1LaWNWa0o0?oc=5,tesis,,"Yangın, 00:30 sıralarında merkez Yıldırım ilçesi Çelebi Mehmet Mahallesi'nde faaliyet gösteren geri dönüşüm tesisinde çıktı. Kısa sürede büyüyen alevleri gören vatandaşlar durumu 112 Acil Çağrı Merkezi'ne bildirdi. İhbar üzerine olay yerine çok sayıda itfaiye, polis ve Bursa Büyükşehir Belediyesi'ne bağlı su tankerleri sevk edildi. Polis, yangın mahallinde bulunan meraklı vatandaşları uzaklaştırmak için yoğun çaba gösterirken, itfaiye ekipleri de yangına müdahale etmeye başladı. Yangın mahalline sevk edilen itfaiye ekipleri, yangını kontrol altına alabilmek için yoğun çaba harcadı. Yangın, ekiplerin müdahalesiyle yaklaşık 1 buçuk saat sonra kontrol altına alındı. Soğutma çalışmaları sürerken, yangınla ilgili soruşturma başlatıldı. Yangın, 00:30 sıralarında merkez Yıldırım ilçesi Çelebi Mehmet Mahallesi'nde faaliyet gösteren geri dönüşüm tesisinde çıktı. Kısa sürede büyüyen alevleri... Yangın, 00:30 sıralarında merkez Yıldırım ilçesi Çelebi Mehmet Mahallesi'nde faaliyet gösteren geri dönüşüm tesisinde çıktı. Kısa sürede büyüyen alevleri gören vatandaşlar durumu 112 Acil Çağrı Merkezi'ne bildirdi. İhbar üzerine olay yerine çok sayıda itfaiye, polis ve Bursa Büyükşehir Belediyesi'ne bağlı su tankerleri sevk edildi. Polis, yangın mahallinde bulunan meraklı vatandaşları uzaklaştırmak için yoğun çaba gösterirken, itfaiye ekipleri de yangına müdahale etmeye başladı. Yangın mahalline sevk edilen itfaiye ekipleri, yangını kontrol altına alabilmek için yoğun çaba harcadı. Yangın, ekiplerin müdahalesiyle yaklaşık 1 buçuk saat sonra kontrol altına alındı. Soğutma çalışmaları sürerken, yangınla ilgili soruşturma başlatıldı. Bursa'da yangın paniği! Geri dönüşüm tesisi alevlere teslim oldu | Video 06.07.2026 00:00 Pa","Bursa'da yangın paniği! Geri dönüşüm tesisi alevlere teslim oldu Bursa'da yangın paniği! Geri dönüşüm tesisi alevlere teslim oldu | Video videosunu izle | Son Dakika Haberleri Sabah Yangın, 00:30 sıralarında merkez Yıldırım ilçesi Çelebi Mehmet Mahallesi'nde faaliyet gösteren geri dönüşüm tesisinde çıktı. Kısa sürede büyüyen alevleri gören vatandaşlar durumu 112 Acil Çağrı Merkezi'ne bildirdi. İhbar üzerine olay yerine çok sayıda itfaiye, polis ve Bursa Büyükşehir Belediyesi'ne bağlı su tankerleri sevk edildi. Polis, yangın mahallinde bulunan meraklı vatandaşları uzaklaştırmak için yoğun çaba gösterirken, itfaiye ekipleri de yangına müdahale etmeye başladı. Yangın mahalline sevk edilen itfaiye ekipleri, yangını kontrol altına alabilmek için yoğun çaba harcadı. Yangın, ekiplerin müdahalesiyle yaklaşık 1 buçuk saat sonra kontrol altına alındı. Soğutma çalışmaları sürerken, yangınla ilgili soruşturma başlatıldı. Kısa sürede büyüyen alevleri... Geri dönüşüm tesisi alevlere teslim oldu | Video 06.07.2026 00:00 Pa",browser_full_article,https://m.sabah.com.tr/video/yasam/bursada-yangin-panigi-geri-donusum-tesisi-alevlere-teslim-oldu-video/amp,Bursa,Yıldırım,Yıldırım ilçesi Çelebi Mehmet Mahallesi,,Geri dönüşüm tesisi,,,firma yok,Geri dönüşüm tesisi Yıldırım ilçesi Çelebi Mehmet Mahallesi Yıldırım Bursa Türkiye,Ss Yıldırım Hurdacılar Ve Geri Dönüşümcüler Sitesi | DMR Geri Dönüşüm | EREN GERİ DÖNÜŞÜM METAL TAŞIMACILIK VE ENDÜSTRİYEL TEMİZLİK SAN. TİC. LTD. ŞTİ | TARHAN GERİ DÖNÜŞÜM VE ATIK YÖNETİMİ | Bursa Hurda Kağıt | Bursa Hurda Karton | Bursa Geri Dönüşüm,Ss Yıldırım Hurdacılar Ve Geri Dönüşümcüler Sitesi,"firma adı yok, tesis/lokasyon ile maps tahmini var",55.072463768115945 | 85.71428571428571 | 77.41935483870968 | 77.41935483870968 | 77.41935483870968,,208.0,1
2026-07-06 09:46:58,para aklama,Kara Para / MASAK / Bahis,Uyuşturucu kaçakçılığı ve Para Aklama Menşeli 1 Milyon Euro’luk Mal Varlığına El Konuldu,Uyuşturucu kaçakçılığı ve Para Aklama Menşeli 1 Milyon Euro’luk Mal Varlığına El Konuldu Kosovahaber.com,https://news.google.com/rss/articles/CBMiwgFBVV95cUxQNjJJNm1KTnZTekpYQ2FYbmZzT2otVFQwU3BjanRwZnlRMllZYVFlVDRjTW9LSlRvVHMzT0lLc09LT1czbjd0RFk2SkVqWUttNGJFdWViNDRmd0VsTlJ2NGhlRlk2MWdPR0R0b3hYaE1PeldoVjJJRUd4aEplb1BWRXhuWmxMQlI5UFFFa3N0djcyZUYxbDJ5cUJDN2NDbEM5WU9BMVFGWnpPblU1bmh2VHlnMTdzMFczOVNHenpmckx1dw?oc=5,"el konuldu, mal varlığı",,"Kosova Polisi, Özel Savcılık’ın yetkilendirmesiyle 30 Haziran’da Priştine’de gerçekleştirdiği operasyon kapsamında yaklaşık 1 milyon Euro değerinde mal varlığına el koydu. Operasyonun, uyuşturucu kaçakçılığından elde edilen paraların aklanmasına yönelik uluslararası bir soruşturma çerçevesinde yürütüldüğü belirtildi. Polisin açıklamasında, soruşturmanın İtalya ve Fransa’daki yetkili makamlar tarafından yürütülen çalışmaların bir parçası olduğu, operasyonun ise Europol ve Eurojust koordinasyonunda, Kosova Özel Savcılığı ve Kosova Polisi ile yakın iş birliği içinde gerçekleştirildiği ifade edildi. Açıklamada, “Operasyon, uyuşturucu kaçakçılığından elde edilen gelirlerin sınır ötesi düzeyde aklanmasına ilişkin soruşturma kapsamında gerçekleştirilmiştir.” denildi. Yetkililer, operasyonun detaylarının paylaşılması amacıyla saat 14.30’da bir basın toplantısı düzenleneceğini duyurdu. Kosova Polisi, Özel Savcılık’ın yetkilendirmesiyle 30 Haziran’da Priştine’de gerçekleştirdiği operasyon kapsamında yaklaşık 1 milyon Euro değerinde mal varlığına el koydu. Operasyonun, uyuşturucu kaçakçılığından elde edilen paraların aklanmasına yönelik uluslararası bir soruşturma çerçevesinde yürütüldüğü belirtildi. Polisin açıklamasında, soruşturmanın İtalya ve Fransa’daki yetkili makamlar tarafından yürütülen çalışmaların bir parçası olduğu, operasyonun ise Europol ve Eurojust koordinasyonunda, Kosova Özel Savcılığı ve Kosova Polisi ile yakın iş birliği içinde gerçekleştirildiği ifade edildi. Açıklamada, “Operasyon, uyuşturucu kaçakçılığından elde edilen gelirlerin sınır ötesi düzeyde aklanmasına ilişkin soruşturma kapsamında gerçekleştirilmiştir.” denildi. Yetkililer, operasyonun detaylarının paylaşılması amacıyla saat 14.30’da bir basın toplantısı düzenleneceğini duyurdu. Kosova Polisi, Özel Savcılık’ın yetkilendirmesiyle 30 Haziran’da Priştine’de gerçekleştirdiği operasyon kapsamında yaklaşık 1 milyon Euro değerinde mal varlığına el koydu. Operasyonun, uyuşturucu kaçakçılığından elde edilen paraların aklanmasına yönelik uluslararası bir soruşturma çerçevesinde yürütüldüğü belirtildi. Polisin açıklamasında, soruşturmanın İtalya ve Fransa’daki yetkili makamlar tarafından yürütülen çalışmaların bir parçası olduğu, operasyonun ise Europol ve Eurojust koordinasyonunda, Kosova Özel Savcılığı ve Kosova Polisi ile yakın iş birliği içinde gerçekleştirildiği ifade edildi. Açıklamada, “Operasyon, uyuşturucu kaçakçılığından elde edilen gelirlerin sınır ötesi düzeyde aklanmasına ilişkin soruşturma kapsamında gerçekleştirilmiştir.” denildi. Yetkililer, operasyonun detaylarının paylaşılması amacıyla saat 14.30’da bir basın toplantısı düzenleneceğini duyurdu. Diğer Protesto Sonrası Bakan Muja'dan Çağrı 53 dakika önce Diğer Kosovalı Süt Üreticilerinden Acil Görüşme Çağrısı 1 saat önce Siyaset Osmani, Abdixhiku’nun Görevden Alınması Girişimini Yorumlamıyor 1 saat önce Siyaset AB, Sırbistan’ın Kosova Vatandaşlarına Yönelik Keyfi Gözaltılarına Tepki Göstermeli 2 saat önce Siyaset Ankara’daki NATO Zirvesi İçin Her Şey Hazır 2 saat önce Anasayfa Diğer Uyuşturucu kaçakçılığı ve Para Aklama Menşeli 1 Milyon Euro’luk Mal Varlığına El Konuldu Uyuşturucu kaçakçılığı ve Para Aklama Menşeli 1 Milyon Euro’luk Mal Varlığına El Konuldu 6 Temmuz 2026, 11:37 0 0 dk A+ A A- Kosova Polisi, Özel Savcılık’ın yetkilendirmesiyle 30 Haziran’da Priştine’de gerçekleştirdiği operasyon kapsamında yaklaşık 1 milyon Euro değerinde mal varlığına el koydu. Operasyonun, uyuşturucu kaçakçılığından elde edilen paraların aklanmasına yönelik uluslararası bir soruşturma çerçevesinde yürütüldüğü belirtildi. Polisin açıklamasında, soruşturmanın İtalya ve Fransa’daki yetkili makamlar tarafından yürütülen çalışmaların bir parçası olduğu, operasyonun ise Europol ve Eurojust koordinasyonunda, Kosova Özel Savcılığı ve Kosova Polisi ile yakın iş birliği içinde gerçekleştirildiği ifade edildi. Açıklamada, “Operasyon, uyuşturucu kaçakçılığından elde edilen gelirlerin sınır ötesi düzeyde aklanmasına ilişkin soruşturma kapsamında gerçekleştirilmiştir.” denildi. Yetkililer, operasyonun detaylarının paylaşılması amacıyla saat 14.30’da bir basın toplantısı düzenleneceğini duyurdu. Yorum","Uyuşturucu kaçakçılığı ve Para Aklama Menşeli 1 Milyon Euro’luk Mal Varlığına El Konuldu Uyuşturucu kaçakçılığı ve Para Aklama Menşeli 1 Milyon Euro’luk Mal Varlığına El Konuldu Kosovahaber.com Kosova Polisi, Özel Savcılık’ın yetkilendirmesiyle 30 Haziran’da Priştine’de gerçekleştirdiği operasyon kapsamında yaklaşık 1 milyon Euro değerinde mal varlığına el koydu. Operasyonun, uyuşturucu kaçakçılığından elde edilen paraların aklanmasına yönelik uluslararası bir soruşturma çerçevesinde yürütüldüğü belirtildi. Polisin açıklamasında, soruşturmanın İtalya ve Fransa’daki yetkili makamlar tarafından yürütülen çalışmaların bir parçası olduğu, operasyonun ise Europol ve Eurojust koordinasyonunda, Kosova Özel Savcılığı ve Kosova Polisi ile yakın iş birliği içinde gerçekleştirildiği ifade edildi. Açıklamada, “Operasyon, uyuşturucu kaçakçılığından elde edilen gelirlerin sınır ötesi düzeyde aklanmasına ilişkin soruşturma kapsamında gerçekleştirilmiştir.” denildi. Yetkililer, operasyonun detaylarının p",browser_full_article,https://kosovahaber.com/haber/uyusturucu-kacakciligi-ve-para-aklama-menseli-1-milyon-euroluk-mal-varligina-el-konuldu-103124,,,,,,,,il yok | ilçe yok | firma yok | faaliyet/tesis yok,,,,maps araması yapılmadı,,,101.0,2
2026-07-06 09:30:44,para aklama,Diğer,Uyuşturucu kaçakçılığından elde edilen paranın aklanması: Priştine'de düzenlenen uluslararası operasyonda bir milyon euro değerinde mal varlığına el konuldu,Uyuşturucu kaçakçılığından elde edilen paranın aklanması: Priştine'de düzenlenen uluslararası operasyonda bir milyon euro değerinde mal varlığına el konuldu KoSSev,https://news.google.com/rss/articles/CBMixgFBVV95cUxPZUQyckZoTTd4OUdJMHgwdW5uS2duTHFhZWp3UVBwZnVzc2hpZnB3aTJxWkZjUm15OFhUNk5YeVJnRnJocTNGMS1Icmc0T1FPTXZHbllCdGhSX0NVQzRwVVdnWFpuVENTZmpUaVRSRmlsNHhDcDFIb2ZpQVJRSWFEazMyRXdyVFY5Vi04dmdMZDRwUnVzMDdCamdOOXc2dEZEWHJxbEx0bW9UamRVUEdUQjQyUy1kTDRoeF9nc09Zb3dWWGdzOVE?oc=5,"el konuldu, mal varlığı",,Uyuşturucu kaçakçılığından elde edilen paranın aklanması: Priştine'de düzenlenen uluslararası operasyonda bir milyon euro değerinde mal varlığına el konuldu. Haber - KoSSev Uyuşturucu kaçakçılığından elde edilen paranın aklanması: Priştine'de düzenlenen uluslararası operasyonda bir milyon euro değerinde mal varlığına el konuldu. Haber - KoSSev,Uyuşturucu kaçakçılığından elde edilen paranın aklanması: Priştine'de düzenlenen uluslararası operasyonda bir milyon euro değerinde mal varlığına el konuldu Uyuşturucu kaçakçılığından elde edilen paranın aklanması: Priştine'de düzenlenen uluslararası operasyonda bir milyon euro değerinde mal varlığına el konuldu KoSSev Uyuşturucu kaçakçılığından elde edilen paranın aklanması: Priştine'de düzenlenen uluslararası operasyonda bir milyon euro değerinde mal varlığına el konuldu. Haber - KoSSev Uyuşturucu kaçakçılığından elde edilen paranın aklanması: Priştine'de düzenlenen uluslararası operasyonda bir milyon euro değerinde mal varlığına el konuldu.,browser_full_article,https://kossev.info/tr/pranje-novca-od-trgovine-drogom-u-medjunarodnoj-akciji-u-pristini-zaplenjena-imovina-vredna-milion-evra/,,,,,,,,il yok | ilçe yok | firma yok | faaliyet/tesis yok,,,,maps araması yapılmadı,,,138.2,3
2026-07-06 04:30:44,para aklama,Banka / Finansal Kuruluş,"Dürüstlük Komisyonu ve Merkez Bankası, para kaçakçılığı kanallarını kurutma konusunda anlaştı » Irak Haber Ajansı","Dürüstlük Komisyonu ve Merkez Bankası, para kaçakçılığı kanallarını kurutma konusunda anlaştı » Irak Haber Ajansı وكالة الانباء العراقية (واع)",https://news.google.com/rss/articles/CBMivwFBVV95cUxNQnV5ei1hMy1HcnYwVUd4d25Vc2gtSEszN0dXZTdwRFRYM0xrVE1MckE4blY4TUx0NTVxNlpsYXlBQ1Q5OXozUFpyazdBRXhPbkJaR1BBNW9jdGhkWl9xWXp4YmFLTTdJd0FTa0wwZmxMcXp5VnMtUGJJLWd4ek1YRVB6akZIeEhORWlwVWx3ZnZ3S2hUUk8yV2ZudG43ZHdRaVp0b1lGN1BtOVB5d2RKZmpRSXUwa0ItdXBoYlhVMA?oc=5,banka,finansal kuruluş,"Sorry, you have been blocked You are unable to access ina.iq Why have I been blocked? This website is using a security service to protect itself from online attacks. The action you just performed triggered the security solution. There are several actions that could trigger this block including submitting a certain word or phrase, a SQL command or malformed data. What can I do to resolve this? You can email the site owner to let them know you were blocked. Please include what you were doing when this page came up and the Cloudflare Ray ID found at the bottom of this page. Cloudflare Ray ID: a16ec7e35e162290 • Your IP: Click to reveal 52.188.87.64 • Performance & security by Cloudflare Sorry, you have been blocked You are unable to access ina.iq What can I do to resolve this? This website is using a security service to protect itself from online attacks. The action you just performed triggered the security solution. There are several actions that could trigger this block including submitting a certain word or phrase, a SQL command or malformed data. You can email the site owner to let them know you were blocked. Please include what you were doing when this page came up and the Cloudflare Ray ID found at the bottom of this page. Cloudflare Ray ID: a16ec7e35e162290 • Your IP: Click to reveal 52.188.87.64 • Performance & security by Cloudflare","Dürüstlük Komisyonu ve Merkez Bankası, para kaçakçılığı kanallarını kurutma konusunda anlaştı » Irak Haber Ajansı Dürüstlük Komisyonu ve Merkez Bankası, para kaçakçılığı kanallarını kurutma konusunda anlaştı » Irak Haber Ajansı وكالة الانباء العراقية (واع) Sorry, you have been blocked You are unable to access ina.iq Why have I been blocked? This website is using a security service to protect itself from online attacks. The action you just performed triggered the security solution. There are several actions that could trigger this block including submitting a certain word or phrase, a SQL command or malformed data. What can I do to resolve this? You can email the site owner to let them know you were blocked. Please include what you were doing when this page came up and the Cloudflare Ray ID found at the bottom of this page. Cloudflare Ray ID: a16ec7e35e162290 • Your IP: Click to reveal 52.188.87.64 • Performance & security by Cloudflare Sorry, you have been blocked You are unable to access ina.iq What can I do to resolve this?",browser_full_article,https://ina.iq/tk/political/63903-durustluk-komisyonu-ve-merkez-bankas-para-kacakcl-kanallarn-kurutma-konusunda-anlat.html,,,,,,,,il yok | ilçe yok | firma yok | faaliyet/tesis yok,,,,maps araması yapılmadı,,,111.6,4
2026-07-05 14:22:00,mal varlığına el konuldu,Diğer,Suç örgütlerine büyük darbe! 818 milyon liralık mal varlığına el konuldu,Suç örgütlerine büyük darbe! 818 milyon liralık mal varlığına el konuldu Haber Hürriyeti,https://news.google.com/rss/articles/CBMivgFBVV95cUxQM1R1dnpFaEtubE5CSkZTQWFQOE1lVFAtN0Z4a1N1dUNaWURhd3RpSUpqQ0RqdjFGN3AyRGNTWjhrM21oZ0EzeEZFWVpaVGFBNUtDeW5kaHA1OTZTQmpCdnpnbU1hNGhTSFlQU3cxVVhuYW95NUN6eFMwU0haTXRZMXFxaUtZMnVKOU1IQU9GSUNzMDJOa2piem1HMlJBSlVreGRCdFpnN3JtWmhCbHRveTdaVkdRX3JwemV1Nk5n0gG-AUFVX3lxTFAzVHV2ekVoS25sTkJKRlNBYVA4TWVUUC03RnhrU3V1Q1pZRGF3dGlJSmpDRGp2MUY3cDJEY1NaOGszbWhnQTN4RkVZWlpUYUE1S0N5bmRocDU5NlNCakJ2emdtTWE0aFNIWVBTdzFVWG5hb3k1Q3p4UzBTSFpNdFkxcXFpS1kydUo5TUhBT0ZJQ3MwMk5ramJ6bUcyUkFKVWt4ZEJ0Wmc3cm1aaEJsdG95N1pWR1FfcnB6ZXU2Tmc?oc=5,"el konuldu, mal varlığı",,"İçişleri Bakanlığı'nın koordinasyonunda 16 ilde organize suç örgütlerine yönelik gerçekleştirilen 22 ayrı operasyonda 228 şüpheli gözaltına alındı. Sosyal medya üzerinden yatırım danışmanlığı bahanesiyle dolandırıcılık, uyuşturucu ticareti, yasa dışı bahis ve tefecilik gibi suçlara karıştıkları belirlenen şüphelilerin yaklaşık 818 milyon lira değerindeki mal varlığına tedbir kararı uygulandı. İçişleri Bakanlığı'nın koordinasyonunda 16 ilde organize suç örgütlerine yönelik gerçekleştirilen 22 ayrı operasyonda 228 şüpheli gözaltına alındı. Sosyal medya üzerinden yatırım danışmanlığı bahanesiyle dolandırıcılık, uyuşturucu ticareti, yasa dışı bahis ve tefecilik gibi suçlara karıştıkları belirlenen şüphelilerin yaklaşık 818 milyon lira değerindeki mal varlığına tedbir kararı uygulandı. İçişleri Bakanlığı'nın koordinasyonunda 16 ilde organize suç örgütlerine yönelik gerçekleştirilen 22 ayrı operasyonda 228 şüpheli gözaltına alındı. Sosyal medya üzerinden yatırım danışmanlığı bahanesiyle dolandırıcılık, uyuşturucu ticareti, yasa dışı bahis ve tefecilik gibi suçlara karıştıkları belirlenen şüphelilerin yaklaşık 818 milyon lira değerindeki mal varlığına tedbir kararı uygulandı. 05 Temmuz 2026 - Gündem Suç örgütlerine büyük darbe! 818 milyon liralık mal varlığına el konuldu İçişleri Bakanlığı'nın koordinasyonunda 16 ilde organize suç örgütlerine yönelik gerçekleştirilen 22 ayrı operasyonda 228 şüpheli gözaltına alındı. Sosyal medya üzerinden yatırım danışmanlığı bahanesiyle dolandırıcılık, uyuşturucu ticareti, yasa dışı bahis ve tefecilik gibi suçlara karıştıkları belirlenen şüphelilerin yaklaşık 818 milyon lira değerindeki mal varlığına tedbir kararı uygulandı. İçişleri Bakanlığı, organize suç örgütlerine yönelik geniş çaplı bir operasyon düzenlendiğini duyurdu. Jandarma Genel Komutanlığı'nın koordinesinde 16 ilde eş zamanlı gerçekleştirilen 22 operasyonda 228 şüpheli yakalanırken, örgütlerin milyarlarca liralık para trafiğini yönettiği ortaya çıktı. Operasyonlarda çok sayıda taşınmaz, şirket ve banka hesabına da el konuldu. HABERİN DEVAMI İÇİN TIKLAYINIZ... YORUM YAP Damlakent’te damlaya damlaya değil, fışkırta fışkırta gelen zarar Hintli dev, Erkunt Traktör'ü verip üzerine 2,26 milyar TL ödeyecek On binlerce öğrenciyi 'Nermin' yaktı: ÖSYM'nin hatası sıralamaları değiştirdi! Mide bulandıran olay... 12 yaşındaki çocuk 6 yıl boyunca istismara uğramış! AKP'li Mehmet Ali Çelebi Atatürk'ü Erdoğan'la kıyasladı 05 Temmuz 2026 - Gündem Suç örgütlerine büyük darbe! 818 milyon liralık mal varlığına el konuldu İçişleri Bakanlığı'nın koordinasyonunda 16 ilde organize suç örgütlerine yönelik gerçekleştirilen 22 ayrı operasyonda 228 şüpheli gözaltına alındı. Sosyal medya üzerinden yatırım danışmanlığı bahanesiyle dolandırıcılık, uyuşturucu ticareti, yasa dışı bahis ve tefecilik gibi suçlara karıştıkları belirlenen şüphelilerin yaklaşık 818 milyon lira değerindeki mal varlığına tedbir kararı uygulandı. İçişleri Bakanlığı, organize suç örgütlerine yönelik geniş çaplı bir operasyon düzenlendiğini duyurdu. Jandarma Genel Komutanlığı'nın koordinesinde 16 ilde eş zamanlı gerçekleştirilen 22 operasyonda 228 şüpheli yakalanırken, örgütlerin milyarlarca liralık para trafiğini yönettiği ortaya çıktı. Operasyonlarda çok sayıda taşınmaz, şirket ve banka hesabına da el konuldu. HABERİN DEVAMI İÇİN TIKLAYINIZ... Suç örgütlerine büyük darbe! 818 milyon liralık mal varlığına el konuldu İçişleri Bakanlığı, organize suç örgütlerine yönelik geniş çaplı bir operasyon düzenlendiğini duyurdu. Jandarma Genel Komutanlığı'nın koordinesinde 16 ilde eş zamanlı gerçekleştirilen 22 operasyonda 228 şüpheli yakalanırken, örgütlerin milyarlarca liralık para trafiğini yönettiği ortaya çıktı. Operasyonlarda çok sayıda taşınmaz, şirket ve banka hesabına da el konuldu. HABERİN DEVAMI İÇİN TIKLAYINIZ...","Suç örgütlerine büyük darbe! 818 milyon liralık mal varlığına el konuldu Suç örgütlerine büyük darbe! 818 milyon liralık mal varlığına el konuldu Haber Hürriyeti İçişleri Bakanlığı'nın koordinasyonunda 16 ilde organize suç örgütlerine yönelik gerçekleştirilen 22 ayrı operasyonda 228 şüpheli gözaltına alındı. Sosyal medya üzerinden yatırım danışmanlığı bahanesiyle dolandırıcılık, uyuşturucu ticareti, yasa dışı bahis ve tefecilik gibi suçlara karıştıkları belirlenen şüphelilerin yaklaşık 818 milyon lira değerindeki mal varlığına tedbir kararı uygulandı. 05 Temmuz 2026 - Gündem Suç örgütlerine büyük darbe! 818 milyon liralık mal varlığına el konuldu İçişleri Bakanlığı'nın koordinasyonunda 16 ilde organize suç örgütlerine yönelik gerçekleştirilen 22 ayrı operasyonda 228 şüpheli gözaltına alındı. İçişleri Bakanlığı, organize suç örgütlerine yönelik geniş çaplı bir operasyon düzenlendiğini duyurdu. Jandarma Genel Komutanlığı'nın koordinesinde 16 ilde eş zamanlı gerçekleştirilen 22 operasyonda 228 şüpheli yakalanırken, örgütlerin milyarlarca liralık para trafiğini yönettiği ortaya çıktı. Operasyonlarda çok sayıda taşınmaz, şirket ve banka hesabına da el konuldu. YORUM YAP Damlakent’te damlaya damlaya değil, fışkırta fışkırta gelen zarar Hintli dev, Erkunt Traktör'ü verip üzerine 2,26 milyar TL ödeyecek On binlerce öğrenciyi 'Nermin' yaktı: ÖSYM'nin hatası sıralamaları değiştirdi! 12 yaşındaki çocuk 6 yıl boyunca istismara uğramış! AKP'li Mehmet Ali Çelebi Atatürk'ü Erdoğan'la kıyasladı 05 Temmuz 2026 - Gündem Suç örgütlerine büyük darbe! Suç örgütlerine büyük darbe! 818 milyon liralık mal varlığına el konuldu İçişleri Bakanlığı, organize suç örgütlerine yönelik geniş çaplı bir operasyon düzenlendiğini duyurdu.",browser_full_article,https://www.haberhurriyeti.com/amp/haber/28289392/suc-orgutlerine-buyuk-darbe-818-milyon-liralik-mal-varligina-el-konuldu,,,,,,,,il yok | ilçe yok | firma yok | faaliyet/tesis yok,,,,maps araması yapılmadı,,,89.0,5
2026-07-06 07:07:42,kara para,Banka / Finansal Kuruluş,"Bankalar ve ödeme aracı kurumları, hesap verilerini vergi makamlarıyla paylaşmak zorundadır.","Bankalar ve ödeme aracı kurumları, hesap verilerini vergi makamlarıyla paylaşmak zorundadır. Vietnam.vn",https://news.google.com/rss/articles/CBMiqAFBVV95cUxQd3V1Zl9YVndlc0E3Mll2dTB3el9leFUzT1VJT1NDbzJwWkNIZnpoWEtkcENBS0gtMEJpZEhVRFJyWWR0Z1pWQzU4c2pRbDFJNlljZnJKQVNvTFFwUHF0Q0NSdnVuVG9KMmczVXg3V1lQNnpyS2hXOUFvX3BOZWdrMnpNNlZOWXo4THcxckFkNWlxQmxIMllSQlBvUE4zR1F4NjJLUlBVVU0?oc=5,banka,finansal kuruluş,"Bankalar ve ödeme aracı kurumları, hesap verilerini vergi makamlarıyla paylaşmak zorundadır. Vietnam.vn","Bankalar ve ödeme aracı kurumları, hesap verilerini vergi makamlarıyla paylaşmak zorundadır. Bankalar ve ödeme aracı kurumları, hesap verilerini vergi makamlarıyla paylaşmak zorundadır. Vietnam.vn Bankalar ve ödeme aracı kurumları, hesap verilerini vergi makamlarıyla paylaşmak zorundadır.",browser_failed,https://news.google.com/rss/articles/CBMiqAFBVV95cUxQd3V1Zl9YVndlc0E3Mll2dTB3el9leFUzT1VJT1NDbzJwWkNIZnpoWEtkcENBS0gtMEJpZEhVRFJyWWR0Z1pWQzU4c2pRbDFJNlljZnJKQVNvTFFwUHF0Q0NSdnVuVG9KMmczVXg3V1lQNnpyS2hXOUFvX3BOZWdrMnpNNlZOWXo4THcxckFkNWlxQmxIMllSQlBvUE4zR1F4NjJLUlBVVU0?oc=5&hl=tr&gl=TR&ceid=TR:tr,,,,,,,,il yok | ilçe yok | firma yok | faaliyet/tesis yok,,,,maps araması yapılmadı,,,78.78,6
