published,search_term,category,title,summary,link,matched_words,activity_type,raw_text,entity_source_text,article_fetch_status,resolved_article_url,city_candidates,district_candidates,neighborhood_candidates,street_candidates,facility_candidates,company_candidates,company_candidate_scores,entity_quality_note,maps_queries,maps_candidates,maps_best_guess,maps_status,maps_match_scores,maps_rejected_candidates,record_quality_score,duplicate_group_id
2026-06-24 10:47:00,sahte fatura,Operasyon / Soruşturma / Suç,"Akaryakıt Sektöründe ""Dev"" Operasyon: 9 İlde 10 Şirkete Kayyum, 27 Gözaltı!","Akaryakıt Sektöründe ""Dev"" Operasyon: 9 İlde 10 Şirkete Kayyum, 27 Gözaltı! Malatya Söz",https://news.google.com/rss/articles/CBMingFBVV95cUxNcUo2NlMtQnNDRGRuT2Vtb1pxRGZfQWFOQzRvdFpVWWJqVFV0UU5LUGNkWFZqaHdyNGpXeC1WcHNQMG81Mk16MllZdThVUVpNbmhGOGRYT18wYmMtWE9TOXRaQWo0MGpRcmlBOUdoeHNiVnl0VzN2YVpSS0ZDckthVmNDTDFtdDJOU3dxR0hKQkl0VVpRM1M5emN1cXdnUdIBowFBVV95cUxNcUJRS1dSTTdnODhCTW9qN3Q3VU9JdEJEbDZSdTZYbVhZRWZRXzZmdUdobWZ3UUN1WkdKZDFNM2VpRHdmZHVRT1FUUFpadTB3WnUzMGhuaHltQ0U2cmJSMG9JN2pNVkx1Ti14QkhHVGZoR3BVckh5eEhMbkpsWTlEVnZCbktORDN1WHNkQy1rOTlhR0dfbjRPbzJjRE5hdUN1TGNj?oc=5,şirket,akaryakıt tesisi | şirket / firma,"Türkiye genelinde akaryakıt ve LPG sektöründe büyük bir vergi vurgununa imza atan organize suç örgütüne şafak operasyonu düzenlendi. Sahte fatura ve hayali ihracatla devleti milyonlarca lira zarara uğratan 6 şirkete el konulurken, 10 şirkete kayyum atandı. Türkiye genelinde akaryakıt ve LPG sektöründe büyük bir vergi vurgununa imza atan organize suç örgütüne şafak operasyonu düzenlendi. Sahte fatura ve hayali ihracatla devleti milyonlarca lira zarara uğratan 6 şirkete el konulurken, 10 şirkete kayyum atandı. Türkiye genelinde akaryakıt ve LPG sektöründe büyük bir vergi vurgununa imza atan organize suç örgütüne şafak operasyonu düzenlendi. Sahte fatura ve hayali ihracatla devleti milyonlarca lira zarara uğratan 6 şirkete el konulurken, 10 şirkete kayyum atandı. Yaşam Gündem Asayiş Bilim Gündem Spor Akaryakıt Sektöründe ""Dev"" Operasyon: 9 İlde 10 Şirkete Kayyum, 27 Gözaltı! Türkiye genelinde akaryakıt ve LPG sektöründe büyük bir vergi vurgununa imza atan organize suç örgütüne şafak operasyonu düzenlendi. Sahte fatura ve hayali ihracatla devleti milyonlarca lira zarara uğratan 6 şirkete el konulurken, 10 şirkete kayyum atandı. Hüseyin Canbay Editör 24.06.2026 - 13:47 Yayınlanma 24.06.2026 - 13:49 Güncelleme 2 Dk Okunma Süresi Paylaş Linkedin Pinterest Telegram Yazdır Kopyala A - A + Paylaş Linkedin Pinterest Telegram Yazdır Kopyala A - A + Akaryakıt sektörünü mercek altına alan güvenlik güçleri, devletin vergi güvenliğini ve ekonomik düzeni hedef alan devasa bir ""sahte fatura ve hayali ihracat"" düzeneğini çökertti. 9 ilde eş zamanlı olarak gerçekleştirilen operasyonlarda, örgütlü şekilde hareket ederek kamu kaynaklarını hortumlayan 27 şüpheli kıskıvrak yakalandı. Vurgunun Boyutu Dudak Uçuklattı İstanbul Anadolu Cumhuriyet Başsavcılığı tarafından başlatılan soruşturma kapsamında, akaryakıt sektöründe faaliyet gösteren bir yapılanmanın yıllık yaklaşık 350-400 bin ton LPG ithalatı gerçekleştirdiği belirlendi. Zanlıların, bu işlemlerden doğan ÖTV ve KDV yükümlülüklerini sahte fatura organizasyonları ve hayali ihracat yöntemleriyle bertaraf ettikleri tespit edildi. 2024 yılında Hatay Dörtyol’daki gümrüklü bölgede gerçekleştirilen LPG kaçakçılığı da soruşturma dosyasına dahil edilen kritik bulgular arasında yer aldı. 9 İlde Eş Zamanlı Şafak Operasyonu O Dağa Bahar Yeni Geldi İçeriği Görüntüle İstanbul İl Jandarma Komutanlığı ekiplerinin aylar süren teknik ve fiziki takibi sonrası İstanbul, Ankara, Bursa, Kırıkkale, Kırşehir, Mardin, Konya, Hatay ve Niğde illerinde düğmeye basıldı. Operasyonda örgüt elebaşı V.B. ile yöneticileri S.B., H.B.G., K.B., Ş.B., M.E.B., S.A., M.K. ve Y.K.'nin de aralarında bulunduğu toplam 27 şüpheli gözaltına alındı. Bakan Gürlek: ""Müsamaha Göstermeyeceğiz"" Operasyonun detaylarını sosyal medya hesabından duyuran Adalet Bakanı Akın Gürlek, kararlı mesajlar verdi: ""Devletimizin vergi güvenliğini, ekonomik düzenini ve kamu kaynaklarını hedef alan hiçbir organize yapıya müsamaha göstermeyeceğiz. Soruşturma kapsamında 6 şirkete el konulmuş, 10 şirkete kayyum atanmıştır. Suçtan elde edilen gelirlerin izini sürecek, kamu zararına sebep olan yapılara karşı hukuki süreçleri kararlılıkla işleteceğiz."" MASAK, Vergi Denetim Kurulu, Gümrükler Muhafaza Genel Müdürlüğü, EPDK ve TMSF'nin koordineli çalışmasıyla yürütülen operasyon, akaryakıt sektöründeki kaçakçılıkla mücadelede şimdiye kadar atılan en büyük adımlardan biri olarak kayıtlara geçti. Kaynak: haber merkezi Editörün Seçtiği Malatyalı ev sahipleri için kritik haber: Önce komşuya sormanız gerek! Editörün Seçtiği Çöpe giden kestaneler artık şifa kaynağı olacak! Editörün Seçtiği Trabzonspor'da dört futbolcunun geleceği kampa bağlı Editör Hakkında Hüseyin Canbay Bunlar","Akaryakıt Sektöründe ""Dev"" Operasyon: 9 İlde 10 Şirkete Kayyum, 27 Gözaltı! Akaryakıt Sektöründe ""Dev"" Operasyon: 9 İlde 10 Şirkete Kayyum, 27 Gözaltı! Malatya Söz Türkiye genelinde akaryakıt ve LPG sektöründe büyük bir vergi vurgununa imza atan organize suç örgütüne şafak operasyonu düzenlendi. Sahte fatura ve hayali ihracatla devleti milyonlarca lira zarara uğratan 6 şirkete el konulurken, 10 şirkete kayyum atandı. Yaşam Gündem Asayiş Bilim Gündem Spor Akaryakıt Sektöründe ""Dev"" Operasyon: 9 İlde 10 Şirkete Kayyum, 27 Gözaltı! Hüseyin Canbay Editör 24.06.2026 - 13:47 Yayınlanma 24.06.2026 - 13:49 Güncelleme 2 Dk Okunma Süresi P",browser_full_article,https://www.malatyasoz.com/akaryakit-sektorunde-dev-operasyon-9-ilde-10-sirkete-kayyum-27-gozalti,,,,,,,,il yok | ilçe yok | firma yok | faaliyet/tesis yok,,,,maps araması yapılmadı,,,90.25,14
2026-06-24 07:44:37,dolandırıcılık,Banka / Finansal Kuruluş,Bankadan arıyoruz diyenlere dikkat! Telefon dolandırıcılığında yeni tuzak büyüyor,Bankadan arıyoruz diyenlere dikkat! Telefon dolandırıcılığında yeni tuzak büyüyor Haberton,https://news.google.com/rss/articles/CBMipAFBVV95cUxOLWdxLWd0dG5QS0ZvSUlwYjM2WFVCcTRDVS1tMU56ZmdySHVsVEU4RHBDRWJkOVh1RmdCTWo2a3l6ZXdLY0NwQWVsS3ZCQzB6WFhtYzZuRmJvSU5CTFFoaTBLczZGMUJxSUFNQjJfS2hpVWR3TTVvMEF6VXlpNnhDVUt3Ri1EYnliQjk1TV9RWk1RSTNMQ1NlVTBLRDM0S28xbHMyaw?oc=5,banka,finansal kuruluş,Bankadan arıyoruz diyenlere dikkat! Telefon dolandırıcılığında yeni tuzak büyüyor Haberton,Bankadan arıyoruz diyenlere dikkat! Telefon dolandırıcılığında yeni tuzak büyüyor Bankadan arıyoruz diyenlere dikkat! Telefon dolandırıcılığında yeni tuzak büyüyor Haberton Bankadan arıyoruz diyenlere dikkat! Telefon dolandırıcılığında yeni tuzak büyüyor Haberton,browser_failed,https://news.google.com/rss/articles/CBMipAFBVV95cUxOLWdxLWd0dG5QS0ZvSUlwYjM2WFVCcTRDVS1tMU56ZmdySHVsVEU4RHBDRWJkOVh1RmdCTWo2a3l6ZXdLY0NwQWVsS3ZCQzB6WFhtYzZuRmJvSU5CTFFoaTBLczZGMUJxSUFNQjJfS2hpVWR3TTVvMEF6VXlpNnhDVUt3Ri1EYnliQjk1TV9RWk1RSTNMQ1NlVTBLRDM0S28xbHMyaw?oc=5&hl=tr&gl=TR&ceid=TR:tr,,,,,,,,il yok | ilçe yok | firma yok | faaliyet/tesis yok,,,,maps araması yapılmadı,,,69.9,15
2026-06-23 13:52:00,dolandırıcılık,Dolandırıcılık / Sahtecilik,Akaryakıtta dolandırıcılık operasyonu: 10 şirkete kayyum atandı,Akaryakıtta dolandırıcılık operasyonu: 10 şirkete kayyum atandı 61SAAT,https://news.google.com/rss/articles/CBMiiAFBVV95cUxQUVlyZndtQktHTmo1YnRBeG1iNjRVamZrcnpXSVEtazNUTDQ2MlRTTnVPV01BcUVIeC0zZm1pSS1NWFRJVHBpOHpzY3owT3BJLUUtUnN1S1pxTVdPVU5HUzlFT1V6MDRiRTExcE55VGNKRG82UlY5UDRWbHgzazlIVnN3NFh2WVFX0gGOAUFVX3lxTE9NWEtXRXNkaTN4Nm9RWW5lSTlMaVNIY1J0S2Y1TXVmaC1jakpQZXhFWl9IUmNMSVNYLS1TUVdxWFpZcXhxWmhicTVTcHp4QWxFc2JtWGVNb2hRVDN2U1E4OWVvazFiWUFBTXkyeE1jOVRrbmJhTEd6S2JYQUp1amxVM05vbGpyUk9MQ2EtMGc?oc=5,şirket,akaryakıt tesisi | şirket / firma,"Adalet Bakanı Akın Gürlek, akaryakıt sektöründe faaliyet gösteren bir şirket yapılanması üzerinden sahte fatura ve hayali ihracat işlemlerinin yapıldığının tespit edilmesi üzerine düzenlenen operasyonda, 6 şirkete el konulduğunu, 10 şirkete kayyum atandığını, 27 zanlı hakkında adli işlem başlatıldığını bildirdi. Adalet Bakanı Akın Gürlek, akaryakıt sektöründe faaliyet gösteren bir şirket yapılanması üzerinden sahte fatura ve hayali ihracat işlemlerinin yapıldığının tespit edilmesi üzerine düzenlenen operasyonda, 6 şirkete el konulduğunu, 10 şirkete kayyum atandığını, 27 zanlı hakkında adli işlem başlatıldığını bildirdi. Adalet Bakanı Akın Gürlek, akaryakıt sektöründe faaliyet gösteren bir şirket yapılanması üzerinden sahte fatura ve hayali ihracat işlemlerinin yapıldığının tespit edilmesi üzerine düzenlenen operasyonda, 6 şirkete el konulduğunu, 10 şirkete kayyum atandığını, 27 zanlı hakkında adli işlem başlatıldığını bildirdi. Gündem Akaryakıtta dolandırıcılık operasyonu: 10 şirkete kayyum atandı Adalet Bakanı Akın Gürlek, akaryakıt sektöründe faaliyet gösteren bir şirket yapılanması üzerinden sahte fatura ve hayali ihracat işlemlerinin yapıldığının tespit edilmesi üzerine düzenlenen operasyonda, 6 şirkete el konulduğunu, 10 şirkete kayyum atandığını, 27 zanlı hakkında adli işlem başlatıldığını bildirdi. Paylaş Linkedin Pinterest Telegram Yazdır Kopyala A - A + ESER HACISALİHOĞLU 23.06.2026 - 16:52 Gürlek, NSosyal hesabından yaptığı açıklamada, suç, kaçakçılık, vergi usulsüzlükleri ve kamu kurumlarını hedef alan nitelikli dolandırıcılıkla mücadeleyi Cumhurbaşkanı Recep Tayyip Erdoğan'ın liderliğinde, İçişleri, Hazine ve Maliye, Ticaret, Enerji ve Tabii Kaynaklar bakanlıklarıyla eş güdüm içinde kararlılıkla sürdürdüklerini vurguladı. İstanbul Anadolu Cumhuriyet Başsavcılığınca yürütülen soruşturma kapsamında, İstanbul Jandarma Komutanlığı, Vergi Denetim Kurulu, MASAK, Gümrükler Muhafaza Genel Müdürlüğü, EPDK ve TMSF ile koordineli şekilde önemli bir operasyon gerçekleştirdiklerini belirten Gürlek, şunları kaydetti: ""Soruşturma kapsamında, akaryakıt sektöründe faaliyet gösteren bir şirket yapılanması üzerinden yıllık yaklaşık 350-400 bin ton LPG ithalatı gerçekleştirildiği, doğan ÖTV ve KDV yükümlülüklerinin sahte fatura organizasyonu ve hayali ihracat işlemleriyle bertaraf edilmeye çalışıldığı tespit edilmiştir. Bu kapsamda bu sabah İstanbul, Ankara, Bursa, Kırıkkale, Kırşehir, Mardin, Konya, Hatay ve Niğde illerinde eş zamanlı operasyon düzenlenmiş, toplam 6 şirkete el konulmuş, 10 şirkete kayyum atanmış, 27 şüpheli hakkında adli işlem başlatılmıştır. Devletimizin vergi güvenliğini, ekonomik düzenini ve kamu kaynaklarını hedef alan hiçbir organize yapıya müsamaha göstermeyeceğiz. Suçtan elde edilen gelirlerin izini sürecek, sahte fatura ve hayali ihracat düzenekleriyle kamu zararına sebep olan yapılara karşı hukuki süreçleri kararlılıkla işleteceğiz."" Gürlek, soruşturma ve operasyon sürecinde görev alan kurum ve kamu görevlilerine teşekkür etti. Kaynak: CNN TÜRK Bunla","Akaryakıtta dolandırıcılık operasyonu: 10 şirkete kayyum atandı Akaryakıtta dolandırıcılık operasyonu: 10 şirkete kayyum atandı 61SAAT Adalet Bakanı Akın Gürlek, akaryakıt sektöründe faaliyet gösteren bir şirket yapılanması üzerinden sahte fatura ve hayali ihracat işlemlerinin yapıldığının tespit edilmesi üzerine düzenlenen operasyonda, 6 şirkete el konulduğunu, 10 şirkete kayyum atandığını, 27 zanlı hakkında adli işlem başlatıldığını bildirdi. Gündem Akaryakıtta dolandırıcılık operasyonu: 10 şirkete kayyum atandı Adalet Bakanı Akın Gürlek, akaryakıt sektöründe faaliyet gösteren bir şirket yapılanması üzerinden sahte fatura ve hayali ihracat işlemlerinin yapıldığının tespit edilmesi üzerine düzenlenen operasyonda, 6 şirkete el konulduğunu, 10 şirkete kayyum atandığını, 27 zanlı hakkında adli işlem başlatıldığını bildirdi.",browser_full_article,https://61saat.com/akaryakitta-dolandiricilik-operasyonu-10-sirkete-kayyum-atandi,,,,,,,,il yok | ilçe yok | firma yok | faaliyet/tesis yok,,,,maps araması yapılmadı,,,72.0,16
2026-06-24 01:15:57,ihale yolsuzluğu,Diğer,Dicle Üniversitesi hastane ihalesi skandalı mı? CHP'den şok iddialar: Sadece AKP'nin çağırdığı firmalar katılmış!,Dicle Üniversitesi hastane ihalesi skandalı mı? CHP'den şok iddialar: Sadece AKP'nin çağırdığı firmalar katılmış! Habererk.com,https://news.google.com/rss/articles/CBMi4wFBVV95cUxPd05QZmxFSXRJMGMwSlZUcklFWk96ZUVSQVdMMkI3UjVjbG1MX193UFBtMHFjNkRlQ0RpLUtYTlEyOWk3dXFQQXlCbVpfOEc5Vk9zUU1kS2w0TXdQcHg2Tmx6aGg1UlRTSzRFQ0g0OXl0NjJ2X25jMjhOY09fcTM0MjkyOFZoTFVqejhRaHNXNXdaRWJVbHhLWVMwbFFhbDVqeVBOczdSWFAyc3loUWNVTVVBWWRUSWo4MHpHbkRUQ0RJUmR0by1XbjF3R3I4YlByR3hwSENIRFVwRXQ4V0lPVWtLOA?oc=5,firma,şirket / firma,"CHP'li Deniz Yavuzyılmaz, Dicle Üniversitesi hastane ihalesinin kanuna aykırı pazarlık usulüyle yapıldığını ve sadece AKP'nin davet ettiği firmaların katıldığını iddia etti. İhaleyi Rönesans'ın kazandığını belirten Yavuzyılmaz, maliyet artı CHP'li Deniz Yavuzyılmaz, Dicle Üniversitesi hastane ihalesinin kanuna aykırı pazarlık usulüyle yapıldığını ve sadece AKP'nin davet ettiği firmaların katıldığını iddia etti. İhaleyi Rönesans'ın kazandığını belirten Yavuzyılmaz, maliyet artı CHP'li Deniz Yavuzyılmaz, Dicle Üniversitesi hastane ihalesinin kanuna aykırı pazarlık usulüyle yapıldığını ve sadece AKP'nin davet ettiği firmaların katıldığını iddia etti. İhaleyi Rönesans'ın kazandığını belirten Yavuzyılmaz, maliyet artı CHP Zonguldak Milletvekili Deniz Yavuzyılmaz, Dicle Üniversitesi Tıp Fakültesi Araştırma Hastanesi'nin ihale süreciyle ilgili ciddi iddialarda bulundu. Yavuzyılmaz'a göre, hastane ihalesi kanuna aykırı bir şekilde, pazarlık usulüyle gerçekleştirildi ve bu sürece yalnızca AK Parti tarafından davet edilen firmalar katılabildi. PAZARLIK USULÜ İHALE VE SEÇİLMİŞ KATILIMCILAR Yavuzyılmaz, sosyal medya hesabından yaptığı açıklamada, 'deprem, sel, salgın veya özel yapım tekniği gerektiren şartlar oluşmadığı halde' kanuna aykırı olarak pazarlık usulüyle yapılan ihaleye sadece AK Parti'nin davet ettiği şirketlerin katıldığını belirtti. Bu durumun, ihalenin şeffaflığı ve rekabetçi yapısı hakkında ciddi soru işaretleri doğurduğunu vurguladı. GÖZLER RÖNESANS VE 6,5 MİLYARLIK MALİYETİNDE İhalenin sonucunda, 'adrese teslim ihalelerin bilindik adresi' olarak nitelediği Rönesans firmasının kazandığını öne süren Yavuzyılmaz, "" Bakalım 6,5 Milyar Liralık ihale konusu iş, kaç milyar liraya fırlayacak! Takip ediyoruz! "" diyerek tepkisini dile getirdi. Milletvekili, bu konunun yakından takip edileceğini belirtti. Dicle Üniversitesi hastane ihalesi skandalı mı? CHP'den şok iddialar: Sadece AKP'nin çağırdığı firmalar katılmış! PAZARLIK USULÜ İHALE VE SEÇİLMİŞ KATILIMCILAR GÖZLER RÖNESANS VE 6,5 MİLYARLIK MALİYETİNDE Beğen, Paylaş, Takip Et","Dicle Üniversitesi hastane ihalesi skandalı mı? CHP'den şok iddialar: Sadece AKP'nin çağırdığı firmalar katılmış! Dicle Üniversitesi hastane ihalesi skandalı mı? CHP'den şok iddialar: Sadece AKP'nin çağırdığı firmalar katılmış! Habererk.com CHP'li Deniz Yavuzyılmaz, Dicle Üniversitesi hastane ihalesinin kanuna aykırı pazarlık usulüyle yapıldığını ve sadece AKP'nin davet ettiği firmaların katıldığını iddia etti. İhaleyi Rönesans'ın kazandığını belirten Yavuzyılmaz, maliyet artı CHP'li Deniz Yavuzyılmaz, Dicle Üniversitesi hastane ihalesinin kanuna aykırı pazarlık usulüyle yapıldığını ve sadece AKP'nin davet ettiği firmaların katıldığını iddia etti. İhaleyi Rönesans'ın kazandığını belirten Yavuzyılmaz, maliyet artı CHP Zonguldak Milletvekili Deniz Yavuzyılmaz, Dicle Üniversitesi Tıp Fakültesi Araştırma Hastanesi'nin ihale süreciyle ilgili ciddi iddialarda bulundu. Yavuzyılmaz'a göre, hastane ihalesi kanuna aykırı bir şekilde, pazarlık usulüyle gerçekleştirildi ve bu sürece yalnızca AK Parti tarafından davet edilen firmalar katılabildi. PAZARLIK USULÜ İHALE VE SEÇİLMİŞ KATILIMCILAR Yavuzyılmaz, sosyal medya hesabından yaptığı açıklamada, 'deprem, sel, salgın veya özel yapım tekniği gerektiren şartlar oluşmadığı halde' kanuna aykırı olarak pazarlık usulüyle yapılan ihaleye sadece AK Parti'nin davet ettiği şirketlerin katıldığını belirtti. GÖZLER RÖNESANS VE 6,5 MİLYARLIK MALİYETİNDE İhalenin sonucunda, 'adrese teslim ihalelerin bilindik adresi' olarak nitelediği Rönesans firmasının kazandığını öne süren Yavuzyılmaz, "" Bakalım 6,5 Milyar Liralık ihale konusu iş, kaç milyar liraya fırlayacak! "" diyerek tepkisini dile getirdi. Milletvekili, bu konunun yakından takip edileceğini belirtti. Dicle Üniversitesi hastane ihalesi skandalı mı? CHP'den şok iddialar: Sadece AKP'nin çağırdığı firmalar katılmış!",browser_full_article,https://www.habererk.com/haber/dicle-universitesi-hastane-ihalesi-skandali-mi-chp-den-sok-iddialar-sadece-akp-nin-cagirdigi-firmalar-katilmis_337158/,,,,,,,,il yok | ilçe yok | firma yok | faaliyet/tesis yok,,,,maps araması yapılmadı,,,109.0,17
2026-06-24 12:28:00,bankaya soruşturma,Banka / Finansal Kuruluş,"Hepsiburada'yı satın alan dev şirket, Türkiye'de banka satın alıyor","Hepsiburada'yı satın alan dev şirket, Türkiye'de banka satın alıyor Haber3",https://news.google.com/rss/articles/CBMirwFBVV95cUxQUEV2RTBnR2g4ME1talg3ZlM4c21aOF9XQ1B1QjFKSFF3UDJjUWpVUHVRcjUzY0hiNFVuX05GQkY5VnFjSWkyclBzWkQyUUVUbVZOenVmN1pPc2VtRy0yVVhwRzd5d3pDUDgyZW5tQlpRbUIwaEhDSDVLdWcxTzdEa01vWHFTTW5iU0p0cHRMTTluYzNKQlZMNXpINFBFTW1PNE1zNXFsM195dU1uMEZj0gG0AUFVX3lxTE51Sm1XRnpmZnVveklyeTVBeHZka3VhVldfeTFkOUMyUDI0QTA2UWdHVlVnanJqS0ViVUpkMm5ESE1sS2toU0V1bkJUakx1TDNiVXE4aFpzY0JvbEJSeXVXaDJTemxPa3c5bXVxa1gyMjVDYzVCWmQ1M0p0a3pkNDVRM1FKUlRZeFVUUGJ5a1hUaTZLOEN4bWxJNkpIZHpUWnVLQW5qa2JDbXluUTJNTVVJeUFINg?oc=5,"banka, şirket",finansal kuruluş | şirket / firma,"2025'te Hepsiburada'yı alarak Türkiye pazarına giren Kaspi.kz, Rabobank A.Ş.'nin satın alımı için BDDK'dan resmi onayı aldı. 2025'te Hepsiburada'yı alarak Türkiye pazarına giren Kaspi.kz, Rabobank A.Ş.'nin satın alımı için BDDK'dan resmi onayı aldı. 2025'te Hepsiburada'yı alarak Türkiye pazarına giren Kaspi.kz, Rabobank A.Ş.'nin satın alımı için BDDK'dan resmi onayı aldı.","Hepsiburada'yı satın alan dev şirket, Türkiye'de banka satın alıyor Hepsiburada'yı satın alan dev şirket, Türkiye'de banka satın alıyor Haber3 2025'te Hepsiburada'yı alarak Türkiye pazarına giren Kaspi.kz, Rabobank A.Ş.'nin satın alımı için BDDK'dan resmi onayı aldı.",browser_full_article,https://www.haber3.com/ekonomi/hepsiburadayi-satin-alan-dev-sirket-turkiyede-banka-satin-aliyor-haberi-6258365,,,,,,Rabobank A.Ş,Rabobank A.Ş:63:body | Rabobank A.Ş:raw_legal,il yok | ilçe yok | faaliyet/tesis yok,Rabobank A.Ş Türkiye,Rabobank,Rabobank,firma adı + güvenli maps adayı var,100.0,,142.34,18
2026-06-24 10:08:00,bankaya soruşturma,Banka / Finansal Kuruluş,Banka hatasıyla hesabına 53 milyon TL yattı! Parayı geri vermek istemeyince…,Banka hatasıyla hesabına 53 milyon TL yattı! Parayı geri vermek istemeyince… Manisa Kulis Haber,https://news.google.com/rss/articles/CBMiqwFBVV95cUxOb01wSldGemNrMlZTbFIzWlowaG1QOEU2QjcxTlNPRXRSQmhqeWlab01GSG8weW95ZWF0NTduQUdQcWp1eXRfeWdiNjlXTE5FS0NBTm5aQXBTUWJlUnZjQkl3YktoalFpdmpWdmN0VS1kMmVpd0ZPTVpHdTdOdFJ4bUtXYXhVZzdXdXM1UnRJdlVTSjVQeW9rTFZkTlNfZVlySXRFelRVWUpvNU0?oc=5,banka,finansal kuruluş,"Nijerya’da yaşanan olayda, bankacılık sistemindeki teknik hata nedeniyle Ojo Eghosa Kingsley isimli bir kişinin hesabına yaklaşık 1 milyon euro (53 milyon TL) tutarında para yatırıldığı bildirildi. Nijerya’da yaşanan olayda, bankacılık sistemindeki teknik hata nedeniyle Ojo Eghosa Kingsley isimli bir kişinin hesabına yaklaşık 1 milyon euro (53 milyon TL) tutarında para yatırıldığı bildirildi. Nijerya’da yaşanan olayda, bankacılık sistemindeki teknik hata nedeniyle Ojo Eghosa Kingsley isimli bir kişinin hesabına yaklaşık 1 milyon euro (53 milyon TL) tutarında para yatırıldığı bildirildi. Banka hatasıyla hesabına 53 milyon TL yattı! Parayı geri vermek istemeyince… Nijerya’da yaşanan olayda, bankacılık sistemindeki teknik hata nedeniyle Ojo Eghosa Kingsley isimli bir kişinin hesabına yaklaşık 1 milyon euro (53 milyon TL) tutarında para yatırıldığı bildirildi. 24.06.2026 - 13:08 Yayınlanma 1 Dk Okunma Süresi Paylaş Linkedin Pinterest Telegram Yazdır Kopyala A - A + Paylaş Linkedin Pinterest Telegram Yazdır Kopyala A - A + Olayın, Kingsley’in banka hesabını kontrol etmesiyle ortaya çıktığı belirtildi. Banka yetkilileri hatayı fark ettikten sonra kendisiyle iletişime geçerek paranın iadesini talep etti. Parayı iade etmedi, yakınlarına aktardığı iddia edildi İddiaya göre Kingsley, parayı iade etmek yerine hızlı bir şekilde farklı hesaplara transfer etti ve meblağın önemli bir kısmını ailesi ve yakın çevresine dağıttı. Banka şikâyeti üzerine Nijerya Ekonomik ve Finansal Suçlar Komisyonu (EFCC) devreye girerek Kingsley hakkında “yasadışı zenginleşme” suçlamasıyla soruşturma başlattı. Mahkemeden dikkat çeken seçenek Yargılama sürecinde Kingsley’e parayı iade etmesi ya da hapis cezası seçenekleri sunulduğu, sanığın ise hapis yatmayı tercih ettiği öne sürüldü. Paranın büyük bölümü donduruldu Ancak sürecin beklendiği gibi ilerlemediği, yetkililerin paranın aktarıldığı hesapları dondurarak büyük kısmına el koyduğu bildirildi. Kingsley’in ayrıca cezasını tamamladıktan sonra bankaya oluşan zararı tazmin etmekle yükümlü olacağı ifade edildi. Kaynak: Haber merkezi B","Banka hatasıyla hesabına 53 milyon TL yattı! Parayı geri vermek istemeyince… Banka hatasıyla hesabına 53 milyon TL yattı! Parayı geri vermek istemeyince… Manisa Kulis Haber Nijerya’da yaşanan olayda, bankacılık sistemindeki teknik hata nedeniyle Ojo Eghosa Kingsley isimli bir kişinin hesabına yaklaşık 1 milyon euro (53 milyon TL) tutarında para yatırıldığı bildirildi. Banka hatasıyla hesabına 53 milyon TL yattı! Parayı geri vermek istemeyince… Nijerya’da yaşanan olayda, bankacılık sistemindeki teknik hata nedeniyle Ojo Eghosa Kingsley isimli bir kişinin hesabına yaklaşık 1 milyon euro (53 milyon TL) tutarında para yatırıldığı bildirildi. 24.06.2026 - 13:08 Yayınlanma 1 Dk Okunma Süresi",browser_full_article,https://www.manisakulishaber.com/banka-hatasiyla-hesabina-53-milyon-tl-yatti-parayi-geri-vermek-istemeyince,,,,,,,,il yok | ilçe yok | firma yok | faaliyet/tesis yok,,,,maps araması yapılmadı,,,82.75,19
2026-06-23 13:12:15,şirketlere operasyon,Diğer,Hatay’ın da Aralarında Bulunduğu 9 İlde Akaryakıt Operasyonu: 6 Şirkete El Konuldu,Hatay’ın da Aralarında Bulunduğu 9 İlde Akaryakıt Operasyonu: 6 Şirkete El Konuldu sondakikahatay.com,https://news.google.com/rss/articles/CBMiugFBVV95cUxObFJZOElSdHpuVzVLamlnWVkxSllLYVNFcmdXdjB4X19rTVNoZzdWRmdyNEZxNXBSWkxfZEx2MWpGZWRHTFhNdDB0eFdjWF9fS0F1QlBUaUkyWnJEYk5Pbkg0MFgwbjVuQ05XUGdXeS1SOHNHTzZzSV9qRGptUjlSaGVvWE9wNmJDeGFpdGs0aEk4R2RMZzBpMWRJbTdvbVI1THFXb3NWNXprX2ptdDUzQjhWWG81dUV5blHSAb8BQVVfeXFMT2FMOE1jZ1ZQLVhGZVZBUzhUYk10dXJQMWtKenNNS0s2a1FGYldGR0pQc1lsX00zS3VGeGtZU1pLejJsZkp5cHV3Z2VGS01kVW9DTlFZMklZSDc3TlFjSGhVR3VLcTB2ZHg1Q2JUZk9YV2w0LTdqRXBwdjJDb3U0Q3JuRFdzT0k0VWI4X041THhxSFZQMHlDRmFrT2VZdFhvTHQyQXlMMFR2bk9CMFNuUU5Cd1RtWV8tQnM0cGNCSjQ?oc=5,"el konuldu, şirket",akaryakıt tesisi | şirket / firma,Hatay’ın da Aralarında Bulunduğu 9 İlde Akaryakıt Operasyonu: 6 Şirkete El Konuldu sondakikahatay.com,Hatay’ın da Aralarında Bulunduğu 9 İlde Akaryakıt Operasyonu: 6 Şirkete El Konuldu Hatay’ın da Aralarında Bulunduğu 9 İlde Akaryakıt Operasyonu: 6 Şirkete El Konuldu sondakikahatay.com Hatay’ın da Aralarında Bulunduğu 9 İlde Akaryakıt Operasyonu: 6 Şirkete El Konuldu sondakikahatay.com,browser_failed,https://news.google.com/rss/articles/CBMiugFBVV95cUxObFJZOElSdHpuVzVLamlnWVkxSllLYVNFcmdXdjB4X19rTVNoZzdWRmdyNEZxNXBSWkxfZEx2MWpGZWRHTFhNdDB0eFdjWF9fS0F1QlBUaUkyWnJEYk5Pbkg0MFgwbjVuQ05XUGdXeS1SOHNHTzZzSV9qRGptUjlSaGVvWE9wNmJDeGFpdGs0aEk4R2RMZzBpMWRJbTdvbVI1THFXb3NWNXprX2ptdDUzQjhWWG81dUV5blHSAb8BQVVfeXFMT2FMOE1jZ1ZQLVhGZVZBUzhUYk10dXJQMWtKenNNS0s2a1FGYldGR0pQc1lsX00zS3VGeGtZU1pLejJsZkp5cHV3Z2VGS01kVW9DTlFZMklZSDc3TlFjSGhVR3VLcTB2ZHg1Q2JUZk9YV2w0LTdqRXBwdjJDb3U0Q3JuRFdzT0k0VWI4X041THhxSFZQMHlDRmFrT2VZdFhvTHQyQXlMMFR2bk9CMFNuUU5Cd1RtWV8tQnM0cGNCSjQ?oc=5&hl=tr&gl=TR&ceid=TR:tr,Hatay,,,,,,,ilçe yok | firma yok | faaliyet/tesis yok,,,,maps araması yapılmadı,,,93.26,20
